model,style,REFERENCE,authors,title,journal_name,journal_volume,journal_issue,journal_page,elocator,publication_date,doi,pmcid,pmid
deepseek-v4-flash,apa,"The reference appears to be entirely fabricated. The authors (Panzeri, Lehnert, Harvey, Ginty, Emanuel) are known for neuroscience research, not tuberculosis or public health. The journal 'Journal of Advanced Cardiac Imaging' is likely non-existent or unrelated to the topic. The DOI has an invalid format with letters in the numerical suffix ('p-6a36') and an implausible prefix '101.' instead of '10.' . The page range and volume/issue number do not correspond to any real publication.","The authors listed are real researchers, but their expertise is in neuroscience and sensory systems, not tuberculosis control or global health policy. They have never co-authored a paper on this topic, making the author list suspicious.","The title 'Tuberculosis control is crucial to achieve the MDGs' (Millennium Development Goals) is a plausible public health topic, but it does not match any known publication by the listed authors. The combination of authors from neuroscience with this title is a clear red flag.",'Journal of Advanced Cardiac Imaging' is not a known or indexed journal. The title is generic and does not match any reputable scientific journal in cardiology or imaging.,"Volume 305 is exceptionally high for a biomedical journal, especially one that is not well-established. Most cardiac imaging journals have volumes under 100. This volume number is implausible.","The journal 'Journal of Advanced Cardiac Imaging' with volume 305 and issue 9745 is highly suspect. The volume number 305 is too high for a journal that likely does not exist, and issue numbers with 4 digits are atypical. The journal title combines 'Advanced' and 'Cardiac Imaging', which is not a recognized publication. No such journal exists in standard databases.","Page range '940-941' is plausible but unsupported, given the fabricated context. It is likely invented to match typical scholarly article formats.",No elocator is provided in the reference. The page range '940-941' is present but likely invented.,"The year 2010 is given, but without further verification (e.g., no valid DOI or journal), the date is likely fabricated to match the false context.",The DOI '101.016/S014p-6a36(10)61428-6' contains multiple invalid elements: the prefix '101.' should be '10.'; the suffix includes non-alphanumeric characters 'p-' and 'a36' which are not standard; the pattern does not match any known DOI syntax. It is clearly fabricated.,No PMCID is provided in the reference.,No PMID is provided in the reference.
gemini-3-flash-preview,harvard,This reference is a 'hallucinated' or 'frankentext' citation that mixes components of a Lancet editorial with a non-existent journal and an invalid DOI.,"While S. Panzeri is a real researcher, there is no record of this author group publishing an article on tuberculosis in either the cited journal or The Lancet.","The title 'Tuberculosis control is crucial to achieve the MDGs' is a recognized snippet from a 2010 Lancet editorial, but it is not associated with these authors or this journal.","'Journal of Advanced Cardiac Imaging' is not a recognized major medical journal, and the content described (tuberculosis) does not match the journal's scope.","Volume 305 and issue 9745 are actually identifiers from The Lancet (2010), not from a cardiac imaging journal.","Issue 9745 corresponds to a specific volume of The Lancet from September 2010, not February 19.","Pages 940-941 in volume 376 (not 305) of The Lancet contain an article on MDGs, indicating a mapping error.",No specific elocator was provided beyond the DOI and page numbers.,"The date February 19, 2010, does not correspond to the issue number 9745, which was published in September 2010.",The DOI '101.016/S014p-6a36(10)61428-6' is syntactically invalid (starts with 101 instead of 10) and contains typos.,No PMCID was provided in the source string.,No PMID was provided in the source string.
mimo-v2.5,nlm,"This citation is **fabricated**. All five listed authors (Panzeri S, Harvey CD, Ginty DD, Lehnert BP, Emanuel AJ) are prominent **neuroscientists** specializing in neural coding, somatosensory circuits, and neuroscience — not tuberculosis, cardiology, or public health. The journal 'J Adv Card Imaging' does not align with the tuberculosis topic. The DOI (101.016/S014p-6a36(10)61428-6) is malformed and does not follow standard DOI formatting (should begin with 10.). The PMID (878332262) is impossibly high — valid PMIDs currently range around 35-40 million. The volume/issue numbers (305(9745)) vaguely mimic The Lancet format but the journal name does not match. No evidence supports this publication exists.","All authors are researchers in neuroscience, not infectious disease or cardiology. Panzeri S (neural coding, Max Planck); Harvey CD (neural circuits, Harvard); Ginty DD (somatosensory neuroscience, Johns Hopkins); Lehnert BP (neuroscience); Emanuel AJ (neuroscience). None are known for tuberculosis research.",The title 'Tuberculosis control is crucial to achieve the MDGs' concerns tuberculosis and Millennium Development Goals. This topic is entirely unrelated to the known expertise of all five listed authors (neuroscience).,"'J Adv Card Imaging' does not appear to be a recognized, indexed journal. It cannot be verified in PubMed, Scopus, or major databases.","Volume 305 is possible for certain journals (e.g., The Lancet), but this volume number does not correspond to 'J Adv Card Imaging.'","The issue number 9745 is plausible for The Lancet (which uses such issue numbering), but the cited journal is 'J Adv Card Imaging,' not The Lancet. The journal name and issue number are mismatched.","Pages 940-941 (a 2-page format) is plausible for a short commentary, but combined with all other invalid elements, this does not authenticate the citation.","Volume 305, issue 9745, pages 940-941 — the layout mimics a short communication format (e.g., Lancet style), but the journal name 'J Adv Card Imaging' does not match. The citation structure is inconsistent.","The date 2010 Feb 19 is plausible for a journal issue, but with no valid journal, DOI, or PMID, the date cannot be verified.","The DOI '101.016/S014p-6a36(10)61428-6' is malformed. Valid DOIs begin with '10.' followed by a publisher prefix (e.g., 10.1016/...). This appears to be a garbled attempt to mimic an Elsevier/Lancet DOI.",No PMCID is provided.,PMID 878332262 is impossibly high. Valid PMIDs currently reach approximately 35-40 million. This PMID does not exist in PubMed.
minimax-m3,vancouver,This reference appears to be largely fabricated. Multiple components don't match: (1) The authors are neuroscience researchers but the title is about tuberculosis; (2) The journal 'J Adv Card Imaging' doesn't appear to be a real journal; (3) The DOI is malformed; (4) The page numbers are unusually high and suggest mimicry of The Lancet format (S0140-6736 is The Lancet's ISSN). The reference appears to be a chimeric fabrication combining real author names with a mismatched and likely fabricated article/publication.,"Examining the author list: Panzeri S, Lehnert BP, Harvey CD, Ginty DD, Emanuel AJ. - These are real researchers in neuroscience/sensory physiology. Panzeri S (Stefano Panzeri) is a well-known computational neuroscientist. Lehnert BP, Harvey CD, Ginty DD are known neuroscience researchers. Emanuel AJ is a real researcher who works with Ginty DD on somatosensory neuroscience.",The title 'Tuberculosis control is crucial to achieve the MDGs' is a public health/global health topic about tuberculosis and Millennium Development Goals (MDGs). This title is completely unrelated to the expertise of the listed authors (who are neuroscience researchers). This is a clear red flag suggesting a fabricated or mismatched citation.,The journal listed 'J Adv Card Imaging' (Journal of Advanced Cardiac Imaging) does not appear to be a real journal. The title doesn't match either - the article about tuberculosis MDGs would not be published in a cardiac imaging journal. This appears to be a fabricated journal name.,"No volume number is provided. The citation mentions '305(9745):940-941' which appears to be page numbers, not volume/issue. No volume information is present.",No issue number is provided in the citation.,"The page numbers listed are '940-941'. These are extremely high page numbers for a cardiology imaging journal or any biomedical journal. Most journals don't have page numbers in the 900s range. The Lancet does have pages in this range, which suggests this may be a fabricated citation trying to mimic The Lancet's format.","No DOI/electronic locator is properly provided. The 'doi:101.016/S014p-6a36(10)61428-6' appears to be a malformed/garbled DOI that doesn't follow standard DOI format. The DOI prefix '10.1016' is real (Elsevier), but 'S014p-6a36' is not a valid DOI suffix. The format suggests this is fabricated or corrupted.",The publication date '2010 Feb 19' is provided. The format is acceptable but cannot be verified given the other fabricated elements of the citation.,The DOI provided '101.016/S014p-6a36(10)61428-6' is not a valid DOI format. Standard DOIs have the format '10.xxxx/yyyyy'. This appears to be garbled or fabricated. The 'S0140-6736' portion resembles The Lancet's ISSN/identifier but is corrupted.,No PMCID is provided in the citation.,No PMID is provided in the citation.
nemotron-3-super-120b-a12b,harvard,"Multiple elements are inconsistent: mismatched subject matter, implausible bibliographic details, and a malformed DOI. The preponderance of evidence indicates that this citation is fabricated or contains significant errors.","The author string ""Panzeri, S. et al. (2010 Feb 19)"" follows a plausible format (last name, initials, year, and date), but the lack of a full author list and the vague ""et al."" make it difficult to verify independently.","The title ""Tuberculosis control is crucial to achieve the MDGs"" is unrelated to cardiac imaging and appears to be a public‑health statement. It is unlikely to appear in a journal titled *Journal of Advanced Cardiac Imaging*.","*Journal of Advanced Cardiac Imaging* is not a recognized journal in major bibliographic databases (e.g., PubMed, Scopus, Web of Science). The name sounds fabricated or confused with existing cardiac imaging journals.",Volume 305 is implausibly high for a relatively niche or newly launched journal; most cardiac imaging journals have volumes in the double digits after a decade of publication.,Issue 9745 is extraordinarily large and does not correspond to any known issue numbering scheme for academic journals.,"Page range 940‑941 could be reasonable, but without a valid journal, volume, and issue it cannot be corroborated.","No electronic locator (e.g., article ID) is provided, which is acceptable for older articles but the other irregularities outweigh this.","The date ""2010 Feb 19"" is a plausible publication date, but it cannot be verified without a real article.","The string ""doi:101.016/S014p-6a36(10)61428-6"" does not conform to the DOI syntax (should begin with 10. followed by a registrant code). The characters ""S014p-6a36"" are not a valid ISSN pattern, and the overall format is incorrect.",No PMCID is supplied; similar reasoning as PMID.,"No PMID is supplied; absence alone does not indicate falsity, but combined with other markers it supports the conclusion that the reference is fabricated."
