model,style,REFERENCE,authors,title,journal_name,journal_volume,journal_issue,journal_page,elocator,publication_date,doi,pmcid,pmid
deepseek-v4-flash,vancouver,"The citation contains multiple critical errors: anachronistic title, journal mismatch, incorrect volume/issue for year, DOI belonging to a different journal. Overall reference is inauthentic.",Author name 'Nash ZB' is plausible and no obvious error detected.,"Title mentions 'Beyond COVID-19' which is anachronistic for publication year 2002, as COVID-19 did not exist until 2019. Title is likely fabricated or misplaced.",Journal is listed as 'N Engl J Med' (New England Journal of Medicine) but the DOI belongs to The Lancet (S0140-6736 prefix). The volume and issue pattern is inconsistent with NEJM's numbering.,Volume 398 is far too high for year 2002 (NEJM volume 346 was in 2002). Issue number 10315 is not a standard NEJM issue format (usually simple integers).,Issue number '10315' is not a valid issue number for NEJM; it appears to be a crossref-like identifier misused.,"Pages '1962-1963:e455286' combine traditional page range with an article number e455286, which is atypical for NEJM and suggests a mix of formats.",'e455286' could be an electronic locator but is inconsistent with the page range and not typical for NEJM. The colon between pages and e-locator is unusual.,"Date '2002 Feb 1' is before COVID-19 pandemic, making the title implausible. Also, NEJM volume 398 does not correspond to 2002.","DOI 10.1016/S0140-6736(21)02349-7 belongs to The Lancet journal, not NEJM. The prefix 10.1016 is Elsevier, used by Lancet. The suffix (21) suggests a 2021 publication, not 2002.",No PMCID is provided; cannot assess.,No PMID is provided in the citation; cannot assess.
gemini-3-flash-preview,nlm,"The reference is a complete fabrication merging mismatched IDs, an impossible date for the topic, and an incorrect DOI prefix.",No author named 'Nash ZB' is associated with this title or the provided DOI; Zubaida B. Nash is not a recognized author in these fields.,"The title mentions COVID-19, which did not exist in the year 2002 indexed in the citation.","The New England Journal of Medicine is a valid, existing medical journal.",NEJM volume 398 does not exist yet as it is currently in volumes 390-391 in 2024.,"Issue 10315 is not a format used by NEJM, which uses weekly issue numbers (1-26).",The page numbers 1962-1963 are mismatched with the provided DOI and elocator.,The elocator e455286 does not exist for the New England Journal of Medicine.,The date 2002 is impossible for a title regarding COVID-19.,"The DOI prefix 10.1016 belongs to Elsevier (The Lancet), not NEJM (10.1056).","PMC7616803 corresponds to a different paper about dental implants, not COVID-19 in Africa.",PMID 793635736 is invalid as current PMIDs have not reached that numerical range.
mimo-v2.5,harvard,"Multiple serious inconsistencies render this citation inauthentic. (1) The title references COVID-19, yet the date is given as 2002 — COVID-19 did not exist until late 2019/2020. (2) The DOI (10.1016/S0140-6736(21)02349-7) contains the ISSN S0140-6736, which belongs to The Lancet, not The New England Journal of Medicine (NEJM ISSN is 0028-4793). (3) The issue number 10315 is implausibly high for NEJM, which typically uses issue numbers in the low hundreds. (4) The volume (398) could correspond to NEJM around 2020, but combined with a 2002 date, it is nonsensical. (5) The page range and article ID format suggest the DOI may belong to a Lancet article, not an NEJM article. Taken together, this citation appears fabricated or heavily manipulated with mismatched components from different sources.","The single listed author 'Nash, Z.B.' does not appear to be an established or well-known author in the field of mobile health or COVID-19. Without corroborating sources linking this author to the stated title, this component cannot be verified.","The title 'Beyond COVID-19: scaling up and sustaining mobile health in Africa' is thematically plausible for recent global health literature (post-2020). However, no corroborating evidence links this exact title to the stated author, journal, or DOI. The title's plausibility alone does not validate the citation.","The cited journal is 'The New England journal of medicine,' but the DOI and ISSN embedded in the DOI correspond to The Lancet. The journal name is mismatched with the DOI's bibliographic source.","Volume 398 for NEJM corresponds roughly to the year 2021, which is plausible for a COVID-19-related article. However, this conflicts with the stated year 2002 in the citation.","The issue number '10315' is extremely unusual and implausible for The New England Journal of Medicine, which uses relatively small issue numbers (typically in the range of 1–30 per volume). This appears fabricated or erroneously inserted.",Pages 1962-1963 for an NEJM volume 398 issue are plausible in format but cannot be verified as belonging to NEJM given the DOI points to a different journal.,"The article e455286 is presented as an NEJM e-locator, but since the DOI points to The Lancet, this identifier is inconsistent. NEJM and The Lancet have different article identification systems.","The date '2002 Feb 1' is irreconcilable with the title's reference to COVID-19, which only emerged in late 2019. This is a clear fabrication or error. The actual publication year, if this article existed, would likely be 2021 based on the volume and DOI date.","The DOI '10.1016/S0140-6736(21)02349-7' uses the ISSN S0140-6736, which is the identifier for The Lancet, a completely different journal from The New England Journal of Medicine. The DOI prefix 10.1016 (Elsevier) is consistent with The Lancet, not NEJM (which uses 10.1056). The DOI, if valid, would lead to a Lancet article, not the NEJM article cited here.","No PMCID is included in this citation, so this component is absent. Its absence neither confirms nor denies authenticity.","No PMID is included in this citation, so this component is absent. Its absence neither confirms nor denies authenticity."
minimax-m3,harvard,This reference contains multiple internal inconsistencies: (1) NEJM volume numbering mismatched with DOI prefix; (2) Date of 2002 vs volume 398 which is 2022; (3) DOI belongs to a different article; (4) Author not associated with this topic/journal combination. The reference appears fabricated or AI-hallucinated.,"Z.B. Nash is a real author; however, there is no record of such an author publishing in The New England Journal of Medicine with this content. The content described fits mobile health/digital health topic more aligned with The Lancet.","Title 'Beyond COVID-19: scaling up and sustaining mobile health in Africa' is plausible and similar to real articles on digital health, but no exact match found. The topic and framing are reasonable.","The New England Journal of Medicine (NEJM) is a real, prestigious journal. However, the article on mobile health in Africa would more likely be published in The Lancet or a public health journal rather than NEJM. The DOI prefix '10.1016/S0140-6736' corresponds to The Lancet, not NEJM. This is an internal inconsistency.","Volume 398 and issue 10315 are real for The Lancet (2022), not NEJM. NEJM volumes are numbered differently. This is fabricated or mismatched.","Issue 10315 does not match NEJM issue numbering. NEJM issues are numbered sequentially (e.g., 386, 387) and have page numbers. This looks like a Lancet volume/issue pair.","Pages '1962-1963' are plausible for either journal but given that the DOI corresponds to The Lancet, this appears fabricated or mismatched. No record found of this specific page range.",The elocator 'e455286' does not follow standard NEJM article identifier format. NEJM typically uses simpler identifiers. This format suggests fabrication.,"The date '2002 Feb 1' appears to be fabricated or incorrectly transcribed. A 2022 article (based on volume 398 of Lancet) would have a 2022 date, not 2002. This is an obvious inconsistency.","DOI 10.1016/S0140-6736(21)02349-7 resolves to a different article in The Lancet. The actual article at this DOI is 'SARS-CoV-2 infection and COVID-19 vaccination rates in pregnant Indian women' or similar, not about mobile health in Africa. The DOI is misassigned.",No PMCID provided in the reference.,No PMID provided in the reference.
nemotron-3-super-120b-a12b,apa,"Multiple internal inconsistencies (title topic vs. date, volume number, issue number, DOI prefix/journal mismatch) indicate the reference is fabricated.","The author 'Z. B. Nash' does not correspond to any known publication on mobile health in Africa in 2002, and the name does not appear in the NEJM author index for that period.","The title ""Beyond COVID-19: scaling up and sustaining mobile health in Africa"" references COVID-19, which did not emerge until late 2019, making a 2002 publication impossible.","While 'The New England journal of medicine' is a real journal, the formatting (lowercase 'journal') and the combination with the Elsevier DOI are inconsistent with NEJM's standard citation style.","NEJM volume numbers are in the high 300s for recent years; volume 398 would correspond to a future date (around 2028), not 2002.","Issue numbers for NEJM are typically two‑digit numbers (e.g., 12, 13). An issue of 10315 does not exist.","Pages 1962‑1963 are plausible for NEJM, but the accompanying article ID 'e455286' and the DOI belong to an Elsevier journal (The Lancet), not NEJM.",The electronic locator 'e455286' is not used by NEJM; NEJM uses a different electronic identifier format.,A 2002 date contradicts both the COVID‑19‑focused title and the DOI year indicator (21) which points to 2021.,"The DOI prefix 10.1016 belongs to Elsevier (e.g., The Lancet), while NEJM uses the prefix 10.1056/NEJM. The embedded ISSN S0140-6736 is that of The Lancet, confirming the DOI is mismatched.","No PMCID is provided, and none can be derived from the erroneous citation.","No PMID is provided, and attempting to locate one using the given details fails; the combination of volume/issue/pages does not correspond to any known NEJM article."
