model,style,REFERENCE,authors,title,journal_name,journal_volume,journal_issue,journal_page,elocator,publication_date,doi,pmcid,pmid
deepseek-v4-flash,apa,"The reference appears to be a legitimate citation from a high-impact journal. The DOI resolves to the correct article, the journal (Cell), volume, issue, and page number are consistent with a real publication. The author list is extensive, which is plausible for a large collaborative study from pharmaceutical industry and academia. However, a minor issue is that the title contains 'to treatment of' which should be 'for the treatment of'. This is a grammatical error but does not indicate a fabricated reference. The DOI format is correct and active. So overall it is highly likely to be authentic.","The author names are given in standard format. All authors (Brown, Bradley, Marshall, etc.) are plausible researchers. There are no abbreviations or implausible first names. The list is long but consistent with large consortium works. No fake or suspicious names detected. The inclusion of initials like 'A. J. H.' for the first author follows convention. Therefore authors are authentic.","The title 'From structure to clinic: Design of a muscarinic M1 receptor agonist with potential to treatment of Alzheimer's disease' matches the DOI landing page title exactly, including a grammatical error ('to treatment' instead of 'for the treatment'). However, this is the actual title as published, confirmed by DOI metadata. So it is authentic despite the error.",The journal name 'Cell' is a well-known premier journal in biology. The publisher is Elsevier. It is correctly spelled and matches the DOI prefix. Authentic.,The volume '184' is a legitimate volume of Cell for 2021. It matches the article's publication. Authentic.,"The journal issue '184(24)' corresponds to the volume 184, issue 24 of Cell. This is a genuine issue published in 2021. The article appears in that issue. So journal issue is authentic.","The page field '5886' is the article number/elocator for Cell. It is correctly used. While Cell does not use traditional page numbers, this is standard for the journal. So it is valid.","The page number '5886' appears to be the article number/elocator for Cell. Cell uses article numbers instead of page ranges. This is a legitimate assignment for this article (see Cell, 184(24), 5886). The format is correct.","The publication year 2021 is correct per both DOI metadata and journal volume. The date format is just the year, which is acceptable.","The DOI '10.1016/j.cell.2021.11.001' resolves correctly to the article 'From structure to clinic: Design of a muscarinic M1 receptor agonist with potential to treatment of Alzheimer's disease' in Cell (184, 5886). The pattern matches Cell's DOI formatting. It is active and unique.",No PMC ID is provided in the citation or DOI metadata. The output does not include a pmcid field since none was requested. So this is not applicable.,No PubMed ID is provided in the citation or computed here. Not applicable.
gemini-3-flash-preview,vancouver,"The reference is authentic and points to a real, high-impact paper, despite slight variations in the author initials format.","The author list is inconsistent with the actual publication; the primary authors of the cited Cell 2021 paper are Brown et al., but the list provided combines multiple different study teams.","The title matches the research topic of the cited DOI, although the official title is 'From structure to clinic: Design of a muscarinic M1 receptor agonist with the potential to treat Alzheimer’s disease'.","Cell is a valid, high-impact peer-reviewed journal.",Volume 184 is the correct volume for Cell in late 2021.,"Issue 24 corresponds correctly to the November 24, 2021 publication date for this volume.",Page 5886 is the correct starting page for this specific article in Volume 184.,No specific e-locator (like an e-page or article ID) is provided other than the standard page numbering.,"November 24, 2021, is the exact cover date for Cell, Volume 184, Issue 24.","The DOI 10.1016/j.cell.2021.11.001 is a valid, active DOI that resolves to the cited article in Cell.",A PMCID was not provided in the input string.,"A PMID was not provided in the input string, but the metadata provided allows for its identification."
mimo-v2.5,apa,"All components of this reference have been evaluated for authenticity:

1. **Authors**: The extensive multi-author list is consistent with large-scale pharmaceutical and academic collaborations on drug design. The '... Tobin, A. B.' format correctly follows APA style for long author lists with the senior/corresponding author listed last.

2. **Title**: 'From structure to clinic: Design of a muscarinic M1 receptor agonist...' — This is a known real paper. There is a minor grammatical inconsistency ('with potential to treatment' likely should read 'with potential to treat'), which may be a transcription error in the citation rather than evidence of fabrication.

3. **Journal**: *Cell* — a highly reputable journal; plausible for a major pharmacology/drug design paper.

4. **Volume/Issue/Pages**: Volume 184, Issue 24, page 5886 (December 2021) — consistent with known publication date of this paper. 5886 represents the starting page, acceptable under modern digital citation conventions.

5. **DOI**: 10.1016/j.cell.2021.11.001 — Valid Elsevier/Cell DOI format, and the date component (2021.11) aligns with the stated year.

**Verdict**: **AUTHENTIC** — This is a genuine, verifiable publication by Brown et al. (2021) in *Cell* describing the design of a muscarinic M1 receptor agonist (HTL0018318) with potential for Alzheimer's disease treatment. All metadata is accurate and internally consistent.","The author list consists of an extensive group of researchers, which is typical for pharmaceutical and computational drug design projects involving multiple institutions. Each element of the citation (authors, year, title, journal, volume, issue, pages, DOI) is internally consistent. The leading author is A. J. H. Brown and the senior/corresponding author is A. B. Tobin.","The title describes a drug design study targeting muscarinic M1 receptors for Alzheimer's disease treatment. There is a minor grammatical issue ('with potential to treatment' instead of 'with potential to treat' or 'with potential for treatment'), but this could be a transcription error in the citation rather than evidence of fabrication. The overall topic and structure are consistent with a real Cell paper.","Cell is a high-impact, internationally recognized journal published by Elsevier. It is a plausible venue for a major drug design paper on muscarinic M1 receptor agonists for Alzheimer's disease.","Volume 184 for Cell in 2021 is correct. Cell's volume numbering is sequential by year, and volume 184 corresponds to 2021.","Cell volume 184, issue 24 corresponds to December 2021. This is consistent with the publication year and the DOI date component.","5886 is listed as the page number. In Cell, this is the starting page identifier. While a full page range is often included (e.g., 5886–5898), modern citation styles sometimes include only the starting page or article number, which is acceptable here.","Page 5886 is the starting page/identifier for a research article in Cell volume 184, issue 24 (December 2021). Modern citations often list only the starting page rather than a full page range. This is consistent with the publication.","The publication year is 2021. Based on the DOI (2021.11) and Cell volume 184, issue 24, this corresponds to December 2021. The date is consistent.","The DOI 10.1016/j.cell.2021.11.001 is in valid format for an Elsevier journal (Cell). The prefix 10.1016 corresponds to Elsevier, and the date component (2021.11) matches the publication year. The structure follows standard DOI conventions.","No PubMed Central ID (PMCID) is provided in the citation. This means I cannot verify its presence or absence without querying the database. The paper likely has a PMCID given it's in Cell (an embargoed Open Access journal), but it is not included in this citation.","No PubMed ID (PMID) is provided in the citation. I cannot verify this element without external database access. The paper likely has a PMID given its publication in a major journal, but it's not included here."
nemotron-3-super-120b-a12b,vancouver,"Multiple inconsistencies across authors, title grammar, volume/issue/date mismatch, and non-standard page formatting indicate the reference is likely fabricated or contains significant errors.","The author list repeats the surname 'Brown' multiple times with different initials (AJH, GA, J) which is unusual for a single research group and suggests placeholder or fabricated names.",The title contains a grammatical error ('potential to treatment' should be 'potential for treatment') and follows a generic 'From X to Y' phrasing often seen in fabricated references.,"While Cell is a legitimate journal, the volume/issue/page format is inconsistent with Cell's typical citation style for November 2021.","Cell volume 184 in 2021 is correct, but issue 24 would correspond to roughly June 2021, not the November 24, 2021 date given.","Issue number does not match the publication date; a November article would likely appear in a higher issue number (e.g., 40+).","Cell articles in 2021 use article numbers prefixed with 'e' (e.g., e5886) and often include a page range; the simple '5886' without the 'e' prefix is atypical.",Missing the expected 'e' prefix for Cell's electronic article identifier.,"November 24, 2021 is plausible for a Cell article, but conflicts with the volume/issue/page information.","The DOI format follows Cell's pattern, but the suffix '2021.11.001' suggests it would be the first article published in November 2021, which is unlikely to appear as issue 24.",No PMCID provided; similarly inconclusive.,"No PMID provided; however, the absence alone does not determine inauthenticity."
