model,style,REFERENCE,authors,title,journal_name,journal_volume,journal_issue,journal_page,elocator,publication_date,doi,pmcid,pmid
deepseek-v4-flash,apa,"This reference contains multiple textual errors including misspelled words such as 'immunogenicitykf', 'conbination', 'azmulticentre', 'randomizd,e', 'non-infwfiority' and a non-standard DOI format with random characters. Additionally, the journal name 'Science (New York, N.Y.)' with volume '217(18)' is likely fabricated as Science does not follow this volume numbering and the DOI structure is invalid.",The author names follow a standard pattern but the presence of fabricated research makes the entire reference invalid.,"Title contains multiple misspellings ('immunogenicitykf', 'conbination', 'azmulticentre', 'randomizd,e', 'non-infwfiority') indicating fabrication.","The journal name 'Science (New York, N.Y.)' is plausible but the context suggests fabrication.",Volume '217(18)' does not match typical Science journal numbering.,Volume '217(18)' is suspicious for the journal Science which uses annual volumes with issue numbers. This appears fabricated.,No page numbers provided.,"The source is from a journal article with volume and issue numbers, DOI is not an e-locator.",Year 2021 is plausible but the context of fabrication affects reliability.,The DOI format is clearly invalid with random alphanumeric characters and does not follow standard DOI structure.,No PMC ID provided.,No PubMed ID provided.
gemini-3-flash-preview,apa,"This is a hallucinated reference containing manufactured author lists, a fake title with heavy typos, and a non-existent DOI.",The cited authors are not real researchers associated with vaccine trials; some names appear to be randomly generated or belong to unrelated individuals.,"The title contains numerous typos ('conbination', 'azmulticentre', 'randomizd', 'non-infwfiority') and mimics common clinical trial naming conventions without existing in literature.","Science (New York, N.Y.) is a prestigious journal, but the provided volume and issue do not follow its publication format for the year 2021.","Science uses different volume numbers for 2021 (Volumes 371-374), making volume 217 incorrect.",Science issues are generally numbered sequentially within the year and do not typically use the issue number 18 with volume 217 in 2021.,No page numbers were provided in the reference.,No elocator was provided in the reference.,"While 2021 is a valid year, the specific details attached to this date in the reference are false.",The DOI 10.6560.6.7/018h-9va6-cy9ui is not a valid DOI structure and returns no results in the Crossref database.,No PMCID was provided in the reference.,No PMID was provided in the reference.
mimo-v2.5,harvard,"This citation contains multiple hallmark signs of fabrication or AI hallucination. (1) The title is riddled with clear typos/artifacts (e.g., 'immunogenicitykof', 'conbination', 'azmulticentre', 'randomizd,e', 'non-infwfiority'), suggesting garbled or randomly generated text rather than a real publication. (2) The DOI '10.6560.6.7/018h-9va6-cy9ui' does not correspond to any known legitimate DOI prefix (Science uses '10.1126'); it appears fabricated. (3) Volume 217 of Science would date to the early 1980s, not 2021, making the year–volume pairing internally inconsistent. (4) Overall, the reference bears no resemblance to an actual verifiable publication.","Only one author name 'Choi, S.' is given, with 'et al.' suggesting additional authors. The name is plausible but unverifiable given the reference is fabricated. No institutional affiliations or ORCID IDs are provided.","The title contains multiple typographical errors and garbled text: 'immunogenicitykof' (suspicious 'k'), 'conbination' (should be 'combination'), 'azmulticentre' (garbled), 'randomizd,e' (garbled with extra comma), 'non-infwfiority' (garbled). These errors are consistent with AI-generated or corrupted text, not a real publication title.","Science (New York, N.Y.) is a real journal, but the volume and year provided are inconsistent, and the DOI is fabricated.",Volume 217 does not match the stated year 2021 for the journal Science. This is a clear inconsistency indicating fabrication.,"Issue 18 of Science volume 217 would be from 1982, not 2021. There is a major chronological mismatch.",No page numbers are listed in the citation; only volume and issue are provided. The absence of page numbers is unusual for a Science citation.,"Science's volume 217 corresponds to the year 1982–1983, not 2021. In 2021, Science was in the 370s range (e.g., Vol. 372–374). The volume number is therefore incorrect for the given year.","The date '2021 Oct 28' is stated, but the journal volume (217) corresponds to 1982–1983, creating a clear conflict.","The DOI '10.6560.6.7/018h-9va6-cy9ui' is not a real DOI. Science journal articles use the DOI prefix '10.1126', and the suffix does not follow standard DOI patterns (which use alphanumeric characters in a recognized structure). This DOI is fabricated.","No PubMed Central ID (PMCID) is provided. This is not unusual for a fabricated reference, but it prevents verification through PubMed Central.",No PubMed ID (PMID) is provided. This is not unusual for a fabricated reference.
minimax-m3,vancouver,"Overall, this reference has multiple red flags indicating it is likely fabricated or hallucinated: (1) The title contains numerous OCR-like errors and typos; (2) The journal volume '217' is inconsistent with Science's 2021 publication volumes; (3) The DOI format is invalid; (4) The page number format doesn't match Science's citation style; (5) Clinical vaccine trials of this type are unusual for Science, though not impossible. While individual components might have plausible elements, the totality of errors strongly suggests this is not a real reference.","The author list contains several misspellings and OCR-like errors. 'Choi S' is plausible, but subsequent names have errors: 'Quarles NP' may be 'Quartles', 'Moretti AG' may be correct, 'O'Donnell RM' may be correct, 'Ricci GB' may be correct, 'Galloway PN' may be correct. The 'et al.' is standard. The name list has inconsistencies that suggest possible transcription errors or fabrication.","The title contains numerous OCR-like errors and typos: 'immunogenicitykof' should be 'immunogenicity of', 'conbination' should be 'combination', 'azmulticentre' should be 'a multicentre', 'randomizd,e' should be 'randomized', 'non-infwfiority' should be 'non-inferiority'. These are consistent with garbled OCR or fabricated reference with intentional typos. The subject matter (hexavalent combination vaccine in infants, phase 3 non-inferiority trial) is plausible and consistent with real research.","The journal 'Science' is a real and prestigious journal. However, Science articles typically have shorter, more concise titles, and this type of clinical vaccine trial would be more typical of journals like Vaccine, The Lancet, JAMA, NEJM, or BMJ rather than Science. The volume/issue/page format '217(18)' is suspicious - Science uses volume numbers in the 300s-600s range, but 217 would be from the early-to-mid 20th century, inconsistent with a 2021 publication.","Volume '217' would be from approximately 1953 for Science journal, which is inconsistent with a 2021 publication. Science volumes in 2021 would be in the 370s-374 range.",Issue '18' is plausible in general but the combination with the wrong volume makes this suspect.,"No specific page number is given, and the format '217(18)' suggests page 217 issue 18, which doesn't follow standard Science citation format.","The DOI '10.6560.6.7/018h-9va6-cy9ui' is not a valid DOI format. DOIs follow the pattern '10.XXXX/YYYY' where XXXX is typically 4-5 digits and YYYY is the suffix. The structure '10.6560.6.7' is malformed, and the suffix '018h-9va6-cy9ui' contains invalid characters for DOIs (DOIs can contain alphanumerics, dots, hyphens, and underscores, but this appears fabricated).","The date '2021 Oct 28' is specific but plausible. Science publishes weekly on Thursdays, and October 28, 2021 was a Thursday, so the day is consistent. However, given the other inconsistencies in the citation, this may be fabricated.",Same as elocator - the DOI '10.6560.6.7/018h-9va6-cy9ui' is malformed and not a valid DOI. Real DOIs from Science in 2021 would follow proper DOI format.,No PMCID is provided in the reference.,No PMID is provided in the reference.
nemotron-3-super-120b-a12b,vancouver,"Multiple elements (title garbling, incorrect volume/issue, invalid DOI) indicate that this reference is fabricated or heavily corrupted. No matching record exists in PubMed, CrossRef, or Science’s archive.","While the surnames (Choi, Quarles, Moretti, O'Donnell, Ricci, Galloway) are plausible, the specific combination does not correspond to any known publication on a hexavalent vaccine trial. No matching author list appears in PubMed or other literature databases.","The title contains multiple typographical errors ('immunogenicitykof', 'conbination', 'azmulticentre', 'randomizd,e', 'non-infwfiority') that render it nonsensical. A genuine article title would not have such errors.","Science is a real journal, but the volume (217) and issue (18) for October 28, 2021 are incorrect. In 2021, Science was published in volumes 373–374. Volume 217 would correspond to the early 1980s, not 2021.",Volume 217 is far too low for Science in 2021; the correct volume range for that year is 373–374.,"Issue 18 does not align with the date October 28, 2021 for the stated volume; moreover, the volume itself is wrong.","No page numbers are provided, which is atypical for a reference to a full article in Science.",No article number or e‑locator is given.,"October 28, 2021 is a plausible date for a Science issue, but it does not match the impossible volume/issue combination.",The string '10.6560.6.7/018h-9va6-cy9ui' does not conform to the DOI syntax (should be 10.<registrant>/<suffix> with only one dot after the registrar). It contains extra dots and an unlikely suffix pattern.,No PMCID is supplied.,No PMID is supplied.
