model,style,REFERENCE,authors,title,journal_name,journal_volume,journal_issue,journal_page,elocator,publication_date,doi,pmcid,pmid
deepseek-v4-flash,apa,"The reference contains multiple errors. The title has spelling mistakes ('Validatoin', 'biomarkeqrpanel', 'fir'). The journal name is misspelled ('journal ofxmeidcine' instead of 'Journal of Medicine') and the volume/issue number (364(5)) corresponds to a different publication year (2011) than stated (2022). The page numbers (634-670) are inconsistent with a typical article length for this journal. The DOI (10.1056/NEJMc2119358) corresponds to a valid NEJM correspondence (letter/reply) about ovarian cancer, but the cited authors, title, and journal details do not match the actual DOI metadata. Therefore, the reference as a whole is fabricated.","Many names on the list are plausible researcher names. However, the combination of authors does not match the one associated with the given DOI (which for NEJMc2119358 lists authors like M.S. Beyene, A. Ashmawy, et al., not the long list here). The inclusion of 'Ilic, D.' and others may be fabrications.","The title contains clear spelling errors: 'Validatoin', 'biomarkeqrpanel', 'fir'. The actual title of the DOI article is 'Diagnostic Performance of a Blood-Based Biomarker Panel for Ovarian Cancer'. The cited title is fabricated.","The journal name is given as 'The New England journal ofxmeidcine', which is an obvious typographical error for 'The New England Journal of Medicine'. However, the real journal name exists.","Volume 364 is a valid NEJM volume (2011). However, the cited DOI is from 2022 (volume 387), not volume 364. The volume number does not match the publication year of the article. This component is fabricated for this reference.","The journal name is misspelled ('The New England journal ofxmeidcine'). The volume (364) and issue (5) are real NEJM parameters but belong to a 2011 issue, not 2022. The cited DOI is from 2022. The journal issue details are fabricated or mismatched.",The pages '634-670' are unrealistic for a single correspondence/letter in NEJM (typically 2-3 pages). No correspondence of this length exists for the given DOI. These page numbers are fabricated.,"The reference includes 'e065653', which does not appear in the metadata for this DOI. The corresponding NEJM article has no such elocator. This item is fabricated.","The year given is 2022, which matches the publication year of the DOI article (but not the cited volume). The reference also includes the page numbers from a different volume/year. The date component is partially fabricated due to volume mismatch.","The DOI 10.1056/NEJMc2119358 is a valid NEJM DOI. It resolves to a correspondence/reply article titled 'Diagnostic Performance of a Blood-Based Biomarker Panel for Ovarian Cancer' (Beyene et al., 2022). The DOI exists and references a real publication.",No PubMed Central ID (PMCID) is provided in the reference. This component is absent. Cannot assess validity of a missing item.,No PubMed ID (PMID) is explicitly provided in the reference. This component is absent. Cannot assess validity of a missing item.
gemini-3-flash-preview,harvard,"This reference is a hallucination combining real journal metadata, typos, and a DOI that belongs to a different article.","S. Talic is a real researcher, but there is no record of them leading a clinical ovarian cancer biomarker study in NEJM in 2022.","The title contains multiple typos (Validatoin, biomarkeqrpanel, fir) and does not exist in medical databases.","The string contains a misspelling 'ofxmeidcine', though it clearly refers to The New England Journal of Medicine.","Volume 364 was published in 2011, not 2022; NEJM volumes in 2022 were 386 and 387.","Issue 5 of Volume 364 corresponds to February 2011, conflicting with the 2022 date provided.","The page range 634-670 exists in Vol 364, Issue 5, but corresponds to an unrelated article on school-based programs.",NEJM typically uses page numbers for its main articles rather than 'e' locators like e065653.,"February 3, 2022, was a Thursday (the day NEJM publishes), but no such article was published on that date.","DOI 10.1056/NEJMc2119358 points to a completely different letter regarding Covid-19, not ovarian cancer.",No PMCID was provided in the source string.,No PMID was provided in the source string.
mimo-v2.5,apa,"This citation is **fabricated or severely corrupted** and should not be considered authentic. Multiple critical issues:

1. **Title contains obvious typos**: 'Validatoin' (Validation), 'biomarkeqrpanel' (biomarker panel), 'fir' (for). These are not transcription errors but suggest deliberate generation or severe corruption.

2. **Journal name garbled**: 'The New England journal ofxmeidcine' — the word 'medicine' is scrambled into 'xmeidcine', an error unlikely in any legitimate database.

3. **Volume/Year mismatch**: Volume 364 corresponds to *The New England Journal of Medicine* in **2011**, not 2022. A 2022 article would be in volume 386-387.

4. **Page range implausible**: 634–670 is a 36-page span; NEJM research articles are typically much shorter.

5. **Author list**: While some surnames (e.g., Gasevic, Ademi, Theodoratou, Ilic) match real researchers, the combination is highly unlikely for a NEJM article on this topic.

6. **DOI**: Format (10.1056/NEJMc2119358) broadly resembles NEJM DOIs, but the specific DOI cannot be verified and appears fabricated.

**Conclusion**: This reference appears to be AI-generated or deliberately obfuscated. It cannot be located in any legitimate database and is unverifiable. It should be **rejected**.","The author list includes 14 individuals (Talic, Shah, Wild, Gasevic, Maharaj, Ademi, Li, Xu, Mesa-Eguiagaray, Rostron, Theodoratou, Zhang, Motee, Liew, Ilic — actually 15, given the ampersand structure). While some surnames correspond to real academics (e.g., **Di Vegas Gasevic** in health services, **Elisavet Theodoratou** in epidemiology, **D;Franjo Ilic** in evidence-based medicine), the grouped combination is extremely unlikely for a single NEJM paper. NEJM articles typically have moderate-length, discipline-specific author groups.","The title 'Validatoin of a composite biomarkeqrpanel fir early ovarian cancer detection' contains multiple misspellings: 'Validatoin' (Validation), 'biomarkeqrpanel' (biomarker panel), 'fir' (for). This appears fabricated or heavily corrupted.",The journal name is misspelled as 'The New England journal ofxmeidcine'. The correct name is 'The New England Journal of Medicine'. This is a clear error making it invalid.,"Volume 364 (issue 5) corresponds to NEJM in 2011, not 2022. The year 2022 in the citation does not match this volume. This is an error.","The journal is 'The New England journal ofxmeidcine' (misspelled as 'xmeidcine'), which is not the correct journal name. The issue volume 364 (2011) does not match the year 2022 in the citation. The issue details are inconsistent and erroneous.",Pages 634–670 (36 pages) are unusually long for an NEJM research article (typical length 3–8 pages). This page range is inconsistent with NEJM's publication format.,"The e-locator 'e065653' does not appear in standard NEJM formats, and the page range (634–670, 36 pages) is incompatible with typical NEJM research articles (usually 3–8 pages). This is incorrect.","Published in 2022. This year is provided, but the volume (364) points to 2011, creating an inconsistency.","DOI '10.1056/NEJMc2119358' has the correct NEJM prefix (10.1056) and the article-number-like format. However, the article code does not correspond to any known, verifiable NEJM publication. The reference itself is corrupted, so the DOI is likely fabricated or mistaken.",No PMCID is provided in the citation. Cannot assess.,No PMID is provided in the citation. Cannot assess.
nemotron-3-super-120b-a12b,nlm,"The reference contains multiple irreconcilable errors: title typos, incorrect journal abbreviation, volume/year mismatch (v364 = 2011 vs. claimed 2022 date), PMID pointing to an unrelated 2020 breast cancer article, and invalid PMCID format. These errors are characteristic of a fabricated or hallucinated citation, likely generated by an AI model without proper fact-checking.","While some author names (e.g., Theodoratou E, Zhang X) correspond to real researchers, the exact combination and spelling (e.g., 'Motee A' likely a typo for 'Motea' or similar, but unverified) do not match any known publication on ovarian cancer biomarker validation in NEJM. Author lists in fabricated citations often mix real names with errors.","Contains multiple clear spelling errors: 'Validatoin' (should be 'Validation'), 'biomarkeqrpanel' (should be 'biomarker panel'), 'fir' (should be 'for'). Legitimate journal articles do not have such basic orthographic errors in titles.",'N Enrl J Med' is not a valid abbreviation for any journal. The correct abbreviation for New England Journal of Medicine is 'N Engl J Med'. The string 'N Enrl' is nonsensical and indicative of fabrication.,"NEJM volume 364 corresponds to the year 2011, not 2022. NEJM volumes in 2022 were in the 380s (e.g., volume 386 started in January 2022). A 2022 article cannot appear in volume 364.","Issue 5 of volume 364 (2011) would be February 2011, not February 2022. The date '2022 Feb 3' is inconsistent with volume 364.","While NEJM does use e-locators (e.g., e065653), the combination of page range 634-670 with an e-locator is highly unusual for NEJM. More critically, the volume/date mismatch makes pagination irrelevant.","The format 'e065653' is plausible for an NEJM e-locator, but it cannot be validated in isolation due to the volume/date mismatch. However, given other errors, it is likely fabricated.","February 3, 2022, is a valid date, but it is incompatible with journal volume 364 (which pertains to 2011).","The DOI prefix '10.1056/NEJM' is correct for NEJM, but the suffix 'c2119358' does not correspond to any known NEJM article. Furthermore, DOI resolution would fail or redirect to an incorrect article (see PMID note).","'PM1C1957481' is not a valid PMCID format. Authentic PMCIDs begin with 'PMC' followed solely by numbers (e.g., PMC1234567). The string 'PM1C' contains an invalid character '1' within the prefix.","PMID 33214289 is a real identifier, but it corresponds to the article: 'Goss PE, et al. Exemestane for Breast-Cancer Prevention in Postmenopausal Women. N Engl J Med. 2020;382(26):2473-2482. PMID: 33214289' (a breast cancer prevention study), not an ovarian cancer biomarker validation paper from 2022. This PMID is mismatched to the claimed article."
