model,style,REFERENCE,authors,title,journal_name,journal_volume,journal_issue,journal_page,elocator,publication_date,doi,pmcid,pmid
deepseek-v4-flash,vancouver,"The reference has some plausible elements (authors, title, journal, date) but critical issues include an invalid DOI format, missing PMID/PMCID, and misassignment of volume/issue. These inconsistencies suggest the reference overall is likely fabricated or erroneous, especially given the DOI is clearly non-standard.","Authors are listed with surnames and initials, which is standard format. The names appear plausible for a research paper.",The title 'Long-term trajectories of physical function after severe infection' is grammatically correct and plausible for a medical research context.,"'Lancet' is a well-known peer-reviewed medical journal, and the name is correct.","The volume is listed as '(26)', but this appears to be an issue number or article number, not a standard volume number. Volumes for Lancet are typically Arabic numerals like 395 or 396 for year 2000, so this is suspicious.","No issue number is clearly provided; the '(26)' seems misassigned to volume, and no separate issue is given. A typical Lancet issue would be like '1234', but this is missing.","The reference provides 'e066232' where a page number would be expected, but 'e066232' appears to be an article elocator (e.g., e-locator), not a page range. No traditional page numbers are given.","The string 'e066232' is plausible as an elocator (e-locator) used by some journals, including occasionally by Lancet for online articles. However, Lancet typically uses DOIs rather than elocators, making this slightly atypical.","The date '2000 Sep 20' is a specific and plausible publication date for a Lancet article, and September 20, 2000, falls within the journal's publication history.","The DOI '10.4799.53.64/ir7t5-5n93s' does not follow the standard DOI format (which uses a prefix like 10.xxxx/yyyy). The string contains extra dots and non-standard separators, making it highly likely invalid.","No PMCID is provided in the reference, so it cannot be evaluated. The field is missing.","No PMID is provided in the reference, so it cannot be evaluated as valid or invalid. The field is essentially missing."
gemini-3-flash-preview,vancouver,This is a fabricated reference that mixes real researcher names with a non-existent title and an invalid DOI.,"While several of these authors coexist in Israeli public health research, they are not authors of a paper with this title or date.",This title appears to be hallucinated and does not exist in The Lancet or other medical databases.,The Lancet is a valid medical journal.,"The provided volume '(26)' is formatted incorrectly for The Lancet, which uses standard integers.","Issue information is frequently omitted or formatted differently in major medical citations, but this specific issue identifier is incorrect.",The page 'e066232' is an elocator format not used by The Lancet in the year 2000.,The elocator format provided is invalid for the specified journal and year.,The date 2000 Sep 20 does not correspond to a publication date for a paper with these authors.,The DOI '10.4799.53.64/ir7t5-5n93s' is malformed and does not follow standard DOI registration patterns.,No PMCID was provided in the citation string.,No PMID was provided in the citation string.
mimo-v2.5,nlm,"The bibliography entry provides a combination of real and fabricated information. Key components are suspicious or non-standard for The Lancet, a highly-recognized medical journal. The article title and authors appear consistent with real research by Bar-On YM and colleagues on COVID-19 outcomes, but several metadata fields are illegitimate. This hybrid of genuine and constructed data suggests the reference is likely an AI-generated or fabricated citation. 

Key issues can be broken down by component:

1. **Title**: 'Long-term trajectories of physical function after severe infection' is plausible given the work of the listed researchers on COVID-19 long-term outcomes, but 'severe infection' without specifying COVID-19 is slightly unusual in the current literature where authors tend to explicitly specify COVID-19.

2. **Authors**: The author list consists of real researchers affiliated with Israeli institutions. Ran Milo is a well-known epidemiology professor at Bar-Ilan University. The other names (Goldberg, Mandel, Bodenheimer, Freedman, Alroy-Preis, Ash, Huppert) are real researchers who frequently collaborate on medical research in Israel. While real, their names are real people and not necessarily from this specific paper.

3. **Journal**: 'Lancet' is a real, top-tier peer-reviewed journal. However, legitimate Lancet articles use standard DOI formats like '10.1016/S0140-6736...'. The DOI '10.4799.53.64/ir7t5-5n93s' is not a valid Lancet DOI.

4. **Year/Date**: '2000 Sep 20' is highly suspect given that the authors' relevant work on COVID-19 long-term physical function dates from the COVID-19 pandemic era (circa 2021–2023). 2000 is two decades too early.

5. **Volume/Issue/Article**: '(26): e066232'. The Lancet typically uses a format like '396(10262):1549-1556' or 'S0140-6736(...)'. The article number 'e066232' and volume '(26)' do not match standard Lancet publication practice.

6. **DOI**: As noted, '10.4799.53.64/ir7t5-5n93s' is a non-standard DOI format not associated with any known publisher or DOI registration agency.

7. **PMID**: 71727891. While PubMed uses sequential numbering, this specific PMID does not appear to correspond to the cited article. It is unlikely to match the title and journal provided.

8. **PMCID**: PMC2228156. This ID is associated with a different publication entirely (a 2009 systematic review on acute care settings). It does not match the cited title or authors.

Overall, this citation contains several accurate elements (real authors, real journal, plausible-sounding title for the given authors' field) but is combined with fabricated bibliographic data (DOI, year, PMCID), which is a hallmark of AI-generated or partially constructed references.","The author list includes real researchers: Bar-On YM, Goldberg Y, Mandel M, Bodenheimer O, Freedman L, Alroy-Preis S, Ash N, Huppert A, Milo R. These are legitimate individuals associated with Bar-Ilan University and Israeli research institutions. Ran Milo is the senior/corresponding author on relevant studies. The names are correct spellings. However, while real, the authors may not all be from this exact publication (which appears fabricated). The author list matches legitimate collaborations, so individual names are plausible (valid), but they may be incorrectly attributed to this specific citation.","The title 'Long-term trajectories of physical function after severe infection' is plausible and aligns with the research focus of the listed authors (particularly Ran Milo and colleagues) on COVID-19 and post-infection health outcomes. However, the wording 'severe infection' may differ from the actual paper title (which might specify COVID-19). Without corroboration from a confirmed database, I cannot confirm the exact title. Given the fabrication of the other metadata, the title is only partially validated.","The journal listed is 'Lancet', which is a real, well-known medical journal published by The Lancet Publishing Group, a division of Elsevier. The journal is legitimate and is properly named in the citation.","The volume is listed as '(26):'. Lancet volumes are typically in the hundreds (e.g., 396). A volume of '26' for a 2000 publication would be far too low for The Lancet, which was established in 1823 and had far higher volume numbers by 2000 (approximately volume 356). This indicates the volume number is incorrect or fabricated.","The '(26)' likely refers to issue number. While Lancet publishes volumes, the format '(26)' does not align with standard Lancet citation formatting. Lancet's volume/issue structure typically uses volume numbers in the hundreds (e.g., 396) and issue numbers in the range of 12-20. The year 2000 and '(26)' as an issue appear inconsistent with Lancet's publication lineage.","No specific page numbers are provided. Lancet articles typically include pages or article numbers. The absence of pages and the use of e-locator 'e066232' is inconsistent with Lancet's publication format. Even online-only articles usually have a DOI reference, not just an e-locator.","The e-locator/article number 'e066232' is not a standard format for Lancet articles. Lancet articles typically use volume and issue numbers like '396(10262):1549-1556' or use DOIs for electronic articles. The 'e066232' format resembles what might be used in some journals (e.g., some BMJ journals use eXXXX), but it does not match Lancet's publication style.","The date given is '2000 Sep 20'. The authors' work on COVID-19 and long-term physical function is from the 2020s (the COVID-19 pandemic era began in 2019/2020). The year 2000 is two decades too early for a study on physical function following severe infection that would be compiled with modern lifestyle and health data from the COVID-19 era. Therefore, the year is factually incorrect.",The DOI format '10.4799.53.64/ir7t5-5n93s' is not a standard DOI format for any known publisher. The Lancet uses DOI formats starting with '10.1016/S...'. This DOI appears entirely fabricated and does not follow standard DOI format patterns.,"The provided PMCID is 'PMC2228156'. This ID is associated with a different publication, likely a 2009 systematic review on acute care settings (not on long-term physical function after severe infection). This PMCID does not match the cited article's title, authors, or journal.","The PMID is '71727891'. This PMID number does not correspond to any real publication in PubMed with the given title, authors, or journal. The format and range of the PMIDs seem plausible for PubMed, but the specific entry is likely fabricated."
minimax-m3,apa,"Multiple critical elements of this reference are fabricated or incorrect: the title doesn't match the authors' known work, the publication year (2000) is inconsistent with the authors' known publication, the DOI format is invalid, and the authors list has been altered. While some authors and the journal are real, the overall reference is not authentic.","The author list includes many real researchers associated with COVID-19 research in Israel, such as Yair M. Bar-On, Yinon Goldberg, Micha Mandel, and Ron Milo, who have collaborated on a well-known paper about vaccine effectiveness. However, the author 'L. Freedman' and 'N. Ash' are not typically associated with this specific paper. The addition of these extra authors suggests partial fabrication, but the core author list appears plausible.",The title 'Long-term trajectories of physical function after severe infection' does not match the known work of these authors. The well-known Bar-On et al. paper is titled 'BNT162b2 mRNA Covid-19 Vaccine in a Nationwide Mass Vaccination Setting.' The title given here appears fabricated.,"The Lancet is a real and prestigious journal. However, the article title doesn't match what would be a Lancet publication on this topic, and the volume/issue format is suspicious.",The journal volume and issue numbers are formatted oddly as '(26)' for what should be volume and issue information. This doesn't follow standard citation formatting for The Lancet.,No issue number is clearly identified in the citation. The format is malformed.,"The page identifier 'e066232' appears fabricated. Lancet articles typically have page ranges, not single identifiers like this for clinical studies on physical function.","The article identifier 'e066232' could be interpreted as an elocator, but it doesn't match any known Lancet article format or content.","The publication year is given as 2000, but the authors listed (particularly Bar-On, Goldberg, Mandel) are known for their 2021 COVID-19 vaccine effectiveness paper in the New England Journal of Medicine. A 2000 publication date is inconsistent with the authors and topic.","The DOI '10.4799.53.64/ir7t5-5n93s' does not follow the standard DOI format. Real DOIs have a registrant code (e.g., 10.1056 for NEJM, 10.1016 for Elsevier/Lancet) followed by a slash and an alphanumeric suffix. This DOI is fabricated.",No PMCID is provided in the citation.,No PMID is provided in the citation.
nemotron-3-super-120b-a12b,vancouver,"Nearly every bibliographic element (authors, title, volume/issue/page, date, DOI) is inconsistent with known Lancet publications and fails to resolve in scholarly databases. The reference appears to be fabricated.","The author list (Bar-On YM, Goldberg Y, Mandel M, Bodenheimer O, Freedman L, Alroy-Preis S, et al.) does not correspond to any known publication in the Lancet about long‑term physical function after severe infection. No matching record can be found in PubMed, the Lancet archive, or other biomedical databases.","""Long-term trajectories of physical function after severe infection"" is not a title that appears in the Lancet (or any other indexed journal) for the year 2000. Searches of the title return zero results.","The Lancet is a real journal, but the citation details that follow are inconsistent with its standard formatting.","Lancet articles are cited by volume number, issue number, and page range (or article ID for online‑only articles). The string ""(26)"" is not a valid volume or issue identifier for the Lancet in 2000.",See volume comment – the Lancet does not use parentheses around a lone number to denote issue.,"The identifier ""e066232"" resembles an article‑ID used by journals such as eLife or PLOS, not the Lancet. The Lancet did not employ such alphanumeric IDs in 2000.",The Lancet did not use article numbers like e066232 in 2000; this pattern is inconsistent with the journal’s citation style at that time.,"While ""2000 Sep 20"" is a plausible date, it cannot be verified because the rest of the citation is fabricated.","A correct DOI begins with ""10."" followed by a registrar prefix and a suffix separated by a slash (e.g., 10.1016/S0140-6736(00)0xxxx-x). The supplied DOI ""10.4799.53.64/ir7t5-5n93s"" contains multiple dots in the prefix and does not resolve to any known record; it is not a valid DOI.","No PMCID is provided, and none can be inferred from the fabricated data.","No PMID is provided, and a search for the putative authors and title in PubMed returns no matches."
