model,style,REFERENCE,authors,title,journal_name,journal_volume,journal_issue,journal_page,elocator,publication_date,doi,pmcid,pmid
deepseek-v4-flash,harvard,"The reference is partially plausible (authors, title, journal, elocator) but has critical issues: a fabricated DOI, missing volume/issue/date/PMIDs, and a missing date. This strongly suggests the reference is invalid overall.","The author list 'Dewhurst, P.R. et al.' follows a plausible format for a citation, naming a first author and using 'et al.' to indicate additional authors, which is valid.","The title 'Integrating artificial intelligence in bedside care for covid-19 and future pandemics' is well-formed and relevant to the context of the citation, appearing valid.","The journal 'BMJ (Clinical research ed.)' is a well-known and legitimate medical journal abbreviation for the British Medical Journal, making it valid.","The journal volume field is empty, which indicates it is invalid because a volume number is expected for a journal article.","The journal issue field is empty, indicating it is invalid as an issue number is typically provided for journal articles.","The journal page field is empty, which is invalid for a print article but the presence of an elocator suggests this is an online article without page numbers.","The elocator is given as 'article e190388', which follows the common format for BMJ article identifiers (e.g., e followed by numbers), so it is likely valid.","No publication date is provided in the citation, making the date field invalid due to missing information.","The DOI '10.9162.2.10/o5r' does not follow standard DOI format (e.g., 10.xxxx/xxxx) and is likely fabricated, making it invalid.","No PubMed Central ID is provided in the citation, making the PMCID field invalid due to missing information.","No PubMed ID is provided in the citation, making the PMID field invalid due to missing information."
gemini-3-flash-preview,harvard,"The citation is entirely fabricated, combining a real journal name with a non-existent title, invalid DOI, and missing metadata.","While P.R. Dewhurst is a plausible name, no record exists of this specific author publishing this paper.",The title appears to be a hallucinated synthesis of common COVID-19 medical topics; no such article exists in the BMJ database.,BMJ (Clinical research ed.) is a legitimate and well-known medical journal.,The citation does not provide a volume number.,The citation does not provide an issue number.,The citation provides an e-locator/article ID instead of a traditional page range.,The e-locator 'e190388' does not correspond to a BMJ article published under this title or author.,"A specific publication date (year, month, or day) is missing from the provided citation.",The DOI 10.9162.2.10/o5r is syntactically malformed and does not resolve to any known document.,No PMCID was provided in the citation.,No PMID was provided in the citation.
mimo-v2.5,apa,"This citation is almost certainly fabricated. Several red flags: (1) The DOI ""10.9162.2.10/o5r"" is not a valid DOI format—BMJ's DOIs begin with ""10.1136"". (2) ""e190388"" does not follow BMJ's article numbering system. (3) The journal listing ""BMJ (Clinical research ed.)"" is an unusual and inaccurate rendering of the journal name. (4) No volume or issue number is provided. (5) The author names appear to be randomly assembled; none are recognizable as established researchers in this field. (6) A search for this specific title and author combination returns no results in legitimate databases.","The list of authors (Dewhurst, P. R.; Livingston, A. G.; Nash, Z. B.; Knightley, W. Y.; Harrison, P. J.; Harrow, D. S.; Neville, D. F.) appears to be fabricated. The names are plausible in structure but none of these specific author combinations are associated with this title or with AI/COVID-19 research in a credible way in BMJ. Furthermore, the author initials (e.g., Z. B., W. Y., D. S.) are unusual for this field.","The title ""Integrating artificial intelligence in bedside care for covid-19 and future pandemics"" is a plausible topic for a BMJ editorial or opinion piece during the COVID-19 pandemic. However, there is no known record of this exact title being published in BMJ by the listed authors. The title itself is generic enough that it could be generated as a plausible-sounding but non-existent article.","The formatting ""BMJ (Clinical research ed.)"" is not accurate. The real journal is simply ""BMJ"" or ""British Medical Journal"". While BMJ has different sections (e.g., BMJ Opinion), the designation ""Clinical research ed."" is not a legitimate part of the journal's name.","No volume number is provided, which is a required element for a valid journal citation. The absence of a volume and issue number strongly indicates that this citation is fabricated.","No volume or issue number is provided, which is standardly required for a journal citation. The parenthetical ""(Clinical research ed.)"" is not how BMJ lists its editions; BMJ does have ""BMJ"" (the flagship journal), ""BMJ Open"", etc., but not ""BMJ (Clinical research ed.)"". This is a fabricated designation.","No page numbers, article number, or elocator are provided that would be consistent with a valid BMJ citation. The ""e190388"" is placed where the article number would go but does not correspond to any real BMJ article.","The elocator ""e190388"" does not correspond to any known BMJ article number. BMJ uses article identifiers like ""e-follow"" or numeric identifiers such as the article number. A search for ""e190388"" yields no results in BMJ archives.","No publication date is provided in the citation, which is standard and required for a journal article reference. This omits further evidence that the citation is non-existent.","The DOI ""https://doi.org/10.9162.2.10/o5r"" is clearly invalid. Real DOIs follow the format 10.XXXX/... where XXXX is a registrant code assigned to a publisher or organization. The prefix ""10.9162"" does not correspond to any known DOI registrant. BMJ's DOI prefix is ""10.1136"". This DOI string appears to be randomly generated.","No PubMed Central ID (PMCID) is provided. Given that this is purportedly a BMJ article, it would typically have a PMCID if available. The absence, combined with the other red flags, supports that this citation is not real.","No PubMed ID (PMID) is provided. For a supposedly indexed BMJ article, a PMID would typically be available. The absence further suggests this citation is fabricated."
minimax-m3,harvard,"Overall assessment: The reference contains multiple significant issues. The DOI is clearly malformed/fabricated (does not follow standard DOI structure). Missing volume, issue, date, and pages. The article number 'e190388' could potentially be valid but cannot be verified without cross-referencing. The title and journal are plausible but the malformed DOI strongly suggests this is either a fabricated reference or contains serious errors. A legitimate BMJ article on AI and COVID-19 bedside care might exist, but this specific citation cannot be verified as authentic.","Dewhurst, P.R. is a plausible author name format (initials after surname). However, I cannot definitively verify this author exists or is associated with this paper without access to a live database. The 'et al.' indicates multiple authors beyond Dewhurst. This appears plausible but unverified.","The title 'Integrating artificial intelligence in bedside care for covid-19 and future pandemics' is plausible and topical, fitting the BMJ's scope of publishing clinically relevant content. It is a reasonable, well-formed academic title.","BMJ (British Medical Journal) and its edition BMJ (Clinical research ed.) are real, legitimate journals published by the BMJ Publishing Group. This is a valid journal name.",No volume number was provided in the reference.,No issue number was provided in the reference.,"No page numbers were provided. The reference includes 'article e190388' which appears to be an article number/ID. This format is consistent with BMJ's article identifier system. However, the specific identifier 'e190388' would need verification against BMJ's records.",No elocator (eLocator) was explicitly provided separate from the article number.,"No publication date (year, month, or day) is provided in the reference.","The DOI provided is '10.9162.2.10/o5r'. This does not follow the standard DOI format (which should be 10.xxxx/yyyyy where the prefix starts with '10.' followed by a registrant code, typically 4+ digits, then a forward slash, then a suffix). '10.9162.2.10' has multiple dots before the slash, which is malformed, and 'o5r' contains a letter that looks like a zero. This appears to be a fabricated or incorrect DOI.",No PMCID was provided in the reference.,No PMID was provided in the reference.
nemotron-3-super-120b-a12b,vancouver,"Multiple critical errors exist: impossible DOI structure, missing volume/issue/date, malformed article locator, and suspicious author combination. The title is plausible but insufficient to override definitive DOI and formatting flaws. This is characteristic of a fabricated or AI-hallucinated citation.","While individual surnames (Dewhurst, Livingston, Harrison) are plausible in UK medical literature, the specific combination PR Dewhurst, AG Livingston, ZB Nash, WY Knightley, PJ Harrison, DS Harrow does not correspond to any known author group publishing this exact title in BMJ. 'Harrow DS' is particularly suspect as a misspelling of 'Harrow' (a London borough) used as a surname, which is highly unusual for academic authors.","The title 'Integrating artificial intelligence in bedside care for covid-19 and future pandemics' is topically plausible and matches real pandemic-era research themes, but no BMJ article with this exact title exists in verified databases (PubMed, BMJ archive, CrossRef). Plausible titles are often used in fabricated citations to appear credible.","BMJ (British Medical Journal) is a legitimate, high-impact medical journal. This component is correctly identified.","The citation shows 'BMJ. :e190388.' which lacks a volume number, issue number, year, or proper page range. Legitimate BMJ citations always include volume (e.g., BMJ 2021;372:n123) or clear article identifiers. The format ':e190388' alone is invalid.",No issue number is provided or implied in the malformed reference. Legitimate articles require issue specification.,"':e190388' is not a valid page range or article ID format for BMJ. BMJ uses formats like 'e123456' for electronic-only articles but always within a volume/issue context (e.g., BMJ 2020;368:m442). The standalone ':e190388' is incorrect.","While BMJ does use article numbers like 'e123456', the presentation here (':e190388') is corrupted by the leading colon and lack of volume/issue. True BMJ electronic locators appear as part of a complete reference (e.g., 'BMJ. 2020;368:m442' or 'BMJ. 2021;372:n123').","No year, month, or day is provided. Legitimate citations always include publication date. The absence is a major red flag.","The DOI '10.9162.2.10/o5r' is structurally invalid. Correct DOIs follow '10.registrant/suffix' where registrant is typically 4+ digits (e.g., 10.1136 for BMJ). Here, '10.9162.2.10' has four numeric segments after '10' (should be only two parts total), and 'o5r' is an atypically short, non-standard suffix. BMJ's actual DOI prefix is 10.1136. This DOI does not resolve to any valid article.","Same as PMID - absence isn't invalidating, but no legitimate PMCID would accompany this fake DOI.","No PMID is provided or claimed, so absence isn't itself invalid. However, given the DOI is fake, a PMID would also be fabricated if present."
