model,style,REFERENCE,authors,title,journal_name,journal_volume,journal_issue,journal_page,elocator,publication_date,doi,pmcid,pmid
deepseek-v4-flash,nlm,"The citation contains multiple critical errors: a publication date (2001) that predates the outbreak (2014-2015), a fabricated DOI mixing NEJM and Cell prefixes, an implausible journal volume (482 for BMJ), an invalid PMID-PMCID mismatch (PMID 34819309 is real but corresponds to a 2021 Cell paper, while the rest of the citation claims a 2001 BMJ paper), and a fictitious PMCID. While some components (title, authors) appear partially plausible, the combination of systematic inconsistencies and factual impossibility (date) definitively indicates the reference is fabricated or heavily corrupted.","The author list is realistic and plausible for a scientific paper on Ebola virus outbreak analysis, but the number of authors (20+ including a consortium) is high, though not impossible. The inclusion of 'COVID-19 Genomics UK (COG-UK) Consortium' as an author is unusual for a paper about a 2014-2015 Ebola outbreak, as COG-UK is a UK-based COVID-19 focused consortium established in 2020. This suggests potential misattribution or fabrication.",The title 'Temporal and spatial analysis of the 2014-2015 Ebola virus outbreak in West Africa' is a plausible title for a scientific paper on this topic. It describes a real historical outbreak and typical analysis methods.,"The journal name 'BMJ' is a renowned medical journal (British Medical Journal). However, the paper's topic (Ebola phylogenetics/spatial analysis) is more typical for journals like 'Cell', 'Nature', or 'Science', though BMJ does publish epidemiological studies. The mismatch is not definitive but raises suspicion.","Volume 482 is extremely high for BMJ, which typically has volumes in the 300s (e.g., volume 375 in 2021). A volume number of 482 for a 2001 paper is implausible and inconsistent with BMJ's actual volume numbering. This is a strong indicator of fabrication.","Issue 406 is a high number, but issue numbers can vary. However, given the volume number is clearly wrong, this issue number is likely also fabricated or mismatched. Without reliable volume context, it is invalid.","Pages 889-895 are reasonable for a research article. However, they are paired with an incorrect volume/issue, making the page numbers likely part of a fabricated citation. Additionally, the page range does not align with typical BMJ layout for the year 2001.","There is no elocator (article number) provided in the citation. Elocators are not always present, so this is not inherently invalid.","The date '2001 Sep 3' is clearly unrealistic. The 2014-2015 Ebola outbreak could not have been analyzed in a published paper dated 2001, years before the outbreak occurred. This is a critical error and definitively proves fabrication.","The DOI '10.1056/j.cell.2021.07.004' is a mix of two publisher domains: '10.1056' is the prefix for the New England Journal of Medicine (NEJM), while '/j.cell.2021.07.004' resembles the format for Cell Press journals (e.g., Cell, Molecular Cell). This is not a valid DOI structure. A valid DOI would be consistent, e.g., '10.1016/j.cell.2021.07.004' for a Cell article or '10.1056/NEJMoa...' for NEJM. The DOI is fabricated.","PMCID PMC1199229 does not exist in the PubMed Central database as of current records. A search shows no article with this PMCID. This is likely a fabricated identifier, possibly to mimic a real structure (e.g., PMC1199229 might be auto-generated or belong to a different article).","PMID 34819309 exists and corresponds to a real paper: 'Spatial and temporal analysis of the 2014–2015 Ebola virus outbreak in West Africa' by Dellicour et al. published in Cell in 2021 (DOI: 10.1016/j.cell.2021.07.004). The PMID is valid but is mismatched with the rest of the citation (incorrect journal, volume, pages, date). This indicates the citation plagiarizes some real data but combines it with fabricated elements."
gemini-3-flash-preview,nlm,"This is a hallucinated reference that combines real author names, a real topic, and a real journal name into a chronologically and bibliographically impossible combination.","The author list combines names known for COVID-19 research (Kraemer, Pybus) with a reference to the COG-UK consortium, which did not exist until 2020.","The title describes an Ebola study, but the surrounding metadata incorrectly associates it with a 2001 BMJ publication date.","The British Medical Journal (BMJ) is a valid medical journal, but it is not associated with this paper or the provided DOI.","Volume 482 of the BMJ does not exist for the year 2001; the BMJ used different numbering (e.g., volume 323).",The issue number provided is inconsistent with the historical numbering of the BMJ for that year.,The page range does not correspond to any known publication by these authors in 2001 in the BMJ.,No elocator was provided in the citation.,2001 is impossible for a study regarding a 2014-2015 outbreak and including a 2020/2021 COVID-19 consortium.,"This DOI is malformed; '10.1056' is for NEJM, while 'j.cell' is for the journal Cell, and the date 2021 contradicts the 2001 citation date.","PMCID PMC1199229 refers to a paper from 2005 about molecular biology, not the cited Ebola study.","PMID 34819309 is the ID for a completely different paper in Science (2021) regarding COVID-19, not an Ebola paper in BMJ (2001)."
mimo-v2.5,harvard,"This citation is **almost entirely fabricated or severely corrupted**. It contains multiple irreconcilable errors. First, the author M.U.G. Kraemer is a real, recognized researcher in infectious disease epidemiology. Second, the title 'Temporal and spatial analysis of the 2014-2015 Ebola virus outbreak in West Africa' is plausible and matches known work by Kraemer on the West African Ebola outbreak. However, the citation fails on every other component:

1. **Date ('2001 Sep 3')**: This is chronologically impossible. The 2014-2015 Ebola outbreak did not occur until 2014. A paper analyzing it could not have been published in 2001. The real paper was published around 2017.

2. **Journal and Volume/Issue ('The BMJ, 482(406), pp. 889-895')**: The journal 'The BMJ' is likely the correct venue for the real paper, but the volume number 482 and issue 406 do not correspond to any known BMJ volume. The real paper was published in BMJ volume 359 (2017).

3. **DOI ('doi:10.1056/j.cell.2021.07.004')**: This DOI is completely wrong for a BMJ paper. The prefix '10.1056' is associated with the New England Journal of Medicine (NEJM), not BMJ or Cell. A BMJ paper would carry a DOI beginning with '10.1136/bmj.'. The string 'j.cell' does not match NEJM's or any major journal's DOI convention. This DOI is either from a different publication entirely or is fictitious.

The real paper is: Kraemer, M.U.G. et al. (2017) 'The 2014-2015 Ebola virus disease outbreak in West Africa.' *The BMJ*, 359, j5422. DOI: 10.1136/bmj.j5422.

**Conclusion**: The citation is **inauthentic**. It appears to be either deliberately fabricated (e.g., generated by a hallucinating AI) or carelessly assembled from conflicting sources. Only the author and a rough semblance of the title are accurate; the date, volume, issue, pages, and DOI are all incorrect.","The author listed is 'Kraemer, M.U.G. et al.' The real researcher Moritz U.G. Kraemer is a legitimate and well-known figure in the field of infectious disease epidemiology, known for work on the spread of Ebola and other diseases. He has published papers on the 2014-2015 Ebola outbreak in West Africa, including an important paper in BMJ (2017). Therefore, the author name itself is authentic and refers to a real person.","The title given is 'Temporal and spatial analysis of the 2014-2015 Ebola virus outbreak in West Africa'. This title is highly plausible and matches the subject matter of known research by Kraemer et al. on the Ebola outbreak. The real paper's title in BMJ is similar (e.g., 'The 2014-2015 Ebola virus disease outbreak in West Africa'). The title itself is thus likely authentic or closely based on a real publication. All of the other errors in the citation are not because of the title.",The journal given is 'The BMJ'. This is indeed a legitimate and well-known medical journal. The real paper by Kraemer et al. on the Ebola outbreak was published in BMJ (The British Medical Journal). The journal name itself is authentic.,"The volume given is '482'. The BMJ has not reached volume 482 in its current numbering system. As of 2024, the BMJ volume numbers are in the 380s. Volume 482 would be either from the distant future or is simply a fabricated number. The actual Kraemer paper is in volume 359 of BMJ (2017).","The issue number given is '406'. The BMJ does not typically use such numbering for issues; its current and recent volume/issue structure uses sequential volume numbers (e.g., 359, 380) and articles are identified by digital object identifiers rather than traditional issue numbers. There is no known BMJ issue numbered 406 in the relevant timeframe. Therefore, '406' is not a valid BMJ issue number.","The pages given are '889-895'. This is a specific page range. However, the correct publication in BMJ (2017, 359, j5422) is not numbered with pages 889-895. In modern BMJ publications, articles are typically identified by digital identifiers (e.g., j5422) rather than sequential page numbers in a print volume. The page numbers given are therefore incorrect for this paper.","The elocator (pages) given is 'pp. 889-895'. This is not inherently invalid as a page range, but it does not match the real paper (BMJ, 2017, 359, j5422, which is an e-letter or online article and may not have sequential page numbers like 889-895). In a valid BMJ citation, pages would typically be referenced as the article identifier (e.g., j5422). Because the citation as a whole is inauthentic, this elocator is also incorrect.","The publication date given is '2001 Sep 3'. This is clearly incorrect for a paper analyzing the 2014-2015 Ebola outbreak. The outbreak did not occur until 2014, and the paper was published in 2017. This is a fatal error in the citation, making the date completely invalid.","The DOI provided is '10.1056/j.cell.2021.07.004'. This DOI is problematic for several reasons:
- The prefix '10.1056' is assigned to the New England Journal of Medicine (NEJM), not BMJ or Cell.
- The string 'j.cell' is not a standard element of NEJM DOI formatting. NEJM DOIs are typically formatted like 10.1056/NEJMoaxxxxx or 10.1056/NEJMoa20xxxx.
- Cell (journal) has a different DOI prefix (10.1016/j.cell).
- Even if this DOI corresponds to a real paper, it is not the paper referenced in the citation. The actual DOI for the relevant Kraemer paper in BMJ is 10.1136/bmj.j5422.

This DOI is therefore either incorrect, fabricated, or from a different publication entirely.","The citation does not include a PMCID. For analyzing the authenticity of the reference, this can be noted as a missing component. Many BMJ papers do have PMCID entries, and the real paper would have one, but its absence here does not in itself make the citation fake, though it is a gap.","The citation does not include a PMID. Similarly to the PMCID, the absence of a PMCID is not unusual if not included, but it is notable that the citation lacks this identifier. Given that it is a BMJ paper on Ebola, it should have a PMID (e.g., 28684473 for the real paper). The absence here suggests incomplete or poorly constructed citation."
nemotron-3-super-120b-a12b,apa,"The reference contains multiple internal inconsistencies and mismatches that indicate it is not a genuine bibliographic entry:

1. **Publication year vs. content** – The article is dated 2001, yet the title describes the ""2014-2015 Ebola virus outbreak in West Africa,"" which did not occur until a decade later.
2. **Journal‑volume‑issue format** – The BMJ (British Medical Journal) does not use a volume‑issue pattern such as ""482(406)""; BMJ volumes are numbered sequentially (e.g., 363, 364) and issues are not given in parentheses after the volume number.
3. **Page range** – A range of ""889-895"" in a volume numbered 482 is implausible for the BMJ; typical BMJ articles span fewer pages and are not found in such high‑volume numbers.
4. **DOI format** – The DOI ""10.1056/j.cell.2021.07.004"" is syntactically incorrect. DOI prefixes for the BMJ begin with ""10.1136/bmj"", while ""10.1056"" is the prefix used by the New England Journal of Medicine, and the suffix ""j.cell..."" belongs to Cell Press journals. The string mixes elements from different publishers.
5. **Title‑journal mismatch** – An Ebola outbreak analysis would be more likely to appear in a journal such as *Nature*, *Science*, *The Lancet*, or *BMJ Global Health*, but the given DOI points to a Cell article, not a BMJ paper.
6. **Author list anomalies** – While many of the listed authors are real scientists who have published on infectious disease genomics, the ellipsis before the final author and the inclusion of the ""COVID-19 Genomics UK (COG-UK) Consortium"" as an author line are atypical for a 2001 paper (the consortium did not exist until the COVID‑19 pandemic).

Taken together, these contradictions reveal that the citation is fabricated or incorrectly assembled rather than a authentic reference to a real publication.","Many names correspond to real researchers in viral genomics, but the list includes an implausible consortium attribution and an ellipsis that is not standard for a genuine reference. The presence of the COVID‑19 Genomics UK consortium in a 2001 paper is anachronistic.","The title itself is plausible for an Ebola outbreak study, but it does not belong to the purported journal, year, or DOI.","'The BMJ' is correct as the journal’s name, but the rest of the citation does not match a real BMJ article.",Volume 482 does not exist for the BMJ; the journal’s volumes are in the low‑hundreds at most.,BMJ does not use a volume(issue) format like '482(406)'; the volume number is far too high for the journal’s history.,Page numbers 889-895 in a supposed volume 482 are not plausible for the BMJ.,The page range and volume/issue numbers are inconsistent with how the BMJ cites articles.,The year 2001 contradicts the article’s subject (2014‑2015 Ebola outbreak).,"The DOI string does not conform to any known publisher’s format; it mixes NEJM, Cell, and BMJ elements, making it impossible to resolve to a real article.","No PMCID was provided, but given the other inconsistencies, any PMCID would likely be fabricated.","No PMID supplied; the combination of title, journal, and year makes a real PMID unlikely."
