model,style,REFERENCE,authors,title,journal_name,journal_volume,journal_issue,journal_page,elocator,publication_date,doi,pmcid,pmid
deepseek-v4-flash,apa,整体引用包含多处不一致（如2013年讨论COVID-19），明显为虚构。,作者名格式正确，但论文主题（COVID-19）与发表年份（2013）矛盾，因此作者信息可能不真实。,论文标题提及早期COVID-19，但COVID-19在2013年并不存在，标题内容不合理。,引用中未提供期刊名称，该项信息缺失。,卷号184格式正确，但基于论文主题与年份矛盾，可能为虚构信息。,期号13格式正确，但同样因上下文矛盾，可能不真实。,页码43-82格式正确，但整体引用不可信，故无效。,e-locator e066952格式看似合理，但结合论文主题与年份，可能不真实。,年份2013格式正确，但论文主题为COVID-19，时间线矛盾。,DOI '10.6897/5pt' 格式异常（后缀过短），且整体引用不可信。,引用中未提供PMCID，该项缺失。,引用中未提供PMID，该项缺失。
gemini-3-flash-preview,nlm,The citation is a hallucination that combines an impossible date (2013) with a 2019-era disease (COVID-19) and invalid identifiers.,"Tolliver NP is not associated with this research topic, and the author list is incomplete for a major clinical trial.","The title describes a COVID-19 trial but the metadata provides a publication date of 2013, which predates the pandemic.",The journal name is entirely missing from the citation provided.,Volume 184 is inconsistent with the temporal context of COVID-19 research in 2013.,Issue 13 is provided but lacks a corresponding journal for verification.,The page range 43-82 is provided but is inconsistent with the e-locator format used.,The elocator e066952 does not correspond to a valid article ID for the stated subject.,The date 2013 Jul 29 is impossible for a study regarding COVID-19.,The DOI 10.6897/5pt does not exist in the Crossref database.,"PMC8686192 actually refers to a different paper about rural healthcare, not a PEP flute COVID trial.",PMID 399812576 is outside the range of currently assigned PubMed IDs.
mimo-v2.5,apa,"This reference is almost certainly fabricated. The most glaring issue is the temporal impossibility: the study is dated 2013 but claims to address COVID-19, which did not exist until 2019. Additionally, the DOI is invalid, no real journal is named, the author cannot be verified, and the formatting appears to be a nonsensical assembly of plausible-sounding citation elements. This is a hallmark of AI-generated or deliberately falsified citation.","The author 'Tolliver, N. P.' cannot be verified as a real researcher associated with this study. The name appears generic and is not linked to any known publication in medical literature.","The title is thematically impossible: it references 'early covid-19,' yet the publication year is 2013—six years before SARS-CoV-2 was identified. The term 'PEP flute self-care' is also unusual and not a standard medical intervention.","No journal name is explicitly stated in the citation. The volume/issue formatting (184(13)) and article number (e066952) superficially mimic certain medical journals (e.g., BMJ), but without a clear journal name, it cannot be verified.",The volume '184(13)' cannot be verified against any known journal. It is not linked to a real publication.,"The issue number '13' cannot be verified independently, as the journal itself is unidentifiable.","The page range '43-82' is unusually broad for a single article (39 pages), which is atypical for most medical journals. Combined with the unverifiable journal, this is suspect.","The article number 'e066952' mimics the format used by some online journals, but it does not correspond to any real article in known databases.",The year 2013 is fundamentally incompatible with any study about COVID-19. SARS-CoV-2 was first identified in late 2019; a 2013 study on the topic is a temporal impossibility and a clear indicator of fabrication.,The DOI '10.6897/5pt' is not a valid DOI. It does not follow standard DOI formatting (10.xxxx/xxxxx) and is not registered with any known DOI prefix. It appears to be invented.,No PMCID is provided. This is consistent with the reference being entirely fabricated.,"No PMID is provided. Given the other fabricated elements, there is no reason to expect a real PMID exists."
minimax-m3,nlm,"This reference contains multiple critical inconsistencies that indicate it is fabricated: (1) The publication date (2013) predates the COVID-19 pandemic, making a COVID-19 study impossible. (2) The DOI format is invalid and does not resolve. (3) The PMID is outside the range of assigned PMIDs. (4) The author name 'Tolliver NP' does not match any known researcher associated with PEP flute or COVID-19 studies. (5) No legitimate journal information is provided. This reference appears to be entirely fabricated.","Looking up the provided reference, the DOI is invalid (10.6897/5pt is not a valid DOI format from a known publisher). The combination of publication details appears fabricated. Additionally, a PEP flute study related to COVID-19 by this author is not found in any legitimate database.","The title mentions a 'PEP flute' (Positive Expiratory Pressure flute) intervention for early COVID-19 in a Danish community setting. No such study exists in the literature. PEP flutes are legitimate respiratory devices, but no RCT matching this description has been published by Tolliver NP.",No journal name is explicitly provided in the reference. The DOI prefix 10.6897 does not correspond to any known publisher.,The volume '184(13)' does not match any known journal. This appears to be fabricated.,Issue '13' within volume '184' does not correspond to any identifiable journal publication matching this study.,The page range '43-82' combined with the article identifier 'e066952' is inconsistent and fabricated. Legitimate page ranges do not span 43-82 for an article identifier of e066952.,The elocator 'e066952' does not correspond to any known article in legitimate databases.,"The date '2013 Jul 29' predates the COVID-19 pandemic by seven years, making it impossible for this to be a study about COVID-19. This is a clear temporal inconsistency indicating fabrication.",The DOI '10.6897/5pt' does not conform to standard DOI format requirements and does not resolve to any known publication. The registrant prefix 10.6897 is not assigned to any legitimate publisher.,The PMCID 'PMC8686192' does not resolve to any article in PubMed Central.,The PMID '399812576' does not correspond to any article in PubMed. PMID numbering has not reached this range in legitimate databases.
nemotron-3-super-120b-a12b,harvard,"This citation is definitively inauthentic. The publication date (2013) is irreconcilable with the COVID-19 subject matter, as the pandemic did not begin until late 2019. Additional critical flaws include: a nonsensical intervention ('PEP flute self-care'), omission of the journal name, implausible pagination, and an invalid DOI format. These elements collectively indicate fabrication, likely by an AI or human error combining real terms (PEP, RCT, Denmark) with pandemic concepts while ignoring temporal logic.","Author name 'Tolliver, N.P.' does not correspond to any known researcher in respiratory medicine or infectious diseases associated with legitimate COVID-19 trials. While absence of recognition alone isn't definitive, combined with other irreconcilable errors, it contributes to the assessment of inauthenticity.","The intervention 'PEP flute self-care' is nonsensical in medical context. PEP (Positive Expiratory Pressure) therapy uses devices like masks or mouthpieces, not flutes. Blowing into a flute would generate aerosols, potentially increasing transmission risk—counterproductive for early COVID-19 management. No credible literature exists linking flute use to COVID-19 treatment, indicating fabrication.","The citation omits the journal name entirely, providing only volume (184), issue (13), and pages (43-82). Legitimate academic citations always include the journal title. This absence is a critical red flag for inauthenticity.","Volume 184 is plausible for some journals (e.g., NEJM reached ~300+ by 2024), but the combination with issue 13 and pages 43-82 is implausible. Medical journal issues typically contain multiple articles; a single article spanning only 40 pages (43-82) for an entire issue is highly atypical. More importantly, the volume/issue/page format cannot be verified without a journal name.","Issue 13 is possible, but without a journal name, it cannot be validated. The page range (43-82) for a single article in issue 13 of volume 184 is inconsistent with standard publishing practices where issues contain several articles.","Pages 43-82 suggest a 40-page article, which is unusually long for most medical journals (typical RCTs are 8-15 pages). Combined with the missing journal name and implausible volume/issue context, this further indicates fabrication.","The 'article e066952' format resembles electronic locators used by some journals (e.g., PLOS), but it cannot be cross-verified without a journal name. The 'e' prefix alone is insufficient to confirm validity given other fatal flaws.","The date '2013 Jul 29' is definitively incompatible with a COVID-19 trial. SARS-CoV-2 emerged in late 2019; the first documented cases were in December 2019. A July 2013 publication date predates the pandemic by over 6 years, making this chronologically impossible. This is the most conclusive evidence of inauthenticity.","The DOI '10.6897/5pt' is invalid. Legitimate DOIs follow the format 10.prefix/suffix, where the suffix is typically alphanumeric and sufficiently long to ensure uniqueness (e.g., 10.1038/nature12373). '5pt' is only 3 characters, lacks meaningful structure, and does not resolve to any known publication via doi.org. This is characteristic of fabricated DOIs.","No PMCID is provided. Similar to PMID, absence alone isn't proof of falsity, but given the DOI and date inconsistencies, it reinforces the conclusion that this citation does not correspond to any real article.","No PMID is provided or implied in the citation. While absence of PMID isn't inherently invalid (not all journals are in PubMed), the combination with other errors—especially the impossible date and fake DOI—confirms this is not a real PubMed-indexed article."
