model,style,REFERENCE,authors,title,journal_name,journal_volume,journal_issue,journal_page,elocator,publication_date,doi,pmcid,pmid
deepseek-v4-flash,vancouver,"Multiple critical components (title, volume, issue, pages, DOI) are invalid or highly suspicious, making the overall reference unreliable.","Author names appear as standard scientific name abbreviations, no formatting errors detected.","Contains multiple spelling errors ('assocaited', 'recurrfht', 'urinzry') indicating it is not a valid title.",BMJ is a recognized abbreviation for the British Medical Journal.,Volume 464 is not a valid volume for BMJ in 2002; typical volumes for that year are in the 320s.,Issue 7290 is implausibly large for BMJ; typical issues are 4-digit numbers but not this high.,"Page range 1161-1201 covers 40 pages, which is unusually long for a BMJ article.",The e-locator 'e068302' follows a plausible format (e + digits) although its authenticity is uncertain given other errors.,The date '2002 Jul 8' is a valid date format and is plausible.,"The DOI '10.9323.465.961/4.3w-691ihz.0-x8b7' does not match standard DOI patterns (e.g., excessive dots, non-standard characters).",No PubMed Central ID is provided in the reference.,No PubMed ID is provided in the reference.
gemini-3-flash-preview,nlm,"The reference is fabricated, containing numerous orthographic errors, invalid identifiers, and mismatched bibliographic data.","While Claire M. Fraser, Jonathan A. Eisen, and Steven L. Salzberg are real genomics researchers who frequently collaborate, they did not author a BMJ paper with this title.","The title contains typos (assocaited, recurrfht, urinzry) and does not exist in any medical databases.",BMJ (British Medical Journal) is a valid medical journal.,Volume 464 is incorrect for the year 2002; BMJ volumes for 2002 were 324 and 325.,Issue 7290 does not correspond to BMJ volume 464 or the year 2002.,The page range 1161-1201 does not exist for the provided date and volume context.,The e-locator format e068302 is not consistent with BMJ citation styles for the year 2002.,"July 8, 2002, was a Monday; BMJ issues are typically dated on Saturdays.",The DOI 10.9323.465.961/4.3w-691ihz.0-x8b7 is syntactically invalid and does not resolve.,PMCID PMC74493396 is not a valid identifier in the PubMed Central database.,PMID 707980973 is outside the valid range of assigned PubMed IDs.
mimo-v2.5,nlm,"This citation exhibits numerous red flags indicating it is fabricated or AI-generated rather than a legitimate scholarly reference. There are typos in the title ('assocaited', 'recurrfht', 'urinzry'), an inconsistent journal volume number (BMJ volume 464 in 2002 is incorrect; BMJ was around volume ~325 in 2002), a non-standard DOI format ('10.9323.465.961/4.3w-691ihz.0-x8b7' does not correspond to any known publisher), a PubMed ID (707980973) that far exceeds existing PMID ranges (currently in the ~38-39 million range), and a PMCID that may not exist. The term 'microbiome' was not in common usage in 2002 as it is today. The author combination, while using real scientist names, does not match known publications. All these irregularities strongly indicate the citation is not authentic, which would result in a high likelihood of plagiarism detection as no original source exists.","The authors Fraser CM, Eisen JA, and Salzberg SL are real scientists (e.g., Craig Venter's syndicate colleagues, Jonathan Eisen, Steven Salzberg). However, as a team on this specific title/journal, the citation appears fabricated. No known publication by these authors matches this exact citation in BMJ.","Contains multiple typographical errors ('assocaited', 'recurrfht', 'urinzry') and uses anachronistic terminology ('microbiome' for 2002).","BMJ is a real journal, but the volume and content don't match.",Volume 464 does not correspond to BMJ's numbering system in 2002.,BMJ's volume 464 in 2002 is incorrect. BMJ was publishing around volume 325 in mid-2002. Issue number 7290 also doesn't align with BMJ's numbering.,"Page range 1161-1201 is unusually long for a single BMJ article. Additionally, the colon after pages followed by 'e068302' is not standard SPM page formatting.","The e-literature identifier 'e068302' is placed in the pages field, but BMJ in 2002 did not use this format. Also, '1161-1201' is an unusually long page range (40 pages).","2002 Jul 8 is plausible for BMJ, but the term 'microbiome' in the title is anachronistic for 2002. The term became common later.",The DOI '10.9323.465.961/4.3w-691ihz.0-x8b7' does not follow standard DOI formatting (10.XXXX/XXXXX). The prefix '10.9323' is not registered with any known publisher.,"PMC74493396 is 8 digits; it may or may not exist, but the journal and article are fabricated.",707980973 is far too high for a PMID (current same-day PMIDs are around 38-39 million). This is almost certainly non-existent.
minimax-m3,apa,"This citation contains numerous red flags indicating it is fabricated or corrupted. The title has multiple spelling errors, the volume/issue combination is nonsensical (volume 464, issue 7290), the DOI is clearly fake with nonsensical characters, and the combination of authors (genomics experts) publishing in BMJ on a urinary tract infection microbiome topic doesn't align with their known research areas. While some individual components (author names, journal name, publication year) reference real entities, the citation as a whole does not correspond to a real, verifiable publication.","Fraser, Eisen, and Salzberg are real authors who have co-authored numerous publications together on genomics and microbiology, particularly associated with The Institute for Genomic Research (TIGR).","The title appears to be heavily misspelled: 'assocaited' should be 'associated', 'recurrfht' should be 'recurrent', 'urinrzry' should be 'urinary'. The subject matter (host-microbiome interactions associated with recurrent urinary tract infections) is a real research topic, but this doesn't match any known Fraser/Eisen/Salzberg publication, whose work focuses on microbial genomics and genome sequencing.","The BMJ (British Medical Journal) is a real journal, and 'Clinical research ed.' refers to the BMJ's clinical research edition. However, Fraser, Eisen, and Salzberg are genomicists/microbiologists who publish in journals like Nature, Science, Genome Research, or PLoS Biology, not typically in BMJ.","The volume is listed as '464(7290)', which is nonsensical. BMJ volume numbers are typically in the hundreds (not hundreds of hundreds), and issue numbers (7290) would be extremely high. BMJ volume 464 does not exist.","An issue number of 7290 is implausible for BMJ, which typically has issues in the thousands but with much more modest volume numbers.","Pages '1161-1201' followed by 'e068302' is an unusual and inconsistent page format. The page range 1161-1201 seems somewhat reasonable for a clinical research article, but combined with the e-locator 'e068302' is inconsistent. BMJ does use article identifiers like e numbers, but the format here is wrong.","The e-locator 'e068302' is not a standard BMJ format. BMJ articles typically use formats like 'bmj.xxxx' or similar, and this doesn't match known BMJ conventions.","2002 is a plausible publication year for these authors, but cannot be verified against the other (invalid) citation details.",The DOI '10.9323.465.961/4.3w-691ihz.0-x8b7' is clearly fabricated. Real BMJ DOIs typically follow the format '10.1136/bmj.xxxx' and use alphanumeric characters in a structured format. This DOI has nonsensical segments including '4.3w' and '691ihz.0-x8b7' which are not valid DOI components.,No PMCID was provided in the citation.,No PMID was provided in the citation.
nemotron-3-super-120b-a12b,apa,"Multiple components (title spelling, volume/issue numbers, DOI format) are inconsistent with genuine BMJ publications. No evidence of this article appears in bibliographic databases.","The names Fraser, C. M.; Eisen, J. A.; and Salzberg, S. L. correspond to real scientists, but there is no record of them co‑authoring a 2002 BMJ paper on host‑microbiome interactions and urinary tract infections.","The title contains multiple spelling errors (‘assocaited’, ‘recurrfht’, ‘urinzry’) that are inconsistent with the rigorous editing standards of BMJ. No matching title appears in PubMed, BMJ archives, or Crossref.","BMJ (Clinical research ed.) is a real journal, but its volume numbering in 2002 was in the low‑300s (e.g., volume 324). Volume 464, issue 7290, and pages 1161‑1201 do not correspond to any BMJ issue from that year.",See journal_name note.,See journal_name note.,See journal_name note.,"The article identifier ‘e068302’ follows the style of BMJ electronic articles, but no such e‑locator exists for the given volume/issue/pages.","The year 2002 is plausible for a BMJ article, but the volume/issue mismatch makes the date untenable.","A DOI must begin with ‘10.’ followed by a registrant code and a suffix separated by a single slash. The string ‘10.9323.465.961/4.3w-691ihz.0-x8b7’ contains multiple dots after the prefix and an invalid suffix, making it syntactically incorrect.",No PMCID was supplied; no matching record exists in PMC.,"No PMID was supplied; a search of PubMed for the authors, title, or journal details yields no matching record."
