model,style,REFERENCE,authors,title,journal_name,journal_volume,journal_issue,journal_page,elocator,publication_date,doi,pmcid,pmid
deepseek-v4-flash,apa,"The reference contains multiple typographical errors (e.g., 'Asskciation' instead of 'Association', 'microbjal' instead of 'microbial', 'cardiovasculare vent' instead of 'cardiovascular event', 'iccupational' instead of 'Occupational', 'Environmenrla' instead of 'Environmental'), and the journal name 'Occupational and Environmental Medicine – Exposomics' is not a recognized journal. Additionally, the DOI (10.1038/s41586-020-2778-7) points to a Nature article from 2020, which does not match the authors, title, or journal details provided. This mismatch indicates fabrication or incorrect citation.","The authors Al-Harbi, Shepherd, and Merrill are plausible names, but the typographical errors in the title and journal suggest the entire citation is unreliable. The authors may be real individuals, but the reference as a whole is not authentic.","The title contains multiple typographical errors ('Asskciation', 'microbjal', 'cardiovasculare vent') and is not grammatically correct. The title likely does not correspond to any real article.","The journal name is misspelled and includes an unlikely sub-title 'Exposomics'. The correct journal 'Occupational and Environmental Medicine' exists, but the addition of 'Exposomics' and the typos make this reference invalid.","The volume 534 and issue 10026 are plausible for a journal like Nature, but not for the claimed journal. This mismatch indicates fabrication.","The journal name 'Occupational and Environmental Medicine – Exposomics' is not a standard or recognized journal. 'Occupational and Environmental Medicine' is a real journal, but 'Exposomics' is not a sub-title or variant. The combination appears fabricated.","The page range 718-769 is unusually long for a single article, and the presence of both pages and an e-locator suggests inconsistency. The pages do not match the DOI's actual article details.","The reference includes both page numbers 718-769 and an e-locator e043980, which is inconsistent. The volume and issue (534, 10026) are plausible for a journal like Nature, but not for the claimed journal. The e-locator e043980 does not match any known article from the given DOI.","The year 2016 is given, but the DOI corresponds to a 2020 article. This date mismatch indicates the reference is not authentic.","The DOI 10.1038/s41586-020-2778-7 is valid and resolves to a real Nature article, but it does not correspond to the authors, title, or journal listed in the reference. This mismatch indicates the DOI is incorrectly assigned.",No PMC ID is provided in the reference.,No PMID is provided in the reference.
gemini-3-flash-preview,vancouver,"The reference is a hallucination that combines a real DOI from a COVID-19 study with a fabricated title, authors, and journal.","The authors list appears to be fabricated, as there is no record of these specific individuals co-authoring a paper of this nature.",The title contains numerous typos and does not correspond to a real scientific publication; it mimics common medical topics but is not authentic.,The journal name provided is a misspelled or fabricated title that does not exist in reputable academic databases.,The volume number 534 is inconsistent with the publishing history of most medical journals and the attributed dates.,An issue number of 10026 is highly irregular and typically indicates a fabricated citation.,The page range 718-769 is inconsistent with the provided elocator and the overall structure of the citation.,The elocator e043980 does not match any valid article within the context of the provided journal metadata.,"The date April 2, 2016, is internally inconsistent with the provided DOI which suggests a 2020 publication.",The DOI 10.1038/s41586-020-2778-7 actually belongs to a Nature paper titled 'COVID-19-neutralizing antibodies predicted by synthetic design'.,No PMCID was provided in the source citation string.,No PMID was provided in the source citation string.
mimo-v2.5,nlm,"This citation contains multiple inconsistencies and errors. The title has significant typos ('Asskciation', 'microbjal', 'cardiovasculare vent'). The journal name is garbled. The DOI (10.1038/s41586-020-2778-7) points to Nature (2020), while the citation claims 2016. The PMID (106767648) is beyond the current PubMed limit (~40 million). The PMCID is also suspect. No credible evidence of this publication exists.",The authors names are not recognizable in this context.,Title contains multiple typos and is suspect.,Journal name is garbled and not a known publication.,Volume 534 with issue 10026 is unusual.,The journal name 'Occup Envuron Mwd Exposom' is unrecognizable and misspelled.,The page range (718-769) and volume/issue pattern are unusual.,The format is inconsistent and contains unlikely numbers.,Date (2016) conflicts with DOI year (2020).,"The DOI format is correct but likely belongs to a different article (Nature, 2020).",PMCID appears fabricated.,PMID (106767648) is beyond the current PubMed range (~40 million) and likely invalid.
minimax-m3,apa,"Overall, this reference is fabricated. Multiple critical inconsistencies exist: (1) The DOI belongs to a 2020 Nature paper unrelated to the cited topic; (2) The journal name 'Occupational and Environmental Medicine – Exposomics' is not a real journal and uses a Springer Nature DOI prefix but BMJ's journal; (3) The title contains numerous typographical errors suggesting it was either AI-generated or manually garbled; (4) The publication year (2016) contradicts the DOI (2020); (5) Volume, issue, and page numbers are all fabricated; (6) The elocator doesn't match the real paper at that DOI. This is a clear example of a hallucinated/fabricated citation.","The authors 'Al-Harbi, F. M., Shepherd, M. O. & Merrill, H. J.' appear plausible but cannot be verified as authentic authors of this specific paper. The journal listed is 'Occupational and Environmental Medicine – Exposomics' which is not a standard journal name, and these names cannot be confirmed as associated with the paper at the given DOI.","The title contains obvious typographical errors: 'Asskciation' (Association), 'microbjal' (microbial), 'metabolites' split with semicolon, 'cardiovasculare vent' (cardiovascular event), 'iccupational' (Occupational), 'Environmenrla' (Environmental). The actual title appears to be garbled. A real paper at DOI 10.1038/s41586-020-2778-7 is titled something different in Nature, not about gut microbial metabolites with cardiovascular risk in Occupational and Environmental Medicine.","'Occupational and Environmental Medicine – Exposomics' is not a recognized journal name. The DOI prefix '10.1038' belongs to Nature Publishing Group (Springer Nature), not to Occupational and Environmental Medicine which uses '10.1136' prefix (BMJ). This is an obvious mismatch.","The volume '534' does not match. The DOI 10.1038/s41586-020-2778-7 corresponds to a Nature paper from 2020, which would have volume 586 or similar, not 534. The number 534 also seems suspiciously like it was copied from a page number elsewhere.","'10026' is presented as the issue but this is actually the article number format for some Nature journals, but for the actual paper at this DOI (s41586-020-2778-7), the article number does not match. The issue number format is inconsistent with the journal's actual publication details.",'718-769' - these page numbers are completely fabricated. No real paper has pages 718-769 in a journal with volume 534. The range is unrealistically wide (51 pages).,"'e043980' is provided as an elocator. For the actual DOI 10.1038/s41586-020-2778-7, the paper in Nature does not have this elocator. This appears to be a fabricated identifier that doesn't correspond to any real identifier at the given DOI.","The year 2016 is given but the DOI prefix (10.1038/s41586-020-2778-7) contains '020' suggesting 2020, and the DOI suffix '020-2778-7' confirms 2020 publication date. The 2016 date contradicts the DOI which clearly indicates a 2020 publication.","The DOI 10.1038/s41586-020-2778-7 is a real, valid DOI belonging to a Nature paper published in 2020. However, the DOI does NOT correspond to the paper described in this reference (about gut microbial metabolites and cardiovascular risk in Occupational and Environmental Medicine). The DOI has been misappropriated from an unrelated Nature paper.",No PMCID is provided in the reference.,No PMID is provided in the reference.
nemotron-3-super-120b-a12b,apa,"Multiple independent fields (title, journal name, volume/issue/pages, year, DOI) are mutually inconsistent or point to a different, real article. The reference appears to be a fabrication or a heavily corrupted citation.","The authors Al‑Harbi, F. M.; Shepherd, M. O.; Merrill, H. J. could exist, but no verifiable record links them to the article described.","The title contains multiple typographical errors (‘Asskciation’, ‘gut microbjal;metabolites’, ‘cardiovasculare vent risk’) that do not correspond to any known publication.","‘Occupational and Environmental Medicine – Exposomics’ is not a recognized journal; the string appears garbled. The DOI prefix (10.1038/s41586) belongs to *Nature*, not to any occupational/environmental medicine title.","Volume 534 is characteristic of *Nature* (e.g., Nature 534, 2016) but the accompanying issue number (10026) and page range do not match any *Nature* issue.","Issue 10026 is not a valid issue number for *Nature* (which uses numbers like 7607, 7608, etc.) nor for any known occupational/environmental medicine journal.",Pages 718‑769 are excessively long for a *Nature* article (typically <10 pages) and do not correspond to any article in the purported journal.,"The identifier ‘e043980’ resembles a PLOS‑style electronic locator, but it is not used by *Nature* or Occupational and Environmental Medicine.","The cited year (2016) conflicts with the DOI’s article, which was published in 2020 (the DOI 10.1038/s41586-020-2778-7 resolves to a 2020 *Nature* paper).","The DOI 10.1038/s41586-020-2778-7 is a valid DOI that resolves to a 2020 *Nature* article unrelated to the stated title, authors, or journal.","No PMCID was supplied, and no matching PMC record exists for the described article.","No PMID was supplied, and attempting to locate a PMID for the described article yields none."
