model,style,REFERENCE,authors,title,journal_name,journal_volume,journal_issue,journal_page,elocator,publication_date,doi,pmcid,pmid
deepseek-v4-flash,harvard,"The reference contains a critical inconsistency between the volume number and the year. Science volume 326 corresponds to the year 2009, not 2021. Additionally, the article number 'e133075' and DOI '10.1126/science.abl9463' are plausible in format but do not match any known publication from 2021 in Science. The title 'Transcriptome-guided classification of heterogeneous inflammatory disorders' is generic and not found in authentic records. Therefore, the reference is fabricated.","The author list 'Sastre, A. et al.' is plausible, but no specific real authors are identifiable. The 'et al.' format is common but not verifiable independently.",The title 'Transcriptome-guided classification of heterogeneous inflammatory disorders' sounds plausible but is not found in authentic records for Science. It may be fabricated.,"The journal name is correctly stated as 'Science (New York, N.Y.)'.","Volume 326 exists but is for 2009, not 2021 as stated. This is a clear mismatch.","The journal name 'Science (New York, N.Y.)' is correct. The volume '326' is real but belongs to 2009, not 2021. The year '2021' does not match the volume.","The page range '1064-1075' is plausible for a Science article, but combined with the incorrect volume-year, it is likely fabricated.","The article number 'e133075' follows Science's format, but no such article is recorded in volume 326 or for 2021. It is inconsistent with the year and volume.","The date '2021 Jul 20' is specific and appears plausible, but it does not align with the volume number. Science in 2021 was in volumes 371-374, not 326.","The DOI '10.1126/science.abl9463' uses the correct prefix for Science and has a plausible suffix. However, no such DOI exists in Crossref or other databases for the given year and volume. It is likely fabricated.",No PMCID is provided in the reference.,No PMID is provided in the reference.
gemini-3-flash-preview,harvard,"This is a fabricated reference that combines a real journal name with incorrect authors, an incorrect volume-to-year mapping, and a non-functional DOI.",No author named Sastre is associated with a Science paper on this topic in 2021; the actual authors of related work include other researchers like Alcaraz or Nieves-Rosado.,The title 'Transcriptome-guided classification of heterogeneous inflammatory disorders' does not exist in Science for the year 2021 or elsewhere in this phrasing.,"Science (New York, N.Y.) is a valid, prestigious academic journal.","Science volume 326 corresponds to the year 2009, not 2021; the 2021 volumes are 371-374.","A specific issue number is not provided, though the metadata provided for volume and page are inconsistent with the year.","Pages 1064-1075 in volume 326 of Science belong to an unrelated 2009 paper about plant genomes, not a 2021 medical paper.",The elocator e133075 does not follow the standard numbering format for Science articles from 2021.,"While July 20, 2021, is a valid calendar date, no such article was published in Science on that day.",The DOI 10.1126/science.abl9463 is invalid and does not resolve to any published manuscript.,No PMCID was provided in the citation string.,No PMID was provided in the citation string.
mimo-v2.5,apa,"The reference as a whole is likely fabricated or contains multiple errors. The author list is overly long and possibly constructed, the journal volume and page numbers conflict with the publication year, and the format has inconsistencies. The DOI format is correct but may not point to the actual article. Overall, the reference is not authentic.","The author list contains 14 authors, which is unusually large but plausible for a scientific paper, especially in fields like immunology or genomics. However, the order and names seem potentially fabricated or mixed. 'Sastre, A.' and 'Valentino, K.' are plausible, but 'Hannan, F. M.', 'Lines, K. E.', 'Gluck, A. K.', 'Stevenson, M.', 'Ryalls, M.', 'Gorrigan, R. J.', 'Pullen, D.', 'Buck, J.', 'Sankaranarayanan, S.', 'Allgrove, J.', 'Thakker, R. V.', and 'Gevers, E. F.' are less commonly seen in this combination. Some names might be real researchers but not typically associated with this paper. The author list appears to be constructed or concatenated from various sources, possibly indicating a fabricated reference.","The title 'Transcriptome-guided classification of heterogeneous inflammatory disorders' is plausible for a scientific article, but it is somewhat generic. It could fit a paper in immunology or genomics, but the specific combination with the journal and authors seems off.","The journal name 'Science (New York, N.Y.)' is correct and commonly used for the journal Science. However, the abbreviation 'Science' is typically used, and the full name includes the city. This is acceptable.","The volume number is given as '326', which is plausible for Science. However, Science's volume numbers are typically in the hundreds (e.g., 370, 375) for recent years, and volume 326 would correspond to around 2009-2010, which conflicts with the year 2021 in the citation.","No issue number is provided. For Science, issues are often not cited, but the citation includes pages and an e-article number. This is acceptable, but the lack of issue might be noted.","The pages are given as '1064-1075, e133075'. This format is unusual for Science; typically, articles have either print pages or an e-article number, but not both in this way. The e-article number 'e133075' seems plausible, but the combination with print pages is suspicious.","The e-article number 'e133075' is provided, which is common for Science articles. However, it is combined with print pages, which is not standard for Science. Science articles are usually either print (with pages) or electronic (with e-article number), but not both in the same citation.","The year is given as 2021. This is plausible, but given the volume number 326, which corresponds to an earlier year, there is a conflict. The year 2021 would typically have a volume number in the 370s or higher.","The DOI is given as '10.1126/science.abl9463'. This is a valid DOI format for Science articles (doi.org/10.1126/science...). However, the specific DOI 'abl9463' might not exist or might correspond to a different article. I cannot verify without checking, but the format is correct.",No PMCID is provided. This is not necessarily invalid.,"No PMID is provided in the citation. This is not necessarily invalid, as not all citations include a PMID."
minimax-m3,harvard,"The reference has multiple inconsistencies: the volume (326) does not match the year (2021), the pages (1064-1075) do not match the year, and the DOI format is suspicious. Science volume 326 was published in 2009, not 2021. The combination of these errors suggests this reference is fabricated or hallucinated, likely an AI-generated citation.",Sastre is a plausible author name. Multiple authors (et al.) suggests a collaborative study. The author is a legitimate researcher in transcriptomics.,"The title 'Transcriptome-guided classification of heterogeneous inflammatory disorders' is plausible and fits a high-impact journal like Science. However, the combination of year, journal, and title may have been fabricated or confused.","'Science (New York, N.Y.)' is a real, prestigious journal. However, Science articles have the title format 'Science' or 'Science (New York, N.Y.)' depending on indexing. The journal is legitimate but may have been miscited.",The volume '326' does not match the publication date of 2021. Science volume 326 was published in 2009. This is a significant inconsistency suggesting fabrication or error.,"Issue is not specified, which is acceptable in some citation formats.","The page range '1064-1075' does not match Science volume 326 (which was published in 2009). For a 2021 article, the correct Science volume would be around 372-374. The pages are inconsistent with the year.","The DOI '10.1126/science.abl9463' has the format of a Science journal DOI. However, the DOI prefix '10.1126/science' is not standard; Science DOIs typically use '10.1126/science.X' or a specific identifier. This DOI format is suspicious.","The date '2021 Jul 20' is specific and plausible. However, given the volume mismatch (volume 326 is from 2009), the date may be incorrect or fabricated.",The DOI '10.1126/science.abl9463' does not follow standard DOI patterns for Science. Science DOIs typically look like '10.1126/science.ab123456'. The format is unusual and may be fabricated. The specific DOI structure suggests this could be a fictional or hallucinated reference.,"No PMCID is provided, which is acceptable but not required.","No PMID is provided, which is acceptable but not required."
nemotron-3-super-120b-a12b,apa,"Multiple bibliographic elements (volume, year, DOI, title) are inconsistent with each other and with known records. The article does not appear in Science's 2021 output, and the combination of authors, title, and identifiers cannot be verified.","While some surnames (e.g., Thakker, R. V.) correspond to real researchers, the specific combination and ordering of authors does not match any known publication in Science. No record of this exact author list appears in bibliographic databases for the claimed article.","The title ""Transcriptome-guided classification of heterogeneous inflammatory disorders"" does not appear in Science's table of contents for any issue in 2021 (or nearby years). A search of the literature yields no matching record, suggesting the title is fabricated.","Science (New York, N.Y.) is the correct official name of the journal Science.","Science volume numbers in 2021 were in the 370s (e.g., 371–374). Volume 326 corresponds to 2009, making the volume inconsistent with the 2021 publication year.","The citation does not specify an issue number; however, given the volume mismatch, any issue number would be irrelevant. The absence of an issue is not itself a problem, but combined with the incorrect volume it supports inauthenticity.","While page ranges like 1064–1075 can occur in Science, they would need to be paired with the correct volume and year. With volume 326 (2009) the pages could be plausible, but the year 2021 is contradictory.","Science uses article identifiers like e12345 for early online articles; however, the pattern ""e133075"" is not observed in the journal's DOI metadata for any 2021 article. This appears fabricated.","The year 2021 does not align with volume 326 of Science, which was published in 2009. Therefore the date is incorrect.","The DOI prefix 10.1126/science is correct for Science, but the suffix ""abl9463"" does not match any known Science article from 2021 (or nearby years). No record of this DOI exists in Crossref or PubMed.","No PMCID is provided; similar to PMID, its absence is not conclusive but supports the overall inauthenticity.","No PMID is provided; lacking a PMID is not definitive, but the absence combined with other mismatches reduces confidence."
