model,style,REFERENCE,authors,title,journal_name,journal_volume,journal_issue,journal_page,elocator,publication_date,doi,pmcid,pmid
deepseek-v4-flash,vancouver,The reference contains multiple inconsistencies: the journal 'Eur J Autoimmun Dis' (presumably European Journal of Autoimmune Diseases) is not a standard title and does not match the article's topic on antimicrobial pharmacokinetics; the volume/issue format (509(10311)) mimics Nature's volume 509 but is implausible for an autoimmune journal; the DOI is non-standard and appears fabricated. The article title is unrelated to the journal's scope.,"Author names appear plausible but are not verifiable; the list includes known plant biology researchers (e.g., Castrillo, Conway) who are unlikely to publish antimicrobial pharmacokinetics. This mismatch suggests fabrication.","The title 'Population pharmacokinetics of emerging antimicrobial therapies in critical care' is plausible and well-formed, but its mismatch with the journal scope indicates fabrication of the entire reference.",The journal name is misspelled or non-existent; no reputable journal uses 'European Journal of Autoimmune Diseases' with this abbreviation. It is likely fabricated.,Volume 509 is suspiciously high for a niche journal; most autoimmune journals are not in the 500s. This volume number is likely copied from a different source.,The journal 'Eur J Autoimmun Dis' is not a recognized title in standard databases. It likely does not exist or is a misnomer. The scope (autoimmune) contradicts the article's focus on antimicrobials.,Page numbers 1139-1142 are unverifiable and do not correspond to any known article. The pattern is generic.,"The elocator '509(10311):1139-1142' is inconsistent: volume 509 with issue 10311 is atypical for any journal, and the page range is unverifiable. No legitimate journal uses such formatting.",No explicit publication date is given; the volume/issue does not provide a year.,"The DOI '10.9815/mq73/vy-6i/cxwr8-5fgwsdeu' does not follow standard DOI structure (e.g., missing typical registrant code, contains random characters). It is not resolvable and likely fabricated.",No PMCID is provided; the reference does not include a PubMed Central identifier.,No PMID is provided; the reference is not indexed in PubMed.
gemini-3-flash-preview,vancouver,This is a hallucinated reference that incorrectly attributes a medical topic to plant biology researchers and uses a fake DOI and journal metadata.,"The listed authors are prominent researchers in plant-microbe interactions, not pharmacokinetics or critical care medicine.","The title refers to pharmacokinetics in critical care, which is entirely unrelated to the scientific output of the listed authors.","'Eur J Autoimmun Dis' (European Journal of Autoimmune Diseases) exists, but it does not publish on population pharmacokinetics of antimicrobials.",A volume number of 509 is excessively high and inconsistent with the history of this specific journal.,An issue number of 10311 is extreme and does not align with standard academic journal numbering systems.,The page range 1139-1142 is a standard format but cannot be verified for a non-existent article.,No elocator was provided in the citation string.,No year of publication was provided in the citation string.,The DOI format '10.9815/mq73/...' is invalid and does not resolve to any known academic publication.,No PubMed Central ID was provided for this reference.,No PubMed ID was provided for this reference.
mimo-v2.5,nlm,"This entire reference is fabricated. Multiple elements are inconsistent with reality: (1) the authors are plant biologists, not clinical pharmacologists; (2) the journal name does not correspond to any real journal; (3) the DOI is invalid; (4) the PMID is impossibly high. This appears to be an AI-generated or deliberately fabricated citation.","Most of the authors listed are real researchers in plant biology and plant-microbe interactions, particularly associated with Jeffrey L. Dangl's lab at UNC Chapel Hill (e.g., Finkel OM, Salas-González I, Castrillo G, Conway JM, Teixeira PJPL, Fitzpatrick CR, Law TF). However, these scientists specialize in plant immunity and microbiome research, not clinical pharmacokinetics or critical care medicine. The mismatch between author expertise and topic is a significant red flag.","The title 'Population pharmacokinetics of emerging antimicrobial therapies in critical care' describes a clinical pharmacology/medicine topic. This is entirely inconsistent with the known research areas of the listed authors (plant biology, plant-microbe interactions). The title appears fabricated or randomly generated to sound plausible.","'Eur J Autoimmun Dis' does not correspond to any known, legitimate peer-reviewed journal. While there are journals related to autoimmunity (e.g., European Journal of Autoimmunity), this specific abbreviation does not match any established journal. It appears fabricated.",Volume 509 with issue number 10311 is highly unusual. Issue numbers of this magnitude are extremely rare and not characteristic of any known journal's numbering scheme.,Issue 10311 is an extraordinarily high and implausible issue number for any standard journal. This appears fabricated.,"Pages 1139–1142 (4 pages) is a plausible page range length, but in context with the other fabricated elements, it adds to the overall inauthenticity.",No eLocator is provided in the citation. This is not applicable.,No explicit publication date is included in the citation. Cannot be verified.,"The DOI '10.9815/mq73/vy-6i/cxwr8-5fgwsdeu' does not follow standard DOI formatting conventions. DOI prefixes (the '10.xxxx' portion) are assigned to legitimate publishers/registries, and '10.9815' is not a recognized DOI registrant. The suffix also appears to be randomly generated. This DOI is fabricated.",No PMCID is provided in the citation. Cannot be verified.,"The PMID '460949789' is impossibly high. As of 2024, PubMed IDs are in the range of approximately 38–40 million. A PMID of over 460 million is completely fabricated and does not exist in the PubMed database."
minimax-m3,vancouver,"This reference is fabricated. Multiple red flags indicate it is not a legitimate citation: (1) The author list includes researchers known for plant microbiome research paired with a clinical pharmacology title, suggesting mismatched authorship; (2) The journal name 'Eur J Autoimmun Dis' does not appear to be a real journal; (3) The volume/issue numbers (509/10311) are unrealistically large; (4) The DOI format is invalid and does not correspond to any legitimate registered DOI prefix; (5) The reference appears to mix elements that don't logically belong together.","The author list appears legitimate with names like Finkel, Castrillo, and Teixeira PJPL, who are associated with plant microbiome research. However, the specific combination of these authors with a pharmacokinetics article seems odd given their typical research focus on plant-microbe interactions.","The title 'Population pharmacokinetics of emerging antimicrobial therapies in critical care' does not match the typical research focus of the listed authors (Finkel, Castrillo, Teixeira), who are known for plant microbiome research published in journals like Nature. This title is characteristic of clinical pharmacology journals.","The journal 'Eur J Autoimmun Dis' is suspicious. This appears to be a fictitious journal name. There is no well-known European Journal of Autoimmune Diseases with this exact title, and the format seems fabricated.",The volume/issue/page format '509(10311):1139-1142' is highly unusual. Volume 509 with issue 10311 is not a realistic journal numbering format. Real journals typically have single or double-digit volume numbers and reasonable issue numbers.,"As noted above, the issue number 10311 is unrealistically high for a journal issue.","The page range 1139-1142 is plausible in format but combined with the other suspicious elements, this appears to be fabricated.","The DOI '10.9815/mq73/vy-6i/cxwr8-5fgwsdeu' does not follow the standard DOI format. DOIs typically have prefixes like 10.xxxx where xxxx is a registered publisher prefix (e.g., 10.1038 for Nature, 10.1126 for Science). The structure of this DOI with random alphanumeric strings is not consistent with legitimate DOI registration.",No publication date is provided in the reference.,"The DOI '10.9815/mq73/vy-6i/cxwr8-5fgwsdeu' is clearly malformed. Legitimate DOIs follow the structure 10.[registrant prefix]/[suffix], with registrant prefixes being registered with the DOI Foundation. This string contains nonsensical alphanumeric sequences that don't conform to DOI standards.",No PMCID is provided in the reference.,No PMID is provided in the reference.
nemotron-3-super-120b-a12b,apa,"Given the multiple inconsistencies—non‑existent journal, atypical volume/issue formatting, unresolved DOI, and lack of any trace in scholarly databases—the reference is almost certainly fabricated or contains significant errors.","While some surnames (e.g., Dangl) correspond to real scientists, the combination of these specific initials and the order does not match any known publication by these individuals, especially in the field of antimicrobial pharmacokinetics.","The title is plausible but generic; no record of a paper with this exact title appears in PubMed, Web of Science, or Google Scholar.","There is no indexed journal titled 'European Journal of Autoimmune Diseases' in the NCBI NLM Catalog, ISSN registry, or major publisher lists. The closest existing titles are 'European Journal of Immunology' or 'Journal of Autoimmunity'.","Volume 509 is unusually high for a relatively new or niche journal; combined with the non-standard '(10311)' issue formatting, it does not follow typical bibliographic conventions.","The issue number appears to be concatenated with the volume in an atypical way ('509(10311)'), which is not a standard format used by any major publisher.","Pages 1139-1142 are reasonable for a short article, but without a valid journal and volume/issue they cannot be verified.",No elocator or article number is provided; the reference relies solely on page range.,No date is supplied; the volume/issue numbering does not allow inference of a credible publication year.,"The DOI string '10.9815/mq73/vy-6i/cxwr8-5fgwsdeu' does not resolve to a known record via doi.org, and its structure (multiple slashes after the prefix) is atypical for registered DOIs. The prefix 10.9815 is not assigned to any known publisher in the Crossref registry.",No PMCID provided; no matching article found in PMC.,"No PMID provided, and a search for the title/authors yields no matching PMID."
