model,style,REFERENCE,authors,title,journal_name,journal_volume,journal_issue,journal_page,elocator,publication_date,doi,pmcid,pmid
deepseek-v4-flash,apa,"The reference contains significant issues suggesting it is fabricated or heavily corrupted. The DOI is invalid ('10.1059/h7,1hd' is not a valid format). The journal title ('Annual Review of Biomedical Data Science') does not typically publish on the described topic. The author list mixes real researchers (P. Ondoa, L. Oskam) with plausible others, but the combination for this specific topic is unlikely. The page range (637-666, e468964) is irregular for a review. The combination of a suspicious DOI, a topic mismatch with the journal, and an irregular page range strongly indicates fabrication.","The author names are plausible, but their combination for this topic is suspicious. While individual authors like Ondoa and Oskam may have published on related subjects, the specific topic of 'serologic predictors of treatment escalation in chronic autoimmune conditions' is not a clear match for their known expertise. The inclusion of an 'e468964' article number alongside standard pages is unusual and may indicate a mix of genuine and fabricated elements.","The title 'Serologic predictors of treatment escalation in chronic autoimmune conditions' is plausible and well-formed for a biomedical review. However, it does not match the typical scope of 'Annual Review of Biomedical Data Science', which focuses on computational and data-driven topics. The mismatch with the journal and other metadata suggests the title may be fabricated or repurposed from a different source.","'Annual Review of Biomedical Data Science' is a real journal. However, the volume number (323) and year (2014) are inconsistent: the journal began in 2018, so volume 323 in 2014 is impossible. The journal name itself is correct but the context makes it suspicious.","Volume '323' is implausible for 'Annual Review of Biomedical Data Science'. This journal started in 2018 with volume 1 and publishes one volume per year. By 2024, it would be volume 7. Volume 323 for a 2014 publication is impossible, as the journal didn't exist then. This is a clear fabrication.","The journal title 'Annual Review of Biomedical Data Science' is a legitimate journal (Annual Reviews, ISSN 2574-3414) established in 2018. However, the topic 'serologic predictors of treatment escalation in chronic autoimmune conditions' is not typical for this journal, which focuses on data science, bioinformatics, and computational biology. The volume number '323' is implausibly high for a journal that publishes one volume per year since 2018 (volume 7 in 2024). This is a strong indicator of fabrication.","The page range '637-666' is plausible for a review article, but the addition of 'e468964' after it is irregular. In legitimate publications, if an article has an elocator, it typically replaces page numbers in journals that use article numbers (like eLife or PLOS). Annual Reviews journals traditionally use page numbers. The combination of both is unusual and suggestive of fabrication.","The reference includes 'e468964' as an elocator, but it is listed after standard page numbers (637-666). For review articles, especially in a journal like 'Annual Review of Biomedical Data Science', such a format is unusual. Typically, review journals use volume, year, and article number (e.g., 10.1146/annurev-biodatasci-XXXXXX). This irregularity adds to the suspicion of fabrication.","The publication year '(2014)' is inconsistent with the journal 'Annual Review of Biomedical Data Science', which was first published in 2018. This is a critical error indicating fabrication.","The DOI '10.1059/h7,1hd' is invalid. DOIs follow the format '10.xxxx/xxxx' where the suffix typically uses alphanumeric characters and slashes, not commas or mixed alphanumeric with 'h7,1hd' which is not a standard DOI suffix. This is a clear indicator of fabrication.","No PMCID is provided in the reference, and it is not requested in the user instructions. The reference lacks a PubMed Central ID, which is not necessarily a sign of fabrication but is another missing piece. Not applicable.","No PMID is provided in the reference, and it is not requested in the user instructions. The reference lacks a PubMed ID, which is not necessarily a sign of fabrication but is another missing piece. Not applicable."
gemini-3-flash-preview,apa,"The citation is entirely hallucinated, combining a journal that didn't exist in 2014 with an impossible volume number and invalid DOI.","While these individuals are real researchers in global health and microbiology, they have not co-authored a paper with this specific title or in this specific journal.",There is no record of a paper with this exact title authored by the listed individuals; the title appears to be hallucinated.,"The Annual Review of Biomedical Data Science was launched in 2018, making a 2014 publication date impossible.","Annual Review volumes for newer series start at 1, and volume 323 is inconsistent with the journal's actual publication history.",Annual Reviews typically publish single annual volumes rather than numbered issues like 323.,Pagination 637-666 does not exist for the non-existent volume 323 of this journal.,The elocator e468964 does not follow the standard naming or indexing conventions for this journal.,The journal did not exist in 2014.,"The DOI 10.1059/h7,1hd_ is syntactically invalid and does not resolve to any real document.",No PMCID was provided in the source citation; internal verification finds no matching entry in PubMed Central.,No PMID was provided in the source citation; internal verification finds no matching entry in PubMed.
mimo-v2.5,nlm,"The citation exhibits multiple inconsistencies: the journal 'Annual Review of Biomedical Data Science' was established in 2018, making a 2014 publication impossible. The volume number '323' is unusually high for an annual review, and the DOI '10.1059/h7,1hd' contains a comma, which is not standard in DOI formatting. While the PMID and PMCID formats are correct, their validity cannot be confirmed without access to PubMed databases. Overall, the reference contains significant inconsistencies suggesting it may be fictitious or erroneous.",Author names are plausible but not verifiable without further context. No immediate issues with naming conventions.,"The title sounds plausible as a biomedical research paper, but given the journal issues, it may be fabricated.","The journal name is inaccurate; the correct name would be 'Annual Review of Biomedical Data Science' but it was launched in 2018, not available in 2014.","Volume '323' is extremely high for an annual review journal, which typically has volumes corresponding to their edition number, not exceeding 50 in most cases.",The journal 'Annual Review of Biomedical Data Science' did not exist in 2014; it was founded in 2018. The volume '323' is unusually high for an annual review journal.,"Pages '637-666' are plausible, but in conjunction with the volume '323', they are inconsistent with typical annual review pagination.","The e-locator 'e468964' is not typical for annual reviews, which often use standard page ranges. The format is inconsistent with typical citation patterns for this type of journal.",Date '2014 May 5' is not consistent with the journal's establishment timeline; the journal was not active in 2014.,"The DOI format '10.1059/h7,1hd' is non-standard, containing a comma which is not allowed in DOI strings. Additionally, 10.1059 is not a commonly recognized DOI prefix.","The PMCID 'PMC59138165' is correctly formatted and plausible, but cannot be verified without checking PubMed Central.","The PMID '69375494' is correctly formatted and plausible, but its existence cannot be verified here."
minimax-m3,apa,"This citation contains multiple fabricated or invalid elements: the journal 'Annual Review of Biomedical Data Science' does not exist, the volume number 323 is implausible, the page range is inconsistent, the DOI is clearly invalid (contains a comma and doesn't match DOI format), and the elocator appears fabricated. While the author names and title are plausible on their own, the overall citation is clearly not authentic.","The author names follow a plausible format with multiple authors including what appears to be African-origin names (Ondoa, Oskam, Loembe, Okeke). The combination of authors from different backgrounds is plausible for biomedical research.",The title 'Serologic predictors of treatment escalation in chronic autoimmune conditions' is grammatically correct and describes a plausible biomedical research topic. It aligns with the scope of biomedical data science journals.,"'Annual Review of Biomedical Data Science' is not a real journal. The real Annual Review journals include 'Annual Review of Biomedical Engineering' and 'Annual Review of Genomics and Human Genetics', but there is no 'Annual Review of Biomedical Data Science'. Furthermore, the volume and page numbers (323, 637-666) are inconsistent and far too large for an Annual Review-type journal.","The volume number 323 is implausible for an Annual Review journal, which typically have much lower volume numbers. Additionally, the page range 637-666 is inconsistent with volume 323.",No issue number is provided in the citation.,The page range 637-666 is unusually large for a single article and is implausible for a review journal format.,"The elocator 'e468964' does not follow standard elocator formats. While some journals do use elocators like e123456, the specific format here appears fabricated.","2014 is a plausible publication year, but cannot be verified independently given the journal doesn't exist.","The DOI '10.1059/h7,1hd' is clearly invalid. DOIs follow the format 10.xxxx/yyyy and contain only alphanumeric characters, periods, and hyphens. This DOI contains a comma and uses 'h7,1hd' which is not a valid DOI suffix.",No PMCID is provided in the citation.,No PMID is provided in the citation.
nemotron-3-super-120b-a12b,apa,"Multiple fields (journal name, volume, page range, DOI) are inconsistent with real bibliographic data, indicating the reference is fabricated.",The authors' names do not correspond to any known publication in the cited journal.,No record of this title exists in the purported journal or elsewhere in biomedical literature.,"Annual Review of Biomedical Data Science is not a recognized Annual Reviews title; the real series includes Biomedical Engineering, Immunology, etc.",Volume 323 is implausibly high for an Annual Reviews journal; typical volumes are under 50.,"No issue number is provided, and the journal does not exist, making this field meaningless.",Page range 637-666 with an article ID e468964 does not match the formatting of any Annual Reviews article.,The supplemental identifier e468964 is not used by Annual Reviews and appears fabricated.,"The year 2014 is plausible, but without a real journal it cannot be verified.","The DOI string '10.1059/h7,1hd' contains a comma and does not follow the standard DOI pattern (prefix/suffix).","No PMCID is provided, and none exists for this citation.","No PMID is provided, and a search yields no matching record."
