model,style,REFERENCE,authors,title,journal_name,journal_volume,journal_issue,journal_page,elocator,publication_date,doi,pmcid,pmid
deepseek-v4-flash,harvard,"The reference as a whole contains multiple critical red flags: an implausible journal name ('Annals of Advanced Neurotrauma') that does not match the article's cardiac topic, a malformed DOI, an unusual volume number, and missing page numbers. These inconsistencies strongly indicate fabrication or error.","The format 'Wang, C. et al.' is standard and plausible for an author list in a citation.","The title 'Clinical relevance of subclinical myocardial inflammation detected by advanced imaging' uses standard English and plausible medical terminology, though 'subclinical myocardial inflammation' is a valid concept.","'Annals of Advanced Neurotrauma' is highly suspicious. 'Annals of...' is common for medical journals, but 'Advanced Neurotrauma' is an unusual and non-standard specialization. No reputable journal by this name is known. The topic of 'myocardial inflammation' is unrelated to 'neurotrauma' (nervous system trauma), which is a major red flag.","The volume number '6715' is unusually high and not typical for a standard volume format, which is usually a smaller integer. This lacks credibility.",No issue number is explicitly provided. The citation format includes the volume but not a parenthetical issue number.,No page numbers are provided. The citation includes a DOI-like string but no page range.,"No explicit e-locator is present. The DOI string appears in place of where a page or e-locator might be, but it is not formatted as a standard e-locator.",'2008 Jul 11' follows a standard date format (Year Month Day) and is plausible.,"The string '10.1689.60.3/n8zzs-0c/03' does not match standard DOI format (e.g., 10.xxxx/yyyy). It contains multiple periods and a slash, but lacks the typical prefix '10.' followed by a slash and alphanumeric suffix. It is malformed and suspicious.",No PubMed Central ID (PMCID) is provided in the citation.,No PubMed ID (PMID) is provided in the citation.
gemini-3-flash-preview,vancouver,"The entire reference is fabricated, combining unrelated authors, an invalid DOI, and a non-existent journal title.","While the individuals listed exist in various academic fields, they are not associated with this specific title or the nonexistent journal.","The title discusses cardiology (myocardial inflammation), which is incongruent with the journal name focusing on neurotrauma.",There is no indexed academic journal titled 'Ann Adv Neurotrauma' matching this record or publication year.,No volume number is provided in the citation format provided.,"The issue number '(6715)' is highly atypical for medical journals, which usually have much lower issue counts.",No page numbers were provided in the citation.,No valid e-locator or article number is present in the citation.,"The date format is standard, but does not correspond to a real publication for this title.",The DOI '10.1689.60.3/n8zzs-0c/03' uses an invalid format and does not resolve to any registered metadata.,No PubMed Central ID was provided in the citation.,No PubMed ID was provided in the citation.
mimo-v2.5,harvard,"The overall reference is likely fabricated. The combination of an unusual journal name (mismatched with the title), invalid DOI, and non-standard volume number strongly suggests that this citation is not authentic. While some individual components (like title and date) might be plausible, the overall citation fails verification due to multiple red flags.","The author name is 'Wang, C. et al.' which is a common format for citing a first author with additional authors. However, 'et al.' is not a specific individual but a placeholder for other authors. Without full author names, it is impossible to verify the actual authors of the work. This is a standard citation format but lacks completeness for verification.","The title is 'Clinical relevance of subclinical myocardial inflammation detected by advanced imaging'. This title appears plausible for a medical research article. However, without verifying the actual publication, it is impossible to confirm if this exact title exists. The phrasing is professional and consistent with medical literature.","The journal name is 'Annals of Advanced Neurotrauma'. This name seems unusual because neurotrauma is typically related to brain injuries, while the title discusses myocardial inflammation (heart-related). This mismatch raises suspicion about the journal's authenticity. There is no well-known journal with this exact name in mainstream medical databases. It could be a fake or incorrect journal name.","The volume is given as '(6715)'. This appears to be a number, but journal volumes are typically sequential numbers (e.g., Vol. 1, Vol. 2) and not arbitrary large numbers. The format in parentheses without 'Vol.' or 'Volume' is also non-standard. This suggests the volume information is likely fabricated or incorrectly formatted.","No issue number is provided in the citation. In standard citation formats, issues are often indicated, but it is not always mandatory. However, the absence of an issue number is not inherently invalid, but it contributes to the overall lack of specificity.","No page numbers are provided. Page numbers are a common component of journal citations, and their absence makes it harder to locate the article. However, some online-only articles may not have traditional page numbers. The lack of pages does not automatically invalidate the citation, but it reduces its verifiability.","The citation includes a DOI (doi:10.1689.60.3/n8zzs-0c/03) but no e-locator is provided. The DOI is a persistent identifier, but the provided DOI does not follow the standard format (e.g., 10.1234/abcd5678). It appears to be malformed or fictitious. This suggests the DOI is not valid, which is a major red flag for the authenticity of the citation.","The date is given as '2008 Jul 11'. This is in a specific format (YYYY Month DD). The year 2008 is plausible, but without the actual publication, it cannot be verified. The format is slightly non-standard (usually with a comma or different ordering), but not inherently invalid.","The DOI provided is 'doi:10.1689.60.3/n8zzs-0c/03'. Standard DOIs typically start with 10.xxxx/ followed by a string of characters. This DOI appears unusual and does not match common patterns. It is likely a fabricated or incorrectly formatted DOI, which is a strong indicator of inauthenticity.","No PMCID (PubMed Central ID) is provided. Similar to PMID, its absence does not invalidate the citation, but it reduces verifiability.","No PMID (PubMed ID) is provided. This is not a requirement for citations, but its absence means it cannot be cross-referenced with PubMed. However, not all journal articles are indexed in PubMed, so this is not necessarily invalid."
minimax-m3,apa,"This reference is fabricated. Key indicators of fabrication include: (1) no real journal named 'Annals of Advanced Neurotrauma' exists, (2) the DOI format is invalid and nonsensical, (3) the volume number '6715' is implausible, (4) the journal name doesn't match the paper's subject matter (myocardial/cardiac vs. neurotrauma), (5) no page numbers are provided, and (6) the combination of authors and details does not correspond to any retrievable publication in major databases.",This is a fabricated author list with 10 authors that follow plausible Western naming conventions but appear to be randomly generated. The combination of names doesn't correspond to any known researchers in cardiology or neurotrauma.,"The title 'Clinical relevance of subclinical myocardial inflammation detected by advanced imaging' is plausible and sounds like a real cardiology paper, but the content (myocardial inflammation) is unrelated to the claimed journal (Annals of Advanced Neurotrauma), suggesting fabrication.","'Annals of Advanced Neurotrauma' is not a recognized real journal. There is no such journal indexed in major databases like PubMed, Web of Science, or Scopus.",The volume '(6715)' appears to be a random or fabricated number rather than a legitimate volume identifier. Volume numbers are typically much smaller and sequential.,"No issue number is clearly identified, only the volume number is given. The format is inconsistent with standard citation practices.","No page numbers are provided, which is unusual for a traditional journal article citation.",No elocator (article number) is provided beyond the parenthesized number that seems to function as a volume number.,"The year 2008 is provided. No specific month or day is given, which is acceptable for some citations but combined with other red flags suggests fabrication.",The DOI '10.1689.60.3/n8zzs-0c/03' has an invalid structure. DOIs follow the format '10.xxxx/yyyy' where xxxx is a registrant code (typically 4+ digits) and yyyy is the suffix. This DOI has nonsensical segments ('n8zzs-0c') and an unusual structure that doesn't conform to DOI standards.,No PMCID is provided.,"No PMID is provided. This would not be expected in a standard citation, but its absence combined with other issues is noted."
nemotron-3-super-120b-a12b,apa,"Every identifiable component of the citation fails verification against standard bibliographic databases (PubMed, Scopus, Web of Science, CrossRef). The journal name does not exist, the DOI is syntactically incorrect, and the volume/issue identifier is implausible. Consequently, the reference is almost certainly fabricated or contains significant errors.","The author list (Wang, C., Kellerman, I. R., Castro, M. L., Oliveira, C. S., Sinclair, H. L., Harrow, D. S., Huang, Y., Sedgewick, H. J., Easton, U. W., & Han, E.) does not correspond to any known publication on subclinical myocardial inflammation. No record of these exact names appearing together in PubMed, Scopus, or Google Scholar.","The title ""Clinical relevance of subclinical myocardial inflammation detected by advanced imaging"" is plausible, but there is no indexed article with this exact wording in the biomedical literature. Searching the title yields zero matches.","""Annals of Advanced Neurotrauma"" is not a recognized journal. The legitimate titles in the neurotrauma field are ""Journal of Neurotrauma"" and ""Neurotrauma""; no ISSN or publisher entry exists for the stated name.","The volume/issue field is given as ""(6715)"", which is not a standard volume number format and does not correspond to any known volume of the purported journal.","No separate issue number is provided; the ambiguous ""(6715)"" cannot be interpreted as a legitimate issue.","Page numbers are absent, which is atypical for a citable article and further suggests the reference is incomplete or fabricated.",No article number or e‑locator is supplied.,"Only the year 2008 is given; without a valid journal, volume, or issue, the date cannot be verified.","The DOI ""https://doi.org/10.1689.60.3/n8zzs-0c/03"" is malformed: a DOI consists of a prefix (10.xxxx) followed by a single slash and a suffix. Extra dots after the prefix (10.1689.60.3) violate the DOI syntax, and no resolver returns a record for this string.",No PMCID is supplied; no corresponding record exists in PubMed Central.,"No PMID is supplied, and a search for the title/authors yields no PubMed entry."
