model,style,REFERENCE,authors,title,journal_name,journal_volume,journal_issue,journal_page,elocator,publication_date,doi,pmcid,pmid
deepseek-v4-flash,vancouver,"The reference has a vague author list, an implausibly high volume number for 'Science', a non-existent article number format, and a non-standard DOI. The journal is real but the rest is fabricated.","Author names are plausibly formatted but some appear fictional (e.g., 'Yeats WJ', 'Ainsworth QS'). No real-world verification possible; treated as likely fabricated.","Title is plausible and matches the style of articles in Science, but the reference is overall fabricated so the title is likely fabricated as well.","Science is a legitimate, well-known journal. Based on the name alone, it is valid.",Volume 447 is implausibly high for Science. Science's volume numbers in 2017 were around 355-358. Fabricated.,Volume number 447 is far higher than Science's actual volume progression (volumes are much lower). Issue number is realistic but volume is not.,"Page numbers '996-1003' are plausible for an article, but combined with the fabricated volume and elocator, likely part of a fabricated reference.","The article number format ':e421134' is non-standard for Science. Science volumes typically use page numbers, not this pattern. Fabricated.","Date '2017 Dec 30' is plausible and matches the cited year. However, the date is likely fabricated along with the rest of the reference.",DOI format is atypical. It does not match any standard DOI pattern for Science journal. Likely fabricated.,No PMCID provided in the reference.,No PMID provided in the reference.
gemini-3-flash-preview,apa,"The citation is entirely fabricated; the volume number is incorrect for the journal and year, the title is non-existent, and the DOI is invalid.",The list of authors appears to be fabricated as there is no record of this specific collaboration or these authors publishing this work together.,The title 'Patterns of recovery after ischemic stroke measured with wearable technologies' does not exist in the journal Science in 2017.,"'Science (New York, N.Y.)' is a real journal, but it is typically just referred to as 'Science'.","In 2017, the journal Science published volumes 355 to 358; volume 447 does not exist for this journal.","No issue number was provided in the citation, though the volume number itself is invalid for the specified year.",The page range 996-1003 for volume 447 is invalid because the volume itself does not exist.,The e-locator 'e421134' does not follow the standard citation format for the journal Science and cannot be verified.,"While 2017 is a valid year, no article with this title or volume was published in Science during this year.",The DOI 10.3415.60.8/snp is malformed and does not resolve to any known academic publication.,No PubMed Central ID was provided in the citation.,No PubMed ID was provided in the citation.
mimo-v2.5,apa,"This citation has numerous red flags indicating it is fabricated. 1) **DOI**: The DOI '10.3415.60.8/snp' is not in valid DOI format and does not correspond to any registered publisher prefix. 2) **Journal Volume/Year Mismatch**: Science's volume in 2017 would have been approximately 357-358, not 447. 3) **Authors**: The listed author combination does not correspond to known researchers in stroke rehabilitation or wearable technology. 4) **Page/Issue Format**: The 'e421134' issue designator and page range format are inconsistent with Science journal's conventions. 5) **URL**: The DOI link would not resolve to a real article. This appears to be a fully fabricated citation.","The author list (Xavier, V. F., Northwood, K. M., Yeats, W. J., Ainsworth, Q. S., Barrows, C. M. & Müller, M. J.) does not match any known research group in stroke rehabilitation, wearable technologies, or related fields. The combination of names and initials appears to be randomly generated.",The title 'Patterns of recovery after ischemic stroke measured with wearable technologies' sounds plausible but cannot be verified as a real published article in Science or any other journal. It is likely fabricated.,"While 'Science (New York, N.Y.)' is a real and well-known journal (published by AAAS), the associated metadata (volume, pages, authors, DOI) do not align with any real publication in this journal.",Volume 447 does not correspond to Science's volume numbering for 2017. Science volumes in 2017 were around 357-358.,Information is missing or inconsistent. The issue number and page range do not correspond to any verifiable issue of Science.,The page numbers '996-1003' are not verifiable against any real article in Science for this topic and volume.,There is no standard article identifier like 'e421134' identifiable as belonging to Science journal.,"The year 2017 is listed but contradicts the volume number. Without additional metadata, the date cannot be independently verified.","The DOI '10.3415.60.8/snp' is invalid. It does not follow standard DOI formatting (typically 10.XXXX/identifier, where the prefix is a 4-digit number assigned by a registration agency). '10.3415' is not a recognized publisher prefix, and the structure '.60.8/snp' is not a valid DOI suffix.",No PMCID is present in the citation.,No PMID is present in the citation.
minimax-m3,apa,"This reference contains multiple fabricated elements: impossible DOI format, impossible volume number for Science journal, inappropriate eLocator format, and likely fabricated authors and title. The reference is not authentic.","The author names appear to be fabricated or highly implausible. 'Xavier', 'Northwood', 'Yeats', 'Ainsworth', 'Barrows' are plausible surnames but the combinations look like generic AI-generated names. 'Müller' is a common German name but paired with these others seems odd. The grouping looks synthetic.","The title sounds plausible - wearable technologies for measuring recovery after ischemic stroke is a legitimate research area. However, given the other clearly fabricated elements, this title is likely also fabricated.","'Science' is a real and prestigious journal published by AAAS. However, Science (New York, N.Y.) does not have volume 447 - it would not have reached that volume by 2017 (Science was around volume 355-358 in 2017).",Volume 447 for Science journal in 2017 is impossible. Science's volumes were in the 350s range in 2017. The volume number is fabricated.,No issue number was provided in the reference.,"Pages '996-1003' are plausible page numbers for Science, but the combination with the impossible volume suggests fabrication.",'e421134' is an eLocator format that would not be typical for Science journal. Science uses page numbers. This appears fabricated.,"The year 2017 is plausible for the research topic, but given other fabricated elements, this cannot be verified.",The DOI '10.3415.60.8/snp' is malformed. DOIs typically follow the pattern '10.xxxx/yyyyyy' with only two segments before the slash and no periods in the prefix. This is clearly fabricated.,No PMCID was provided in the reference.,No PMID was provided in the reference.
nemotron-3-super-120b-a12b,harvard,"Taken together, multiple elements (volume, article identifier, DOI format, title case, date specificity) are inconsistent with known *Science* publication patterns. No verifiable record of this article exists in CrossRef, PubMed, or Web of Science. The reference is therefore almost certainly fabricated or incorrectly transcribed.","The surname ""Xavier"" with initials ""V.F."" is plausible, but the use of ""et al."" without listing any co‑authors in the citation is atypical for a formal reference. No record of a researcher named V.F. Xavier publishing a wearable‑stroke‑recovery paper in *Science* around 2017 could be found in major bibliographic databases.","The title follows sentence‑case style, which *Science* does not use; *Science* article titles are given in title case (major words capitalized). Moreover, the phrasing ""Patterns of recovery after ischemic stroke measured with wearable technologies"" is vague and does not match the specific, mechanistic titles typical of *Science* reports.","""*Science (New York, N.Y.)*"" is the correct full name of the journal *Science*. This element is accurate.","Volume 447 would correspond to a publication year far later than 2017 (approximately early 2020s based on *Science*'s volume progression). A 2017 article would appear in a volume in the mid‑300s (e.g., vol. 355‑358). Hence volume 447 is inconsistent with the stated year.","No issue number is supplied; while not always required, the absence is not in itself a problem. However, combined with the erroneous volume, it contributes to the overall implausibility.","Page range 996‑1003 is plausible for a *Science* article, but without a correct volume and issue the pages cannot be verified.","*Science* does not use an ""e""‑prefixed article identifier like ""e421134"". Its online articles are cited with a DOI or a PMID, not an internal e‑ID of this form.","The date ""2017 Dec 30"" is unusually specific; *Science* typically lists only month and year (or season) for weekly issues, not an exact day. Moreover, late December issues are rare and usually belong to the following year's volume.","The string ""doi:10.3415.60.8/snp"" does not conform to the DOI syntax (which is 10.<prefix>/<suffix> with only one dot after the prefix). The presence of multiple dots and the nonsensical suffix ""snp"" indicates a fabricated identifier.","Similarly, no PMCID is given.","No PMID is provided; while not mandatory, the lack of any verifiable identifier further undermines the reference."
