model,style,REFERENCE,authors,title,journal_name,journal_volume,journal_issue,journal_page,elocator,publication_date,doi,pmcid,pmid
deepseek-v4-flash,apa,The reference as a whole contains a fabricated DOI and a date contradiction (2012 vs. 2021). It is not a genuine citation.,"Author name 'Thompson, B. T.' appears plausible for a medical researcher, but further verification is not possible without cross-referencing.","Title is plausible for a commentary on beta-agonists in ARDS, consistent with Lancet style.","Lancet is a legitimate journal, but the provided DOI prefix (10.1126) is actually used by the journal Science, not Lancet (which uses 10.1016). This mismatch indicates the DOI is fabricated or incorrect.","Volume number omitted; only issue number (9812) is given. Lancet issues are numbered but the volume is missing, which is unusual but not impossible.","Issue (9812) is plausible for Lancet, but without the volume it cannot be fully validated.",Pages 196-198 are typical for a short commentary or editorial and are within the expected range.,No elocator is provided; not applicable.,"Year 2012 is plausible, but the DOI suffix '(21)00798-4' implies a 2021 article, creating a contradiction. The date is likely fabricated.","The DOI '10.1126/S0140-6736(21)00798-4' is invalid: it uses the 10.1126 prefix (for Science) but the suffix mimics a Lancet-style DOI. Additionally, the suffix indicates a 2021 article, conflicting with the 2012 date. This DOI is fabricated.",No PMC ID provided.,No PMID provided.
gemini-3-flash-preview,apa,"The reference is for a real and significant academic article, but contains a hallucinated/incorrect DOI and is missing the volume number.",B. Taylor Thompson is a known expert in ARDS and the author of this commentary.,The title accurately reflects the commentary published in response to the BALTI-2 trial results.,The Lancet is the correct journal for this editorial piece.,"The citation is missing volume 379, which corresponds to the provided issue and date.","Issue 9812 is the correct issue for the publication date January 21, 2012.",The page range 196-198 is the exact location of the commentary within the journal.,No elocator is provided or required for this print-indexed article.,"The year 2012 is correct, specifically published in January 2012.","The DOI 10.1126/S0140-6736(21)00798-4 contains a prefix mismatch (10.1126 belongs to AAAS/Science, not Lancet) and an incorrect suffix; the correct DOI is 10.1016/S0140-6736(11)61845-6.",No PMCID was provided in the citation to evaluate.,No PMID was provided in the citation to evaluate.
mimo-v2.5,vancouver,"The citation is **NOT AUTHENTIC** in its presented form, although it is based on a real, existing article. Multiple critical components have been altered or are incorrect, making this particular citation unreliable and potentially fabricated or corrupted.","The author 'Thompson BT' is plausible and matches a real researcher (B. Taylor Thompson, MGH/Harvard) who has published commentaries on β-agonists/ARDS in The Lancet.",The title 'β-agonists for ARDS: the dark side of adrenergic stimulation?' closely matches the actual title of the real commentary by Thompson BT published in The Lancet in 2011. This part is the most authentic element of the citation.,The journal name 'Lancet' is correct and matches the real publication venue for this article.,"No volume number is present in the citation. The Lancet would include a volume (e.g., 378 for 2011). The missing volume information contributes to the overall inaccuracy.","The year '2012' and pages '196-198' do not match the real article, which was published on 12 Nov 2011 in The Lancet vol 378, issue 9805, pages 1827-1828. This suggests deliberate tampering or convergence errors.",The pages '196-198' are incorrect. The actual pages of the real article are '1827-1828'. This is a clear discrepancy.,The issue number '(9812)' is inconsistent with how The Lancet cites articles in 2011/2012 (using volume/issue format like '378(9805)' or similar). This is bypassing The Lancet standard concurrent citation format.,"The date '2012 Jan 21' is incorrect. The real article was published on 12 November 2011. The approximate timing (late 2011/early 2012) suggests this could be a year-off error, but combined with all the other errors, it contributes to the overall invalidity of the citation.","This DOI is **wrong** and appears intentionally altered or fabricated. The prefix '10.1126' belongs to **AAAS (Science/AAAS)**, not to The Lancet (Elsevier), which uses the prefix '10.1016'. The real DOI for this article is 10.1016/S0140-6736(11)61282-9. The combination of an incorrect DOI prefix with a textual content that resembles a real article is a hallmark of citation manipulation.","No PubMed Central ID is provided in the citation, which is not a problem in itself but should be noted.","No PubMed ID is provided in the citation, which is not a problem in itself but should be noted."
minimax-m3,apa,"This reference appears to be fabricated or heavily corrupted. While the author (B.T. Thompson) and topic (β-agonists for ARDS) are real and consistent with published work, multiple critical identifiers are wrong: (1) The DOI mixes Science's prefix (10.1126) with Lancet's journal code, (2) The DOI contains '21' indicating 2021, conflicting with the stated 2012 date, (3) The issue number 9812 is unusual for Lancet. There appears to be real content underlying this reference but the citation metadata is clearly falsified or constructed from incorrect parts. A real Thompson editorial on β-agonists for ARDS exists in The Lancet from 2012 (likely around vol 379), but this specific citation does not match the real publication.",The author 'B. T. Thompson' is a recognized researcher in critical care medicine and ARDS. This author is real and has published in The Lancet.,The title 'β-agonists for ARDS: the dark side of adrenergic stimulation?' is consistent with editorial/commentary pieces about beta-agonist trials in ARDS that appeared around 2011-2012 in The Lancet.,"The Lancet (London, England) is a well-known, real medical journal published by Elsevier. The issue number (9812) seems potentially inconsistent - The Lancet volume numbering would need verification. The Lancet is a legitimate journal.","Issue 9812 is suspicious. The Lancet uses volume numbers in the hundreds, not issue numbers in the thousands. By 2012, The Lancet had published well over 9,812 issues if you count from its founding in 1823, but that would be an unusual identifier. This appears to be a fabricated or incorrect issue number.",Issue 9812 does not match typical Lancet issue numbering conventions.,Pages '196-198' - a short commentary of 3 pages is plausible for a Lancet editorial/commentary piece.,Not applicable here.,"The year 2012 is plausible for this type of editorial, given the BALTI-2 trial results were published in 2012.","The DOI '10.1126/S0140-6736(21)00798-4' contains '21' suggesting a 2021 publication, but the citation states 2012. The DOI prefix '10.1126' is for Science (AAAS), not for Lancet (which uses 10.1016). This DOI is clearly fabricated - it mixes Science's prefix with Lancet's journal code and a 2021 identifier.",No PMCID provided.,No PMID provided.
nemotron-3-super-120b-a12b,nlm,"Multiple components (issue number, DOI, PMID) are inconsistent with each other and with known Lancet metadata. The article cannot be verified in PubMed, Lancet archives, or CrossRef.","Author 'Thompson BT' could exist, but no verifiable record of this specific article.",Title β-agonists for ARDS: the dark side of adrenergic stimulation? does not appear in PubMed or Lancet archives.,"Lancet is correct journal name, but the rest of the citation does not match Lancet formatting.","The issue number (9812) and page range (196-198) do not correspond to the Jan 21, 2012 Lancet issue (which is issue 9811).",Same as volume; the issue number is off by one.,Page range not found for that issue.,No elocator provided; not applicable.,"Date Jan 21, 2012 is plausible for a Lancet issue, but the issue number mismatch makes the date inconsistent with the rest of the citation.","DOI prefix 10.1126 belongs to Science (AAAS), not Lancet; Lancet DOIs start with 10.1016/S0140-6736. The given DOI does not resolve to a Lancet article.",No PMCID provided; not applicable.,PMID 22166901 does not retrieve this article in PubMed; searching returns unrelated records.
