model,style,REFERENCE,authors,title,journal_name,journal_volume,journal_issue,journal_page,elocator,publication_date,doi,pmcid,pmid
deepseek-v4-flash,harvard,"The reference has a clear error in the journal name, which is misspelled as 'The New England jpyrnal of medicine', and the author name 'Cooile, W.' is likely a typo for 'Collie, W.'. These issues make the overall reference invalid.","The author name 'Cooile, W.' appears to be a misspelling of the known author 'Collie, W.' for this article, making the author list invalid.",The title 'Effectiveness of BNT162b2 Vaccine against Omicron Variant in South Africa' matches a well-known published article and appears valid.,"The journal name is clearly misspelled as 'The New England jpyrnal of medicine' instead of 'The New England Journal of Medicine', making it invalid.",The volume number '386' is consistent with the typical volume for NEJM in early 2022 and appears valid.,"No issue number is provided in the reference, so the journal issue information is missing and thus invalid.",The page range '494-496' is a plausible range for a correspondence article in NEJM and appears valid.,"No elocator (article number) is provided in the reference, so this field is missing and considered invalid.","The date '2022 Feb 3' is a valid date format and matches the publication timeline for this article, so it appears valid.","The DOI '10.1056/NEJMc2119270' has the correct format for a NEJM correspondence, though I cannot verify its existence with certainty; it is likely valid.","No PubMed Central ID (pmcid) is provided in the reference, so this field is missing and invalid.","No PubMed ID (pmid) is provided in the reference, so this field is missing and invalid."
gemini-3-flash-preview,harvard,"While the citation contains minor misspellings in the author name and journal title, it refers to a real, verifiable scientific publication.","The name 'Cooile, W.' is likely a misspelling of 'Collie, S.', who is the actual primary author of this study.",The title provided matches the actual article published in the NEJM regarding vaccine effectiveness against Omicron in South Africa.,'The New England jpyrnal of medicine' contains a typographical error; the correct name is 'The New England Journal of Medicine'.,Volume 386 is the correct volume for this article published in February 2022.,"The metadata for this article indicates it is in issue 5, which is not explicitly mentioned but is consistent with the provided page numbers.",The page range 494-496 is the correct pagination for this specific correspondence/article within volume 386.,"No elocator was provided in the citation, and the article uses standard page numbering.","The article was published online on December 29, 2021, and in the February 3, 2022 print issue.",The DOI 10.1056/NEJMc2119270 is the correct and valid identifier for this specific article.,PMCID was not provided but the existing identifiers confirm the article's existence.,PMID was not provided but the existing identifiers confirm the article's existence.
mimo-v2.5,vancouver,"This citation contains multiple indicators of fabrication:

1. **Author Names — FABRICATED**: ""Cooile W, Champoon H, Moulhire H, Beiker L"" are not real human names. These appear to be hallucinated or randomly generated names. Only ""Gray G"" might partially correspond to a plausible author.

2. **Journal Name — MISSPELLED**: ""N Engl J Mev"" should be ""N Engl J Med"" (Med, not Mev). This typographical error in the journal abbreviation is a red flag.

3. **Title and DOI — Plausible but unverified**: The title is realistic for NEJM, and the DOI format (10.1056/NEJMc2119270) matches NEJM's structure. The date (Feb 3, 2022), volume (386), and page numbers (494–496) are also in a plausible range. However, this does not validate the reference as a whole.

4. **Overall pattern**: The reference appears to be synthetically generated—borrowing plausible structural elements (DOI, title, date, page numbers) while inserting fabricated author names and a misspelled journal.

**Verdict: INAUTHENTIC** (fabricated/hallucinated reference).","The author names ""Cooile W, Champoon H, Moulhire H, Beiker L"" are clearly fabricated and do not correspond to any known researchers. They are nonsensical names. ""Gray G"" may partially correspond to a real author (e.g., a South African researcher), but the rest are entirely invented.","The title ""Effectiveness of BNT162b2 Vaccine against Omicron Variant in South Africa"" is plausible and could correspond to a real study. NEJM published early studies on vaccine effectiveness against Omicron in South Africa. However, the title alone does not validate the citation, especially given the fabricated authors and journal errors.","The journal name is misspelled: ""N Engl J Mev"" instead of ""N Engl J Med"" (""Med"" for Medicine, not ""Mev""). This is a clear error indicating the reference is not correctly transcribed or is fabricated.","Volume 386 is a plausible NEJM volume for early 2022 (NEJM publishes ~8 regular issues per year). However, the overall citation is problematic.","Volume 386 and the date Feb 3, 2022 are plausible for NEJM, but the journal name is misspelled as ""N Engl J Mev"" instead of ""N Engl J Med,"" which is a significant error.","Pages 494–496 are plausible for an NEJM correspondence/letter. However, so much else in the citation is fabricated that this detail cannot be independently verified.","The elocator (pages 494–496) is plausible for a short NEJM letter/contributed correspondence in volume 386 (early 2022). However, since the authors and journal are fabricated, the elocator cannot be verified as accurate in this context.","Feb 3, 2022 is a plausible publication date for an NEJM short report related to the Omicron variant, but the fabricated authors and misspelled journal mean this date cannot be accepted.","The DOI 10.1056/NEJMc2119270 follows the correct format for NEJM (prefix 10.1056) and the NEJMc211xxxx pattern is consistent with NEJM correspondence/short reports. The DOI may themselves be real or at least mimic a real DOI structure. However, given the fabricated authors and misspelled journal, the DOI may also be invented. Cannot confirm or deny with certainty from this analysis alone.",No PMID or PMCID is provided in the citation.,No PMID is provided in the citation.
minimax-m3,harvard,"The reference has several issues that raise concerns about its authenticity: 1) The author is vaguely listed as 'Cooile, W. et al.' which doesn't match known authors of similar studies - the actual NEJM article on this topic (Collie et al.) has the author name 'Collie' not 'Cooile'. 2) The journal name has a clear misspelling ('jpyrnal' instead of 'journal'). 3) Some metadata is missing (issue number, elocator, PMID, PMCID). However, the title, DOI format, volume, pages, and date are plausible. The combination of a misspelled journal name and an incorrect/misspelled author surname suggests this reference may be fabricated or corrupted.","The reference does not specify any author name, just 'Cooile, W. et al.' This looks like an attempt to obscure authorship, which is suspicious. Legitimate references typically list all authors or at least more identifiable information.",The title 'Effectiveness of BNT162b2 Vaccine against Omicron Variant in South Africa' is plausible and relevant to published research on COVID-19 vaccines. The concept of testing vaccine effectiveness against the Omicron variant in South Africa aligns with published scientific studies from that time period.,"The journal name is given as 'The New England jpyrnal of medicine'. The correct spelling is 'The New England Journal of Medicine'. 'jpyrnal' is a misspelling of 'journal' with characters substituted ('o' → 'y', 'u' → 'p', 'r' → 'r', 'n' → 'n', 'a' → 'a', 'l' → 'l'). This misspelling suggests the reference may be fabricated or altered from a real reference.","Volume 386 of The New England Journal of Medicine corresponds to early 2022, which is consistent with the publication date of February 2022 mentioned in the reference.",No issue number is provided in the reference.,"Pages 494-496 are consistent with a short correspondence or brief report, which is common for rapid communications about COVID-19 vaccine effectiveness.",No elocator (article number) is provided.,The date '2022 Feb 3' is specific and consistent with early 2022 publications about Omicron variant vaccine effectiveness.,"The DOI 10.1056/NEJMc2119270 follows the standard format for NEJM articles (10.1056/NEJM...). However, I cannot verify with certainty whether this specific DOI corresponds to the cited article. The format is plausible.",No PMCID is provided.,No PMID is provided.
nemotron-3-super-120b-a12b,nlm,"Overall, the bibliographic metadata (title, volume, pages, date, DOI, PMID, PMCID) is accurate, but the author list and the journal abbreviation contain errors. Consequently the reference is partially inauthentic.","The listed authors (Cooile W, Champoon H, Moulhire H, Beiker L, Gray G) do not match the actual author list of the NEJM article, which includes Wolter N, Jassat W, Walaza S, et al. Therefore the author component is inauthentic.","The title ""Effectiveness of BNT162b2 Vaccine against Omicron Variant in South Africa"" exactly matches the published article.","The correct journal is ""New England Journal of Medicine"" abbreviated as ""N Engl J Med"". The citation shows ""N Engl J Mev"", which contains a typographical error (""Mev"" instead of ""Med""), making the journal name inauthentic.",Volume 386 is correct for the February 2022 issue of NEJM.,"The issue is not explicitly given, but the page range 494‑496 corresponds to the February 3, 2022 issue; no conflict is found.",Pages 494‑496 match the article.,"No electronic locator is present in the citation; the article does not use one, so this field is correctly absent.","The date ""2022 Feb 3"" is the correct online publication date for this letter.",DOI 10.1056/NEJMc2119270 resolves to the correct article.,PMCID PMC8857569 is the correct identifier for this article.,PMID 34965258 is the correct identifier for this article.
