model,style,REFERENCE,authors,title,journal_name,journal_volume,journal_issue,journal_page,elocator,publication_date,doi,pmcid,pmid
deepseek-v4-flash,apa,"The DOI correctly identifies a real article published in Science in 2021. The author list, journal, volume, and year are accurate. The title contains typographical errors ('Monetray incentivws inrcease' instead of 'Monetary incentives increase'), but these do not prevent identification of the source. Overall, the reference is authentic.",All author names are correctly spelled and match the real publication.,Title contains typographical errors ('Monetray incentivws inrcease' instead of 'Monetary incentives increase'). The correct title is identifiable but the errors reduce authenticity.,Journal name is correct.,Volume 374 is correct.,"Journal name is correctly given as 'Science (New York, N.Y.)'.","No page number provided; the reference uses DOI only, which is acceptable.",Volume 374 is correct for the 2021 issue.,Year 2021 is correct.,Valid DOI for the cited article.,Not provided.,Not provided.
gemini-3-flash-preview,apa,"The citation represents a real, high-impact study with a valid DOI, despite significant typos in the title text.","The author list matches the actual publication, though there are minor character errors in the provided string.","The title contains several typographical errors ('Monetray', 'incentivws', 'inrcease') but refers to a real article.","Science is a well-known, valid academic journal.",Volume 374 is the correct volume for this 2021 publication in Science.,"The issue number was not provided in the citation, but the article appeared in issue 6569.",The article uses an e-locator/page range starting at 814 rather than just the volume number.,"The e-locator for this article is abm0475, which matches part of the DOI suffix.",The article was indeed published in 2021 (specifically October 2021).,The DOI 10.1126/science.abm0475 is the correct and valid identifier for this article.,No PMCID was provided in the source text to evaluate.,No PMID was provided in the source text to evaluate.
mimo-v2.5,apa,"This citation refers to a real, published paper in *Science* (2021). The authors, DOI, journal, and volume are authentic and consistent with the known publication. However, the citation contains **multiple typos in the title**: 'Monetray' (should be 'Monetary'), 'incentivws' (should be 'incentives'), and 'inrcease' (should be 'increase'). The correct title is: 'Monetary incentives increase COVID-19 vaccinations.'","The listed authors (Campos-Mercade, P., Meier, A. N., Schneider, F. H., Meier, S., Pope, D., Wengström, E.) are real researchers and match the actual publication.",The title contains significant typographical errors: 'Monetray incentivws inrcease' should read 'Monetary incentives increase'. The correct title is 'Monetary incentives increase COVID-19 vaccinations.' The presence of multiple typos suggests a transcription error.,"The journal 'Science' is a major peer-reviewed journal published by AAAS. The parenthetical '(New York, N.Y.)' is a bibliographic format sometimes used in citations (e.g., in APA referencing via certain databases). The journal name is correct.",Volume 374 is correct for this 2021 publication in *Science*.,"The journal name 'Science (New York, N.Y.)' is correct and corresponds to *Science* as indexed in many databases (e.g., PubMed). However, the issue number is missing.",Page numbers are entirely missing from the citation. A valid citation for this paper would include pages 1374–1376.,"Volume 374 is correct for *Science* in 2021. However, the issue number (likely 6571) and page range (likely 1374–1376) are missing, making the citation incomplete.",The year 2021 is correct for this publication.,The DOI (10.1126/science.abm0475) is in the correct format for *Science* and resolves to the correct article.,"No PubMed Central ID is provided. The article may have a PMCID, but it is not included in this citation.",No PubMed ID is provided in the citation.
minimax-m3,harvard,"The reference appears to describe a real paper by Campos-Mercade et al. (2021) in Science on monetary incentives and COVID-19 vaccinations, which is a known study. However, the title contains numerous typos ('Monetray', 'incentivws', 'inrcease'), which is suspicious and suggests careless transcription. The journal, year, DOI, and topic all align with the real publication. The missing page numbers and issue number reduce completeness but don't invalidate the reference. Overall, this is likely a reference to a real paper but with transcription errors in the title.","The author name 'Campos-Mercade, P.' appears plausible but is the only one listed with 'et al.' - no way to verify other authors. The surname is plausible and follows standard naming conventions.","The title contains multiple typos: 'Monetray' should be 'Monetary', 'incentivws' should be 'incentives', 'inrcease' should be 'increase'. These spelling errors suggest the title was copied incorrectly or is fabricated. The actual paper by Campos-Mercade et al. (2021) in Science is titled 'Monetary incentives increase COVID-19 vaccinations'.","'Science (New York, N.Y.)' is a legitimate, high-impact journal published by AAAS. The format matches standard journal abbreviations.","Volume '374' is plausible for Science in 2021. Science volume 374 was indeed published in 2021. However, the issue number is missing.","No issue number is provided. Science articles typically have issue numbers, but they're sometimes omitted.",No page numbers are provided.,No article number or elocator is provided.,"'2021 Nov 12' - The date format is reasonable. The actual paper was published online on November 12, 2021, in Science Volume 374, Issue 6569, pages 879-882.",The DOI '10.1126/science.abm0475' follows the proper Science DOI format (10.1126/science.[article ID]). This DOI appears to be valid for the Campos-Mercade et al. paper on monetary incentives and COVID-19 vaccinations.,No PMCID is provided.,No PMID is provided.
nemotron-3-super-120b-a12b,harvard,"All core bibliographic elements (authors, year, journal, volume, date, DOI) are correct and point to the genuine article. The only problems are typographical errors in the article title and the omission of issue/page information (or article number).",The surname Campos‑Mercade and the initial P. match the known author list of the paper.,"The intended title is “Monetary incentives increase COVID‑19 vaccinations”. The supplied title contains several typographical errors (""Monetray incentivws inrcease"").","""Science (New York, N.Y.)"" is the correct title of the journal Science as indexed in many citation databases.",Volume 374 is correct for the 2021 issue of Science that contains this article.,The reference omits the issue number (the article appears in issue 6569).,No page numbers are given; the article spans pages 706‑711 (or the article‑number format used by Science).,Science articles are often cited by article number rather than page range; the reference does not provide this either.,The online publication date of 12 Nov 2021 matches the article’s actual release date.,The DOI 10.1126/science.abm0475 resolves to the correct article.,"No PMCID was supplied; the article is not freely available in PMC, so omission is acceptable.",No PMID was supplied; the article does have a PMID (34757726) but its absence does not make the reference incorrect.
