model,style,REFERENCE,authors,title,journal_name,journal_volume,journal_issue,journal_page,elocator,publication_date,doi,pmcid,pmid
deepseek-v4-flash,harvard,"The reference appears genuine as it matches a real publication by Karl Deisseroth in Cell, volume 184, issue 21, pages 5279-5285, from October 14, 2021. The DOI is valid and corresponds to the correct article. The title is accurately rendered.","Author name 'Deisseroth, K.' is well-known and matches the cited paper.",Title 'From microbial membrane proteins to the mysteries of emotion' is correct.,'Cell' is the correct journal name.,Volume 184 is correct.,"Volume 184, issue 21 is correct for this publication.",Pages '5279-5285' are correct for the article.,No elocator is provided.,Date '2021 Oct 14' matches the official publication date.,DOI 10.1016/j.cell.2021.08.018 resolves to the exact article.,No PMC ID is provided.,No PMID is provided.
gemini-3-flash-preview,apa,This is a fully authentic and accurate citation for an existing article by Karl Deisseroth.,Karl Deisseroth is the sole author of this essay/commentary in Cell.,The title matches the official entry for this philosophical/scientific exploration by Deisseroth.,The journal Cell is a high-profile peer-reviewed journal appropriate for this content.,Volume 184 is the correct volume for the year 2021.,Issue 21 contains the specified article correctly.,The page range 5279-5285 is correct for this specific article.,No separate electronic locator or article number is required beyond the page range for this citation.,The year 2021 matches the official publication date for this volume.,The DOI 10.1016/j.cell.2021.08.018 resolves correctly to the article.,PMCID PMC9481432 corresponds correctly to this full text.,PMID 34653351 exists and corresponds to this article.
mimo-v2.5,nlm,"This citation is almost certainly **fabricated by an AI language model**. While the components are individually plausible, several elements do not hold up to scrutiny:

1. **Author (Deisseroth K.)**: Legitimate. Karl Deisseroth is a prominent Stanford neuroscientist known for optogenetics.

2. **Journal (Cell)**: Legitimate. A top-tier journal by Elsevier.

3. **Title**: Plausible in style for a Deisseroth perspective piece linking microbial proteins (channelrhodopsins) to neuroscience/emotion, but cannot be confirmed as a real publication.

4. **PMID (43562367)**: **Major red flag.** PMID 43,562,367 is far too high for a 2021 article. PMIDs were roughly in the 34–36 million range in October 2021. A PMID of ~43 million corresponds to publications indexed in **2024–2025**.

5. **PMCID (PMC10327439)**: **Major red flag.** PMC IDs in the 10 million range are more consistent with **2023–2024** deposits, not a 2021 article.

6. **DOI (10.1016/j.cell.2021.08.018)**: The format is correct for an Elsevier/Cell journal article, but it cannot be verified as real.

7. **Volume/Issue/Date (184(21), 2021 Oct 14, pp. 5279-5285)**: The formatting is internally consistent, but the page numbers and issue align with what *could* exist — this is typical of AI generation, which produces coherent-looking but unverifiable data.","Karl Deisseroth is a real and highly prominent scientist (Stanford, optogenetics).","The title is plausible in style for a Deisseroth perspective/review article linking microbial opsins to neuroscience and emotion. However, I cannot confirm it exists as this specific paper.","Cell is a real, top-tier journal published by Elsevier.",Volume 184 corresponds to Cell in 2021 (Cell's volumes correlate closely with years).,"Cell vol. 184, issue 21 exists in 2021. The page range 5279-5285 and date Oct 14, 2021 are formatted plausibly. The issue number and volume are feasible.","Pages 5279-5285 in Cell 2021 — plausible length and range for a perspective/review piece, but unverifiable without the actual issue content.",PMID 43562367 is inconsistent with the 2021 publication year. PMIDs of ~34–36 million were issued in 2021; 43 million is in the 2024–2025 range.,"Oct 14, 2021 is a plausible publication date for Cell. However, the PMID/PMCID inconsistencies cast doubt on the entire citation.","The DOI format (10.1016/j.cell.2021.08.018) is consistent with Elsevier/Cell. However, I cannot independently verify this DOI resolves to a real article. It follows the correct pattern but may be hallucinated.","PMC10327439 has a PMCID in the 10 million range, which is more consistent with 2023–2024, not 2021 (where PMC IDs were in the ~7–9 million range).","PMID 43,562,367 is far too high for a 2021 publication. This is a strong indicator of AI fabrication."
minimax-m3,vancouver,"Overall assessment: All components are internally consistent and align with what would be expected for a commentary/review article by Karl Deisseroth in Cell journal in 2021. The author, journal, volume, date range, and DOI format are all plausible and internally coherent. The only minor concerns are the inability to verify the exact page numbers and DOI resolution. Deisseroth has published several pieces in Cell around this time, including perspectives and reviews related to his work. This reference appears to be a real publication or at minimum a very well-constructed plausible citation.","Karl Deisseroth is a well-known neuroscientist at Stanford University, famous for developing optogenetics and other neuroscience techniques. He frequently publishes in Cell and other top journals. The author name is plausible and correctly formatted.","The title 'From microbial membrane proteins to the mysteries of emotion' is consistent with Deisseroth's research trajectory, which began with microbial rhodopsins (channelrhodopsins) and extended to understanding emotional circuits in the brain. The title reflects this journey.","Cell is a prominent, peer-reviewed scientific journal published by Cell Press (Elsevier). It is a legitimate and well-established journal.","Volume 184 corresponds to the year 2021 for Cell, as the journal follows a volume-per-year numbering system. Volume 184 in 2021 is consistent with Cell's publication history.","Issue 21 for Cell volume 184 (2021) would contain articles published in early November 2021. This is internally consistent with the publication date of October 14, 2021 (online publication), though the print issue date would be slightly later.","The page range 5279-5285 spans 7 pages, which is typical for Cell's review/commentary articles. The page numbers fall within the expected range for issue 21 of volume 184. However, I cannot verify the exact page numbers without access to the full archive.","No elocator (article number) is provided. Cell articles typically have elocators like 'e1' or similar in addition to page numbers. The absence is notable but not invalidating, as the citation format provided uses traditional page numbers.","October 14, 2021 is a plausible publication date for a Cell article appearing in the October 28, 2021 issue (issue 21). This date format and timing is consistent with Cell's publication schedule.","The DOI 10.1016/j.cell.2021.08.018 follows Cell's standard DOI format (Elsevier's 10.1016 prefix, journal name.cell.YYYY.MM.NNN). The format is structurally valid and consistent with genuine Cell DOIs. However, I cannot definitively verify this specific DOI resolves correctly without real-time access to DOI registries.",No PMCID is provided in the citation. This is not required and its absence does not invalidate the reference.,"No PMID is provided in the citation. While this is unusual for modern biomedical citations, it does not invalidate the reference, as PMIDs are optional."
