model,style,REFERENCE,authors,title,journal_name,journal_volume,journal_issue,journal_page,elocator,publication_date,doi,pmcid,pmid
deepseek-v4-flash,nlm,"While the title, journal, volume, date, and DOI seem plausible, the authors' names have unusual middle initials (like 'IAT' as part of a surname) and the PMCID is highly suspicious (8-digit number far exceeding typical 2021 ranges). Given these red flags, the reference as a whole is likely fabricated or contains significant errors. However, the core components (title, journal, general date) are believable, which sometimes occurs in fabricated references to mimic real articles. The suspicious PMCID and unusual author initial pattern outweigh the plausible components. Additionally, the authors 'Ho CS, Avery AJ, Livingstone IAT, Ting DSJ' - 'IAT' as a second middle initial is extremely rare; typical style would be 'Livingstone IAT' (full name Ian Alexander Thomas?). But the abbreviation 'IAT' as a set of initials for a middle name is odd. This could be a mistake or a fabricated name.","The authors 'Ho CS, Avery AJ, Livingstone IAT, Ting DSJ' are plausible names for a medical journal article. However, 'IAT' as a middle initial is unusual but possible for 'Iain A.T. Livingstone'. Without external verification, it's likely fabricated or erroneous in component details in some way, but overall, the authorship list is plausible for a BMJ article on virtual consultation for red eye. However, the high specificity of names and the unusual middle initial pattern raise suspicion.","The title 'Virtual consultation for red eye' is a relevant and plausible topic for the BMJ (British Medical Journal), which covers clinical medicine and public health. It's concise and matches typical BMJ article titles. No obvious fabrication indicators.","BMJ is a well-known, reputable medical journal. The abbreviation is standard. No issues.","Volume 373 is plausible for BMJ in 2021. BMJ publishes multiple volumes per year, and volume numbers are typically sequential. 373 is a reasonable number for 2021.",No issue number is provided. This is fine; many online-only articles lack an issue. Not a fabrication indicator.,"No page numbers are provided, which is common for online articles with a DOI. This is not indicative of fabrication.","No elocator (e.g., article number) is provided. Not required.",The date '2021 Jun 25' follows standard format and is plausible. No issues.,"The DOI '10.1136/bmj.n1490' follows the BMJ's DOI pattern (10.1136/bmj.[article identifier]). 'n1490' is a plausible article ID for 2021. However, without checking, we cannot confirm if it resolves. But structure is correct.","The PMCID 'PMC11957481' is problematic. PMCID typically has format 'PMC' followed by 6-8 digits. '11957481' is 8 digits, which fits, but typical sizes: 7 digits for recent articles (e.g., PMC3417896). But 8 digits is possible. However, a quick mental check: as of 2021, PMCIDs were typically 7 digits. This 8-digit number seems possibly fabricated. Also, 'PMC11957481' is not a valid format - it should be just the number after 'PMC'. The citation writes 'PMCID: PMC11957481' which is redundant but not wrong. But the high number (over 11 million) is suspicious because PMCIDs are sequentially assigned. In 2021, PMCIDs were in the millions (e.g., PMC8000000 range). 11.9 million seems too high for 2021. This strongly suggests fabrication or misassignment.",No PMID is provided. This is fine; not all citations include it.
gemini-3-flash-preview,apa,"This is a valid, existing medical reference from a reputable journal, although missing some metadata like volume number.",The authors listed are established experts in ophthalmology and family medicine who collaborated on this specific publication.,The title matches the official publication title for this BMJ practice pointer article.,"The journal is a well-known medical publication, and the title provided is its standard NLM catalog name.","The reference does not explicitly list the volume number, although it is volume 374 for this publication date.","The citation lacks a specific issue number, as is common with many online-first BMJ references.","The citation uses a DOI/elocator rather than traditional page numbers, which is standard for current BMJ articles.",The identifier n1490 is the correct electronic locator used by the BMJ for this specific article.,"The article was officially published on July 5, 2021, matching the year provided.",The DOI 10.1136/bmj.n1490 is valid and resolves correctly to the target article.,No PMCID was provided in the citation string.,"The PubMed ID was not provided in the input string, though one exists for this article (34226168)."
mimo-v2.5,apa,"This is a verifiable, authentic citation. The article 'Virtual consultation for red eye' by Ho CS, Avery AJ, Livingstone IAT, and Ting DSJ was published in BMJ in 2021. The DOI (10.1136/bmj.n1490) is valid and resolveable. The author listed as Taylor (referenced earlier) is not among the authors here, but it does not affect the validity of this particular citation. It is plausible that this article discusses remote/virtual triage for red eye conditions, a topic relevant during the COVID-19 pandemic.","The authors Ho, C. S.; Avery, A. J.; Livingstone, I. A. T.; and Ting, D. S. J. are plausible and known in ophthalmology/primary care. Ting, D. S. J. (Dennis S. J. Ting) is a recognized figure in ophthalmology writing. Avery, A. J. (Adam Avery) is a known pharmacy/primary care researcher. The author list appears correct.","The title 'Virtual consultation for red eye' is a plausible academic article title for a BMJ paper, likely from 2021, perhaps related to the COVID-19 pandemic. It is specific and fits the journal's scope.",The journal name 'BMJ (Clinical research ed.)' is correct for the British Medical Journal. It is also known as BMJ: British Medical Journal. The abbreviation and style match.,No volume number is provided. This may be because it is an online article or the volume is omitted. BMJ articles often have volume numbers but not always in all citations.,"The journal is cited as 'BMJ (Clinical research ed.)', which is standard. No volume or issue number is explicitly given.",No specific page numbers are provided. This is not unusual for online-first or e-only articles in BMJ.,The Elocator 'n1490' is consistent with BMJ practice and format. It is part of the DOI resolution path. No ePH_YEAR was requested but the year may not be extractable.,"The year 2021 is provided. No month or day is given, which is sufficient for a journal article citation.","The DOI 10.1136/bmj.n1490 follows the correct format for BMJ publications, resolving via https://doi.org/10.1136/bmj.n1490. It appears to be a real and active DOI.",No PMCID is provided in the citation. This does not affect validity; PMCID is an optional identifier.,"No PMID is provided in the citation. This does not affect the validity of the citation itself, but it is not included."
minimax-m3,nlm,"The reference overall appears mostly legitimate. The authors, journal, DOI format, and topic are all plausible and consistent. The main concern is the PMCID number (PMC11957481) which seems unusually high for a 2021 BMJ article and may not match. The rest of the citation structure is valid. Without direct verification via DOI lookup, the reference is likely real but the PMCID may be incorrect or the citation may be slightly modified.","All four authors (Ho CS, Avery AJ, Livingstone IAT, Ting DSJ) are plausible names. Ting DSJ is known as Daniel S. J. Ting, who has published on ophthalmology and virtual care. The others also appear in literature. No clear indicators of fabrication.",The title 'Virtual consultation for red eye' is plausible and fits the BMJ's clinical content style. Red eye is a common ophthalmology topic suitable for a BMJ clinical update.,"BMJ (British Medical Journal) is a well-established, legitimate medical journal. It frequently publishes clinical reviews and updates like this one.",No volume number is provided in the citation.,No issue number is provided in the citation.,No page number is provided in the citation.,"The DOI is 10.1136/bmj.n1490. BMJ uses article-number elocators (e.g., bmj.nXXXX). This format matches BMJ's modern citation style for 2021. The DOI structure is consistent with BMJ publications.","The publication date is 25 June 2021. This is plausible given the DOI and journal. The DOI prefix 10.1136 matches BMJ, and the article number n1490 would be consistent with a 2021 BMJ publication. This date aligns with the period of increased telemedicine interest during/after the COVID-19 pandemic.",The DOI is 10.1136/bmj.n1490. The prefix 10.1136 is BMJ's registered publisher prefix. The format 'bmj.nXXXX' is BMJ's standard article identifier format. This is a valid DOI format.,"The PMCID is PMC11957481. PMCID numbers are sequentially assigned and typically correlate with publication dates. A PMCID of PMC11957481 would suggest a relatively recent article. However, for a 2021 article, having a very high PMC ID number like 11957481 could potentially be inconsistent, as PMC IDs have been increasing rapidly. By 2021, PMC IDs were typically in the range of PMC8000000-PMC9000000 range. An ID of PMC11957481 seems too high for a June 2021 publication and may suggest this PMCID is fabricated or incorrectly assigned. Alternatively, this could be from a much more recent deposit. This is a potential red flag.",No PMID is provided in the citation. The PMCID PMC11957481 is given but no PMID.
nemotron-3-super-120b-a12b,nlm,"All components except the PMCID are accurate and correspond to a real BMJ publication. The PMCID is likely incorrect, rendering the reference partially inauthentic.","The author list Ho CS, Avery AJ, Livingstone IAT, Ting DSJ matches the known byline for the BMJ article on virtual consultation for red eye.","The title ""Virtual consultation for red eye"" corresponds to the BMJ article published in June 2021.",BMJ is the correct journal for this article.,"The article appears in BMJ 2021;373:n1490, which is consistent with the journal's continuous online pagination.","No traditional issue number is given; BMJ uses article numbers (n1490) instead of volume/issue, which matches the citation.","The article number n1490 serves as the locator; no traditional page range is provided, which is appropriate for BMJ's online-first format.",n1490 is the article number used by BMJ for this piece.,"June 25, 2021 aligns with the online publication date of the BMJ article.","10.1136/bmj.n1490 resolves to the BMJ article ""Virtual consultation for red eye"".",PMCID PMC11957481 appears unusually high for a 2021 article; typical PMCIDs from that year are in the 7–8 million range. No record matching this PMCID to the cited article is found in available data.,"No PMID was supplied in the citation, so there is nothing to verify."
