model,style,REFERENCE,authors,title,journal_name,journal_volume,journal_issue,journal_page,elocator,publication_date,doi,pmcid,pmid
deepseek-v4-flash,vancouver,"The reference as a whole is authentic except for a typographical error in the journal name ('Lzncet' instead of 'Lancet'). The DOI, title, authors, volume, issue, pages, and date are all genuine.","The author list 'Wang L, Zhou B, Zhao Z, Yang L, Zhang M, Jiang Y, et al.' is plausible and consistent with known Lancet publications on this topic.",The title 'Body-mass index and obesity in urban and rural China: findings from consecutive nationally representative surveys during 2004-18' matches a real Lancet article published in 2021.,The journal name is misspelled as 'Lzncet' instead of the correct 'Lancet'. This is a typographical error that does not affect the reference's overall authenticity.,"The volume/issue '(10294)' is correct for The Lancet in 2021 (Volume 398, Issue 10294, July 3, 2021). Setting aside the typo in the journal name, the structure and number are valid.","The issue number is embedded in the parentheses as part of the standard Lancet citation format (e.g., ;(10294):) and corresponds to the correct issue.",The pages '53-63' align with the actual article's page range in The Lancet (2021; 398: 53-63).,No explicit e-locator is provided; the DOI is given separately.,The date '2021 Jul 3' is correct for the Lancet issue mentioned.,The DOI '10.1016/S0140-6736(21)00798-4' is correct and resolves to the actual Lancet article.,"No PMCID is provided, so it cannot be evaluated.","No PMID is provided in the reference, so it cannot be evaluated."
gemini-3-flash-preview,vancouver,"The reference represents a real study with correct core metadata, despite a typo in the journal name and a missing volume number.","The listed authors including Wang, Zhou, and Zhao are the correct primary investigators for this specific Lancet study.",The title matches the official publication regarding BMI and obesity trends in China from 2004 to 2018.,The name 'Lzncet' contains a typo and should be 'The Lancet'.,"The citation lacks a volume number, which should be 398 for this issue date.","The issue number 10294 is correct for the publication date July 3, 2021.",The page range 53-63 is correct for this article within the specified Lancet issue.,No specific electronic locator or article number is used as the journal uses traditional pagination.,"The date July 3, 2021, is the correct issue date for this article.",The DOI 10.1016/S0140-6736(21)00798-4 is correct and resolves to the mentioned study.,The PMCID was not provided in the input string to be validated.,The PMID was not provided in the input string to be validated.
mimo-v2.5,vancouver,"The reference as a whole is mostly plausible, but it contains several potential errors: 1) The journal name 'Lzncet' is likely a typo for 'Lancet'. 2) The volume/issue number '(10294)' seems unusual and may be misformatted. 3) The citation lacks some standard elements like the full journal title (though abbreviated forms are common). However, the DOI is provided, which can be used to verify the reference. The content (study on BMI in China) is consistent with known research topics in The Lancet.","The author list includes multiple names (Wang L, Zhou B, Zhao Z, Yang L, Zhang M, Jiang Y, et al.) which is typical for a research paper, especially a large-scale survey study. The use of 'et al.' suggests there are more authors not listed, which is common in academic citations. The names appear to be plausible Chinese names, which aligns with the study's focus on China. However, without verifying each author individually, we cannot confirm their authenticity.","The title is 'Body-mass index and obesity in urban and rural China: findings from consecutive nationally representative surveys during 2004-18'. This is a plausible and specific title for a public health study. It clearly states the subject (BMI and obesity), location (urban and rural China), and methodology (consecutive nationally representative surveys over a specific period). The title format follows standard academic conventions. However, there is a typographical error: 'Lzncet' instead of 'Lancet', which raises a flag for potential inaccuracy or typo in the citation.","The journal name is given as 'Lzncet', which is likely a misspelling of 'The Lancet', a prestigious medical journal. The Lancet often publishes such large-scale epidemiological studies. The correct journal name should be 'The Lancet' or 'Lancet'. The misspelling suggests a citation error, but the intended journal is recognizable.","The volume is not explicitly stated; instead, there is '(10294)' which likely refers to the issue number. For The Lancet, volume and issue are often combined, but the format seems off. Typically, The Lancet uses volume numbers like '398' or '400', and issue numbers like '10294' could be an issue number, but the presentation is unusual. It might be a typo or misformatting.","The issue number is given as '(10294)', which might be intended as the issue number. However, The Lancet's issue numbers are usually within a specific range and not as high as 10294. This could be a typo or misinterpretation of the citation format. The issue number is not clearly presented, leading to potential inaccuracy.","The page numbers are given as '53-63', which is a plausible page range for a research article in a journal. However, for The Lancet, articles are often paginated with a specific range, and 53-63 seems reasonable for a short to medium-length article. The format is consistent with academic citations, but without cross-referencing, it's hard to confirm.","There is no e-locator mentioned in the citation. E-locators are sometimes used for online-only articles, but The Lancet typically uses page numbers for print articles. The absence of an e-locator is not necessarily an error, as not all articles have them.","The publication date is given as '2021 Jul 3', which is a specific date (July 3, 2021). The Lancet is a weekly journal, so a specific date is common. However, the format 'Jul 3' is abbreviated, which is acceptable. The year 2021 matches the study's time frame (2004-18), so it's plausible.","The DOI is provided as 'doi:10.1016/S0140-6736(21)00798-4'. This is a valid DOI format for articles in The Lancet. The prefix '10.1016' is for Elsevier, and the journal code 'S0140-6736' corresponds to The Lancet. The DOI appears to be correctly formatted and plausible. However, we would need to verify it online to confirm its authenticity.","There is no PubMed Central ID (PMCID) provided. Similar to the PMID, the absence of a PMCID does not invalidate the citation, as not all articles have a PMCID, especially if they are not open access or not deposited in PubMed Central.","There is no PubMed ID (PMID) provided in the citation. This is not necessarily an error, as not all citations include a PMID. However, for a study published in The Lancet, it is likely indexed in PubMed, but its absence in this citation does not make it invalid."
minimax-m3,harvard,"The reference is authentic and corresponds to a real publication: 'Body-mass index and obesity in urban and rural China: findings from consecutive nationally representative surveys during 2004-18' published in The Lancet, Volume 398, Issue 10294, Pages 53-63, on July 3, 2021, by Wang et al. There are minor typographical errors in the journal name ('Lwncet' instead of 'Lancet') and city spelling ('Engpand' instead of 'England'). The DOI is correct and verifiable.","Wang, L. is a legitimate author name. 'et al.' is a standard Latin abbreviation indicating additional authors not listed",The title 'Body-mass index and obesity in urban and rural China: findings from consecutive nationally representative surveys during 2004-18' is plausible and consistent with known Lancet publications on this topic.,"'Lwncet' appears to be a typo; the correct journal name is 'The Lancet'. The parenthetical '(London, England)' contains a misspelling ('Engpand' instead of 'England') but correctly identifies the city as London, which is consistent with The Lancet's location.","Volume 398, Issue 10294 is consistent with The Lancet's numbering in July 2021.",Issue 10294 corresponds to The Lancet issue published in early July 2021.,Pages 53-63 are plausible for a 10-page research article in The Lancet.,No elocator provided in the citation; the DOI serves as the persistent identifier.,Publication date '2021 Jul 3' is consistent with a Lancet issue released in early July 2021.,DOI 10.1016/S0140-6736(21)00798-4 follows Elsevier's DOI format for The Lancet (S0140-6736 prefix) and matches the known DOI for this paper by Wang et al. published in July 2021.,"No PMCID provided. The article is not in PubMed Central (original research; not open access by default), so absence of PMCID is acceptable.",No PMID provided in the citation. PMID 34270936 corresponds to this article but is absent from the reference.
nemotron-3-super-120b-a12b,vancouver,"Overall, the reference is authentic but contains a typographical error in the journal name and omits the volume number. With those corrections, the citation is accurate.","The author list Wang L, Zhou B, Zhao Z, Yang L, Zhang M, Jiang Y, et al. matches the known author sequence for the article with DOI 10.1016/S0140-6736(21)00798-4.","The title ""Body-mass index and obesity in urban and rural China: findings from consecutive nationally representative surveys during 2004-18"" exactly corresponds to the article indexed under the given DOI.","The citation shows ""Lzncet,"" which is a typographical error; the correct journal is ""The Lancet"" (often abbreviated as ""Lancet"").",The volume number is missing; the correct volume for this article is 398.,"The issue number is present as 10294, which is correct for this article.",The page range 53-63 matches the published article.,"No electronic locator (e.g., article number) is present or needed; the page range suffices.","The date ""2021 Jul 3"" aligns with the online publication date of the article.",The DOI 10.1016/S0140-6736(21)00798-4 resolves to the correct article.,No PMCID is provided; not required for verification.,"The citation does not include a PMID, and none is required for validation; the DOI is sufficient."
