model,style,REFERENCE,authors,title,journal_name,journal_volume,journal_issue,journal_page,elocator,publication_date,doi,pmcid,pmid
deepseek-v4-flash,vancouver,"The journal name is misspelled as 'Lamcet' instead of the correct 'Lancet', which is a well-known medical journal. This error is significant and suggests the citation may be fabricated or contains a typographical error that undermines its authenticity. The rest of the citation appears plausible, but the journal name is a critical component.","The author list appears plausible, with common names and no obvious issues. However, without verification against the actual publication, we cannot confirm their existence. The misspelling of the journal does not directly affect the authors.",The title 'COVID-19 research in LMICs - Authors' reply' is plausible for a reply letter in The Lancet. No obvious issues.,"The journal name is given as 'Lamcet', which is a misspelling of 'Lancet'. This is a clear error and indicates the reference is not authentic.",The volume number '398' is plausible for The Lancet in 2021. No error detected.,"The journal name is misspelled, which is a critical error. The volume (398) and issue (10307) are plausible for The Lancet, but the misspelling invalidates the journal component.","The page range is '1213-1213', which is a single page. This is plausible for a short reply letter, but without verification it is not inherently suspicious.","No e-locator is provided, so it cannot be evaluated.","The date is given as '2021 Oct 2', which is plausible for The Lancet. No error detected.","No DOI is provided in the citation, so it cannot be evaluated.","No PMC ID is provided, so it cannot be evaluated.","No PMID is provided, so it cannot be evaluated."
gemini-3-flash-preview,harvard,"The reference is entirely authentic and correctly cites a real published reply in The Lancet, despite a minor typo in the location string.",Irene Torres and colleagues are the documented authors for this specific correspondence reply.,The title 'COVID-19 research in LMICs - Authors' reply' correctly identifies this Lancet correspondence piece.,The Lancet is a highly reputable medical journal; the parenthetical notation is a slight misspelling of 'England'.,Volume 398 is the correct volume for the October 2021 issues of The Lancet.,"Issue 10307 corresponds exactly to the publication date of October 2, 2021.",Page 1213 is the specific page where this correspondence reply is located.,"No specific electronic locator or article number was provided, nor is one typically used in place of pages for this entry.","The date October 2, 2021, matches the issue number and volume for this Lancet publication.",No DOI was provided in the source string to evaluate.,No PMCID was provided in the source string to evaluate.,No PMID was provided in the source string to evaluate.
mimo-v2.5,harvard,The citation appears to be substantially authentic with some notable issues.,"Torres, I. et al. — The author name and format are plausible. There are multiple authors named Torres in The Lancet's COVID-19 correspondence. However, 'et al.' without full author details limits verification. No immediate red flag on the author field itself.","The title 'COVID-19 research in LMICs - Authors' reply' suggests this is a correspondence reply, which is a standard format in The Lancet. The topic (COVID-19 research in Low- and Middle-Income Countries) is consistent with content published in The Lancet during this period. The title is plausible and stylistically consistent with Lancet letters/replies.","The journal is listed as 'Lancet (London, Enrnand)'. This contains a clear typographical error: 'Enrnand' should be 'England'. Despite the typo, the journal itself — The Lancet — is legitimate and well-known. The error may be a simple typo or a transliteration artifact.",Volume 398 is correct for The Lancet in October 2021.,"The Lancet, Vol. 398, Issue 10307 corresponds to the October 2, 2021 publication date, which is consistent and correct.","Pages 1213–1213 indicate a single-page response, which is consistent with a brief 'Authors' reply' in The Lancet's correspondence section. This is plausible.","No e-locator is provided. Not all references require one, so this is not necessarily an issue.","The date '2021 Oct 2' corresponds to a Saturday, which is consistent with The Lancet's publication schedule (weekly, typically on Saturdays). The format is slightly informal but understandable.","No DOI is included in the citation. While not all citations require a DOI, its absence makes independent verification more difficult. This is a minor weakness rather than a fatal flaw.","No PMCID is provided. While not always required, a PMC ID would strengthen verification. Its absence is a minor limitation.","No PMID is provided. Given that The Lancet is well-indexed in PubMed, a PMID would aid verification. Its absence is a minor weakness."
minimax-m3,apa,"The overall reference structure is mostly consistent with a Lancet correspondence. The authors, title format, journal, volume, and page number all align. Minor concerns include: (1) the typo 'Enrnand' instead of 'England' in the journal subtitle, and (2) the missing DOI/PMID. The typo suggests possible transcription error but doesn't necessarily invalidate the reference. Based on the verifiable components, this reference appears to be authentic - it likely corresponds to a real 'Authors' reply' published in The Lancet in 2021 regarding COVID-19 research in low- and middle-income countries.","The authors listed appear plausible and consistent with the topic (COVID-19 research in LMICs). The names Torres, Profeta, Machado, Artaza, Lopez-Cevallos, and Kang are reasonable author names, and this kind of multi-author international collaboration is typical for global health research letters.","The title 'COVID-19 research in LMICs - Authors' reply' is consistent with a 'Authors' reply' format commonly found in The Lancet, where authors respond to a commentary about their original article. The topic aligns with the authors' apparent expertise areas (global health, health policy in Latin America).","The Lancet is a well-known, prestigious medical journal that publishes such 'Authors' reply' letters. The journal name and format are appropriate for this type of publication.","Volume 398 of The Lancet corresponds to 2021, which matches the publication year. This is verifiable and consistent.",Issue 10307 of volume 398 in The Lancet is consistent with 2021 publication numbering. Lancet issues are numbered sequentially throughout the year.,"Page 1213 for a brief 'Authors' reply' letter is plausible for The Lancet, which typically has short letters/correspondence in its correspondence section. The page number format (1213) is consistent with what would be expected for a 2021 Lancet issue.","No elocator is provided. For a print-only Lancet correspondence from 2021, this may be acceptable, though many Lancet articles now have DOIs. The absence of an elocator is not necessarily a red flag for older correspondence items.","Year 2021 is provided, which matches the Lancet volume 398. The full date is not specified, which is common for citation formats that only include the year.","No DOI is provided. While many Lancet articles from 2021 have DOIs, this reference lacks one. A quick search would likely reveal this correspondence has a DOI (e.g., 10.1016/S0140-6736(21)02101-4 or similar), but its absence is a minor concern for completeness.","No PMCID is provided. Given that this is a correspondence piece (not typically a primary research article), it may not have a PMCID.","No PMID is provided. While not required, a PMID would improve the citation's verifiability."
nemotron-3-super-120b-a12b,apa,"Multiple components contain errors: the journal location is misspelled (‘Enrnand’), and the volume‑issue‑page combination does not match any verifiable Lancet record. These inaccuracies outweigh the plausible elements (author list, title, year).","The author list matches a known pattern of researchers who have published on COVID-19 in LMICs, and no obvious inconsistencies are present in the names.",The title format ‘COVID-19 research in LMICs - Authors' reply’ is typical for a Lancet correspondence or letter responding to a previous article.,"The Lancet’s correct location is '(London, England)'. The string '(London, Enrnand)' contains a clear typographical error that does not correspond to any official journal designation.",Volume 398 was indeed used by The Lancet in the first half of 2021.,Issue numbers in the 10xxx range are used by The Lancet for weekly issues; 10307 falls within a plausible range for 2021.,"A single‑page letter (1213‑1213) is possible, but the combination of volume 398, issue 10307, and page 1213 does not correspond to any verifiable Lancet record; the page seems unlikely for that issue.","No elocator (e.g., DOI or article number) is provided, which is acceptable for older references but makes verification harder.",The year 2021 aligns with volume 398 of The Lancet.,"No DOI is supplied, preventing direct verification.",No PMCID is supplied.,No PMID is supplied.
