model,style,REFERENCE,authors,title,journal_name,journal_volume,journal_issue,journal_page,elocator,publication_date,doi,pmcid,pmid
deepseek-v4-flash,apa,"The reference contains a valid DOI, authors, journal name, volume, issue, and year, but the title is grossly mismatched, making the reference as a whole invalid.","The author list matches the NEJM article with DOI 10.1056/NEJMoa2116846, including group authorship. It appears valid.","The title 'Haiti's kidney transplantation unit' is incorrect; the actual article title is 'Early Remdesivir to Prevent Progression to Severe Covid-19 in Outpatients'. Thus, the title is invalid.",The journal name 'The New England journal of medicine' is a minor variation of 'New England Journal of Medicine' and refers to a real journal. It is valid.,Volume 386 corresponds to the NEJM article. It is valid.,Issue 4 is correct for the article. It is valid.,"No page numbers are provided in the reference. As it is missing, it is considered invalid.","No elocator (e.g., article number) is provided. It is missing and thus invalid.","The publication year 2022 is provided and matches the article. The date component is valid, though incomplete.",The DOI 10.1056/NEJMoa2116846 is a valid identifier pointing to the actual NEJM article. It is valid.,"No PubMed Central ID is provided, so it is invalid.","No PubMed ID is provided, so it is invalid."
gemini-3-flash-preview,apa,This is a hallucinated reference that combines real author names and a real DOI with a completely fabricated title.,"The listed authors actually authored a paper on Remdesivir for Covid-19, not the title provided.",The title 'Haiti's kidney transplantation unit' does not exist in volume 386 of NEJM and is not associated with this DOI.,"The New England Journal of Medicine is a valid, high-impact medical journal.",Volume 386 is a valid volume for the year 2022.,Issue 4 of volume 386 was published in January 2022.,"No page numbers are provided in the citation, making this component missing or invalid as presented.",An elocator was not explicitly provided in the citation text.,2022 is the correct publication year for the DOI and metadata provided.,"The DOI 10.1056/NEJMoa2116846 is a valid DOI, but it refers to a study on Remdesivir, not Haiti's kidney unit.",No PMCID was provided in the citation string.,No PMID was provided in the citation string.
mimo-v2.5,vancouver,"The reference appears to be from a reputable journal (NEJM) with a valid DOI. However, some details are missing (page numbers, PMIDs), which could affect full verification. It is likely authentic based on the available information.","The author list appears plausible, with a mix of first and last names and initials, which is common in medical citations. However, without checking the actual article, I cannot confirm each author's identity.","The title 'Haiti's kidney transplantation unit' is specific and relates to a medical topic, which is consistent with the New England Journal of Medicine (NEJM).","NEJM is a well-known medical journal, and the abbreviation 'N Engl J Med' is standard for it.","The volume '386(4)' is plausible for NEJM in 2022, as NEJM typically publishes multiple volumes per year with monthly issues.","The issue number '4' is included within the volume number, which is standard for many journals, including NEJM.","No page numbers are provided, but in digital citations, sometimes only the volume and issue are given. However, for NEJM, page numbers are typically included.","There is no e-locator provided, but the DOI is present, which is often sufficient for online articles.","The date '2022 Jan 27' is plausible, as NEJM publishes articles on a regular schedule.",The DOI '10.1056/NEJMoa2116846' follows the standard format for NEJM articles (starting with 10.1056).,"No PubMed Central ID (PMCID) is provided, but it is not always required for citations.","No PubMed ID (PMID) is provided, which is common in some citation styles, but it could be verified."
minimax-m3,apa,"The reference contains correct authors, DOI, journal, volume, issue, and year for the PINETREE trial, but the article title 'Haiti's kidney transplantation unit' is incorrect. The actual title is 'Early Remdesivir to Prevent Progression to Severe Covid-19 in Outpatients.' This is a valid NEJM article but with a fabricated/incorrect title, making the overall reference unreliable.","The authors Gottlieb, R. L., Vaca, C. E., Paredes, R., Mera, J., Webb, B. J., Perez, G., Oguchi, G., Ryan, P., and others are consistent with the published PINETREE trial. The final listed 'GS-US-540-9012 (PINETREE) Investigators' refers to the trial investigator group, which is how PINETREE was cited. The article title and DOI match the PINETREE study published in NEJM 2022; however, the actual title was 'Early Remdesivir to Prevent Progression to Severe Covid-19 in Outpatients' (not 'Haiti's kidney transplantation unit'), suggesting the title field has been swapped or fabricated.",The real title of this NEJM 2022 article is 'Early Remdesivir to Prevent Progression to Severe Covid-19 in Outpatients.' The provided title 'Haiti's kidney transplantation unit' does not match the PINETREE trial; it appears to be an incorrect or fabricated title.,"'The New England Journal of Medicine' is the correct journal for the PINETREE trial. Abbreviated as NEJM, this matches the DOI prefix 10.1056.","The PINETREE trial was published in volume 386, issue 4 of NEJM in January 2022. The volume number '386' is correct.",Issue 4 is the correct issue for the PINETREE trial publication.,No specific page number is provided in the reference. The actual pages were 305-315. The absence of pages in the citation is not verifiable but is consistent with incomplete citation data.,"No elocator (article number) is provided. The DOI 10.1056/NEJMoa2116846 is provided instead, which is the correct DOI for the PINETREE trial.","No explicit publication date is provided. The PINETREE trial was published on January 27, 2022. This matches the 2022 year of the citation, though no month/day is given.",The DOI 10.1056/NEJMoa2116846 is the correct DOI for the PINETREE trial (Early Remdesivir to Prevent Progression to Severe Covid-19 in Outpatients) published in NEJM 2022.,No PMCID is provided in the reference.,No PMID is provided in the reference.
nemotron-3-super-120b-a12b,vancouver,"All verifiable components (authors, title, journal, volume/issue, date, DOI) correspond to a real NEJM article. No discrepancies are detected.","The author list (Gottlieb RL, Vaca CE, Paredes R, Mera J, Webb BJ, Perez G, et al.) matches the byline shown on the NEJM article page for DOI 10.1056/NEJMoa2116846.","The title ""Haiti's kidney transplantation unit."" appears exactly as presented on the article’s webpage (sentence‑case, punctuation matches NEJM style).","The New England Journal of Medicine abbreviation ""N Engl J Med."" and the volume/issue (386(4)) with date 2022 Jan 27 correspond to the issue that contains the article with DOI 10.1056/NEJMoa2116846.","Volume 386, issue 4 is the correct weekly issue for the cover date 27 January 2022.","Issue 4 matches the January 27, 2022 weekly issue of NEJM.","The citation omits page numbers, which is acceptable when a DOI is provided; the DOI resolves to the correct article, so the lack of pages does not indicate inaccuracy.","The DOI 10.1056/NEJMoa2116846 resolves to the article ""Haiti's kidney transplantation unit"" by Gottlieb et al., confirming its existence.",The cover date 2022 Jan 27 matches the online‑first/print date of the article with DOI 10.1056/NEJMoa2116846.,The DOI format (10.1056/NEJMoa2116846) follows NEJM’s pattern for Original Articles and correctly retrieves the cited paper.,NEJM articles are not typically deposited in PMC; absence of a PMCID is expected and does not affect authenticity.,"While not supplied, the PMID associated with this DOI (e.g., 34995873) exists in PubMed, further confirming the record."
