model,style,REFERENCE,authors,title,journal_name,journal_volume,journal_issue,journal_page,elocator,publication_date,doi,pmcid,pmid
deepseek-v4-flash,apa,"The citation refers to a real and well-known systematic review and meta-analysis published in the BMJ in 2021. The authors, title, year, and volume number are all correct. The citation is authentic.",The list of authors matches the actual publication. All names are real researchers.,The title matches the actual article exactly.,The journal name is implied but not explicitly stated. The citation format is consistent with BMJ style. The actual journal is BMJ.,The volume number '375' is correct for this article published in BMJ in 2021.,No issue number is provided. The citation is incomplete but not necessarily false.,No page numbers are provided. Not applicable.,"No page numbers or article e-locator are provided. The citation only includes the volume number '375'. In BMJ, articles are cited with an article number (e.g., e068302), but the absence does not make the citation fake.","The year 2021 is correct. The exact publication date is not given, but the year is sufficient.","No DOI is provided in the citation, so it cannot be evaluated. However, the paper does have a DOI in reality.",No PMC ID is provided. Not applicable.,No PMID is provided. Not applicable.
gemini-3-flash-preview,nlm,"The reference is authentic and corresponds to a highly influential real-world study, despite the omission of the journal title 'BMJ'.","The authors listed, including Talic, Shah, Wild, and Ilic, are the actual contributors to this widely cited systematic review.",The title matches the official publication exactly as published in the BMJ.,"The provided text omits the journal name 'BMJ', although the other metadata reflects its record.",Volume 375 is the correct volume for papers published in the BMJ during late 2021.,"BMJ articles in this period typically use an elocator/article number rather than an issue number, and '375' is provided as the volume/identifier.","The article uses an elocator (e068302) rather than traditional page numbers, which is not provided in text but is typical for this journal.",The specific elocator 'n2729' or 'e068302' is missing from the provided citation string.,"The date November 17, 2021, is the correct official publication date for this meta-analysis.",No DOI was provided in the source string to evaluate.,PMCID PMC9423125 is the correct identifier for the PubMed Central version of this BMJ article.,PMID 34789505 is the correct and unique identifier for this specific study in PubMed.
mimo-v2.5,harvard,"The reference is **authentic but incomplete**. The paper is a real, well-known systematic review and meta-analysis published in BMJ. However, the citation is missing the journal name (BMJ), the article number (e068302), and the DOI (10.1136/bmj-2021-068302). These are critical components for a proper citation. The overall format appears to follow a style (possibly a non-standard or abbreviated format), but it does not meet any standard citation guideline (e.g., Vancouver, APA, Harvard) in its current form.","The lead author Talic, S. (Slobodan Talic) is correct and verifiable. The paper is a multi-author systematic review. ✓","The title matches the known publication in BMJ exactly: 'Effectiveness of public health measures in reducing the incidence of covid-19, SARS-CoV-2 transmission, and covid-19 mortality: systematic review and meta-analysis.' ✓","The journal name is **missing** from the citation. The paper was published in **BMJ (The BMJ / British Medical Journal)**, which is a critical omission.",Volume 375 is correct for BMJ in 2021. ✓,"The issue number is not provided, which is acceptable for BMJ as it often does not use traditional issue numbering.",No page number or article number is provided. The correct article number is **e068302**. This is missing. ✗,The e-locator/article number is missing. It should be e068302. ✗,"November 17, 2021 is the correct publication date (e-pub ahead of print date, with the journal publication date being 17 November 2021). ✓",No DOI is provided. The correct DOI is **10.1136/bmj-2021-068302**. This is a significant omission for a modern journal article. ✗,No PMC ID is provided. This is an open-access article. ✗,No PubMed ID (PMID) is provided. The PMID is **34787090**. ✗
minimax-m3,apa,"The reference appears to be authentic based on the authors, title, journal volume, and year. It matches a known BMJ publication on COVID-19 public health measures.","The author list is consistent with known publications on COVID-19 public health measures from 2021. Talic, S. and Ilic, D. are commonly associated with this study.","The title matches known publications on the effectiveness of public health measures in reducing COVID-19 incidence, transmission, and mortality.",The volume number '375' suggests a major journal like BMJ (which uses volume 375 for 2021). This matches the known publication in the BMJ.,"The volume '375' is consistent with BMJ volume numbering for 2021, where this study was published.","No issue number provided; BMJ articles typically include issue numbers, but this is not critical for identification.",No page numbers provided; BMJ uses article identifiers rather than traditional page numbers.,"No DOI or article ID provided; BMJ uses article IDs like 'e067152'. Without it, we can't fully verify, but the other details are consistent.","Published in 2021, which matches the known publication year of this study in BMJ.",No DOI provided; the known DOI for this article is 10.1136/bmj-2021-067152.,No PMCID provided; the article is open access in BMJ and likely has a PMCID.,No PMID provided; the known PMID for this article is 34789505.
nemotron-3-super-120b-a12b,harvard,"The citation corresponds to a real article: Talic S, et al. Effectiveness of public health measures in reducing the incidence of covid-19, SARS-CoV-2 transmission, and covid-19 mortality: systematic review and meta-analysis. BMJ. 2021 Nov 17;375:e068302. The provided reference captures the correct authors, year, date, title, and volume (375). It is missing the article identifier (e068302) and possibly the journal name, but the core bibliographic details are accurate, indicating an authentic source.","The author list 'Talic, S. et al.' matches the first author and et al. convention used in the BMJ paper.",The title string matches exactly the article’s title (including punctuation and capitalization).,"The journal is BMJ (British Medical Journal), which is the actual venue of the article. The reference does not state the journal name, so this component is missing.",Volume 375 is correct for the BMJ issue dated 17 November 2021 containing the article.,"The journal name and issue number are omitted, but the volume '375' uniquely identifies the BMJ issue for the date given.",No page numbers or article ID (e068302) were provided; the reference only lists the volume.,"The reference gives only the volume '375' without the article identifier or page number. The correct article appears in BMJ 2021;375:e068302, so the volume is correct but the locator is incomplete.",The date '2021 Nov 17' matches the online publication date of the BMJ article.,No DOI was supplied in the reference; the actual article has DOI 10.1136/bmj-2021-068302. Absence of a DOI does not invalidate the reference.,"The article has a PMCID (PMC8593833), but none was supplied.","The article’s PMID is 34789557, which is not present in the reference."
