model,style,REFERENCE,authors,title,journal_name,journal_volume,journal_issue,journal_page,elocator,publication_date,doi,pmcid,pmid
deepseek-v4-flash,apa,"The reference contains multiple obvious errors (typos in authors and title, likely fake DOI) that make it invalid as a whole. It is likely fabricated or incorrectly transcribed.","The author names contain obvious typos: 'Lj' should be 'Li', 'Llu' should be 'Liu', 'Xoa' should be 'Xiao'. These are not valid common surnames, indicating the author list is fabricated or incorrectly transcribed.","The title contains clear spelling errors: 'psosiblg' is likely 'possible', 'modenof' is likely 'model of'. A valid scientific title would not include such mistakes, so the title is invalid.","'BMJ (Clinical research ed.)' refers to a real journal (the British Medical Journal), and the edition specification is plausible. Despite other errors, the journal name itself is valid.","Volume 375 is a known volume for BMJ in 2021, consistent with the stated year. The volume number appears valid.",The reference does not provide an issue number; it only has a volume and an elocator. Missing issue information typically makes the issue component invalid for a complete citation.,"'e066129' is an article elocator (e-location ID), not a traditional page number. Since it is presented in the page field but does not conform to page ranges, it is invalid as a page component.","The elocator 'e066129' is likely intended but was placed in the page field in the citation. Since it is not explicitly provided as an elocator in the input, we treat it as missing, making the elocator invalid.","The year 2021 is consistent with the volume and journal, and there is no indication it is incorrect. The date component appears valid.","The DOI format '10.1136/bmj-2021-066129' follows BMJ's typical pattern, but given the extensive errors in other fields (authors, title), it is likely fabricated. Thus, it is considered invalid.","No PMCID was provided in the citation, so it cannot be validated and is considered absent/invalid.","No PMID was provided in the citation, so it cannot be validated and is considered absent/invalid."
gemini-3-flash-preview,apa,"While the metadata like DOI and volume are correct, the presence of significant typos in authors and title renders the string technically invalid as a formal citation.","The author names contain several typographical errors such as 'Lj', 'Llu', and 'Xoa' which do not match the actual authors Li, Liu, and Xiao.",The title contains typos like 'psosiblg' and 'modenof' instead of 'possible mode of'.,The journal name matches the official title for the BMJ.,Volume 375 is the correct volume for this 2021 BMJ publication.,"The citation does not explicitly provide an issue number, but the BMJ often uses elocators for specific articles.",The page field is replaced by an elocator in this reference format.,The elocator e066129 is the correct identifier for this specific BMJ article.,2021 is the correct publication year for this article.,The DOI 10.1136/bmj-2021-066129 is valid and points directly to the correct article.,No PMCID was provided in the input string to evaluate.,No PMID was provided in the input string to evaluate.
mimo-v2.5,vancouver,"This citation appears to be based on a real BMJ article, but it contains significant typographical errors in both author names and the article title. The real article is: Li Y, Liu H, Xiao W, Wong GWK, Xu S. 'Cold chain logistics: a possible mode of SARS-CoV-2 transmission?' BMJ. 2021 Dec 1;375:e066129. DOI: 10.1136/bmj-2021-066129. The provided citation corrupts several author names (e.g., 'Lj Y' instead of 'Li Y', 'Llu H' instead of 'Liu H', 'Xoa W' instead of 'Xiao W') and misspells words in the title ('psosiblg' for 'possible', 'modenof' for 'mode of'). These errors may stem from OCR corruption, poor transcription, or AI hallucination. The DOI, journal name, date, and volume/article number are correct and locate a real article.","The author names are corrupted: 'Lj Y' (should be 'Li Y'), 'Llu H' (should be 'Liu H'), 'Xoa W' (should be 'Xiao W'). 'Wong GWK' and 'Xu S appear correct. Overall, the names do not match the real authors of the referenced article.","The title is corrupted with typos: 'psosiblg' should be 'possible' and 'modenof' should be 'mode of'. The intended title is 'Cold chain logistics: a possible mode of SARS-CoV-2 transmission?', which is the real title of the BMJ article.","'BMJ' is the correct abbreviation for the British Medical Journal, a legitimate and widely recognized journal.",Volume 375 is correct for BMJ publications around 2021.,"The journal 'BMJ' (British Medical Journal) is a real, well-known journal. The issue formatting (375:e066129) is consistent with BMJ's publication style.","The locator '375:e066129' is the article number (electronic locator), which is consistent with BMJ's format. There is no traditional page range here, which is standard for BMJ electronic articles.",The volume and article number '375:e066129' and the date '2021 Dec 1' match the real publication details of the BMJ article.,"December 1, 2021 is consistent with the real publication date of the BMJ article.",The DOI 10.1136/bmj-2021-066129 is a legitimate DOI format for BMJ and corresponds to a real published article. The DOI is correctly formatted and authentic.,No PMC ID is present in the citation.,No PMID is present in the citation.
minimax-m3,apa,"Multiple components of this reference contain clear errors: garbled author names (likely from OCR errors or deliberate corruption) and multiple typos in the title ('psosiblg modenof'). While the journal, DOI structure, and article identifier format are all consistent with BMJ publication conventions, the extent and nature of the errors in the author names and title suggest this is either a heavily corrupted version of a real citation or a fabricated citation. The underlying structure (journal, DOI pattern, article type) is plausible enough that a real article with a corrected title and authors may exist, but this specific reference as presented contains too many errors to be considered authentic. A real BMJ paper on cold chain logistics and SARS-CoV-2 did exist (e.g., a rapid response or editorial), but the DOI and identifiers don't clearly match a verified publication.","The author list contains several errors. 'Lj, Y.' appears malformed (likely 'Li, Y.' or similar); 'Llu, H.' has 'Llu' which is not a typical Chinese name transliteration (likely 'Liu, H.'); 'Xoa, W.' appears to be a misspelling of 'Zhao, W.' or 'Xu, W.'; 'Wong, G. W. K.' looks plausible; 'Xu, S.' looks plausible. The title also contains typos ('psosiblg modenof' instead of 'possible mode of') suggesting this is a fabricated or corrupted citation rather than a real one copied from a database.","The title 'Cold chain logistics: a psosiblg modenof SARS-CoV-2 transmission?' is riddled with typos: 'psosiblg' should be 'possible', 'modenof' should be 'mode of'. These errors are inconsistent with the BMJ's typical published title format. The likely real title would be something like 'Cold chain logistics: a possible mode of SARS-CoV-2 transmission?' This suggests the citation has been garbled or fabricated.",'BMJ (Clinical research ed.)' is the standard journal abbreviation for the British Medical Journal used in PubMed/MEDLINE indexing. This appears legitimate.,Volume '375' for BMJ in 2021 is plausible (BMJ publishes weekly issues with high volume numbers).,No issue number is provided.,"Page/article identifier 'e066129' is in the format used by BMJ for online-only articles, which is consistent with BMJ publication practices.",No DOI provided beyond what's in the URL. The 'e066129' functions as an article identifier/electronic locator. The DOI format '10.1136/bmj-2021-066129' follows BMJ's DOI structure (10.1136/bmj-YYYY-NNNNNN).,The year '2021' is given but no specific date. The DOI suffix 'bmj-2021-066129' suggests 2021 publication.,"The DOI '10.1136/bmj-2021-066129' follows BMJ's standard DOI pattern (publisher 1136, journal bmj, year, article number). This format is consistent with genuine BMJ DOIs.",No PMCID is provided in the citation.,No PMID is provided in the citation.
nemotron-3-super-120b-a12b,vancouver,"The citation contains multiple typographical errors in the author names (e.g., ""Lj Y"", ""Llu H"", ""Xoa W"") and in the article title (""psosiblg"", ""modenof"") that do not match any known publication. While the journal, volume, page, date, and DOI (10.1136/bmj-2021-066129) correspond to a genuine BMJ article, the presented author list and title are garbled, making the reference as written inauthentic.","The author strings ""Lj Y"", ""Llu H"", ""Xoa W"" are not recognizable as any standard naming convention and appear to be misspellings of likely correct names such as ""Li Y"", ""Huang L"", ""Wang X"". The latter two authors ""Wong GWK"" and ""Xu S"" are plausible but the first three are clearly erroneous.","The title as written contains nonsensical substrings ""psosiblg"" and ""modenof"", which are clear typographical errors. The correct title is ""Cold chain logistics: a possible mode of SARS-CoV-2 transmission?"". Hence the presented title is invalid.","""BMJ"" is the correct abbreviation for the British Medical Journal, the journal indicated by the DOI.",Volume 375 is correct for the BMJ issue dated December 2021 associated with the DOI.,"BMJ volume 375, issue for 1 December 2021, is accurate for the given DOI. The journal title ""BMJ"" is correct.","The page ""e066129"" matches the electronic locator for the article identified by the DOI.","The article identifier ""e066129"" is consistent with the BMJ's electronic article numbering for volume 375, issue corresponding to December 2021. This matches the metadata retrieved via the DOI.","The date ""2021 Dec 1"" aligns with the publication date of the article identified by the DOI.","The DOI 10.1136/bmj-2021-066129 resolves to a BMJ article published on 2021-12-01 in volume 375, article number e066129, which matches the journal, date, volume, and page provided. No evidence suggests the DOI is incorrect or associated with a different article.","No PMCID was provided in the citation, and none is required to assess authenticity. The absence does not affect the validity of the existing fields.","No PMID was supplied, but its absence does not invalidate the reference; the DOI alone is sufficient to verify the article."
