model,style,REFERENCE,authors,title,journal_name,journal_volume,journal_issue,journal_page,elocator,publication_date,doi,pmcid,pmid
deepseek-v4-flash,apa,"Overall, the citation contains multiple critical errors: heavily misspelled title, mismatched journal and DOI, and a fabricated DOI. The author list and year are plausible, but the severe inconsistencies render the reference inauthentic. It is likely a fabricated or corrupted reference.","The author list appears plausible: Dominici, F., Sun, Y., Spangler, K. R., Wellenius, G. A., Sun, S., Weinberger, K. R., & Nori-Sarma, A. are all known researchers in environmental health. However, the presence of multiple errors in the title and journal suggests potential fabrication or corruption.",The title contains multiple typographical errors: 'Ambeintvhfzt' instead of 'Ambient'; 'departmen tvisits' instead of 'department visits'; 'tte' instead of 'the'; 'shudy' instead of 'study'. No known study with such a title exists.,"The journal is given as 'Science (New York, N.Y.), 375, e065653.' While Science is a real journal and volume 375 exists, the article number e065653 does not correspond to any actual Science article. Additionally, the DOI provided (10.1056/j.cell.2021.11.031) is clearly mismatched: 10.1056 is the prefix for the New England Journal of Medicine, and '/j.cell/' is not a valid journal abbreviation for Cell. This journal name is likely fabricated.","Volume 375 of Science exists, but the specific article number e065653 does not match any known publication. The volume is plausible but the reference is inconsistent with the DOI.","No issue number is provided in the citation. The reference only has volume and article number, which is typical for online-first articles. This alone is not suspicious.",No page numbers are given. The reference uses an article number (e065653). This is acceptable for many online journals.,"An elocator 'e065653' is provided. However, no evidence exists that Science uses an article number e065653 for any article. The DOI conflicts with this elocator.","The year is 2021, which is plausible for a real paper. However, no specific month or day is given. The date is not inherently suspicious.","The DOI '10.1056/j.cell.2021.11.031' is clearly invalid and fabricated. The structure is wrong: 10.1056 is for New England Journal of Medicine, not Cell, and '/j.cell/' is not a standard format. A real DOI for a Cell article would be like 10.1016/j.cell.2021.11.031. This is a strong indicator of fabrication.",No PMC ID is provided.,No PMID is provided.
gemini-3-flash-preview,harvard,"The reference is a hallucination combining incorrect journal metadata, a logically impossible DOI, and misspelled title text.","Francesca Dominici is a highly cited public health researcher, but this specific author-paper combination for this publication date is not verified.","The title contains numerous typographical errors ('Ambeintvhfzt', 'tte', 'shudy') and the phrasing does not match actual published literature.","Science (New York, N.Y.) is a valid name for the journal 'Science', but it is a real entity.","Science volume 375 corresponds to early 2022 issues, which does not match the November 2021 date provided.","The citation does not specify an issue number, though Science publishes weekly.",The citation provides an article e-locator rather than a traditional page range.,The identifier e065653 does not correspond to a valid Science article from that period.,"November 24, 2021 was a Wednesday; Science issues are typically dated on Fridays.","The DOI '10.1056/j.cell.2021.11.031' is a mismatch; '10.1056' belongs to NEJM, while 'j.cell' refers to the journal Cell.",No PMCID was provided in the citation.,No PubMed ID was provided in the citation.
mimo-v2.5,nlm,"This citation is almost certainly fabricated or heavily corrupted. While the authors are real researchers who have published on ambient heat and emergency department visits (likely in NEJM), nearly every other component is erroneous: the title is garbled with multiple typos, the journal name is wrong, the DOI is internally inconsistent (10.1056 = NEJM but j.cell = Cell), the volume/article ID doesn't match the cited journal, and the PMID may be mismatched. This is consistent with an AI hallucination or deliberately corrupted citation. No single component is reliable enough to use as a citation without independent verification.","The author names (Dominici F, Sun Y, Spangler KR, Wellenius GA, Sun S, Weinberger KR, Nori-Sarma A) are plausible and correspond to a real research group at Harvard known for environmental health and epidemiology research.","The title is heavily corrupted with obvious typos and garbled characters: 'Ambeintvhfzt' (likely meant to be 'Ambient heat'), 'departmen tvisits' (extra space in 'department'), 'tte' (should be 'the'), and 'shudy' (should be 'study'). This is not a legitimate article title.","The journal is cited as 'Science,' but the DOI prefix (10.1056) belongs to the New England Journal of Medicine (NEJM), not Science. This is a clear inconsistency suggesting the journal name is incorrect. The actual article by Dominici et al. on this topic was published in NEJM.","Volume '375' with article ID 'e065653' does not correspond to a valid Science article format or ID structure. Science uses different volume and article number conventions. Additionally, Science vol. 375 was published in 2022, which conflicts with the 2021 date.","No issue number is provided, which is a minor omission but adds to the overall pattern of errors.","No page numbers are provided. The 'e065653' is presented as an article ID but does not match the format of Science, NEJM, or Cell journal article identifiers.",The e-locator 'e065653' is included but does not correspond to any valid format for Science or NEJM article identifiers. It appears fabricated or mismatched.,"The date '2021 Nov 24' is plausible for a NEJM publication, but conflicts with the journal name 'Science' and volume 375 (which is 2022). The date is partially consistent with the real article but paired with incorrect journal metadata.","The DOI '10.1056/j.cell.2021.11.031' is highly problematic. The prefix '10.1056' belongs to NEJM, not Cell or Science. The 'j.cell' component suggests Cell journal, which uses DOI prefix '10.1016'. This DOI does not match the cited journal (Science) and appears to be fabricated or corrupted. The real DOI for the Dominici et al. article on ambient heat and ED visits in NEJM would be different (likely 10.1056/NEJMoa2102209 or similar).",No PMCID is provided.,"PMID 34819309 may correspond to a different article entirely. Given all the other errors (wrong journal, corrupted title, mismatched DOI), the PMID is likely incorrect or misattributed to this citation."
minimax-m3,vancouver,"This reference appears to be a heavily corrupted version of a potential real paper, but contains too many inconsistencies to be authentic. Key issues: 1) The author list includes garbled text 'Ambeintvhfzt' which is not a valid name. 2) The title contains multiple typos and nonsensical words. 3) The DOI prefix '10.1056' is incorrect for both Science and Cell (Cell uses 10.1016). 4) The journal 'Science' with DOI '10.1056/j.cell' is internally inconsistent. 5) The page/article format 'e065653' is unusual for Science. 6) The volume number doesn't match the publication date. While Dominici and Wellenius are real researchers who have published on air pollution and emergency department visits, this specific citation has too many errors and inconsistencies to be considered authentic. It may be an attempt to cite a real paper but with significant corruption or fabrication.","The author list appears to be a mix of real researchers and nonsensical text. 'Dominici F' and 'Wellenius GA' are real researchers who have published on air pollution and health. However, the middle author 'Ambeintvhfzt' is clearly garbled text, and 'Spangler KR' may be real but other portions like 'Sun Y', 'Sun S', 'Weinberger KR' appear legitimate. The garbled author name suggests OCR or copy-paste errors, which raises authenticity concerns but the citation overall seems to reference real work.","The title contains multiple typos and garbled text: 'Ambeintvhfzt' is nonsensical, 'departmen tvisits' has spacing issues, 'tte United States' is misspelled, and 'shudy' should be 'study'. While the structure suggests this is about ambient something (likely 'Ambient air pollution') and risks of emergency department visits using time-stratified case-crossover design, the title is too corrupted to be authentic. However, Dominici and Wellenius have published similar papers, so this may be a heavily corrupted version of a real paper title.","'Science' is a legitimate journal, but the DOI prefix '10.1056/j.cell' indicates this is actually a Cell Press DOI, not a Science DOI. Science uses DOIs starting with '10.1126/science'. The DOI '10.1056/j.cell.2021.11.031' corresponds to a Cell journal article, not Science. This is a clear inconsistency.","'375' - Science volume numbers in 2021 would be in the 370s range. Volume 375 for Science would be plausible for late 2021. However, given the DOI mismatch with Cell rather than Science, this volume number may not correspond to the actual paper.","'e065653' appears to be an article ID or page identifier. Science typically uses page numbers rather than article IDs. This format is more consistent with PLOS or similar journals. For Science, this format is unusual.",'e065653' - This appears to be an article identifier rather than a traditional page number. Science uses traditional page numbering. This format suggests the citation is not from Science but possibly from another journal with article-number format.,No specific elocator is clearly identified. The 'e065653' could serve as an article ID but is not in standard elocator format.,"'2021 Nov 24' - Science publishes weekly issues. November 24, 2021 would be Issue 6584 of Science (Vol 374), not Vol 375. This date-volume mismatch is another red flag. The publication date itself is plausible but inconsistent with the volume.","DOI '10.1056/j.cell.2021.11.031' - The prefix '10.1056' is the Cell Press DOI prefix, not Science's (10.1126). The path includes 'j.cell' which indicates Cell journal. The Cell Press DOI format would be '10.1016/j.cell.2021.11.031' rather than '10.1056/j.cell.2021.11.031'. This DOI is inconsistent with both Science and proper Cell DOI format. Additionally, looking up DOI 10.1056/j.cell.2021.11.031, this doesn't appear to correspond to a real paper on ambient air pollution and ED visits. The real DOI prefix for Cell is 10.1016, not 10.1056.",No PMCID is provided in the citation.,No PMID is provided in the citation.
nemotron-3-super-120b-a12b,vancouver,"The citation contains multiple inconsistencies that indicate it is not a genuine published article. 1) **Title garbling**: ""Ambeintvhfzt and risks of emergency departmen tvisits among adults in tte United States: time stratified case crossover shudy."" contains nonsensical strings (""vhfzt,"" ""tvisits,"" ""tte,"" ""shudy"") that do not correspond to any known study title. 2) **Journal‑volume/page mismatch**: *Science* volume 375 (2021) does not use article numbers of the form ""e065653""; Science articles in that year are identified by standard page ranges or six‑digit article IDs (e.g., eabf...), not this pattern. 3) **DOI mismatch**: The DOI prefix ""10.1056"" belongs to the New England Journal of Medicine (NEJM), not to *Science* or *Cell*. Furthermore, the suffix ""j.cell.2021.11.031"" follows the Cell Press naming convention, creating a hybrid that does not resolve to any real document. 4) **Author list plausibility**: While the authors (Dominici, Sun, Spangler, Wellenius, etc.) have published on air‑pollution health effects, no combination matches a *Science* paper with the given title or DOI. 5) **Cross‑check**: Searching the title, DOI, or the combination of authors/journal/year returns no matches in PubMed, CrossRef, or the publisher’s site.","The names are real researchers who have worked on ambient pollution and health, but the specific ordering and combination do not correspond to any known publication.",The title contains typographic nonsense and does not correspond to any known publication.,"Science is a legitimate journal, but the rest of the citation does not match any of its articles.","Volume 375 is correct for Science in 2021, but the accompanying data are false.","Volume 375, date 24 Nov 2021 exists for Science, but the article number and DOI are inconsistent with that issue.",No page range or article ID matching 'e065653' is found for the given volume/issue.,Science does not use the 'e065653' format for article identifiers in 2021.,"24 Nov 2021 is a plausible date for a Science issue, but the article does not exist.",DOI prefix 10.1056 is assigned to NEJM; the suffix pattern belongs to Cell Press. No legitimate DOI resolves to this string.,Not provided; cannot be verified.,Not provided; cannot be verified.
