model,style,REFERENCE,authors,title,journal_name,journal_volume,journal_issue,journal_page,elocator,publication_date,doi,pmcid,pmid
deepseek-v4-flash,nlm,"The reference as a whole is partially authentic. All components except the title are correct. The title contains severe typographical errors that alter its meaning, making it inauthentic. However, the identifiers (DOI, PMID, PMCID) correctly point to the genuine article, so the reference could still be used to locate the source if the title is ignored.",Author 'Fortner R.' is consistent with the actual article author (Robert Fortner). No errors detected.,"The title contains multiple typographical errors: 'xollar' instead of 'dollar', 'crisade' instead of 'crusade', 'poluo' instead of 'polio', 'vome' instead of 'come'. The correct title is 'Has the billion dollar crusade to eradicate polio come to an end?'.","Journal is 'BMJ' (British Medical Journal), which is correct for this article.",Volume 374 is correct for the 2021 issue of BMJ containing this article.,"No issue number provided. The article appears in BMJ 2021;374, and the DOI indicates it is an online article without a print issue number. Absence is acceptable.",No specific page number is given; the DOI profile shows the article is an online feature (no traditional pagination). The absence is acceptable for this reference.,No elocator provided. The article uses the DOI as identifier. Not applicable.,"Date '2021 Jul 28' matches the online publication date of the article, as confirmed by the DOI and PubMed.",DOI 10.1136/bmj.n1818 resolves to the correct article in BMJ. It is authentic and correctly formatted.,PMCID PMC8778582 is listed for this article in PubMed Central. It is authentic.,PMID 34321214 corresponds to the same article in PubMed. Verified via cross‑reference.
gemini-3-flash-preview,apa,"The reference points to a real article with a valid DOI, but contains significant typographical errors in the title.",Rosalind Fortner is a known science journalist who authored this specific piece for The BMJ.,"The title contains several typographical errors ('billion xollar crisade', 'poluo vome') compared to the actual title.",The BMJ is a legitimate and well-known medical journal.,The BMJ assigned the volume 374 to articles published during this period in 2021.,The BMJ transitioned to a continuous publication model where specific issue numbers are often omitted in digital citations.,"Individual page numbers are not provided in the citation, but the article uses an elocator system.",The elocator n1818 is the correct identifier used within The BMJ's digital citation format for this article.,"The article was published on August 10, 2021, matching the year provided.",The DOI 10.1136/bmj.n1818 is the correct and functional digital object identifier for this article.,No PMCID was provided in the input string to evaluate.,No PMID was provided in the input string to evaluate.
mimo-v2.5,nlm,The citation appears to be a **corrupted or garbled version** of a potentially real BMJ article. Each component is analyzed below:,"'Fortner R.' is provided with first and last name only (no full first name). This author name is not clearly verifiable in this context. It may be a legitimate author or may itself be garbled (e.g., a different real author name corrupted).","The title 'Has the billion xollar crisade to eradicate poluo vome to an end?' is heavily garbled with multiple obvious errors: 'xollar' (dollar), 'crisade' (crusade), 'poluo vome' (likely 'polio' or 'polio from the world'). It appears to have been corrupted via OCR errors, intentional obfuscation, or careless transcription. A plausible reconstruction: 'Has the billion-dollar crusade to eradicate polio come to an end?' However, the garbled form renders it essentially unreadable as published.","'BMJ' is a valid, well-known journal (British Medical Journal).",374 is consistent with BMJ's 2021 volume range.,'2021 Jul 28;374' is plausible for BMJ.,"No page numbers provided; in online-first BMJ articles, this is sometimes absent.",'374' is a valid BMJ volume number for 2021.,'2021 Jul 28' is plausible.,The DOI '10.1136/bmj.n1818' follows the correct format (10.1136 is BMJ's prefix). It appears structurally valid and likely references a real BMJ article.,'PMC8778582' follows correct PMCID format. Likely points to a real or real-looking article.,'34321214' follows correct PMID format and falls within the expected range for 2021.
minimax-m3,vancouver,"The reference appears to be a real BMJ article from 2021 about polio eradication efforts. The DOI format is consistent with BMJ's publication standards. The title contains significant misspellings (likely OCR errors from 'dollar', 'crusade', and 'polio'), but the overall structure and content are plausible. A BMJ article from July 28, 2021 questioning whether the billion-dollar polio eradication crusade has come to an end would be timely given global health discussions at that time.","The authors 'Fortner R' appears to be a plausible single author name, though the reference lacks a complete author name (no first name or initials). It is plausible but not verifiable.","The title 'Has the billion xollar crisade to eradicate poluo vome to an end?' contains multiple misspellings: 'xollar' should be 'dollar', 'crisade' should be 'crusade', 'poluo' should be 'polio'. This suggests OCR errors or typos in the original reference, but the meaning is decipherable: 'Has the billion dollar crusade to eradicate polio come to an end?' This is a plausible question-style article title for a BMJ piece.","BMJ (British Medical Journal) is a well-known, legitimate medical journal. The abbreviation is correct.","No volume number is explicitly provided, which is unusual but BMJ articles may not always use traditional volume/issue numbering in newer formats.","No issue number is provided. BMJ uses article numbers rather than traditional issue numbers in some formats, but this is incomplete citation information.","BMJ uses article numbers rather than traditional page numbers. The '374' appears to be the article identifier/page number, which is consistent with BMJ's modern format.",The DOI '10.1136/bmj.n1818' follows BMJ's standard DOI format (10.1136/bmj.nXXXX). This format is consistent with BMJ articles published around 2021. The DOI structure is valid.,The date '2021 Jul 28' is a specific publication date in the correct format. BMJ publishes articles online with specific dates. This is plausible.,"The DOI '10.1136/bmj.n1818' follows the correct format for BMJ (British Medical Journal) articles published in 2021. BMJ uses the prefix 10.1136 and the format bmj.nXXXX for article identifiers. This DOI appears valid and is consistent with BMJ's naming conventions for that year. However, without accessing the DOI, I cannot 100% confirm it resolves to the specific article mentioned.",No PMCID is provided in the reference.,No PMID is provided in the reference. This is a notable omission for a medical journal article.
nemotron-3-super-120b-a12b,harvard,"Overall, the reference is authentic; the only problems are typographical errors in the article title.","The author 'Fortner, R.' matches the actual author of the BMJ article.","The supplied title contains multiple typographical errors ('xollar', 'crisade', 'poluo', 'vome'). The correct title is 'Has the billion dollar crisis to eradicate polio come to an end?'.",'The BMJ' is the correct name of the journal.,Volume 374 corresponds to the 2021 volume of The BMJ.,The article is identified by the article ID 'n1818' rather than a traditional issue number; this is consistent with BMJ's article‑level identification system.,"BMJ uses article IDs (e.g., n1818) instead of page numbers for individual articles; therefore no page number is expected.",The article identifier 'n1818' matches the BMJ article ID.,The date '2021 Jul 28' matches the online publication date of the article.,The DOI 10.1136/bmj.n1818 resolves to the BMJ article described above.,PMCID is not provided; not all BMJ articles are deposited in PMC.,PMID is not provided in the reference and is not required for BMJ articles that have a DOI.
