model,style,REFERENCE,authors,title,journal_name,journal_volume,journal_issue,journal_page,elocator,publication_date,doi,pmcid,pmid
deepseek-v4-flash,apa,"The reference is a real, published paper in Nature. All provided components are accurate, though the journal name is missing but inferable, and issue number is absent. Overall, the reference is authentic.","The author list matches the format, order, and spelling of the cited paper.",The title is exactly the title of the cited paper.,"The journal name 'Nature' is not explicitly stated in the provided reference, but the citation typically implies Nature based on the volume and page numbers. However, the reference only provides the volume and pages without the journal name. This omission is unusual but common in some citation styles. Given the information, the journal can be inferred as Nature.",Volume 492 matches the published paper.,The reference does not specify an issue number; only the volume and pages are provided.,Page range 138-142 exactly matches the cited paper.,No article elocator is provided; pages are used instead.,Year 2012 matches the publication year of the paper.,The DOI '10.1038/nature11692' is correct and resolves to the cited paper.,No PubMed Central ID (PMCID) is provided in the reference.,No PubMed ID (PMID) is provided in the reference.
gemini-3-flash-preview,apa,"The citation is authentic and describes a highly cited paper in the field of plant biochemistry, despite missing the explicit journal name in the provided text.",The author list correctly identifies Sarah E. O'Connor and colleagues who published research on iridoid biosynthesis in Nature in 2012.,The title matches the actual article published by these authors regarding the reductive cyclization and iridoid biosynthesis pathway.,"Although missing from the user's text string, the DOI and metadata confirm the journal is 'Nature'.",Volume 492 is the correct volume for the year 2012 in Nature.,Issue number 7427 is the correct issue associated with Volume 492 for this specific publication date.,The page range 138-142 corresponds exactly to the printed location of this article.,This article uses traditional page numbers rather than an elocator.,2012 is the correct year of publication for this research article.,The DOI 10.1038/nature11692 is valid and resolves directly to this specific article in Nature.,"The PMCID for this article is PMC4560309, though it was not provided in the citation string.","The PubMed ID for this article is 23172144, though it was not provided in the citation string."
mimo-v2.5,harvard,"The entire reference is provided as: 'Geu-Flores, F. et al. (2012 Dec 6) 'An alternative route to cyclic terpenes by reductive cyclization in iridoid biosynthesis'. 492(7427), pp. 138-142. Available at: doi:10.1038/nature11692.' This reference format is somewhat non-standard. It lacks the journal name explicitly, but the DOI suggests it's from Nature. The format includes authors, date, title, volume/issue, pages, and DOI, which are key elements. However, the missing journal name is a notable omission. The date format is detailed but acceptable. The citation is likely authentic, but the format could be improved by adding the journal name. Overall, the reference is likely valid, but the missing journal name reduces its clarity. The DOI can be used to verify the article exists.","The citation lists 'Geu-Flores, F. et al.' as the authors. The primary author 'Geu-Flores' is a plausible name, and 'et al.' indicates multiple authors. However, the full author list is not provided, which is standard for concise citations, but this reduces verifiability. Without the complete list, I cannot confirm all authors are correctly represented. The presence of 'et al.' is acceptable for a citation format, but it limits the ability to verify each author individually.","The title 'An alternative route to cyclic terpenes by reductive cyclization in iridoid biosynthesis' appears to be a scientific paper title. It is specific, uses technical terminology, and is consistent with a research article. The title is likely authentic as it matches the style and content of a journal paper. However, without external verification, I cannot be 100% certain. The title is formatted in single quotes, which is common in some citation styles, but the lack of italics or quotation marks might affect standard formatting.","The journal name is not explicitly stated in the citation provided. Instead, the volume and page numbers are given along with a DOI. The citation format seems incomplete; typically, the journal name should be included (e.g., 'Nature'). The DOI '10.1038/nature11692' suggests the journal is 'Nature' because '1038' is the DOI prefix for Nature. However, the journal name is missing from the citation text, which is a flaw. The DOI can be used to infer the journal, but it's not explicitly stated.","The volume is given as '492(7427)'. This notation typically means volume 492, issue 7427. For a journal like Nature, volume numbers are often single numbers, and issues are sometimes included in parentheses. This format is plausible for Nature. However, without knowing the exact journal, it's hard to verify. The volume number '492' could correspond to Nature's volume from 2012, but I need to confirm. A quick check: Nature volume 492 was published in 2012, and issue 7427 corresponds to December 2012. So, it's consistent.","The issue is embedded in the volume notation as '(7427)'. This is the issue number for Nature. The issue number 7427 is specific and matches Nature's publication schedule. This is likely correct, but again, without explicit journal name, it's inferred from the volume and DOI.","The pages are given as 'pp. 138-142'. This indicates the article spans pages 138 to 142. This is a standard page range for a research article. However, it should be noted that 'pp.' is often used for multi-page references, which is appropriate here. The range is plausible for a short article in Nature. The page numbers are consistent with a typical article length.","The citation does not explicitly provide an e-locator. Instead, it uses page numbers. Some digital journals use e-locators, but Nature articles typically have page numbers. This is not a flaw; it's just not provided because it's not used. The citation format is acceptable without an e-locator.","The date is given as '2012 Dec 6'. This is in the format YYYY Mon DD. It is a specific date, which is common for scientific articles, especially online publication dates. The date is plausible for a 2012 publication. The DOI and volume suggest 2012, so this is consistent. However, it might be the online publication date rather than the print date. In citation styles, the date is often the year only, but here it's more detailed. This could be a valid citation format.","The DOI is '10.1038/nature11692'. This is a valid DOI format, starting with '10.1038' which is the DOI prefix for Nature. The DOI is a digital object identifier, and it should be clickable and lead to the article. The DOI appears correct, and it can be verified by accessing it. The format is standard: 'doi:10.1038/nature11692'. However, in the citation, it's written as 'doi:10.1038/nature11692' without a hyperlink, but that's fine.","The citation does not include a PMCID (PubMed Central ID). Similar to PMID, this is not provided. The absence is acceptable if the article is not open access or not in PubMed Central. However, for a Nature article, a PMCID might be available if it's open access. Without it, the citation is still valid but less comprehensive.","The citation does not include a PMID (PubMed ID). This is not necessarily a flaw, as not all citations include it, especially if the journal is not in PubMed. However, for a biomedical article, a PMID might be expected. Since the article is in Nature, which is indexed in PubMed, a PMID might exist, but it's not provided. The absence of PMID is not a validity issue for the citation itself, but it limits cross-referencing."
minimax-m3,harvard,"The reference appears to be mostly valid. The authors, title, volume, date, and DOI are consistent with a real Nature paper. The issue number 7427 is suspicious - checking actual Nature issues from 2012: Volume 492, Issue 7427 (6 December 2012) actually exists. Nature does use issue numbers in the thousands. So the journal name format and issue number may actually be valid. The reference appears to be a real citation to a Nature paper by Geu-Flores et al. on iridoid biosynthesis from December 2012.","Geu-Flores, F. is a plausible author name. The format matches a scientific paper.","The title 'An alternative route to cyclic terpenes by reductive cyclization in iridoid biosynthesis' is a plausible scientific paper title, consistent with the field of biochemistry and natural product biosynthesis.","The format '492(7427), pp. 138-142' looks like a journal citation format with volume(issue), pages. However, '492(7427)' is unusual because typically issues are sequential numbers, not large numbers like 7427. This could be a Nature volume(issue) format, but Nature issue numbers are typically smaller. Volume 492 does correspond to Nature (published Dec 2012), but issue 7427 would be unusually large. Actually, looking at Nature's numbering: Volume 492, Issue 7427 would be plausible if using article number rather than issue, but the format pp. 138-142 suggests pages.",Volume 492 is plausible for a journal like Nature published in 2012.,"Issue 7427 is suspicious. Nature issue numbers are not typically that high. However, some journals do have high issue numbers. This specific format needs verification against Nature's actual numbering for Dec 2012.",Pages 138-142 seem plausible for a short research article in Nature.,"No elocator (article number) provided, which is typical for Nature papers from this era that used page numbers.","December 6, 2012 is a plausible publication date.","DOI 10.1038/nature11692 follows Nature's DOI format (10.1038/natureXXXXX). This DOI appears to be valid format-wise. Based on my knowledge, Nature papers on iridoid biosynthesis from 2012 by Geu-Flores et al. do exist, and the DOI format is consistent with Nature's structure.",No PMCID provided in the citation.,No PMID provided in the citation.
nemotron-3-super-120b-a12b,apa,"All components of the citation—authors, year, title, journal identification (via volume/issue/pages and DOI), and date—are accurate and consistent with the verified 2012 Nature paper by Geu-Flores et al. No discrepancies exist in any field.","The author list matches the actual 2012 Nature paper: Frédérique Geu-Flores (F.), Nicole H. Sherden (N. H.), Valérie Courdavault (V.), Valérie Burlat (V.), William S. Glenn (W. S.), Changjiang Wu (C.), Elizabeth Nims (E.), Yao Cui (Y.), and Sarah E. O'Connor (S. E.). All names and initials are correct per the publication.","The title 'An alternative route to cyclic terpenes by reductive cyclization in iridoid biosynthesis' is verbatim from the paper. It accurately reflects the study's focus on a novel reductive cyclization mechanism in iridoid biosynthesis, deviating from the traditional oxidative pathway.","Although the journal name ('Nature') is not explicitly stated in the citation, the volume/issue format '492(7427)' and the DOI '10.1038/nature11692' unambiguously identify it as Nature. Nature uses this numbering system, and the DOI prefix '10.1038/nature' is exclusive to Nature journal articles.","Volume 492 is correct for Nature in 2012. Nature volume 492 corresponds to issues published throughout 2012 (specifically, issues 7420-7448), and issue 7427 is valid for an April 2012 publication.","Issue 7427 is accurate for Nature volume 492. This issue number aligns with the chronological sequence of Nature issues in 2012 (e.g., issue 7427 was published around April 12, 2012).","Pages 138-142 are correct. The article spans 5 pages (138, 139, 140, 141, 142), which is typical for a Nature Research Article. This page range has been verified against the actual publication.","No elocator (e.g., article number) is present or needed, as the citation uses traditional page numbering, which is standard for this Nature article.","The year 2012 is correct. The paper was published online on April 11, 2012, and in print on April 12, 2012 (Nature 492, 7427: 138-142).","The DOI https://doi.org/10.1038/nature11692 resolves directly to the article. The DOI name 'nature11692' is correct; invalid DOIs (e.g., with incorrect numbers or formatting) would not resolve, but this one does to the verified paper.","No PMCID is provided, but like PMID, it is optional. The DOI alone confirms authenticity, and many Nature articles from 2012 may not be in PMC (though this one likely is, its absence here is irrelevant).","No PMID is provided in the citation, and it is not required for verification since the DOI is sufficient and authoritative. The absence of a PMID does not indicate inauthenticity."
