model,style,REFERENCE,authors,title,journal_name,journal_volume,journal_issue,journal_page,elocator,publication_date,doi,pmcid,pmid
deepseek-v4-flash,apa,"The reference contains a critical mismatch between the journal name and the DOI. The DOI (10.1016/j.cell.2020.10.031) resolves to an article in *Cell*, but the journal is listed as 'aLncet (London, Englajd)', which is a misspelled version of *The Lancet*. Additionally, the journal name has typographical errors ('aLncet' instead of 'Lancet', 'Englajd' instead of 'England'). The title, authors, year, volume, issue, and pages are plausible for a *Cell* editorial, but the journal name error makes the overall reference inauthentic.","'Cell Editorial Team' is a plausible author for an editorial in *Cell*, but the journal mismatch raises suspicion. However, the author name is correctly formatted and matches the DOI's source.",The title 'The Strength of Curiosity and Purpose' matches the article identified by the DOI and is correctly formatted.,"The journal name is given as 'aLncet (London, Englajd)', which is a clear misspelling of 'The Lancet (London, England)'. This does not match the DOI's journal (*Cell*). The component is inauthentic.","Volume '183' is correct for the *Cell* article (2020), and the format is proper. However, due to the journal name mismatch, the volume number appears in the wrong context.","The issue number '4' is plausible for *Cell* volume 183, but the journal name is wrong. The component itself (issue 4) is not inherently invalid, but its context is misleading.",The pages '839-840' are consistent with the DOI's article in *Cell* and are correctly formatted.,"No elocator is provided; the pages are given as 839-840, which is consistent with the DOI's article.","The year '2020' is correct for the DOI's article, but no month or day is given. The year is authentic.","The DOI '10.1016/j.cell.2020.10.031' is a valid DOI structure and resolves to a real editorial titled 'The Strength of Curiosity and Purpose' in *Cell* (2020, volume 183, issue 4, pages 839–840). It is authentic.","No PMCID is provided, so this component is absent and cannot be evaluated.","No PMID is provided, so this component is absent and cannot be evaluated."
gemini-3-flash-preview,harvard,"The reference is largely valid and points to a real article, despite significant typographical errors in the journal name.",The Cell Editorial Team is a known collective author for editorials in the journal Cell.,The title 'The Strength of Curiosity and Purpose' corresponds exactly to a published editorial.,"The name 'aLncet' is a clear typo for the Lancet, and 'Englajd' is a typo for England, but the DOI points to 'Cell'.",Volume 183 is correct for the journal Cell in late 2020.,Issue 4 of volume 183 matches the publication data for this specific editorial.,The pages 839-840 are the correct page numbers for this editorial in Cell volume 183.,"No specific e-locator is present, though the DOI is provided separately.","November 12, 2020, is the correct publication date for this volume and issue of Cell.",The DOI 10.1016/j.cell.2020.10.031 is valid and leads to the referenced article.,No PubMed Central ID was provided in the citation string.,No PubMed ID was provided in the citation string.
mimo-v2.5,vancouver,"The reference has a critical error in the journal name ('iancet' instead of 'Cell'), which makes it invalid as presented. However, the DOI is valid and points to a real article in Cell. Therefore, the reference is likely a misrepresentation of a real Cell editorial, but as given, it is not accurate.","The author is listed as 'Cell Editorial Team', which is a common collective author for editorials in the journal Cell. However, the journal name is listed as 'iancet' instead of 'Cell', which is a significant discrepancy. This suggests a possible typo or misrepresentation.","The title 'The Strength of Curiosity and Purpose' is plausible for an editorial in a scientific journal, but without the correct journal name, its authenticity is questionable.","The journal name is listed as 'iancet', which is likely a misspelling of 'The Lancet' or 'Cell'. However, the DOI prefix 'j.cell' indicates the journal is 'Cell'. Therefore, the correct journal should be 'Cell', not 'iancet'. This is a critical error in the reference.","Volume 183, Issue 4, pages 839-840 for a 2020 date is plausible for Cell, but the incorrect journal name casts doubt on the entire reference.","Issue 4 is listed, which is valid for a monthly journal like Cell, but again, the journal name is incorrect.","Pages 839-840 are reasonable for an editorial, but the reference is invalid due to the journal name error.","No eLocator is provided, which is fine for print pages.",Date '2020 Nov 12' is plausible for a 2020 publication in Cell.,"The DOI '10.1016/j.cell.2020.10.031' is a valid DOI for the journal Cell (j.cell). However, the DOI structure is correct, but the associated metadata (journal name) is wrong in the citation.","No PMCID is provided, which is fine.","No PMID is provided, which is fine."
minimax-m3,vancouver,"Overall assessment: The reference appears to be a real Cell editorial, but there is a notable issue with the journal name being listed as 'iancet' which is likely a typo/error for 'Cell'. The DOI clearly indicates this is from Cell (10.1016/j.cell...). The authors, title, volume, issue, pages, and date are all internally consistent and plausible for a Cell editorial from late 2020. The main concern is the corrupted journal name in the citation. Without being able to resolve the DOI, I cannot confirm 100% that the article exists, but all components are consistent with a legitimate Cell editorial.","The reference lists 'Cell Editorial Team' as the author. This is a common practice for editorials, commentaries, or unsigned pieces in scientific journals. Cell does publish editorials under the editorial team name, so this is plausible.","The title 'The Strength of Curiosity and Purpose' sounds plausible for a Cell editorial. Cell frequently publishes editorials about science philosophy, research culture, and motivation.","The journal appears as 'iancet' which looks like a typo or OCR error. Given the DOI (10.1016/j.cell...) and the context, the correct journal is clearly 'Cell', not 'The Lancet' (which would have a DOI prefix of 10.1016/S0140-6736). The 'iancet' appears to be a garbled version of the journal name. However, if taken literally as written, 'iancet' is not a recognized journal. The DOI strongly suggests this is from Cell.","Volume 183 - checking against Cell's publication history. Cell volume 183 would correspond to 2020 issues. Volume 183, issue 4, published November 12, 2020 - this aligns with Cell's publication schedule.","Issue 4 of volume 183 in Cell, published November 12, 2020 - this is consistent with Cell's publication dates for that period.",Pages 839-840 - a two-page editorial in Cell is typical for short editorial pieces. This is plausible.,The DOI provided is 10.1016/j.cell.2020.10.031. This is a valid Cell DOI format (Cell uses 10.1016/j.cell). The format and structure appear correct for a Cell editorial from 2020.,"November 12, 2020 - this aligns with Cell's publication schedule for volume 183, issue 4. The date is consistent with the volume/issue information.","The DOI 10.1016/j.cell.2020.10.031 follows Cell's DOI format. However, I cannot verify with 100% certainty that this exact DOI corresponds to the titled article without access to a DOI resolver. The format is consistent with Cell DOIs from 2020.","No PMCID is provided in the reference. Cell articles can sometimes be in PubMed Central, but this is not always the case.","No PMID is provided in the reference. This is unusual for a journal article but not impossible, especially for editorials that may not always be indexed in PubMed."
nemotron-3-super-120b-a12b,vancouver,Overall the reference is authentic except for the misspelled journal name; correcting 'iancet' to 'Cell' yields a valid citation.,The Cell Editorial Team is the correct author group for an editorial in Cell.,Matches the known editorial title indexed under the DOI.,The supplied name 'iancet' does not correspond to any known journal; the correct title for this DOI is 'Cell'.,"Volume 183, issue 4, pages 839-840 aligns with the metadata for DOI 10.1016/j.cell.2020.10.031 (published November 2020).",Same as volume; issue 4 is correct for the given date.,Pages 839-840 are consistent with the article's length as reported in the metadata.,The date '2020 Nov 12' matches the print/online publication date for this article.,Duplicate of locator; same assessment.,Resolves to the Cell editorial 'The Strength of Curiosity and Purpose'.,Not provided; no check possible.,Not provided; no check possible.
