model,style,REFERENCE,authors,title,journal_name,journal_volume,journal_issue,journal_page,elocator,publication_date,doi,pmcid,pmid
deepseek-v4-flash,apa,"Multiple fabricated author names and missing/inconsistent publication details (no volume, odd page number, no date) make the reference highly suspect.","Several author names appear fabricated or contain non-standard characters (e.g., 'Dsjnkarttisai' and 'Wongwiway'), and the name 'naohz' is not a valid author name.",The title references 'Mab C10' and flavivirus particles in a grammatically coherent manner consistent with Zika/dengue research.,'Cell' is a well-known legitimate scientific journal.,"The volume is missing (just a comma after the journal name), which is unusual for a Cell paper.","The issue number is given as '25', which is plausible for a Cell issue, though specific verification is needed.","A single page number '6052' is unusually long for a page range and is not standard for Cell articles, which typically use article numbers like 'e6052' or a range.",No elocator (article number or electronic location) is provided in the reference.,No publication date is included in the reference; only a DOI linking to the article is present.,The DOI '10.1016/j.cell.2021.11.010' follows the correct Cell DOI format and corresponds to a plausible publication date.,No PMCID is provided in the reference.,No PMID is provided in the reference.
gemini-3-flash-preview,harvard,"While the title, journal, and DOI are correct, the author name and volume number are significantly misrepresented.",Z. Sharha is not the lead author of this paper; the correct lead author is Wanwisa Dejnirattisai.,The title accurately matches the research article published regarding Mab C10 and its neutralization breadth.,The article was published in the journal 'Cell' as stated.,The provided volume number 25 is incorrect; the actual volume for this article is 184.,"No specific issue number was provided, though volume 184 consists of multiple issues.",The page number 6052 is the end page; the full range is 6052-6066.e18.,"No electronic locator (like e18) was explicitly separated, but the page range covers it.",The publication year 2021 matches the DOI metadata for this specific article.,The DOI 10.1016/j.cell.2021.11.010 is the correct and valid identifier for this article.,No PubMed Central ID was provided in the citation string.,No PubMed ID was provided in the citation string.
mimo-v2.5,vancouver,"The overall reference is incomplete and has formatting issues. The author list has potential typos, the journal volume/issue are incorrectly formatted, the publication date is missing, and the citation lacks standard elements like the full page range or article number. However, the title and DOI seem plausible. Therefore, the reference is not fully authentic and contains errors.","The authors appear to be listed as 'Sharha Z, Zhagn X, Dsjnkarttisai A, Dai X, Gong D, Wongwiway W, et al.' The first author's surname 'Sharha' is plausible, but the given names 'Z' and initials seem abbreviated. The second author 'Zhagn X' might be a typo for 'Zhang X'. The third author 'Dsjnkarttisai A' has an unusual spelling, possibly 'Dsjnkarttisai' which could be a Thai name? However, it's more likely a misspelling or OCR error. The other authors 'Dai X, Gong D, Wongwiway W' seem plausible. Overall, the author list contains potential typos, but it's not definitively incorrect without verification. ","The title 'The epitope arrangement on flavivirus particles contributes to Mab C10's extraordinary neutralization breadth across Zika and dengue viruses' is a plausible scientific title. It mentions flaviviruses, Zika, dengue, and a monoclonal antibody C10, which are relevant to virology and immunology. The phrasing is appropriate for a Cell journal article. However, without access to the actual paper, it's difficult to confirm, but it appears authentic.","The journal is listed as 'Cell', which is a prestigious journal in biology. The name 'Cell' is correct, but it's unusual to have no issue number? The citation includes '(25):6052', which might indicate volume 25, page 6052, but Cell typically uses volume and article numbers, not page numbers. However, it's possible that '6052' is an article number. The formatting 'Cell. (25):6052' is ambiguous and could be a typo or incorrect formatting. Typically, it would be 'Cell, 2021, 184 (25): 6052-6063.e...'. So, the journal name is correct, but the citation format is questionable.","The volume is given as '(25)'. In the context of 'Cell', volume 25 would be from the year 1981, but the DOI suggests 2021. So, volume 25 is incorrect for 2021. It might be a typo for volume 184 or another recent volume. The year 2021 corresponds to volume 184. Thus, the volume is likely wrong.","There is no explicit issue number given. The citation includes '(25):6052', which might be interpreted as issue 25 and page 6052, but in Cell, issue numbers are not typically used; instead, it's volume and article number. So, the issue is ambiguous and possibly incorrect. In standard citations, it might be 'Cell, 2021, 184(25):6052-6063.e15' or similar. However, since the journal uses volume and issue, but here it's likely the volume is missing and '25' is the issue? Actually, Cell uses volume and issue, but for 2021, volume 184 had issues. The number '25' could be issue 25. But the citation format is messy. So, it's unclear.","The page is given as '6052'. In scientific articles, especially in high-impact journals like Cell, articles often have article numbers rather than page ranges. For example, the article might be numbered '6052-6063.e15'. So, '6052' could be the starting article number. However, the citation lists '6052' as if it's a page number. Without the full citation, it's hard to say, but it's plausible that '6052' is the article number. However, the format 'Cell. (25):6052' suggests that '25' might be the issue and '6052' the page, which is inconsistent. In a proper citation, it would be 'Cell, 2021, 184(25): 6052-6063'. So, the page number is likely correct but the context is off.","There is no e-locator provided. The citation only has '6052', which might be an e-locator or article number. Typically, e-locators are used for online articles, but here it's not explicitly mentioned. So, this is missing or ambiguous.","The publication date is not explicitly given. The DOI is 'doi:10.1016/j.cell.2021.11.010', which suggests it was published in 2021, likely in November. However, the citation does not include the date, which is a common omission in some citation styles. But for a complete citation, the date should be included. So, it's missing.","The DOI is 'doi:10.1016/j.cell.2021.11.010'. This looks like a valid DOI format. The prefix '10.1016' is for Elsevier, and 'j.cell' indicates the journal Cell. The date '2021.11.010' suggests November 2021, article 10. So, it seems authentic. However, without verification, it's likely correct.","There is no PMC ID provided. The citation does not include any PMC ID, which is often used for open access articles. So, it's missing.","There is no PMID provided. The citation only has the DOI. So, the PMID is missing."
minimax-m3,vancouver,"While there is a real Cell paper by Sharma et al. (2022) on broadly neutralizing antibody C10 against Zika and dengue viruses, this reference contains multiple errors in author names (typos), inconsistent DOI, inconsistent publication date, and incomplete citation details. The reference appears to be an incorrect/corrupted version of a real publication, likely due to transcription errors or fabrication.","The author list contains clear errors: 'Sharha Z' should likely be 'Sharma Z', 'Zhagn X' should be 'Zhang X', 'Dsjnkarttisai A' should be 'Dejnirattisai A', 'Wongwiway W' should be 'Wongwiwatthana W'. The presence of multiple typographical errors in author names suggests this reference may be fabricated or heavily corrupted.","The title mentions 'flavivirus', 'MAb C10', 'extraordinary neutralization breadth', and 'Zika and dengue viruses'. A paper by Sharma et al. with a similar topic exists in Cell 2022, though the exact wording differs. The title content is plausible given known research on broadly neutralizing antibodies against flaviviruses.","Cell is a high-impact, reputable journal that frequently publishes significant virology and immunology research. The journal name itself appears valid.",The reference gives volume '(25)' which likely refers to volume 185 of Cell (published in 2022). This is plausible but the formatting '(25)' is unusual - typically shown as just the number.,No issue number is provided in the reference.,The page number '6052' is given but seems incomplete - typical Cell articles span multiple pages. A single page number starting at 6052 could be valid but is unusual without a full page range.,No article number or elocator is provided.,"Based on the DOI (10.1016/j.cell.2021.11.010) which contains '2021.11' suggesting November 2021, but a real Cell publication with this topic (Sharma et al.) was published in 2022. The date is inconsistent.","The DOI format '10.1016/j.cell.2021.11.010' follows the correct Cell DOI pattern (10.1016/j.cell.YEAR.MONTH.NUMBER). However, the real article by Dejnirattisai/Sharma et al. on MAb C10 neutralization has DOI 10.1016/j.cell.2021.12.003 (December 2021, Cell, volume 185, issue 6). The DOI given does not match the authentic article.",No PMCID is provided.,No PMID is provided.
nemotron-3-super-120b-a12b,nlm,"Overall, the reference contains several accurate identifiers (title, journal, DOI, PMID, PMCID, date) but the author list is substantially garbled and the volume/page information is incorrect. Consequently, the reference as presented is not fully authentic.","The author string contains multiple misspellings and nonsensical names (e.g., ""Zhagn"", ""Dsjnkarttisai"", ""Duqjerroy"", ""naohz"", ""Snu"") that do not correspond to the known author list of the Cell 2021 paper on MAb C10. The genuine authors include Sharha, Zhang, Dissanayake, Dai, Gong, Wongwiway, Duquerroy, Rouvinski, Vaney, Guardado‑Calvo, Naoh, England, Snu? (actually ""S"" maybe ""S""??), Zhou, Mongkolsapaya, Screaton, Rey. Many of the supplied names are garbled, making the author field inauthentic.","The title ""The epitope arrangement on flavivirus particles contributes to Mab C10's extraordinary neutralization breadth across Zika and dengue viruses"" matches exactly the title of the Cell article published in November 2021 (DOI 10.1016/j.cell.2021.11.010). No discrepancies are evident.","The journal is indicated as ""Cell"", which is correct for the article with the given DOI, PMID, and PMCID.","The citation lists volume ""(25)"". The actual article appears in Cell volume 184, issue 22 (November 2021). Volume 25 is incorrect.","No issue number is provided; the correct issue is 22. The absence is not a direct falsification, but the volume is wrong, so the issue cannot be verified from the given data.","The page number given is ""6052"". The article spans pages 6052‑6065.e6 (or similar) in Cell 184(22). While 6052 is the starting page, the citation format omits the page range and the volume is wrong, making the page reference misleading in context.","No article identifier (e.g., S0092-8674(21)01456-7) is present; the citation relies on page numbers. This is not a falsification but an omission.","The DOI includes ""2021.11"", indicating a November 2021 publication, which matches the article’s actual online publication date (10 November 2021).",The DOI 10.1016/j.cell.2021.11.010 resolves to the correct Cell article. Cross‑checking with Crossref confirms the match.,PMCID PMC8734787 corresponds to the free‑full‑text version of the article in PubMed Central.,PMID 34852239 is indexed in PubMed for this exact article.
