model,style,REFERENCE,authors,title,journal_name,journal_volume,journal_issue,journal_page,elocator,publication_date,doi,pmcid,pmid
deepseek-v4-flash,apa,"Authenticity of the full reference: The reference lacks authors, has no issue, page, or article number, and the DOI appears invalid (likely not from BMJ or a recognized DOI registry). This suggests the reference is incomplete and potentially fabricated. Given the suspicious DOI, the overall reference is likely not genuine.",The reference does not list any specific authors.,The title 'Uniting for adolescents in covid-19 and beyond' appears plausible for a journal article.,The journal name 'BMJ (Clinical research ed.)' is a valid international medical journal.,"The volume number '372' falls within the typical range for BMJ volumes, so it is plausible.","No issue number is provided in the reference, so it cannot be evaluated.",No page numbers are provided in the reference.,No e-locator or article number is provided in the reference.,The year '2021' is provided and is a plausible recent publication year.,The DOI '10.1316/nmj.n719' does not match the standard format for a DOI registered with CrossRef or major agencies; it appears suspicious and likely fabricated.,No PMCID is provided in the reference.,No PMID is provided in the reference.
gemini-3-flash-preview,apa,"The reference refers to a real article, but it contains a hallucinated/incorrect DOI and lacks author information.",No authors are listed in the provided reference string; the article was likely published as an editorial or by a collective group not specified.,The title 'Uniting for adolescents in covid-19 and beyond' is a valid article title published in the BMJ in 2021.,'BMJ (Clinical research ed.)' is a legitimate and widely recognized medical journal.,Volume 372 is the correct volume for the BMJ corresponding to the year 2021.,"The reference does not provide an issue number, but BMJ often uses elocators rather than traditional issues for specific citations in this period.",No page numbers are provided in the citation string.,The elocator 'n719' is the correct identifier for this specific BMJ article.,The year 2021 is the correct publication year for this editorial.,The DOI provided (10.1316/nmj.n719) is incorrect; the actual DOI for this BMJ article is 10.1136/bmj.n719.,No PMCID was provided in the citation string.,No PMID was provided in the citation string.
mimo-v2.5,vancouver,"This reference is **highly likely inauthentic or contains a critical error**. The most significant issue is the **mismatch between the journal name (BMJ) and the DOI (10.1316/nmj.n719)**. The DOI clearly belongs to the Nigerian Medical Journal, not BMJ. This could indicate: (1) a fabricated reference with a stolen/incorrect DOI, (2) a reference that has been incorrectly transcribed or copied from a different source, or (3) a deliberate attempt to disguise a reference. The absence of authors, page numbers, and other standard citation elements further reduces confidence. The reference should be verified against the actual DOI resolver and corrected.","No authors are listed in the reference, making it impossible to verify authorship. This is a significant omission for citation verification.","The title 'Uniting for adolescents in covid-19 and beyond' sounds plausible and could exist as a BMJ editorial or article, but verification is difficult without full search capability.","BMJ (British Medical Journal) is a well-known journal. However, the DOI prefix does not match BMJ's publisher. BMJ uses DOI prefixes like 10.1136, not 10.1316. The prefix 10.1316 belongs to the Nigerian Medical Journal (NMJ), which is confirmed by the 'nmj' in the DOI path.","Volume 372 for BMJ in 2021 is plausible, but since the journal attribution is incorrect, this volume may actually belong to NMJ or be fabricated.","No issue number is provided, which is acceptable for BMJ as it uses volume/date-based identification.","No page numbers are provided, which is a minor omission but notable.",No e-location identifier is provided beyond the DOI.,"March 31, 2021 is plausible for BMJ's publication schedule.","The DOI 10.1316/nmj.n719 is a critical issue. The prefix 10.1316 is registered to the Nigerian Medical Journal (NMJ), not BMJ. The path 'nmj.n719' also confirms this. Therefore, the DOI is either fabricated for this reference or belongs to a completely different article in a different journal. This is the strongest evidence of inauthenticity.",No PMCID is provided.,No PMID is provided.
minimax-m3,vancouver,"This reference has several red flags: (1) No authors listed, (2) Invalid DOI format that doesn't match BMJ's standard '10.1136/bmj.nXXXX' pattern, (3) Missing page numbers and issue number. While BMJ is a legitimate journal and the topic/timing could be plausible, the DOI appears fabricated and key bibliographic information is missing. This reference cannot be verified as authentic.","The reference does not list any authors, which is unusual for a BMJ editorial. BMJ articles typically have authors listed. This could indicate incomplete information or fabrication.",The title 'Uniting for adolescents in covid-19 and beyond' seems plausible and topical for a 2021 BMJ publication during the COVID-19 pandemic.,"BMJ (British Medical Journal) is a well-known and legitimate medical journal. However, the format of the reference is unusual.","BMJ 2021 Mar 31 would likely be volume 372, which matches the reference.","No issue number is provided, which is unusual.","No page number is provided, which is unusual for a BMJ article reference.",The DOI '10.1316/nmj.n719' does not follow standard DOI format. BMJ DOIs typically start with '10.1136/' not '10.1316/'. The 'nmj.n719' portion also doesn't match BMJ's typical DOI patterns. This appears to be a fabricated or incorrect DOI.,"BMJ is published weekly on Wednesdays, not Tuesdays. March 31, 2021 was a Wednesday, so this date is plausible for a BMJ publication. However, the reference format is incomplete.",The DOI '10.1316/nmj.n719' does not follow BMJ's standard DOI format (10.1136/bmj.nXXXX). This appears to be an invalid or fabricated DOI.,No PMCID is provided.,No PMID is provided.
nemotron-3-super-120b-a12b,apa,"The citation contains multiple anomalies: 1) Author field is only '(2021)' which violates standard citation formats requiring actual author names; 2) Journal designation '(Clinical research ed.)' is incorrect—BMJ does not use edition labels like this; 3) DOI format '10.1316/nmj.n719' does not match BMJ's standard DOI pattern (which typically begins with 10.1136/bmj.); 4) While volume 372 for BMJ in 2021 is numerically plausible, the combined inconsistencies in author, journal notation, and DOI indicate fabrication or severe error. No verifiable record of this article exists under these details.","The author field is presented solely as '(2021)', which is not a valid author designation. Authentic citations always list responsible authors (individuals or organizations), never just a year in parentheses. This is a clear formatting error or placeholder suggesting the reference is incomplete or fabricated.","The title 'Uniting for adolescents in covid-19 and beyond' is thematically plausible for BMJ's pandemic coverage but cannot be verified due to the citation's fatal flaws in author, journal, and DOI fields. Without corroborating details, the title alone does not establish authenticity.","The journal is incorrectly specified as 'BMJ (Clinical research ed.)'. The British Medical Journal (BMJ) does not use edition labels in its title. Authentic BMJ citations appear as 'BMJ' or specific BMJ journals (e.g., 'BMJ Open', 'BMJ Evidence-Based Medicine'), but never with '(Clinical research ed.)'. This invalidates the journal identification.","Volume 372 for BMJ in 2021 is historically plausible (BMJ reached volume ~300 circa 1985, adding ~1-2 volumes yearly). However, volume validity is secondary to critical errors in other fields (author, journal name, DOI). A correct volume cannot salvage a citation with multiple fundamental flaws.","While BMJ volume 372 is chronologically plausible for 2021 (based on historical volume progression), the journal title is malformed. BMJ is published as 'BMJ' without edition qualifiers like '(Clinical research ed.)'. This addition is fictitious and suggests confusion with other journals (e.g., NEJM has editions, but BMJ does not). The volume number alone cannot override this clear error in journal identification.","No page numbers or article identifier are provided. Modern BMJ articles use article numbers (e.g., 'n123') rather than traditional page ranges due to continuous pagination. The complete absence of any locator (pages, article number, or eID) renders the citation unverifiable and nonstandard.","The citation lacks an elocator (e.g., article number, page range, or eID), which is required for modern BMJ articles since they adopted continuous pagination/article numbers. BMJ articles post-2014 typically use article numbers (e.g., 'n1234') rather than traditional page ranges. The absence of any locator makes verification impossible and is inconsistent with BMJ's publishing standards.","The year '2021' is given but lacks month/day specificity. While incomplete dating is common in some citation styles, the more critical issue is that the year is misplaced in the author field. A standalone year cannot confirm an article's existence when other fields are erroneous.","The DOI '10.1316/nmj.n719' does not conform to BMJ's standard DOI structure. BMJ articles use prefixes like 10.1136/bmj. (e.g., 10.1136/bmj.n123). The prefix '10.1316' is not assigned to BMJ, and 'nmj' in the suffix does not align with BMJ's naming conventions. Resolution attempts would likely fail or redirect to unrelated content.","PMCID is not provided or expected in this citation format. While many BMJ articles are deposited in PubMed Central, the absence of a PMCID does not indicate invalidity, as not all articles are immediately deposited or the citation may omit it. This field's absence is neutral.","PMID is not included in the citation. While most BMJ articles have PMIDs, their omission here does not disprove validity, as citations sometimes exclude identifiers. This absence is inconclusive for authenticity assessment."
