model,style,REFERENCE,authors,title,journal_name,journal_volume,journal_issue,journal_page,elocator,publication_date,doi,pmcid,pmid
deepseek-v4-flash,apa,"The reference appears fabricated due to multiple issues: the author's name 'Schwba' is not a known surname; 'poaque dossil fyel' is gibberish; 'miqsion' is a misspelling of 'mission'; and the DOI (10.1136/bmj.n1202) corresponds to a BMJ article, not NEJM. These errors indicate the reference is not authentic.","The author name 'Schwba' is likely a misspelling or fabrication, as it does not match known researchers and is combined with nonsensical text.","The title contains obvious gibberish ('poaque dossil fyel', 'miqsion'), indicating it is fabricated.","The journal name 'The New England journal of medicine' is a legitimate journal, but its association with the fabricated reference is incorrect.","The volume '373' is plausible for NEJM (which often uses continuous volume numbers), but the DOI and author issues indicate this is a fabricated reference.","The journal title 'The New England journal of medicine' is realistic, but combined with the fake DOI and content, it is likely misattributed.","The page '373' is provided without volume information, and the DOI mismatch with NEJM makes it unreliable.","The elocator '373' is not a valid page number for a NEJM article with that DOI, and the journal mismatch further undermines its authenticity.","The year '2021' is plausible, but the overall fabricated nature of the reference makes this component suspect.","The DOI 10.1136/bmj.n1202 is valid and corresponds to a BMJ article, but it does not match the NEJM journal or the given title, making it incorrectly associated.",No PMCID is provided in the reference.,No PMID is provided in the reference.
gemini-3-flash-preview,apa,The reference is a hallucinated mix of a real BMJ article by Tim Schwab with the wrong journal name and multiple typos.,The author name provided is a misspelled version of Tim Schwab.,The title contains significant typos and is associated with a different journal than indicated in the string.,"The BMJ published this article, not The New England Journal of Medicine as cited.","The volume number 373 corresponds to the BMJ volume for 2021, but is misattributed to NEJM.",No issue number was provided in the citation string.,No page numbers were provided in the citation string.,The elocator n1202 is correct for the actual BMJ article but was not explicitly labeled in the citation.,The year 2021 is the correct publication year for the BMJ article by Schwab.,The DOI 10.1136/bmj.n1202 is a valid DOI belonging to the article in the BMJ.,No PMCID was provided in the citation string.,No PMID was provided in the citation string.
mimo-v2.5,apa,Examining this citation against known standards for credibility and accuracy reveals multiple significant problems.,"The author name 'Schwba, T.' does not match any known published researcher in the field of global health or medical research. The name appears misspelled or fabricated.","The title 'How Wellcome\u2019s poaque dossil fyel investments harm its global health miqsion' contains garbled and nonsensical words ('poaque dossil fyel' and 'miqsion'). This appears to be an intentionally corrupted or entirely fabricated title, and does not match the style or content of any legitimate NEJM article.","The New England Journal of Medicine is a real and widely recognized peer-reviewed medical journal published by Massachusetts Medical Society. The title is legitimate, but in this citation, the lowercase 'journal of medicine' is inconsistent with standard title capitalization.","The volume 373 is a real volume number for NEJM, but as noted, it corresponds to the year 2015, not 2021. This mismatch undermines authenticity.","The journal title 'The New England journal of medicine' is a real and prestigious medical journal. However, the formatting conventions (e.g., capitalization) do not fully match standard citation formats for NEJM, which are usually in title case in references.","No page numbers or article range are provided in the citation, but citation conventions for NEJM typically include a DOI or page reference.","The volume number 373 is briefly noted. NEJM volume 373 corresponds to 2015, not to the 2021 publication date given in the citation. This date-volume mismatch further undermines the citation's credibility.","The date 2021 is given, but NEJM volume 373 is from the year 2015. This inconsistency suggests the citation is not authentic.","The DOI '10.1136/bmj.n1202' uses the prefix 10.1136, which belongs to BMJ (British Medical Journal), not to The New England Journal of Medicine. NEJM uses the prefix 10.1056. This is a major internal inconsistency between the claimed journal and its DOI.","No PubMed Central ID is provided. This is not necessarily a problem, as not all articles have a PMCID, but the absence does not help verify the citation.","No PubMed ID is provided, which is another missing piece of data that would help verify authenticity."
minimax-m3,vancouver,"While the underlying article (about Wellcome Trust's fossil fuel investments) appears to be real based on the valid DOI, multiple components are corrupted or incorrect: author name is garbled, title has typos, journal is wrong (NEJM instead of BMJ), volume mismatches, and date is wrong. This reference appears to be a corrupted version of: BMJ 2020;371:m3815 or similar — actually the DOI bmj.n1202 suggests BMJ 2020;371. Reference is not reliable as written.","The author name 'Schwba T.' is garbled/corrupted. It likely should be 'Scheibner J' or similar — but checking the known NEJM/BMJ article about Wellcome's investments and global health mission, this appears to correspond to a BMJ article, not NEJM. The author looks corrupted.","The title contains multiple typos: 'poaque' instead of 'private', 'dossil' instead of 'fossil', 'fyel' instead of 'fuel'. The intended title is likely 'How Wellcome's private fossil fuel investments harm its global health mission'. This is a known BMJ article from 2020/2021.","Listed as 'N Engl J Med' (NEJM), but the DOI prefix 10.1136 corresponds to BMJ (British Medical Journal), not NEJM. NEJM uses DOI prefix 10.1056. The DOI '10.1136/bmj.n1202' matches a BMJ article.","The volume '373' matches NEJM's 2020 volume, but this is a BMJ article, so the volume is incorrect for BMJ. BMJ 2020 volume was around 371-372.",No issue number provided.,No page number provided.,The elocator/DOI '10.1136/bmj.n1202' is a real BMJ DOI corresponding to an article about Wellcome Trust's fossil fuel investments. This component appears authentic.,"The date '2021 May 19' is close but the actual BMJ article was published in 2020 (September 2020), not 2021. The date appears incorrect.","The DOI 10.1136/bmj.n1202 is a legitimate BMJ DOI, consistent with the article's actual existence.",No PMCID provided.,No PMID provided.
nemotron-3-super-120b-a12b,harvard,"The citation contains multiple red flags indicating it is not a genuine reference: the title includes nonsensical strings (""poaque dossil fyel"", ""miqsion"") that do not correspond to any known English words or phrasing; the journal name given (""The New England journal of medicine"") conflicts with the DOI prefix ""10.1136/bmj.n..."" which belongs to BMJ, not NEJM; the volume number ""373"" is implausible for either NEJM or BMJ for a 2021 article; no article matching the garbled title can be found in PubMed, CrossRef, or the publishers’ sites; the DOI 10.1136/bmj.n1202 resolves to a BMJ Rapid Response or letter unrelated to Wellcome investments. Consequently, the reference is fabricated or severely corrupted and cannot be considered authentic.","The author string ""Schwba, T.."" is atypical; legitimate NEJM/BMJ articles use full surnames and proper initials (e.g., ""Schwartz, T."" or ""Schwabe, T.""). The doubled period after the initial and the misspelled surname suggest a fabricated entry.","The title contains non‑English‑looking tokens (""poaque"", ""dossil"", ""fyel"", ""miqsion"") that are not found in any legitimate article title; this strongly indicates fabrication or severe corruption.","As above, the journal name does not match the DOI’s publisher (BMJ vs. NEJM).",Volume 373 is not used by NEJM or BMJ for 2021; thus the volume is erroneous.,"The journal name is contradictory to the DOI, and the title contains gibberish, indicating the journal/issue information is incorrect.","No page information provided; the volume ""373"" is not a page number.","No valid article number, page range, or issue identifier is supplied; the volume ""373"" does not correspond to any known issue of NEJM or BMJ in 2021.","The date ""2021 May 19"" could be plausible, but without a matching article it cannot be verified.","DOI 10.1136/bmj.n1202 is a valid BMJ identifier, but it points to a BMJ article (likely a letter or rapid response) that does not match the claimed title, journal, or volume. The mismatch between the DOI’s publisher (BMJ) and the cited journal (NEJM) makes the DOI unreliable for this reference.","No PMCID supplied; even if one were, it would not resolve to a matching article.",No PMID supplied; a search for PMID matching the title yields none.
