model,style,REFERENCE,authors,title,journal_name,journal_volume,journal_issue,journal_page,elocator,publication_date,doi,pmcid,pmid
deepseek-v4-flash,nlm,"The reference contains multiple severe errors in authors, title, DOI, and missing volume, indicating it is fabricated or heavily corrupted.","The author list contains multiple obvious misspellings and inconsistencies (e.g., 'Huestks' for Huestis, 'xao' for Xia, 'Dialol' for Diallo, 'jMtctell' for Mitchell), indicating fabrication or OCR errors.","The title has several typos: 'Wondborne' instead of 'Windborne', 'migratioh' instead of 'migration', 'malarai' instead of 'malaria', 'hosquitoes' instead of 'mosquitoes', making it invalid.",The journal name 'Nature' is a valid and well-known journal; no typographical errors are present in the name itself.,"The reference omits the volume number; a valid Nature citation requires a volume (e.g., 574 for this period), so the volume component is missing and thus invalid.","The issue number '7778' is a plausible number for a Nature issue from October 2019 (Volume 574, Issue 7778), but its presence without a volume and in this fabricated reference suggests it may be coincidental.","The page range '404-408' is a standard page format and could be valid, but it is not verified against the actual article.",No elocator is provided in the reference; therefore this component is absent and cannot be considered valid.,The date '2019 Oct' is a correctly formatted and plausible publication date.,"The DOI '101.126/S0140-6736(19o30808l6' is malformed (should start with '10.' not '101.') and contains extraneous characters, making it clearly invalid.","The PMCID 'PMC1104274' has a valid format but likely does not correspond to the described (fabricated) article, given the numerous other errors.","No PMID is provided in the reference, so this component is missing and cannot be considered valid."
gemini-3-flash-preview,apa,"While a real paper exists with these details, this specific reference string is heavily corrupted with typos and contains an entirely incorrect DOI.","The author list contains numerous typographical errors (e.g., 'Huestks' for Huestis, 'xao' for Dao, 'Dialol' for Diallo) although the core group corresponds to the researchers of the actual study.","The title contains several typos ('Wondborne', 'migratioh', 'malarai', 'hosquitoes') but is clearly a corrupted version of the real paper 'Windborne long-distance migration of malaria mosquitoes in the Sahel'.",Nature is a valid scientific journal and is the correct venue for this specific publication.,The provided text omits the volume number (574) and instead only lists the issue number in parentheses.,The issue number 7778 is correct for the Nature publication released in October 2019.,The page range 404-408 is correct for the cited Nature article.,"No electronic locator or article number was provided, as this journal uses traditional page numbers.",The year 2019 is the correct publication year for this article.,"The DOI is invalid and corrupted; '101.126' is incorrect, and the suffix 'S0140-6736' belongs to a Lancet article, not the Nature article described.",No PubMed Central ID was provided in the input string.,No PubMed ID was provided in the input string.
mimo-v2.5,vancouver,"The entire reference appears to be a garbled version of a real article. There is a known Nature article about wind-borne migration of malaria mosquitoes in the Sahel. For example, a 2019 Nature article by Dao et al. titled 'Wind-borne migration of malaria mosquitoes in the Sahel' (DOI: 10.1038/s41586-019-1709-6). The reference here has similar themes but with multiple typographical errors in authors, title, DOI, etc. It might be an OCR error or a mis-citation. However, the core information is somewhat recognizable as a real article.","The author names appear garbled with non-standard characters (e.g., 'Huestks DL, xao A, Dialol K, Sanogo ZL, Samakr D, hadk IS'). This is inconsistent with typical academic author naming conventions (which use standard Latin alphabet characters). Some names look like possibly corrupted versions of real names (e.g., 'Samakr' might be a misspelling of 'Sankara' or similar), but the overall presentation is unreliable. Also, the 'et al.' is placed appropriately for a multi-author paper.","The title contains obvious typographical errors: 'Wondborne' (likely 'Wind-borne'), 'long-distance migratioh' (should be 'migration'), 'malarai' (should be 'malaria'). These errors are not typical for published articles in a high-impact journal like Nature. However, the core topic (wind-borne long-distance migration of malaria mosquitoes in the Sahel) is plausible and matches known research themes.","'Nature' is a legitimate and high-profile journal. However, the formatting is unusual for Nature citations (which typically include volume, issue, pages, year). The placement of year and parentheses suggests the issue number might be '7778', which is not a typical issue number for Nature (Nature uses volume numbers like 'Nature 576' etc.). Also, the 'Available from: doi:...' is not standard in Nature citation styles (usually DOI is embedded in the citation, not as 'Available from').","The volume is indicated as '(7778)' which is not a standard volume number for Nature (Nature's volumes are typically integers like 576, 577, etc.). It could be a misprint or incorrect issue number. Nature does have an issue number, but it's usually not presented in parentheses with 4 digits. The citation format is inconsistent with standard Nature citation styles.","The issue number is not explicitly mentioned; it appears as '(7778)' which might be intended as issue, but it's ambiguous. In standard Nature citations, the issue is sometimes given but not typically in parentheses like that. This is likely incorrect.","The pages are given as '404-408', which is plausible for a Nature article (e.g., a short communication). However, without verifying the exact issue and volume, it's hard to confirm. The page numbers alone are not enough to determine validity.","No elocator is provided. This is acceptable if the article is a print article, but in modern citations, elocators are common. Not a strong indicator of invalidity.","The date is given as '2019 Oct;' which is ambiguous. It should be a full date like '2019 Oct 2' or just '2019'. The format is not standard. Also, the semicolon after 'Oct' is unusual. The year 2019 is plausible for a Nature article on this topic.","The DOI is given as 'doi:101.126/S0140-6736(19o30808l6' which is clearly malformed. DOIs typically follow a pattern like '10.xxxx/xxxxx' (e.g., '10.1038/s41586-019-1709-6'). This DOI contains non-standard characters (e.g., '101.126' instead of '10.1038', and the suffix has letters like 'o', 'l' which are likely OCR errors). It's likely a corrupted or incorrect DOI.","No PMCID is provided. Similar to PMID, not a strong indicator of invalidity. Some Nature articles have PMC IDs, but not all. Not a strong indicator.","No PMID is provided. This is not necessarily an indicator of invalidity, but for a Nature article, a PMID might be available if indexed. Not a strong indicator."
minimax-m3,apa,"This appears to be a corrupted version of a real 2019 Nature paper by Huestis et al. about windborne long-distance migration of malaria mosquitoes in the Sahel. The authors, title (despite misspellings), journal, year, and page numbers are recognizable. However, the DOI is incorrect/garbled, and the volume number appears wrong. Overall, this is a real reference with significant textual errors throughout.","The author list contains several clear misspellings and character substitutions (e.g., 'Huestks' instead of 'Huestis', 'xao' instead of 'Xao', 'Dialol' instead of 'Diallo', 'Samakr' instead of 'Samake', 'hadk' instead of 'Hadd', 'Ouxman' instead of 'Ousman', 'Krishja' instead of 'Krishna', 'Vetu' instead of 'Vettu', 'Fiaman' instead of 'Faiman', 'jMtctell' instead of 'Mitchell', 'Cahmlrro' instead of 'Camilo'). However, many of these names appear to be plausible renderings of real researchers working on mosquito migration in the Sahel. The reference format and structure suggest this is based on a real paper.","The title contains a misspelling: 'Wondborne' should be 'Windborne' and 'malarai' should be 'malaria'. Despite these OCR-like errors, the title is recognizable as describing windborne long-distance migration of malaria mosquitoes in the Sahel, which matches a real 2019 Nature paper.",'Nature' is a well-known and legitimate scientific journal. This matches the real publication venue of the cited paper.,The volume '(7778)' appears to be a misrendering. The actual volume should likely be '574' based on the known publication details of this paper in Nature.,"No issue number is provided, only a volume number is given.","The page numbers '(7778), 404-408' are suspect. The actual pages for this paper are 404-408, which matches, but the volume number is incorrect. The page range 404-408 is consistent with the known paper.",No elocator is provided.,The publication year 2019 is correct for this paper.,The DOI '101.126/S0140-6736(19o30808l6' contains multiple errors: '101.126' should be '10.1038' and the structure includes characters from a Lancet DOI ('S0140-6736' is The Lancet's prefix). The correct DOI for this paper is 10.1038/s41586-019-1620-6. The DOI provided appears to be a scrambled/incorrect version.,No PMCID is provided.,No PMID is provided.
nemotron-3-super-120b-a12b,harvard,"Multiple components (author name, title, journal identifiers, DOI) are incorrect or fabricated, indicating the reference is not authentic.","The author name ""Huestks, D.L."" does not correspond to any known researcher in the field of mosquito migration or malaria; the correct spelling and format are absent.","The title contains multiple typographical errors ('Wondborne', 'migratioh', 'malarai', 'hosquitoes') and does not match any known article title in Nature or related journals.","Although the journal is listed as ""Nature"", the DOI and ISSN point to a different publication (The Lancet), indicating a mismatch.","The volume number is missing; the reference only provides an issue number in parentheses, which is not a valid format for a Nature citation.","Issue ""(7778)"" is implausibly high for Nature and does not correspond to any known issue.","Page range ""404-408"" could be plausible, but without correct volume/issue it cannot be verified.","No article identifier (e.g., article number) is provided; the field is empty.","The date ""2019 Oct"" is vague; Nature citations usually include a specific day or at least a month with a day range. Additionally, the date does not match any known article with the garbled title.","The DOI ""101.126/S0140-6736(19o30808l6"" is malformed: it does not start with ""10."", contains an ISSN for The Lancet, and includes invalid characters. No such DOI exists.","PMCID is not provided; given the other errors, a valid PMCID is unlikely.","PMID is not provided, and the incorrect DOI/ISSN makes it unlikely that a valid PMID exists for this reference."
