model,style,REFERENCE,authors,title,journal_name,journal_volume,journal_issue,journal_page,elocator,publication_date,doi,pmcid,pmid
deepseek-v4-flash,apa,"Multiple critical errors: the journal likely mismatches the topic (BMJ vs microbiology), the title contains typographical errors, and the DOI is completely implausible. Additionally, the author initials are inconsistently formatted. These are strong indicators that the reference is fabricated or heavily corrupted.","The author list appears plausible with common names in microbiology (e.g., Dangl, Jones), but the initials format is inconsistent (e.g., 'O. M.' vs 'I.').","The title contains obvious typographical errors ('singleb acterialg enus maintains roto growth ina complex microbiome'), suggesting misspelling or misformatting. It does not match known real titles.","The journal name is listed as 'The BMJ', which is a well-known medical journal. However, it is highly unlikely for a microbiology study on bacterial genus and root growth to be published in The BMJ, which focuses on clinical medicine. The mismatch suggests fabrication.","The volume number '587' is plausible for the year 2020, but The BMJ typically uses continuous volume numbering; volume 587 existed in 2020 but is uncommon for this journal. Combined with other errors, it raises suspicion.","No issue number is provided, which is acceptable for many journals. However, given other errors, this absence is not itself a flag.","The page range '103-108' is plausible, but the styling '103–108' (with en-dash) is typical; the given '103-108' uses a hyphen, which is acceptable but often not standard for many style guides. Minor issue.",No e-locator is provided; not required.,The year '2020' is plausible and consistent with other details.,"The DOI '10.1162/j.cell.2201.09.017' is clearly invalid. The prefix '10.1162' may correspond to MIT Press journals, but the suffix 'j.cell.2201.09.017' is not a standard Cell journal DOI format and contains an improbable year '2201'. This is a strong indicator of fabrication.","No PMCID is provided, so no assessment needed.","No PMID is provided, so no assessment needed."
gemini-3-flash-preview,vancouver,The citation mixes correct metadata from a Nature paper with a completely unrelated journal (BMJ) and a fake DOI.,"The list of authors is associated with an actual paper published in Nature, not BMJ.","The title contains typos (singleb, acterialg, roto) but corresponds to a known study about bacterial genera and root growth.",The journal BMJ is a medical journal and did not publish this plant biology study.,Volume 587 is not consistent with BMJ volumes in 2020 but matches the actual Nature volume for this paper.,No specific issue number is provided in the citation format beyond the volume and date.,"The pages 103-108 match the real publication in Nature, not a BMJ article.",No elocator is provided in the citation.,The date November 2020 is correct for when the corresponding paper was published in Nature.,The DOI 10.1162/j.cell.2201.09.017 is fabricated; the actual DOI for this paper is 10.1038/s41586-020-2778-z.,No PMCID was provided in the citation.,No PMID was provided in the citation.
mimo-v2.5,harvard,"This citation is **highly likely fabricated or severely corrupted**, with multiple red flags across every component.","Finkel, O.M. is a plausible researcher name in microbiology/plant science, but the use of 'et al.' without a full citation list is suspicious in this context.","The title is severely garbled with extraneous spaces breaking words: 'A singleb acterialg enus maintains roto growth ina  complex microbiome'. The intended title is likely 'A single bacterial genus maintains root growth in a complex microbiome.' The corruption suggests OCR errors, typographical mistakes, or deliberate obfuscation.","The BMJ is a well-known British medical journal. Publishing a primary research article about bacterial genus effects on root growth in a complex microbiome in The BMJ is highly improbable. The content likely belongs to a journal like Cell, Nature, or a microbiome-focused journal.","Volume 587 could be a legitimate BMJ volume, but this cannot be confirmed given the DOI and title issues.","The journal is cited as 'The BMJ' (British Medical Journal), which is a medical journal. The article topic (bacterial genus, microbiome, root growth) suggests a plant biology or microbiology journal, not BMJ. This is a major mismatch.","The volume number 587 is plausible for The BMJ's long publication history, but paired with the wrong journal content and corrupt title, this is unreliable.",The pages '103-108' are a plausible page range but cannot be verified given the other issues.,The date '2020 Nov' is a plausible publication date but cannot be confirmed.,"The DOI 10.1162/j.cell.2201.09.017 is highly suspicious. The prefix 10.1162 is associated with MIT Press journals, not Cell (which uses 10.1016). Additionally, the DOI format 'j.cell.2201.09.017' does not match standard Cell DOI patterns and appears fabricated.","No PMCID is provided, so this component cannot be evaluated.","No PMID is provided, so this component cannot be evaluated."
minimax-m3,nlm,"The reference describes a real paper 'A single bacterial genus maintains root growth in a complex microbiome' by Finkel et al., published in Nature in 2020 (vol 587, pages 103-108). However, multiple critical metadata fields are incorrect: (1) Journal is listed as BMJ instead of Nature, (2) DOI is fabricated, (3) PMID is wrong, (4) PMCID is wrong. The authors, title (despite OCR errors), publication date, volume, and pages are approximately correct. Overall, this is a real reference but with significant fabricated metadata errors.","The author list 'Finkel OM, Salas-González I, Castrillo G, Conway JM, Law TF, Teixeira PJPL, Wilson ED, Fitzpatrick CR, Jones CD, Dangl JL' matches the author list of the actual paper 'A single bacterial genus maintains root growth in a complex microbiome' published in Nature (not BMJ). The authors are real and correctly ordered.","The title 'A single bacterial genus maintains root growth in a complex microbiome' matches the real paper title. However, there are embedded typos/extra characters: 'singleb acterialg enus' and 'roto growth' and 'ina' — these are OCR-like errors but the intended title is clearly recognizable. The title itself is valid.","The paper was published in Nature, not BMJ. BMJ is the British Medical Journal, which is completely unrelated to this plant microbiome research. This is a clear error.","The journal volume is listed as '587'. The actual paper was published in Nature volume 587. However, since the journal is wrong, this compound is also problematic. The number 587 does match Nature's volume for this paper.","No issue number is provided in the input, but the actual paper appears in Nature volume 587, pages 103-108. The page numbers match. No issue was given.",The pages are listed as '103-108' which matches the actual paper's page numbers in Nature volume 587. The page numbers themselves are valid for the actual paper.,"The DOI provided is '10.1162/j.cell.2201.09.017' which is completely fabricated. The actual DOI for this paper is '10.1038/s41586-020-2778-7'. The prefix '10.1162' relates to MIT Press journals, and 'j.cell' is not a valid format. This DOI is invalid.","The publication date is listed as '2020 Nov'. The actual paper was published on November 25, 2020 (online), which matches. The month is correct.",The DOI '10.1162/j.cell.2201.09.017' is fabricated/invalid. The actual DOI is '10.1038/s41586-020-2778-7'. This is a fake DOI.,The PMCID is listed as 'PMC9083102'. The actual PMCID for this paper is PMC8084288. This PMCID does not correspond to the actual paper.,The PMID is listed as '34465633'. The actual PMID for this paper is 33208937. PMID 34465633 corresponds to a different paper. This PMID is invalid for this reference.
nemotron-3-super-120b-a12b,vancouver,"Multiple elements are inconsistent: garbled title, mismatched journal (BMJ vs. Cell‑type DOI), impossible volume number, and a DOI that resolves to nonexistent record. These strongly indicate the reference is fabricated or contains significant errors.","The author list appears plausible (Finkel OM, Salas‑González I, Castrillo G, Conway JM, Law TF, Teixeira PJPL, et al.) and matches known researchers in plant‑microbiome literature, so the authorship itself is not inherently suspicious.","The title is garbled: “A singleb acterialg enus maintains roto growth ina  complex microbiome.” This contains obvious typographical artifacts (e.g., “singleb”, “acterialg”, “roto”, “ina”) that do not correspond to any known article title. A search of the corrected phrase “A single bacterial genus maintains root growth in a complex microbiome” does not retrieve a matching record.",BMJ (British Medical Journal) is a general medical journal; it does not publish primary research on plant microbiomes. The article’s subject matter is far outside BMJ’s scope.,"BMJ volumes in 2020 are in the 300‑range (e.g., volume 371). A volume number of 587 for a November 2020 issue does not exist.","The reference does not specify an issue number; however, the combination of volume 587 and page range 103‑108 is inconsistent with BMJ’s pagination patterns.","Page range 103‑108 is plausible for a short article, but given the incorrect volume/journal, it cannot be verified.","No electronic locator (e.g., article ID) is provided; the reference relies on a DOI that does not match the journal.","November 2020 is a plausible date, but it cannot be validated because the journal/volume are incorrect.","The DOI prefix 10.1162/j.cell belongs to Cell Press (e.g., the journal Cell), not BMJ. The suffix .2201.09.017 does not resolve to any known article. A lookup returns no record.",No PMCID is provided.,"No PMID is provided; even if one were, it would not match a BMJ article with the given details."
