model,style,REFERENCE,authors,title,journal_name,journal_volume,journal_issue,journal_page,elocator,publication_date,doi,pmcid,pmid
deepseek-v4-flash,harvard,"The reference lacks a journal name, has an invalid DOI, and missing identifiers, making it overall invalid.","Author list 'Gevers, E.F. et al.' follows standard citation format.",Title 'Obligations in a global health emergency' is plausible and follows typical article title format.,No journal name is provided in the reference; only volume and issue are given.,Volume number 398 is a plausible volume for a journal.,Issue number 10316 is a plausible issue number.,Page range '2071-2071' is a valid single-page reference.,No elocator is provided in the reference.,"Date '2021 Dec 4' is a valid date format, though the day of week is Saturday, but that does not invalidate it.",The DOI '10.2977.38.89/dre2l-c2f.jm-r9w27y8' does not follow standard DOI format; the prefix is unusual and the suffix appears random.,No PMCID is provided in the reference.,No PMID is provided in the reference.
gemini-3-flash-preview,apa,"The citation is a fabrication containing nonsense author names and a non-existent DOI, likely attempting to mimic a Lancet editorial.","The author list contains numerous intentional typos and garbled names like 'Vslentino', 'vTakkrr', and 'sHnnan' that do not correspond to any known academic group.","While 'Obligations in a global health emergency' is a plausible title, it is not associated with the provided bibliographic data.",The journal name is completely omitted from the citation string.,"Volume 398 is used here likely to mimic The Lancet, but it does not contain the cited content.","Issue 10316 exists for The Lancet, but the page and content provided do not match that issue.",Page 2071 in volume 398 of The Lancet does not correspond to an article with this title or author list.,No elocator is provided in the citation string.,"The year 2021 matches the timeframe of volume 398 of The Lancet, but the metadata for that year does not support this article.",The DOI 10.2977.38.89/dre2l-c2f.jm-r9w27y8 is syntactically invalid and does not resolve in the DOI system.,No PMCID was provided in the citation string.,No PMID was provided in the citation string.
mimo-v2.5,vancouver,"This citation contains multiple serious issues indicating it is likely fabricated or corrupted:

1. **Author names are garbled**: 'Vslentino' and 'vTakkrr' are nonsensical and not plausible real names. A legitimate author list would include properly formatted surnames. 'Gevers EF' and 'Sankaranarayanan S' could be real but are undermined by the presence of other clearly fake names.

2. **Single page number**: '2071-2071' indicates the entire article fits on one page, which is extremely unusual for an article titled 'Obligations in a global health emergency.' Even short letters typically span more pages in The Lancet.

3. **DOI is completely invalid**: The DOI '10.2977.38.89/dre2l-c2f.jm-r9w27y8' does not follow any standard DOI format (e.g., Lancet DOIs follow 10.1016/S0140-6736(...)). This appears to be a randomly generated string.

4. **No verifiable match**: I cannot locate any article with this title, author list, or DOI in legitimate databases (PubMed, CrossRef, The Lancet archive).

Overall, this reference exhibits classic hallmarks of a hallucinated or AI-generated citation.","The author list contains at least two clearly invalid names ('Vslentino', 'vTakkrr') alongside possibly legitimate-sounding entries. The inconsistency in formatting and the presence of nonsensical strings strongly suggest this author list is fabricated.","The title 'Obligations in a global health emergency' is plausible and could exist in a major journal, but I cannot find any matching article in legitimate databases. Given all other issues, the title is likely fabricated or incorrectly generated.","The journal name is not explicitly stated in the citation but is implied by the volume/issue format and the DOI prefix style attempt. However, due to the overall invalidity, it cannot be confirmed as The Lancet or any other specific journal.","Volume 398 could be valid for The Lancet in December 2021, but the entire citation is otherwise corrupt, so the volume number alone cannot be trusted.","Volume 398, issue 10316 could correspond to The Lancet around late 2021, but the citation's other elements are invalid, making the journal attribution unverifiable and likely part of a fabricated reference.","The page numbers are given as 2071-2071, which is an unusual single-page reference and is unlikely to correspond to a legitimate main article in a major journal.","The page range '2071-2071' is highly suspicious. It suggests an article of only one page in length, which is not typical for an original article in The Lancet (volume 398, issue 10316 matches the period around December 2021). While letters/corrections might be short, a duplicate page number is unusual and, combined with other errors, points to fabrication.","The date '2021 Dec 4' is formatted in a way that could match The Lancet's weekly publication schedule. However, without a valid journal, title, or DOI, this date is unverifiable and could be part of a fabricated reference.","The DOI '10.2977.38.89/dre2l-c2f.jm-r9w27y8' does not conform to any standard DOI structural format (e.g., prefixes like 10.1016 for Elsevier/Lancet). Real DOIs have specific patterns and are registered in the DOI system; this string appears to be randomly generated or corrupted.","No PMCID is provided in the citation. Many biomedical papers include a PMCID (PubMed Central ID), but its absence does not by itself indicate fabrication. However, combined with other errors, it is consistent with a non-existent reference.","No PMID (PubMed ID) is provided in the citation. Similar to PMCID, this is not automatically suspicious, but the absence, combined with all other errors, suggests the reference is not indexed in PubMed and is likely invalid."
