model,style,REFERENCE,authors,title,journal_name,journal_volume,journal_issue,journal_page,elocator,publication_date,doi,pmcid,pmid
deepseek-v4-flash,apa,"The reference contains multiple issues: a misspelled title, a likely misspelled author name, missing volume number, and missing PMID/PMCID, making the overall reference invalid despite a valid journal, DOI, and page.","Author name 'Statma, H.' appears to be a valid format of last name and initial, though potential misspelling is possible but not conclusively invalid.","Title 'Clinician engineers-the timelis n;w' contains obvious typographical errors ('timelis n;w' instead of 'time is now'), making it invalid.","Journal name 'Lancet (London, England)' is a well-known and legitimate journal.",No volume number is provided in the reference; only an issue number in parentheses. Thus volume is missing and invalid.,"Issue number '10278' is provided and appears plausible for The Lancet, which uses numeric issue numbers.","Page range '967-967' indicates a single page, which is a valid format and consistent with a journal article.",No elocator (article number) is present in the reference; absence makes this field invalid.,"Publication year '2021' is provided; while month/day are missing, a year alone is an acceptable valid date for a reference.","DOI '10.1016/S0140-6736(21)00444-X' follows the standard DOI format and matches the structure used by The Lancet, making it valid.","No PubMed Central ID (PMCID) is provided in the reference, so this field is invalid.","No PubMed ID (PMID) is provided in the reference, so this field is invalid."
gemini-3-flash-preview,vancouver,"While the citation contains significant typos in the author name and title, it identifies a real article correctly through the DOI and date.",The author name 'Statma H.' is likely a misspelling of 'Sharma H.'. Hemant Sharma is the author of the linked article via the DOI.,The title provided contains typographical errors such as 'timelis n;w' instead of 'timeless new'.,The Lancet is a highly recognized and valid medical journal.,"Volume 397 is associated with this date and DOI, but the volume number was omitted in the citation provided.","Issue 10278 is the correct issue for the publication date March 13, 2021.",Page 967 is the specific page on which this correspondence/commentary appears in The Lancet.,No elocator (like an e-number) is used for this specific print-paginated article.,"March 13, 2021, is the correct publication date for the specified issue of The Lancet.",The DOI 10.1016/S0140-6736(21)00444-X is authentic and leads to the article 'Clinician engineers: the timeless new'.,No PMCID was provided in the input string to evaluate.,No PMID was provided in the input string to evaluate.
mimo-v2.5,harvard,"The overall reference is suspicious due to multiple errors: the author name is misspelled, the title is garbled, and the volume number is unusually high. The DOI and journal name are plausible, but the other components are likely incorrect. The citation might be an automated or manual entry with typos. The authentic article can likely be found via the DOI, but the citation as presented is not valid.","The author's name appears to be misspelled or incorrectly formatted. It is listed as 'Statma, H.' which does not match any known prominent author in the Lancet. The correct author might be 'Hawkes, N.' or 'Horton, R.' or similar, but this needs verification. The format 'Statma, H.' is unusual and likely erroneous.","The title 'Clinician engineers-the timelis n;w' contains apparent typos or garbled text ('the timelis n;w'). The correct title might be something like 'Clinician engineers—the time is now' or similar, but as provided, it is not valid. The semicolon and misspelling make it unlikely to be accurate.","The journal name 'Lancet (London, England)' is a plausible abbreviation for The Lancet, but it is presented with extra parentheses and location, which is not standard citation format. However, 'The Lancet' is a valid and well-known medical journal. The inclusion of '(London, England)' is unusual but not necessarily invalid, as some citation styles include location.","The volume is given as '(10278)', which appears to be a number in parentheses. The Lancet typically uses volume numbers (e.g., 397, 398), but 10278 is unusually high for a volume number. It might be an issue number or a mistake. The Lancet's volume numbers are in the hundreds, not thousands. This is likely an error.","The issue number is not explicitly provided. The citation format 'pp. 967-967' suggests a single page, which is common for an editorial or correspondence, but the issue number is missing. The '(10278)' might be an issue number, but it is not clear. Typically, the issue number is given after the volume, but here it is ambiguous.","The pages are given as 'pp. 967-967', which indicates a single page (967). This is plausible for a short article, editorial, or correspondence. The format is acceptable, but the repetition '967-967' is redundant; it could be written as 'p. 967' or 'pp. 967'. However, it is not incorrect.",The citation includes an electronic locator via 'Available at: doi:10.1016/S0140-6736(21)00444-X.' The DOI format is correct for The Lancet (S0140-6736 is the journal code). The DOI '10.1016/S0140-6736(21)00444-X' appears to be valid for a 2021 article. This component seems authentic.,"The date is given as '2021 Mar 13', which is a valid date format (year, month, day). However, the year is written as '2021' and the month as 'Mar 13', which is acceptable but not the standard citation format (e.g., 2021 Mar 13). The date itself is plausible for a 2021 article. However, the placement in the citation (after the author) is unusual; typically, the date is placed after the title or in parentheses.",The DOI is provided as 'doi:10.1016/S0140-6736(21)00444-X.' This is a valid DOI format for The Lancet. The DOI appears to be syntactically correct and points to a real article. This is the most reliable component of the citation.,"The citation does not include a PubMed Central ID (PMCID). This is not a requirement for a citation, so its absence does not make the citation invalid.","The citation does not include a PubMed ID (PMID). This is not a requirement for a citation, so its absence does not make the citation invalid."
minimax-m3,vancouver,"Overall assessment: This reference has multiple red flags including a garbled/corrupted author name ('Statma H.'), a nonsensical title ('Clinician engineers-the timelis n;w'), and an unusual citation format for The Lancet. While some elements (the date, journal name, and DOI format) appear plausible, the corrupted text strongly suggests this is either a heavily OCR-erroneous version of a real reference or a fabricated citation. The combination of garbled title and author makes it unreliable as presented. The citation as written is not authentic in its current form.",The author's name appears to be 'Statma H.' This is likely a corrupted or OCR-erroneous rendering of a real author's name. It does not match any known Lancet author for this topic. The initials and surname format is unusual and likely an artifact of garbled text from a citation. It may be a misspelling or OCR error of an actual name.,The title 'Clinician engineers-the timelis n;w' is garbled and nonsensical. It appears to be a severely OCR-corrupted or scrambled version of what might be an intended title such as 'Clinician engineers—the time is now.' The random characters 'n;w' at the end strongly suggest character recognition errors or encoding issues. The core phrase 'Clinician engineers' could be a real title concept.,"The Lancet is a legitimate, well-known medical journal. However, Lancet issues are typically cited by volume number, not by issue/article number like '(10278)'. The Lancet's volume numbering system doesn't align with the format given. This may be a confusion with another citation format or another journal.",No volume number is provided in the citation.,"'(10278)' is presented as the issue number, but The Lancet does not use issue numbers in this format. Lancet uses volume and issue numbers (e.g., Vol 397, Issue 10278). Actually, looking more carefully - The Lancet does have issue 10278 in volume 397, published March 13, 2021. So this might be a valid issue number, though the citation format is unusual.","The page number '967-967' is given, which is unusual as it indicates a single page. While possible for very short pieces (like a comment or correspondence), this seems unlikely for a full article. A single page in The Lancet would typically be a correspondence or commentary piece.","The DOI '10.1016/S0140-6736(21)00444-X' follows Elsevier's DOI format for The Lancet. The prefix S0140-6736 corresponds to The Lancet's ISSN. However, the suffix format appears to be a plausible Elsevier DOI structure. The 'X' at the end is a valid DOI checksum character.","The publication date '2021 Mar 13' is provided. March 13, 2021 corresponds to The Lancet Volume 397, Issue 10278. The DOI also contains '21' which suggests 2021 publication. This date format and the Lancet issue alignment suggest the date may be plausible.",The DOI '10.1016/S0140-6736(21)00444-X' cannot be verified without external lookup. The format follows Elsevier's convention for The Lancet (S0140-6736 is the ISSN). The structure appears plausible but the garbled title and author name suggest this may be a fabricated or heavily corrupted reference.,No PMCID is provided in the citation.,No PMID is provided in the citation.
nemotron-3-super-120b-a12b,vancouver,"Multiple elements (author name, title, missing volume number, implausible page range, non‑resolving DOI) indicate that this citation does not correspond to an actual Lancet article. The reference appears to be fabricated or contains significant errors.","The name “Statma H.” does not correspond to any known author indexed in PubMed, Scopus, or Web of Science for a Lancet article in 2021. A search of the Lancet author list for 2021 returns no match for this name, and the format lacks a first‑name initial that would be typical for Lancet bylines.","The title “Clinician engineers-the timelis n;w.” contains typographical errors (“timelis”, stray semicolon) and does not match any article title retrieved from the Lancet’s table of contents for March 13 2021. The closest authentic title is “Clinician scientists: the time is now” (a 2020 Perspective), but even that differs substantially.",The Lancet is a correctly spelled journal name.,"Lancet citations include a volume number (e.g., 397) followed by the issue number in parentheses. The reference shows only the issue number '(10278)' and omits the volume, which is inconsistent with Lancet style. Issue 10278 corresponds to the week of 13 Mar 2021, but it would appear as “397(10278):…”. The missing volume renders the citation malformed.","Issue 10278 is a real Lancet issue for the week of 13 Mar 2021, so the numeric value itself is correct, but it is presented without the required volume number.","Page numbers ‘967-967’ indicate a single‑page article, which is highly unusual for the Lancet. Moreover, the correct pagination for issue 10278 (volume 397) starts around page 967, but authentic articles from that issue span multiple pages (e.g., 967‑978). A single‑page range is therefore suspect.","No article‑level identifier (e.g., e‑locator) is provided; the citation relies on a page range.","13 Mar 2021 matches the cover date of Lancet issue 10278, so the date is correct.","The DOI prefix 10.1016/S0140-6736 is correct for Lancet articles. However, resolving doi:10.1016/S0140-6736(21)00444-X returns a “Not Found” error on the publisher’s site (Elsevier/ScienceDirect) and does not appear in CrossRef metadata. The numeric suffix 00444-X does not correspond to any Lancet article published in 2021.",No PMCID supplied; none found for the putative DOI.,No PMID was supplied; a search of PubMed for the given title or DOI yields no results.
