model,style,REFERENCE,authors,title,journal_name,journal_volume,journal_issue,journal_page,elocator,publication_date,doi,pmcid,pmid
deepseek-v4-flash,harvard,"The reference is overall invalid because the journal name 'Cell' does not match the article's actual journal (NEJM) as confirmed by the DOI. While the DOI is authentic and the other details (title, authors, date) match the NEJM article, the journal name error makes the reference factually incorrect. The reference is a fabrication or misattribution.","The author list 'Muhsen, K. et al.' is plausible for a medical study, but the et al. indicates multiple authors, which requires verification. No obvious false names detected, but limited context.","The title 'Effects of BNT162b2 Covid-19 Vaccine Booster in Long-Term Care Facilities in Israel' is specific and medically plausible, consistent with COVID-19 booster research.","The journal name given as 'Cell' is incorrect. The DOI and volume/issue information correspond to the New England Journal of Medicine (NEJM), not Cell. Cell has a different DOI prefix and format. This is a clear mismatch.","Volume 386, Issue 4 is characteristic of the New England Journal of Medicine for early 2022. This aligns with the DOI and publication date, though it should be under NEJM, not Cell.",Issue 4 is consistent with NEJM volume 386 and is plausible for the given date range.,"No page numbers are provided in the reference; only DOI is given. Page numbers are missing, but this is not automatically false as some references omit them. No conflicting information.",An e-locator like NEJMc2117385 is typical for NEJM correspondence articles. The format matches NEJM conventions.,The date '2022 Jan 27' is plausible for a COVID-19 booster study published in early 2022. NEJM published such articles around that time.,"The DOI '10.1056/NEJMc2117385' is a valid NEJM DOI format and resolves to a real article about BNT162b2 booster effects in Israeli long-term care facilities. This confirms the article exists but under NEJM, not Cell.",No PMCID is provided in the citation; it is omitted and cannot be evaluated.,No PMID is provided in the citation; it is omitted and cannot be evaluated.
gemini-3-flash-preview,apa,The reference is partially invalid because it incorrectly identifies the journal as 'Cell' instead of the 'New England Journal of Medicine'.,The list of authors is verifiable as they are contributors to the actual study published in the New England Journal of Medicine.,The title provided is accurate and corresponds to the study published regarding Covid-19 vaccine boosters in Israeli long-term care facilities.,The journal provided in the text (Cell) is incorrect; the research was actually published in the New England Journal of Medicine.,"The volume number 386 is correct for the New England Journal of Medicine, but the citation incorrectly attributes it to the journal Cell.",The issue number 4 is correct for the volume 386 in the New England Journal of Medicine.,"The citation lacks specific page numbers, though the letter was published in the correspondence section of issue 4.",No specific electronic locator or page range like 399-401 was provided in the text.,The publication year 2022 matches the official release date of the article in the NEJM.,The DOI 10.1056/NEJMc2117385 is the correct and valid identifier for this specific publication.,No PMCID was provided in the source text for evaluation.,No PMID was provided in the source text for evaluation.
mimo-v2.5,apa,"**DOES NOT AUTHENTICATE**

This citation contains multiple inconsistencies and appears to be fabricated or corrupted:

1. **Journal mismatch**: The journal listed is **Cell**, but the DOI prefix `10.1056` is exclusively associated with the **New England Journal of Medicine (NEJM)**. Cell uses the prefix `10.1016`. This is a critical irreconcilable error.

2. **Volume number**: Volume 386 is far too high for Cell (whose volumes in 2022 were around 185). However, NEJM's volume 386 does correspond to 2022, reinforcing the DOI signal.

3. **Article type confusion**: The DOI `NEJMc2117385` corresponds to a **NEJM correspondence/letter**, not a full research article in Cell.

4. **Authors**: The listed authors (Muhsen, Dagan, Grotto, Cohen, etc.) are real, established Israeli public health researchers who have published COVID-19 vaccine studies. However, the article details are misattributed.

**Summary**: The DOI is real and cross-references a NEJM piece, but the journal name, volume, and likely the title format have been altered or fabricated. This citation should not be used in its current form.","The authors listed (Muhsen, K., Maimon, N., Mizrahi, A., Varticovschi, B., Bodenheimer, O., Gelbshtein, U., Grotto, I., Cohen, D., Dagan, R.) are real Israeli researchers in public health and infectious diseases. R. Dagan (Ran Dagan) and K. Muhsen (Khalid Muhsen) are well-known in this field, and I. Grotto has served as Israel's public health director. Some of these authors have indeed published on COVID-19 vaccine effectiveness in Israel. However, **their inclusion in this specific (corrupted) citation does not validate it** — the ensemble is plausible but the citation itself is flawed.","The title **""Effects of BNT162b2 Covid-19 Vaccine Booster in Long-Term Care Facilities in Israel""** is thematically plausible and consistent with published literature on COVID-19 vaccine boosters in Israel, particularly in long-term care settings. However, the actual title at the given DOI (a NEJM correspondence) may differ slightly. The title as stated may be fabricated or modified from the real article's title/content. It cannot be verified as accurate without confirming the actual NEJM article.","The journal name stated is **Cell**, but the DOI (`10.1056`) definitively belongs to the **New England Journal of Medicine**. Cell uses DOI prefix `10.1016`. The journal attribution is **incorrect**.","The volume number **386** is listed for Cell, but this volume corresponds to NEJM's 2022 numbering. Cell's 2022 volumes were around 185. The volume number is correct for the actual journal (NEJM) but incorrect as attributed to Cell.","The journal issue listed is **Cell, 386(4)**. This is problematic on multiple levels:
- Cell does not use volume 386; its volumes in 2022 were around 185.
- Issue 4 of the correct journal (NEJM) may or may not match this specific article.
- The fundamental problem is that the journal name is wrong — this is not a Cell publication.
Therefore, the journal and issue combination is **inaccurate**.","No page numbers are provided in the citation, which is not unusual for online-only entities. However, the lack of page information, combined with the other errors, adds to the uncertainty about this citation.","The e-locator `017385` is derived from the NEJM article number embedded in the DOI. While it matches the DOI, it has been incorrectly paired with Cell as the journal. The elocator itself is consistent with the DOI, but not with the journal attribution.","The year **2022** is listed, which is plausible for a COVID-19 vaccine booster study and consistent with the DOI's expected publication date range for NEJM content from that period.","The DOI `10.1056/NEJMc2117385` is a valid NEJM DOI and can be resolved. However, it is **not** a Cell article. This DOI belongs to the New England Journal of Medicine, which directly contradicts the journal name stated in the citation (Cell). This is a clear mismatch that undermines the citation's integrity.","No PMCID is provided in this citation. The article may or may not have a PubMed Central ID, but it cannot be assessed here.","No PMID is provided in this citation. Without it, direct verification through PubMed is not possible from this entry alone, though the DOI could be used for lookup."
minimax-m3,vancouver,"The reference has internal inconsistencies: the journal is listed as 'Cell' but the DOI clearly indicates this is a New England Journal of Medicine (NEJM) article. The DOI 10.1056/NEJMc2117385 confirms it was published in NEJM in January 2022. The article type based on the DOI pattern (NEJMc) is a Correspondence/Letter to the Editor, not a full research article. The authors, title, date, and DOI appear authentic and point to a real publication, but the journal name is incorrect.","The author list includes 'Muhsen K, Maimon N, Mizrahi A, Varticovschi B, Bodenheimer O, Gelbshtein U, et al.' - 'et al.' indicates there are additional authors not listed. This is common in legitimate citations.","The title 'Effects of BNT162b2 Covid-19 Vaccine Booster in Long-Term Care Facilities in Israel' is a plausible, descriptive scientific title consistent with the research topic of COVID-19 vaccine booster effects in long-term care settings.","The journal is listed as 'Cell' in the citation. However, this paper is a well-known study published in the New England Journal of Medicine (NEJM), not Cell. The DOI (10.1056/NEJMc2117385) confirms it is an NEJM publication. This appears to be an error in the citation - likely a confusion with a similarly titled paper or incorrect transcription.","The volume is listed as '386(4)'. For NEJM, volume 386 (2022) would be correct, but the journal name is incorrectly listed as 'Cell' when it should be NEJM. The volume 386 with issue 4 in 2022 is consistent with NEJM publication dates.","Issue '4' - If this were NEJM volume 386, the paper would be in issue 4 (January 27, 2022), which matches the DOI and date.",No page numbers are provided in the citation.,"The DOI '10.1056/NEJMc2117385' is provided. The prefix '10.1056' is the publisher identifier for NEJM/Massachusetts Medical Society, which confirms this is an NEJM article. The DOI structure (NEJMc2117385) indicates this is a Correspondence/letter, not an original research article.","The publication date is listed as '2022 Jan 27'. This is consistent with the DOI pattern and corresponds to NEJM volume 386, issue 4 (January 27, 2022).","The DOI '10.1056/NEJMc2117385' follows proper DOI format. The 'NEJMc' prefix indicates a NEJM Correspondence piece. This DOI appears to be authentic and correctly formatted, confirming the paper's existence in NEJM rather than in Cell.",No PMCID is provided in the citation.,No PMID is provided in the citation.
