model,style,REFERENCE,authors,title,journal_name,journal_volume,journal_issue,journal_page,elocator,publication_date,doi,pmcid,pmid
deepseek-v4-flash,apa,"The DOI (10.1038/s41586-019-1006-9) points to a Nature article, but the cited journal is 'Hepatology and Fibrosis Research', which is not a recognized journal. The field labeled as 'title' is actually a journal name, and no article title is provided. This indicates a fabricated or severely malformed citation.",List of authors is plausible but cannot be verified for this specific misattributed article. The mismatch with the DOI suggests they are likely incorrect for this reference.,"The provided string 'Hepatology and Fibrosis Research' is a journal name, not an article title. No actual article title is given.",Same as journal_issue. The name is not a standard journal title.,Volume 567 is provided but is not consistent with known journals. Likely fabricated.,'Hepatology and Fibrosis Research' is not a known journal. It does not match the DOI's journal (Nature) and is likely fabricated.,The pages (262-266) are provided but cannot be verified due to the unreliable journal. They are likely incorrect.,"The volume (567) and pages (262-266) are plausible for a journal article, but cannot be confirmed without a valid journal. They are likely fabricated or copied from another source.","Year 2019 is plausible, but along with the other mismatched components, it is likely incorrect for this fabricated reference.","The DOI itself is a valid Nature DOI pointing to a real article, but it does not belong to the cited journal or title. The component is technically authentic but mismatched to the reference.",No PMC ID provided; not applicable.,No PMID provided; not applicable.
gemini-3-flash-preview,harvard,The reference is a hallucination; it combines a real Nature DOI with a fake journal name and author list that do not belong to that DOI.,"While 'Du, F.' is a common author name in biomedical sciences, the specific author list does not correspond to the content associated with the provided DOI.",The title for the referenced work is missing from the citation string.,'Hepatology and Fibrosis Research' is not a recognized major academic journal indexed in standard databases.,"Volume 567 does not exist for the non-existent journal provided, and is inconsistent with the journal linked to the DOI.",No issue number was provided in the citation.,"Pages 262-266 are listed here, but the DOI provided points to a Nature article starting on page 262, suggesting a partial mimicry of real data.","No elocator (e.g., e12345) was provided.",March 2019 matches the publication date of the article associated with the provided DOI.,The DOI 10.1038/s41586-019-1006-9 is valid and belongs to the article 'T cell-derived IL-10 creates a metabolic checkpoint that limits anti-tumour immunity' published in Nature.,No PMCID was provided in the citation.,No PMID was provided in the citation.
mimo-v2.5,nlm,"This citation contains multiple components that are inconsistent and appear fabricated or intentionally manipulated. Here is a detailed breakdown: 1. **Journal Name** - 'Hepatol Fibrosis Res' does not match any known indexed journal in PubMed, Scopus, or Web of Science. It appears to be fabricated or confused with another publication. 2. **DOI Concern** - The DOI `10.1038/s41586-019-1006-9` uses the prefix 10.1038 and the settled suffix s41586, which corresponds specifically to the journal **Nature**, NOT 'Hepatol Fibrosis Res'. This is a clear contradiction. 3. **Volume Number** - Volume '567' is consistent with Nature's 2019 volumes (Nature 567 was published in March 2019), but it is extremely unusual for a specialty journal like 'Hepatol Fibrosis Res'. 4. **Pages** - Pages 262-266 within volume 567 could indeed be valid for Nature, but this contradicts the stated journal. 5. **PMID and PMCID** - The PMID (30842662) and PMCID (PMC9757605) are valid formats, but depending on verification, they might point to a completely different article or may be fabricated to match the DOI.","The authors listed are plausible (primarily Chinese surnames) and could be real researchers, but the journal mismatch makes the entire citation suspect. Without cross-referencing PubMed, I cannot confirm if these authors are associated with a real article under this DOI.","The title is missing from the citation, which is a red flag for a bibliographic reference. Citation authenticity assessments typically require a title to verify against databases.","The journal name 'Hepatol Fibrosis Res' appears to be fabricated. It does not match any indexed journal and is inconsistent with the DOI, which belongs to Nature. This is likely an intentional alteration of the journal name to make the citation appear authentic.","Volume 567 is consistent with Nature's 2019 volumes, but it is highly unusual for a smaller journal to have such a high volume number. This volume is inconsistent with most hepatology journals.",The journal name 'Hepatol Fibrosis Res' is not a recognized journal abbreviation or full title in major databases. The issue March 2019 is plausible for a Nature publication (Nature has monthly issues with multiple volumes). The overall citation lacks a valid journal identity.,"Pages 262-266 within volume 567 could be valid for a Nature article. The page range is plausible for a short article/letter (5 pages). However, this is inconsistent with the fabricated journal name.","Volume 567 and pages 262-266 are plausible for a Nature article in March 2019, but they are inconsistent with the claimed journal 'Hepatol Fibrosis Res'. The page range is within a reasonable range for a Nature article (shorter article/letter format).","March 2019 matches the DOI's year (2019) and could correspond to a Nature publication from that time. However, the date alone does not validate the citation due to other inconsistencies.","The DOI 10.1038/s41586-019-1006-9 uses Nature Publishing Group's prefix (10.1038) and the journal Nature's settled identifier (s41586). This indicates the article should be in Nature, not 'Hepatol Fibrosis Res'. The DOI format itself is plausible, but its connection to the claimed journal is inauthentic.","PMCID PMC9757605 is a valid format, but without verification, it may be fabricated to support the citation. If verified, it might point to a different article in a different journal (likely Nature).","PMID 30842662 is a valid format, but without verification, it may be fabricated or belong to a different article. The PMID range is plausible for early 2019, but I cannot confirm it without access to PubMed."
minimax-m3,apa,"This reference has multiple red flags: (1) No title is provided, (2) The journal name 'Hepatology and Fibrosis Research' does not appear to be a real journal, (3) The DOI prefix (10.1038/s41586) indicates Nature, which contradicts the claimed journal, (4) The volume number appears missing. These inconsistencies strongly suggest this is a fabricated or corrupted reference.","The author names appear plausible and follow standard Western citation format. However, I cannot verify the specific individuals without additional context. The format is consistent with a real citation.",No title is provided in this reference - the field is blank. A citation without a title is unusual and suspicious.,"""Hepatology and Fibrosis Research"" is not a recognized scientific journal. There is no journal with this name in standard databases. Hepatology is a real journal (published by AASLD), and there are some fibrosis-related journals, but no journal combines these in this way.",The volume number 567 is not provided. This field appears to be missing.,No issue number is provided in the citation.,"The page range 262-266 appears to be provided, though without a full title and journal name verification, this cannot be confirmed.",No elocator (article number) is provided.,"The year 2019 is provided, which is plausible.","The DOI 10.1038/s41586-019-1006-9 uses the Nature Publishing Group prefix (10.1038) and the s41586 journal code, which is associated with Nature. However, this DOI format suggests the article would be published in Nature, not in ""Hepatology and Fibrosis Research."" This mismatch between the DOI's journal code (Nature) and the claimed journal name is highly suspicious and suggests the DOI may be fabricated or mismatched.",No PMCID is provided in the citation.,No PMID is provided in the citation.
nemotron-3-super-120b-a12b,harvard,"While the authors, date, volume, pages, and DOI correspond to a real Nature article, the journal title is fabricated, making the citation as a whole misleading.","The author list ""Du, F. et al."" matches the actual authors of the Nature article identified by the DOI.",No title is provided in the citation; absence prevents verification.,"The cited journal ""Hepatology and Fibrosis Research"" does not exist; the DOI resolves to a Nature article.",Volume 567 corresponds to the actual Nature volume for 2019.,Issue information is not supplied; cannot be verified.,Pages 262-266 align with the page range of the Nature article indicated by the DOI.,No article number or e‑locator is present.,Month and year (Mar 2019) match the publication date of the Nature article.,The DOI 10.1038/s41586-019-1006-9 is valid and resolves to a Nature article from March 2019.,No PMCID provided; cannot verify.,No PMID provided; cannot verify.
