model,style,REFERENCE,authors,title,journal_name,journal_volume,journal_issue,journal_page,elocator,publication_date,doi,pmcid,pmid
deepseek-v4-flash,nlm,"The reference contains multiple critical inconsistencies: journal name conflicts with DOI, DOI format is non-standard, PMID and PMCID belong to a different article, and no title is provided. These indicate the reference is fabricated or contains severe errors.",Names appear plausible but cannot be verified as genuine authors of a real paper. No confirmation possible.,No specific title is provided in the citation text.,"'BMJ' (British Medical Journal) is a real journal, but it is listed alongside a DOI that starts with '10.1106/S0140-6736', which is the prefix for The Lancet, not BMJ. This mismatch suggests fabrication or error.","Volume 373 of BMJ is plausible, but the inconsistency with the DOI weakens confidence.","Issue 9679 is reported; no immediate contradiction, but context is suspect.",No page numbers are provided.,No elocator is given.,Date '2009 Jun 6' is plausible for a journal article.,"The DOI '10.1106/S0140-6736(09)06332-9' belongs to The Lancet, not BMJ. The prefix '10.1106' is not standard; The Lancet uses '10.1016'. Thus, this DOI is invalid.","PMCID PMC9905260 is a valid identifier, but it matches the same 2022 article as the PMID, not this citation. Inconsistency confirms fabrication.","PMID 35030645 is a valid PubMed identifier, but it corresponds to an entirely different article (published in 2022, not 2009). This mismatch indicates fabrication."
gemini-3-flash-preview,apa,"The citation is a fabrication that mixes real names and a real journal with contradictory dates, incorrect volume/year correlations, and an invalid DOI.","While these authors exist in the field of epidemiology and public health, they did not co-author a paper in BMJ with this specific metadata.",There is no article title provided in the citation metadata to verify.,BMJ (Clinical research ed.) is a valid medical journal.,"Volume 373 of BMJ was published in 2021, not 2009.","The issue number 9679 does not correspond to BMJ Volume 373, which used elocators (e.g., n123) in 2021.",No page numbers or e-locators were provided in the journal_page field of the request.,No valid elocator was provided in the citation string.,"The year 2009 contradicts the BMJ volume number 373, which belongs to 2021.","The DOI prefix 10.1106 belongs to SAGE/Technomic, not BMJ (10.1136), and the suffix format is inconsistent with BMJ identifiers.",No PMCID was provided for verification.,No PMID was provided for verification.
mimo-v2.5,apa,"The elements of this reference are inconsistent and inauthentic, appearing fabricated.",Five authors listed without full initials for Liu and Xia. Authors are plausible names but cannot be verified without full given names.,No title is provided in this citation.,"BMJ (Clinical research ed.) is a legitimate journal name, but the DOI points to a completely different publisher (SAGE) and references The Lancet's ISSN, making this a mismatch.","Volume 373 is unlikely for BMJ in 2009, and combined with the problematic issue number, appears fabricated.",The volume (373) and issue number (9679) are problematic. Volume 373 in 2009 does not correspond to BMJ. The issue number format 9679 is unusual for BMJ. It appears to be fabricated.,"No page numbers are given, which is incomplete for a journal citation.",No elocator is provided in this citation.,"The year 2009 is stated but the DOI suffix also embeds (09), which is internally consistent. However, the entire reference is inauthentic.","The DOI (10.1106/S0140-6736(09)06332-9) is inconsistent with the claimed journal. The prefix 10.1106 belongs to SAGE, not BMJ (which uses 10.1136). The suffix S0140-6736(09)06332-9 references the ISSN of The Lancet (0140-6736), not BMJ. This DOI appears to be fabricated or misappropriated.",No PMCID is provided.,No PMID is provided.
minimax-m3,nlm,The reference is highly inconsistent: (1) DOI has malformed prefix (10.1106 instead of 10.1016); (2) PMID and PMCID are from 2022 but date is 2009; (3) journal is listed as BMJ but volume/issue/DOI structure is Lancet; (4) missing title. This appears to be either a fabricated citation or a severe mashup of two distinct references.,"The author list 'Li Y, Liu H, Xia W, Wong GWK, Xu S' is plausible but lacks first name initials. This is common in abbreviated citation formats and is acceptable.","No article title is provided in the reference, which is unusual for a complete citation. This is incomplete.","BMJ is listed, but the reference also mentions The Lancet's ISSN/identifier range. The volume/issue notation '373(9679)' and DOI pattern correspond to The Lancet, not BMJ. This appears to be a mismatch/jumble of two different references (one BMJ, one Lancet).","Volume 373 issue 9679 corresponds to The Lancet (BMJ publishes The Lancet, but the journal cited is 'BMJ'). This is inconsistent.","Issue 9679 is a Lancet issue number, not a BMJ issue number. BMJ uses different numbering.",No page numbers are provided.,No elocator (article number or specific page identifier) is provided.,"'2009 Jun 6' is plausible but conflicts with the journal's stated 2022 volume. June 6, 2009 does not correspond to Lancet volume 373 issue 9679 (which was published in 2009 but the issue number 9679 was actually from 2009 - Lancet 373(9679) was published June 2009, so the date may be consistent). However, the PMID and PMCID provided (35030645, PMC9905260) are from 2022, not 2009. This is a major inconsistency.","The DOI '10.1106/S0140-6736(09)06332-9' has formatting errors. The correct Lancet DOI prefix is '10.1016', not '10.1106'. The Lancet ISSN prefix should be 10.1016/S0140-6736(...). This DOI is invalid/fabricated.",PMCID PMC9905260 is from 2022 and does not match a 2009 Lancet article. Inconsistent with the rest of the citation.,"PMID 35030645 corresponds to a 2022 publication in BMJ, not a 2009 Lancet paper. This is inconsistent with the rest of the citation. Either the PMID is wrong or the citation is fabricated/hybrid."
nemotron-3-super-120b-a12b,harvard,"Multiple components of the citation (journal title suffix, volume, issue number, DOI prefix) are inconsistent with known BMJ metadata. No verifiable record exists in PubMed, CrossRef, or the BMJ archive. The reference exhibits hallmarks of a fabricated citation.","The author list 'Li, Y. et al.' is generic and could exist, but no verifiable article matches the given details.","No title is provided in the citation, which is highly unusual for a genuine reference; a real article would include an article title.",BMJ does not use a '(Clinical research ed.)' designation; its official title is simply 'BMJ' (formerly British Medical Journal). This suffix is fabricated.,"BMJ volume numbers in 2009 were in the low 330s, not 373; volume 373 corresponds to a much later year (around 2015‑2016), making the volume implausible for the given date.","BMJ issues are numbered sequentially (e.g., 1, 2, 3…) within each year, not with four‑digit numbers like 9679; such an issue number does not exist.",No page range is supplied; a genuine BMJ article would include page numbers or an article ID.,"No electronic locator (e.g., article ID) is provided; while some modern articles use only a DOI, the absence of any page or locator together with other irregularities raises suspicion.","The date '2009 Jun 6' does not align with BMJ's publishing schedule for the claimed volume and issue; BMJ issues are released weekly, and a June 6, 2009 issue would belong to a volume around 338‑339, not 373.","The DOI prefix 10.1106 is incorrect for BMJ; BMJ articles use the prefix 10.1136. Moreover, the resolver does not return a record for 10.1106/S0140-6736(09)06332-9, indicating the DOI is either fabricated or belongs to a different publisher.","No PMCID is provided, and a search of PMC returns no match for the purported DOI or citation.","No PMID is provided, and a search of PubMed using the given details yields no matching record."
