model,style,REFERENCE,authors,title,journal_name,journal_volume,journal_issue,journal_page,elocator,publication_date,doi,pmcid,pmid
deepseek-v4-flash,harvard,"The reference contains multiple critical errors: a typo in the journal name ('meidicne' instead of 'medicine'), an impossible volume number for the stated year (volume 336 corresponds to ~1997-1998, not 2021), and an invalid issue number format ('10315'). These errors are not typical of a legitimate citation, even with typographical mistakes. The overall assessment is that this reference is fabricated or severely corrupted.","The author name 'Garcia, K.C.' is provided with initials and a comma, which is a standard format for journal articles. The period after 'C' is a formatting detail and does not affect authenticity. No inconsistencies are detected.","The title 'Transforming access to diagnostics: how to turn good intentions into action?' is plausible and follows typical academic paper formatting (capitalizing first word and proper nouns, lowercase rest). The question mark indicates a rhetorical or exploratory title, which is acceptable. No inconsistencies detected.","The journal name 'The New England journal of meidicne' contains a typo: 'meidicne' should be 'medicine'. Additionally, 'journal' should be 'Journal' and 'of' should be lowercase in standard title case, but the typo in the word 'medicine' is a critical error. The correct format is 'New England Journal of Medicine'. This strongly suggests fabrication or sloppy data entry.","The volume '336' is unlikely for the New England Journal of Medicine. NEJM volumes typically run from 1 in 1812 to around 389 in 2023. Volume 336 would correspond to approximately 1997-1998, which is inconsistent with the publication date of 2021. The typical volume for 2021 would be around 384-385. This volume number is likely invented.","The issue number '10315' is inconsistent with NEJM's standard issue numbering. NEJM uses a simple numeric system (e.g., 1, 2, 3, etc.) for regular issues. The number '10315' resembles a PMID or manuscript ID, not an issue number. This further suggests the reference is fabricated.","The page range 'pp. 1947-1949' is plausible for a short perspective or commentary piece in a journal, but the volume, issue, and journal name issues make this part suspect. However, the pages themselves are not inherently invalid as a standalone number.","The elocator 'article e068197' is a plausible online article identifier format (e.g., for open-access or online-first articles). However, given the other errors (typo in journal name, impossible volume and issue number), this is likely part of a fabricated reference. The format itself is not inherently wrong.","The date '2021 Nov 27' is plausible for a publication date, though NEJM articles often have a specific issue date rather than individual dates. However, given the volume number (336) is from the late 1990s, the date 2021 is inconsistent with the volume.","No DOI is provided, so no evaluation is possible.",No PMCID is provided.,"The number '336(10315)' is used as an issue number, which is erroneous. No separate PMID is provided."
gemini-3-flash-preview,nlm,"The reference is a 'hallucination' or 'chimera' combining a Lancet title, an NEJM-like journal name, incorrect PMIDs/PMCIDs, and impossible volume numbers.","K. Christopher Garcia is a known researcher, but he is not the author of an article with this title or metadata in the NEJM.","The title 'Transforming access to diagnostics: how to turn good intentions into action?' is actually attributed to Peter Sands in The Lancet, not the NEJM.","'N Engk J Med' appears to be a typo for the New England Journal of Medicine, but the article provided does not exist within it.","Volume 336 of the NEJM corresponds to the year 1997, which contradicts the 2021 publication date provided.","Issue 10315 is not a valid issue number for the NEJM or most medical journals, which typically use much smaller increments.",The page numbers 1947-1949 do not exist in the 2021 volume of NEJM which uses unique article IDs and different pagination.,"The elocator e068197 belongs to a BMJ Open article, not an NEJM article.","The date Nov 27 2021 was a Saturday; NEJM typically publishes on Thursdays, and the metadata provided is inconsistent with this date.",No DOI was provided in the source string to validate.,"PMCID PMC10601606 belongs to an article in Frontiers in Oncology, not the NEJM article described.","PMID 34626543 refers to an article in the Journal of Internal Medicine about COVID-19, not the title or authors listed."
mimo-v2.5,vancouver,"This citation has multiple red flags suggesting it is fabricated or heavily corrupted. (1) The journal name is misspelled: 'N Engk J Med' should be 'N Engl J Med' (New England Journal of Medicine). (2) The volume number (336) corresponds to NEJM around 1997, not 2021, when the journal was in the ~384-385 range. (3) The issue number 10315 is implausibly high for NEJM, which uses much lower issue numbers per volume. (4) The suffix 'e068197' is not consistent with NEJM's standard citation formatting. (5) While Garcia KC is a known researcher (immunology, Stanford), this specific article could not be verified in NEJM. Overall, the citation appears to be fabricated.","Garcia KC is a legitimate researcher (K. Christopher Garcia, structural immunologist at Stanford University). However, there is no verified evidence of this particular article by Garcia KC in the New England Journal of Medicine. The author name alone is plausible, but the context is not.",The title 'Transforming access to diagnostics: how to turn good intentions into action?' is grammatically plausible but could not be matched to any real NEJM article.,"The journal name is misspelled ('N Engk J Med' instead of 'N Engl J Med'). Even with correction, the volume/issue data does not match any known 2021 NEJM issue.","Volume 336 of the New England Journal of Medicine corresponds to approximately 1997, not 2021. In 2021, NEJM was in the 384-385 range.",The issue number '10315' is fabricated; NEJM uses issues numbered up to ~26 per annual volume. The volume '336' does not correspond to 2021 in NEJM.,The pages (1947-1949) are plausible in format but must be considered in conjunction with the incorrect volume and issue numbers.,The 'e068197' does not appear to be a valid elocator or article identifier for NEJM.,"The date '2021 Nov 27' is plausible in format for NEJM, but the volume/issue mismatch makes it impossible for this to be a real NEJM article from 2021.",No DOI is explicitly provided in the citation. The fragment 'e068197' does not correspond to a valid DOI and is not formatted as one.,"No PMCID is provided. If this article existed, it would likely have a PMCID, but it does not appear in PubMed.",No PMID is provided. The article does not appear to exist in PubMed.
minimax-m3,harvard,"The reference as a whole has multiple inconsistencies: misspelled journal name, implausible volume/issue/page numbers, and unusual DOI format. While individual fields like author and title may be plausible, the combination suggests this reference is likely fabricated or contains significant errors.","The author is listed as 'Garcia, K.C.'. This is a single author. The name appears plausible but it is worth noting that Garcia is a common surname. Without further verification, we cannot confirm the author's authenticity.","The title is 'Transforming access to diagnostics: how to turn good intentions into action?'. This title seems plausible for an article about diagnostics, but we cannot verify its authenticity without further context.","The journal is 'The New England journal of meidicne' which appears to be a misspelling of 'The New England Journal of Medicine'. The NEJM is a well-known and reputable medical journal. However, the misspelling suggests a possible error or fabrication.","The volume is listed as '336(10315)'. The New England Journal of Medicine is typically numbered by volume, and recent volumes are in the 380s-390s range. Volume 336 would correspond to issues from 1997, not 2021. The format '336(10315)' is also unusual for NEJM which typically uses a simpler numbering system (e.g., Volume(Issue)).","The issue number is embedded in '336(10315)' as '10315'. For NEJM, issue numbers are typically in the range of 1-26 or similar, not 10315. This number is inconsistent with NEJM's typical issue numbering.","The page range is 'pp. 1947-1949'. For NEJM, page ranges are typically in the thousands (e.g., pp. 1234-1240) for recent issues. The page range 1947-1949 is unusual and does not match typical NEJM pagination.",The DOI/elocator is 'article e068197'. This format does not match standard DOI formats or typical NEJM elocators. NEJM typically uses a DOI like 10.1056/NEJMxxxxx. The format 'article e068197' is not consistent with NEJM's citation style.,"The publication date is listed as '2021 Nov 27'. This date seems plausible for a recent article, but given the other inconsistencies in the reference, it may be fabricated.","No DOI is provided in the reference. While some citations might omit DOI, its absence combined with other inconsistencies raises suspicion.",No PMCID is provided. This is not unusual for recent articles that may not be in PubMed Central yet.,"No PMID is provided in the reference. Its absence is notable for a medical journal article, but not conclusive."
nemotron-3-super-120b-a12b,harvard,"Multiple bibliographic elements contain clear errors (misspelled journal name, impossible volume/issue, nonexistent page/article ID) and no matching record exists in PubMed/NEJM archives.",No record of a K.C. Garcia authoring an NEJM article with this title in late 2021.,The exact title does not appear in PubMed/NEJM listings for the given date.,Misspelled 'meidicne' instead of 'medicine'; the correct journal is *The New England Journal of Medicine*.,NEJM volume 336 does not correspond to 2021; volume numbers around that year are in the high 380s.,"Issue 10315 is implausible for NEJM, which uses monthly/bi‑monthly numbering, not five‑digit issue numbers.",Page range 1947‑1949 and article identifier e068197 do not match any NEJM article from late 2021.,Article identifiers of the form e##### are not used by NEJM; they use DOI or PMID.,No NEJM issue on 27 Nov 2021 matches the cited volume/issue/pages.,No DOI supplied; a search for the title/authors yields no matching DOI.,No PMCID located.,No PMID found for this citation.
