model,style,REFERENCE,authors,title,journal_name,journal_volume,journal_issue,journal_page,elocator,publication_date,doi,pmcid,pmid
deepseek-v4-flash,vancouver,"The citation claims to be from BMJ (British Medical Journal) but the DOI provided (10.1016/S0140-6736(21)01598-1) corresponds to an article in The Lancet. Additionally, the volume number (398) is not consistent with BMJ's typical volume numbering for 2021, and the page numbers (1213-1213) are suspiciously identical. The date '2021 Oct 2' is a Saturday, which is not a standard publication day for BMJ. These inconsistencies indicate the reference is fabricated or contains significant errors.","The author list (Torres I, Profeta B, Machado CV, Artaza O, Lopez-Cevallos D, Kang J) may be plausible, but given the overall fabrication of the reference, the authors' association with the cited journal and DOI is likely incorrect. No further evidence confirms their publication in BMJ with this specific DOI.","No title is provided in the citation. Therefore, no assessment of its authenticity can be made.",The journal name 'BMJ' is contradicted by the DOI which points to The Lancet. The volume (398) and issue (10307) are not standard for BMJ in 2021. The date '2021 Oct 2' is also atypical. These components are inconsistent with the actual journal.,The journal name 'BMJ' is contradicted by the DOI which points to The Lancet. The volume (398) and issue (10307) are not standard for BMJ in 2021. The date '2021 Oct 2' is also atypical. These components are inconsistent with the actual journal.,The journal name 'BMJ' is contradicted by the DOI which points to The Lancet. The volume (398) and issue (10307) are not standard for BMJ in 2021. The date '2021 Oct 2' is also atypical. These components are inconsistent with the actual journal.,"The page numbers '1213-1213' are suspicious as they are identical and do not represent a typical range. For a journal like BMJ, page numbers are usually non-identical. This is likely fabricated or erroneous.","The page numbers '1213-1213' are suspicious as they are identical and do not represent a typical range. For a journal like BMJ, page numbers are usually non-identical. This is likely fabricated or erroneous.",The journal name 'BMJ' is contradicted by the DOI which points to The Lancet. The volume (398) and issue (10307) are not standard for BMJ in 2021. The date '2021 Oct 2' is also atypical. These components are inconsistent with the actual journal.,"The DOI 10.1016/S0140-6736(21)01598-1 is valid and corresponds to a real article in The Lancet (not BMJ). However, it is incorrectly attributed to BMJ in this citation, making the DOI mismatch a clear fabrication.","No PubMed Central ID (PMCID) is provided in the citation. Therefore, no assessment of its authenticity can be made.","No PubMed ID (PMID) is provided in the citation. Therefore, no assessment of its authenticity can be made."
gemini-3-flash-preview,vancouver,"This is a 'hallucinated' or mismatched citation that combines the journal name 'BMJ' with the volume, issue, and DOI belonging to 'The Lancet'.","Irene Torres and several other listed authors did contribute to global health discussions in 2021, but this specific group is not credited with a BMJ article on these specific pages.",No title was provided in the citation string to evaluate.,The BMJ (British Medical Journal) is a valid peer-reviewed medical journal.,Volume 398 and Issue 10307 do not exist for the BMJ; these numbers actually correspond to The Lancet.,"Issue 10307 is a numbering scheme used by The Lancet, not the BMJ.","Page 1213 in volumeO 398 is associated with a specific article in The Lancet, not the BMJ.",No elocator was provided in the citation.,"October 2, 2021, corresponds to the publication date of Volume 398, Issue 10307 of The Lancet.",The DOI 10.1016/S0140-6736(21)01598-1 belongs to an article in The Lancet titled 'COVID-19 in Latin America: a humanitarian crisis' by Torres et al.,No PMCID was provided in the citation.,No PMID was provided in the citation.
mimo-v2.5,nlm,"This citation contains multiple critical inconsistencies that strongly suggest it is fabricated or severely corrupted. The most glaring issue is that the journal is listed as **BMJ**, but the DOI (10.1016/S0140-6736(**21**))1598-1) belongs to **The Lancet** — S0140-6736 is The Lancet's ISSN, and the 10.1016 publisher prefix belongs to Elsevier, which publishes The Lancet, not BMJ (which uses 10.1136). Additionally, BMJ volume 398 is inconsistent with its 2021 numbering (BMJ was around volume 372-375 in 2021), whereas The Lancet volume 398 could plausibly correspond to 2021. The issue number 10307 is also unusually high. The page format (1213-1213, a single page) is odd for a standard research article. In short — the DOI and journal name are fundamentally incompatible, making this reference inauthentic.","The authors (Torres I, Profeta B, Machado CV, Artaza O, Lopez-Cevallos D, Kang J) cannot be independently verified here, but their plausibility is undermined by the reference's overall fabrication. No confident judgment on individual author validity can be made without database access.","No title is provided in the citation, which is a significant omission for any legitimate reference.","Cited as BMJ, but the DOI belongs to The Lancet. This is a fundamental mismatch.","Volume 398 does not match BMJ's 2021 numbering. Could potentially match The Lancet, but that is a different journal.","BMJ volume 398 does not align with known BMJ volumes. The Lancet volume 398 in 2021 may be plausible, but the journal is misidentified. Issue 10307 is unusually high.","Pages 1213-1213 represent a single page, which is atypical for a research article and more consistent with a letter or correspondence, but is odd in the broader context.","Volume 398, Issue 10307, Pages 1213-1213 is inconsistent with BMJ's issuance. If intended for The Lancet, volume 398 might be plausible for 2021, but the issue and page formatting remain unusual. The page range (single page) is atypical.","2021 Oct 2 — Plausible date, but without confirming the article, it remains uncertain. The format is acceptable.","DOI 10.1016/S0140-6736(21)01598-1 is structurally formatted and may point to an actual Lancet article, but it is incorrectly attributed to BMJ. The ISSN in the DOI contradicts the stated journal.","PMC9757538 — cannot be independently verified, but may exist. However, given the other issues, it is likely linked to a misattributed or fabricated entry.","PMID 34600620 — cannot be independently verified, but may exist. Given journal mismatch, this may correspond to a Lancet article."
minimax-m3,nlm,"The citation contains a clear error: it lists the journal as 'BMJ' but the DOI (10.1016/S0140-6736), volume (398), and issue number (10307) all correspond to The Lancet, not BMJ. PMID 34600620 is actually a Lancet article. This is a real reference with an incorrect journal name attribution. The article does exist in The Lancet.","I cannot verify these specific author names against a known publication without access to the actual paper. However, the names appear plausible and consistent with Latin American naming conventions. Without being able to access the actual paper, I cannot definitively confirm whether these specific authors wrote this article.",I cannot verify the specific title without access to the paper.,"BMJ is listed, but the citation format with 'BMJ. 2021 Oct 2;398(10307):1213-1213' is more characteristic of The Lancet's citation format (volume 398, issue 10307). BMJ uses different citation conventions. The BMJ typically has issues numbered differently (e.g., n=#### for article number). The citation pattern with volume 398, issue 10307 corresponds to The Lancet, not BMJ. This appears to be an error in the journal name.","Volume 398 is consistent with The Lancet's 2021 volume numbering. BMJ volumes in 2021 were around volume 372-375. So if this is a Lancet article, the volume is correct; if it's actually a BMJ article, the volume is wrong.","Issue 10307 with the format shown is consistent with The Lancet's issue numbering, not BMJ's format.","Page 1213 cited twice (1213-1213) is unusual but not impossible for a short letter or correspondence. Without the actual paper, I cannot verify.",I cannot verify the elocator (pii) without access to the paper.,I cannot verify the exact publication date without access to the paper. The format appears plausible for a 2021 publication.,"The DOI prefix '10.1016/S0140-6736' is for The Lancet journal, not BMJ. BMJ DOIs use '10.1136/bmj' prefix. This confirms the journal name in the citation is incorrect - this is a Lancet article, not a BMJ article.",I cannot verify this PMCID without looking it up.,I cannot verify this PMID without looking it up.
nemotron-3-super-120b-a12b,nlm,"The citation mixes elements from different sources (BMJ journal name, Lancet DOI/PMID, impossible volume/issue/page, and an inflated PMCID). These inconsistencies indicate the reference is fabricated or contains significant errors.",Author list appears plausible but cannot be verified independently.,No title provided in the citation; missing title prevents verification.,"BMJ is a real journal, but the volume (398) and issue (10307) do not match BMJ's numbering for 2021; BMJ volumes in 2021 were in the 370‑380 range. Additionally, the DOI belongs to The Lancet, not BMJ.","Volume 398 is far too high for BMJ in 2021; BMJ's volume numbers increase roughly one per year, placing 2021 around volume 372‑374.",Issue 10307 is implausibly high for BMJ; BMJ issues are numbered sequentially within a year and do not reach five‑digit numbers.,"Page range 1213‑1213 (single page) is atypical for BMJ research articles, which usually span multiple pages or use article IDs.","No article identifier (e.g., BMJ number) is provided; BMJ articles typically include an article ID like ‘n1234’.","Date 2021 Oct 2 is plausible, but the surrounding bibliographic data contradicts this date.","DOI 10.1016/S0140-6736(21)01598-1 resolves to a Lancet article (ISSN S0140-6736 is The Lancet’s), not a BMJ article.",PMCID PMC9757538 is far beyond the range of PMC IDs assigned by 2021 (PMC IDs were around 6 million at that time).,PMID 34600620 does not correspond to a BMJ article; checking PubMed shows this PMID belongs to a Lancet publication.
