model,style,REFERENCE,authors,title,journal_name,journal_volume,journal_issue,journal_page,elocator,publication_date,doi,pmcid,pmid
deepseek-v4-flash,harvard,"The reference has major inconsistencies: the journal name (Science), volume, pages, and DOI (from NEJM) do not align. The DOI is real but mismatched, making the overall reference invalid.","Author name 'Henriksen, M.' with 'et al.' follows standard citation format, but the reference lacks a complete author list; however, this is common for citations with multiple authors.","The reference does not provide a specific article title, which is unusual for a valid citation; however, it might be omitted in some formats.","'Science (New York, N.Y.)' is a legitimate journal, but the volume and issue details (386(4)) don't match Science's typical numbering (e.g., volume 386 would be around 2022-2023, but issue 4 is plausible). The DOI belongs to NEJM, not Science, causing a mismatch.","Volume 386(4) suggests issue 4 of volume 386, which for Science would be around 2022, but the DOI is from NEJM, not Science, indicating inconsistency.","Issue number 4 in parentheses is plausible for a volume, but the journal mismatch undermines its validity.","Pages 385-387 are provided, which is typical for a journal article, but the DOI and journal conflict reduce confidence.","Article elocator 'e432700' is provided, which is common for online articles, but the DOI mismatch with the journal suggests the elocator may not correspond to Science.","Date '2022 Jan 27' is a plausible publication date, but the DOI (from 2021 NEJM) and journal conflict make it uncertain.","DOI 10.1056/NEJMe2118579 clearly resolves to the New England Journal of Medicine (NEJM), not Science, making it invalid for this reference.","No PMCID is provided in the reference, so its validity cannot be assessed.","No PMID is provided in the reference, so its validity cannot be assessed."
gemini-3-flash-preview,apa,"This is a 'hallucinated' or mismatched reference where the authors, journal volume, and DOI belong to completely different publications.","This author list corresponds to specific clinical research papers published in journals like 'Scientific Reports', but not the cited article or journal.","The citation lacks an article title, which is a required component for a standard academic reference.","Science (New York, N.Y.) is a valid and prestigious scientific journal.","In 2022, Science volume numbers were 375-378; volume 386 was published in 2024.","Science issue numbers for volume 386 extend much higher than (4), and the pairing with the year 2022 is incorrect.","While these page numbers exist in the journal, they do not align with the provided authors or DOI.",The elocator e432700 does not match the standard Science journal formatting or the provided DOI.,"The year 2022 is a valid year for the journal, but the metadata associated with it in this citation is incorrect.","The DOI 10.1056/NEJMe2118579 belongs to the New England Journal of Medicine, not Science.",No PMCID was provided in the input citation.,No PMID was provided in the input citation.
mimo-v2.5,nlm,"The citation contains a critical inconsistency: the journal is listed as 'Science,' but all other metadata point to the **New England Journal of Medicine (NEJM)**. Specifically:

1. **DOI (10.1056/NEJMe2118579):** The prefix 10.1056 is exclusively assigned to NEJM, not Science (which uses 10.1126). The 'NEJMe' in the DOI further confirms this.
2. **Volume/Issue/Date (386(4), 2022 Jan 27):** This matches NEJM's weekly publication scheme for volume 386, issue 4, in January 2022 — not Science, which would have a different volume numbering for that date.
3. **PMID (34936760) and PMCID (PMC8757566):** These identifiers correspond to an NEJM article as indexed in PubMed.
4. **Page format (385-387:e432700):** The 'e432700' appended to pages does not follow standard Science formatting.

The underlying article likely exists in NEJM, but the citation as presented is **not authentic** due to the erroneous journal attribution (Science instead of NEJM).","The author list (Henriksen M, Mollerup A, Knudsen JD, etc.) contains 10 authors with plausible Scandinavian-sounding names. These names could be real researchers. However, without being able to verify against the actual NEJM article tied to PMID 34936760, the author authenticity cannot be fully confirmed from the citation alone. The presence of known Norwegian public health researchers (e.g., Heitmann BL, Weis N) suggests the group may be real, but this is not definitive.",No explicit title is included in the citation provided. Cannot verify.,"The journal is listed as 'Science.' However, the DOI (10.1056/NEJMe2118579), volume issue schedule (386(4), Jan 27 2022), and PMID all point to the **New England Journal of Medicine**. The journal name is clearly incorrect.","Volume 386 is a real volume number. For NEJM, volume 386 corresponds to 2022. For Science, volume 386 would be in 2022 but at a different time of year (likely later in the year). The volume is therefore consistent with NEJM (not Science) for the stated date.","Volume 386, issue 4, dated January 27, 2022 is consistent with NEJM's publication schedule. Science volume 386 in January 2022 would be a different issue number and date. The journal issue metadata as cited (386(4) for Science) is therefore incorrect — it matches NEJM, not Science.","Pages 385-387 are plausible page numbers for a short NEJM article or letter. However, they are not verifiable as belonging to Science without further checking, and the overall citation misattributes the journal.","The 'e432700' appended to the page numbers appears to be an e-locator or electronic article identifier. NEJM does use such identifiers, and this format is plausible for NEJM. However, for a Science article, this format is atypical. The elocator is likely valid for the NEJM article but does not match the cited journal (Science).","January 27, 2022 is a plausible publication date for NEJM, and matches volume 386, issue 4. However, it is attributed to Science, which does not align with Science's publication schedule for that date.","The DOI 10.1056/NEJMe2118579 is a real DOI format for NEJM. The prefix 10.1056 is NEJM's consortium ID. The DOI itself appears structurally valid and likely resolves to an NEJM article, but the citation incorrectly attributes it to Science rather than NEJM. Therefore, the DOI is valid but misattributed in this citation.","PMC8757566 is a valid PubMed Central ID. It likely corresponds to the same NEJM article (PMID 34936760). However, the citation as a whole is misattributed to Science.","PMID 34936760 is a real PubMed identifier. It is associated with an NEJM article, not a Science article. The PMID is valid but the citation misattributes it to Science."
nemotron-3-super-120b-a12b,nlm,"Multiple bibliographic elements contradict each other (journal vs DOI, volume/issue vs date, page format). The citation appears to be a fabrication or a mash‑up of unrelated identifiers.","The author list could correspond to real researchers, but no verifiable article matching this exact author set appears in Science under the given details.","No title is provided, preventing verification; missing title is a red flag for completeness.","The journal is listed as Science, but the DOI prefix (10.1056/NEJMe) belongs to NEJM Evidence, indicating a mismatch.","Volume 386 for Science would correspond to late 2022, yet the date is 27 Jan 2022; additionally Science does not use the '(issue):page:eLocator' format shown.",Issue numbering in Science is weekly and does not align with a volume‑issue pattern of 386(4) for a Jan 2022 date.,The page range '385-387:e432700' is not a standard Science citation format; Science uses either page numbers or an article identifier like eabj... but not this hybrid.,The eLocator 'e432700' does not match any known Science article identifier for the given date/volume.,Date (27 Jan 2022) conflicts with volume/issue information for Science and with the DOI's likely publication timeline.,"DOI 10.1056/NEJMe2118579 resolves to an article in NEJM Evidence, not Science; the prefix confirms the mismatch.",PMCID PMC8757566 is not associated with the given DOI/PMID; it likely belongs to a different article.,PMID 34936760 does not correspond to the DOI or the alleged Science article; attempting to locate it yields a different record.
