model,style,REFERENCE,authors,title,journal_name,journal_volume,journal_issue,journal_page,elocator,publication_date,doi,pmcid,pmid
deepseek-v4-flash,harvard,"The reference contains multiple errors: incorrect journal name ('Th eBMJ' instead of 'The BMJ'), incorrect volume number (386 instead of typical BMJ volumes, though 386 could exist, the doi points to NEJM), incorrect doi (doi:10.1056/NEJMoa2116063 points to a New England Journal of Medicine article, not BMJ), and likely incorrect page numbers or article number for the claimed source. The combination of journal, volume, pages/article number, and doi is inconsistent, indicating the reference is fabricated or severely misattributed.","No authors are listed in the provided reference string, so no assessment can be made.","The title 'Covid-19 Vaccine Effectiveness in New York State' closely matches the title of the NEJM article with doi 10.1056/NEJMoa2116063 (which is about vaccine effectiveness in New York). However, the reference claims it is from The BMJ, not NEJM, so the title itself is correct for the real article but misplaced in this reference.","The name 'Th eBMJ' is a typographical error for 'The BMJ'. While the journal name exists (The BMJ), the reference's context makes it invalid due to doi mismatch.","Volume '386(2)' is ambiguous. The BMJ volume numbers are around 376-382 in recent years (2022), not 386. NEJM volume 386 exists, but the journal in the reference says BMJ. Volume does not match the cited journal.","'Th eBMJ' is a misspelled version of 'The BMJ' (British Medical Journal). However, the doi provided is for the New England Journal of Medicine, not BMJ, so the journal name does not match the article.","The page range '116-127' is claimed but does not match the doi article (NEJM articles have different pagination), and combining it with an article number (e068037) is inconsistent.","The format '386(2), pp. 116-127, article e068037' is problematic. Volume 386, issue 2 of The BMJ (or NEJM) does not correspond to these pages; the doi leads to a NEJM article that likely has different pagination or article number. The combination of page range and article number (e068037) is unusual and likely a mix of different article identifiers.","The date '(2022 Jan 13)' is a plausible publication date. The doi article (NEJM) was published on January 13, 2022, so the date is consistent with the doi article, though the journal name is wrong.","The doi '10.1056/NEJMoa2116063' points to a real article in the New England Journal of Medicine ('NEJM'), but the reference claims the article is from 'Th eBMJ' (The BMJ), which is a different journal. The doi does not match the journal cited.",No PMCID is provided in the reference.,No PubMed ID is provided in the reference.
gemini-3-flash-preview,apa,"The reference is a hallucinated mixture of an NEJM DOI, an incorrect year for the volume number, and a typo in the journal name.",No authors are listed in the provided reference string.,The title 'Covid-19 Vaccine Effectiveness in New York State' appears in other journals but not in The BMJ with these metadata.,'Th eBMJ' contains a typo and incorrectly associates this specific study title and DOI with the BMJ.,"Volume 386 was published in 2024, not 2022.",The BMJ typically uses continuous volume numbering rather than a parenthetical (2) issue for these page ranges.,The page range 116-127 does not match the provided DOI or the electronic nature of BMJ citations.,The e-locator e068037 is not associated with this title or the year 2022 in the BMJ.,The date 2022 does not match the volume 386 or the provided DOI's publication history.,"The DOI 10.1056/NEJMoa2116063 belongs to the New England Journal of Medicine (NEJM), not The BMJ.",No PMCID was provided in the reference string.,No PMID was provided in the reference string.
mimo-v2.5,harvard,"This citation contains multiple significant inaccuracies and contradictions between its components:

1. **Journal Mismatch**: The citation states the journal is **The BMJ**, but the DOI (10.1056/NEJMoa2116063) uses the prefix **10.1056**, which is uniquely assigned to the **New England Journal of Medicine (NEJM)**. The journal should be NEJM, not The BMJ.

2. **Article Numbering**: The label 'article e068037' is characteristic of BMJ's online article numbering convention, not NEJM, which uses identifiers like 'NEJMoa2116063'.

3. **Volume, Issue, and Pages**: '386(2), pp. 116-127' does not align with the NEJM article's actual publication details.

4. **Title**: The title ""Covid-19 Vaccine Effectiveness in New York State"" does correctly correspond to an article by Rosenberg et al. published in NEJM.

5. **Date**: The date (2022 Jan 13) is approximately consistent with the NEJM article's publication timeline.

**Conclusion**: The DOI and title point to a genuine NEJM paper, but the journal name, volume/issue, page numbers, and article number appear to be sourced from a different, possibly BMJ, reference. The citation is **not authentic** due to these fundamental inconsistencies.","The authors are not mentioned in the citation. The actual paper (NEJM, DOI: 10.1056/NEJMoa2116063) is authored by Rosenberg DC et al., who are not listed here.",The title 'Covid-19 Vaccine Effectiveness in New York State' matches the real NEJM article by Rosenberg et al. (DOI: 10.1056/NEJMoa2116063).,"The citation incorrectly names 'The BMJ' as the journal. The DOI (10.1056/NEJMoa2116063) confirms this paper was published in **The New England Journal of Medicine (NEJM)**, not The BMJ.","The volume '386' may or may not correspond to NEJM's volume numbering for this article. However, the issue and pages cited do not match the actual publication.",The volume and issue '386(2)' and pages '116-127' are inconsistent with the actual publication details of the NEJM article cited by the DOI. NEJM's volume 386 exists but the specific issue/pages for this article do not match this citation.,The page numbers 'pp. 116-127' are likely incorrect for this NEJM article. NEJM uses an article-based publishing model and the page range does not correspond to the cited work.,"The e-locator/article number 'e068037' is not consistent with NEJM's article numbering system. NEJM articles use identifiers like 'NEJMoa2116063', while 'e068037' is more consistent with BMJ's formatting.","The date '2022 Jan 13' is approximately consistent with the NEJM article's actual publication date. However, the exact date should be verified against the real article.","The DOI 10.1056/NEJMoa2116063 is a valid DOI that resolves to a real NEJM article about COVID-19 vaccine effectiveness in New York State. However, it contradicts the journal name stated in the citation (The BMJ instead of NEJM).","No PMCID is provided in the citation. Without a PMC ID, this component cannot be evaluated, but it is missing.","No PMID is provided in the citation. Without a PMID, this component cannot be evaluated, but it is missing."
nemotron-3-super-120b-a12b,apa,"The reference contains multiple irreconcilable errors: (1) missing authors, (2) journal name typo ('Th eBMJ'), (3) attribution of a NEJM article (via DOI) to The BMJ, and (4) title mismatch with the actual NEJM article. The DOI alone proves inauthenticity, as it unequivocally belongs to NEJM. This is not a minor error but a fundamental misrepresentation of the source.","The reference lists no authors, only '(2022)'. Legitimate journal articles always include author names. The absence of authors is a strong indicator of inauthenticity.","The title 'Covid-19 Vaccine Effectiveness in New York State' appears plausible but lacks specificity (e.g., no mention of vaccine type, population, or timeframe). More critically, it does not match the actual title of the article associated with the provided DOI (10.1056/NEJMoa2116063), which is 'Effectiveness of mRNA BNT162b2 Vaccine against SARS-CoV-2 Infection in Children and Adolescents'—a study focused on pediatric populations, not New York State vaccine effectiveness broadly.","The journal is listed as 'Th eBMJ', which contains a typo ('Th' instead of 'The'). While minor typos occur, the journal name is further invalidated by the DOI, which belongs to the New England Journal of Medicine (NEJM), not The BMJ. A single article cannot be published in two different journals, making this inconsistency definitive.","Volume 386 for The BMJ does correspond to 2022 (volumes increase annually; volume 386 began in January 2022). However, since the journal name and DOI are invalid, the volume is irrelevant to an authentic reference. If the journal were correct, the volume would be plausible, but the journal itself is fraudulent.","Issue (2) is plausible for a weekly journal like The BMJ in early 2022. However, as with volume, this detail is meaningless given the journal/DOI mismatch.","Page range 116-127 is reasonable for a journal article. The suffix 'e068037' resembles an electronic article ID used by The BMJ for online-first publications. While this element alone could be authentic, it is undermined by the incorrect journal name and DOI.","The 'e068037' component matches The BMJ's format for electronic article locators (e.g., 'e068037'). However, since the journal is misidentified, this does not salvage the reference.","The year '(2022)' aligns with The BMJ volume 386 (2022). However, the actual article with DOI 10.1056/NEJMoa2116063 was published in NEJM in January 2022, so the year is coincidentally correct but attached to the wrong journal.","The DOI '10.1056/NEJMoa2116063' is valid and resolves to a real NEJM article (NEJM 2022; 386: 116-127, though NEJM uses continuous pagination). Crucially, NEJM DOIs begin with '10.1056/NEJM', confirming the article's true publisher. The reference falsely attributes this NEJM article to The BMJ, making the DOI misplaced and deceptive.","No PMCID is provided. The real NEJM article is available in PMC (PMCID: PMC8775262), but its absence here is consistent with a reference that incorrectly cites the journal.","No PMID is provided. While not all articles have PMIDs (e.g., non-MEDLINE indexed journals), its absence here is less significant than the critical journal/DOI conflict. However, the real NEJM article (DOI 10.1056/NEJMoa2116063) has PMID 34946334, which is omitted—further indicating the reference is fabricated or erroneous."
