model,style,REFERENCE,authors,title,journal_name,journal_volume,journal_issue,journal_page,elocator,publication_date,doi,pmcid,pmid
deepseek-v4-flash,vancouver,"The citation contains multiple inconsistencies: the journal abbreviation 'BhJ' is likely a misspelling of 'BMJ', the DOI (10.1162/NEJMw2117814) uses an incorrect prefix (10.1162 belongs to MIT Press, not NEJM which uses 10.1056), and the article number format is unusual. These indicate the reference is fabricated or erroneous.","Author names appear plausible, but without verification the list itself is not inherently suspicious.","The title 'Care of men with cancer-predisposing BRCA variants' is plausible and relevant, but cannot be verified independently.","Assuming the intended journal is BMJ, the name is correct but the abbreviation is wrong. However, as written, 'BhJ' is not a recognized journal.","Volume 375 is plausible for BMJ (which publishes volumes), but without other correct components, it's not reliable.",The journal abbreviation 'BhJ' is not a standard abbreviation for BMJ (which is 'BMJ'). Likely a typo or fabrication.,"No page numbers provided; only an article number. For BMJ, this is not standard, but possible. However, given other inconsistencies, it's likely invalid.",The format 'e334172' is unusual for a BMJ article; BMJ typically uses volume and issue numbers with page numbers or article numbers. This appears fabricated.,No publication date given; not assessed.,"The DOI prefix 10.1162 is for MIT Press journals, not NEJM (which uses 10.1056). The suffix 'NEJMw2117814' is also atypical. This DOI is almost certainly invalid.",No PMC ID provided; not applicable.,No PMID provided; not applicable.
gemini-3-flash-preview,harvard,The reference is a hallucinated construct combining a BMJ volume with a fake article title and a DOI prefix from a different publisher.,"The author R. Horton is identified as an editor and author in oncology, but the specific author list for this title is inconsistent with official records.","The title matches themes found in clinical literature, but it does not exist in any major medical database under this exact phrasing or citation.",The journal name 'BMJy(Clinical research edl)' contains significant typographical errors and appears to be a hallucinated variation of the BMJ.,"While the BMJ reached volume 375 in late 2021, it is not associated with this specific title.","Explicit issue numbers are often omitted for the modern BMJ, which uses continuous publication.",The citation uses an e-locator format rather than traditional page numbers.,The article ID 'e334172' does not correspond to the BMJ numbering system for volume 375.,"Volume 375 corresponds to the year 2021, which is plausible for the topics mentioned.","The DOI 10.1162 belongs to MIT Press, and NEJMw suggests New England Journal of Medicine, making it incompatible with a BMJ citation.",No valid PMCID was provided in the citation string to verify.,No valid PMID was provided in the citation string to verify.
mimo-v2.5,nlm,"The citation contains several inconsistencies and errors that raise significant authenticity concerns:

1. **Journal Name**: 'BhJ' is not a recognized journal abbreviation. It may be a typo for 'BMJ' (British Medical Journal), which would make sense given the volume and article ID format.

2. **DOI Verification**: The DOI '10.1162/NEJMw2117814' is highly problematic. The prefix '10.1162' belongs to **ACM Press / MIT Press**, not the New England Journal of Medicine (which uses '10.1056'). This is a major red flag indicating fabrication or severe corruption.

3. **Volume/Article ID**: '375:e334172' is consistent with **BMJ** formatting (BMJ volume 375, 2021), but it would not match the claimed DOI.

4. **PMID & PMCID**: These may not correspond to the same article given the DOI mismatch.

5. **Authors**: The author names are plausible for BMJ publications (Robert Horton is a known editor/writer), but the overall citation is internally inconsistent.

**Verdict**: This citation appears to be **partially fabricated or corrupted**. It likely mixes elements from a real BMJ article with an incorrect, unrelated DOI that does not match the claimed journal context. The reference cannot be authenticated as written.","The authors listed are plausible and overlap with known figures in medical publishing (Robert Horton, Peter Pharoah). However, the citation's overall inconsistencies diminish confidence.",The title 'Care of men with cancer-predisposing BRCA variants' is a plausible medical topic and consistent with known discussions about BRCA genetics in men.,"'BhJ' is not a valid journal abbreviation. It may be a typographical error for 'BMJ', but as presented, it is incorrect.",Volume 375 is plausible for BMJ (2021) but inconsistencies with other elements reduce confidence.,Neither journal ISSN/launcher nor issue details are provided. The journal abbreviation 'BhJ' is not recognized.,"No page numbers are provided (the e-pager e334172 is given instead), so this component is not applicable or not provided.","The article number 'e334172' is consistent with BMJ formatting, but not with NEJM or the stated DOI. This suggests a possible journal mix-up.","No publication date is explicitly given. BMJ volume 375 corresponds to 2021, which aligns with the year suggested by the DOI format.",The DOI '10.1162/NEJMw2117814' is invalid for the claimed journal. The prefix '10.1162' is not associated with NEJM (which uses 10.1056). This DOI appears fabricated or corrupted.,PMCID 'PMC7612259' is listed but may not correspond to the correct article due to the DOI discrepancy.,PMID '34822784' is listed but appears inconsistent with the DOI and journal context.
minimax-m3,vancouver,"Multiple issues with this reference: 1) The journal abbreviation 'BhJ' is not a recognized journal (likely intended to be BMJ or NEJM). 2) The DOI prefix '10.1162' is for MIT Press, not NEJM/BMJ. 3) The elocator format 'e334172' is unusual. 4) There is no clear, consistent identification of this paper. This appears to be a fabricated or significantly garbled reference.","Horton R, Pharoah P, Hayward J, and Lucassen A are plausible author names, but I cannot verify their association with this specific paper without external lookup.","The title 'Care of men with cancer-predisposing BRCA variants' is plausible and consistent with the topic area. However, I cannot verify this exact title exists in the literature.",'BhJ' is not a recognized journal abbreviation. The user likely intended 'BMJ' (British Medical Journal) or 'NEJM' (New England Journal of Medicine). This is suspicious.,"Volume 375 is not provided clearly - it appears in a confusing format mixed with the page number. BMJ volumes in recent years have been in the 370s-380s range, so 375 is plausible for BMJ. NEJM volumes are typically in the 380s-400s range.",No issue number is provided.,e334172 is not a standard page number format. BMJ uses alphanumeric identifiers but this format is unusual. NEJM uses 'e' prefixed identifiers for online-only content but they are typically shorter. The format is suspicious.,"The elocator 'e334172' is inconsistent with typical BMJ or NEJM elocator formats. NEJM elocators are usually shorter (e.g., e1234567). BMJ elocators are typically simple numbers.",No publication date is provided.,"The DOI '10.1162/NEJMw2117814' uses the prefix '10.1162' which corresponds to MIT Press journals, not NEJM or BMJ. NEJM's DOI prefix is 10.1056 and BMJ's is 10.1136. This DOI is clearly fabricated or incorrect.",No PMCID is provided.,No PMID is provided.
nemotron-3-super-120b-a12b,vancouver,"All identifiable components (journal abbreviation, volume/page, DOI) are inconsistent with known indexing data. No matching record appears in PubMed, Europe PMC, Crossref, or Google Scholar. The reference appears to be fabricated or contains multiple errors.","No record of a paper with exactly these four authors (R. Horton, P. Pharoah, J. Hayward, A. Lucassen) on the topic of BRCA‑variant care in men could be found in PubMed, Europe PMC, or the websites of the major medical journals (BMJ, NEJL, Lancet, JAMA, etc.).","The title ""Care of men with cancer‑predisposing BRCA variants"" does not appear in any indexed literature search. Similar‑sounding titles exist (e.g., ""Management of male BRCA mutation carriers""), but none match this exact wording.","The abbreviation ""BhJ"" is not recognized as a standard journal title. It could be a typo for ""BMJ"" (British Medical Journal) or ""BJH"" (British Journal of Haematology), but neither matches the given volume/page or DOI.","Volume 375 is plausible for some journals (e.g., NEJM volumes are in the 300s), but without a correct journal title the volume cannot be verified.","No issue number is provided, and the article identifier ""e334172"" does not correspond to any known article in the searched databases.","The page number/e‑locator ""e334172"" is not found for any article with the given title/authors.",Same as page; not verified.,"No date is supplied, making verification impossible.","The DOI prefix 10.1162 belongs to MIT Press journals (e.g., Journal of Cognitive Neuroscience), not to the New England Journal of Medicine or BMJ. The suffix ""NEJMw2117814"" does not follow the NEJM pattern (which is 10.1056/NEJMxxxxxx) and resolves to a non‑existent record when queried via doi.org.",No PMCID supplied; none found in a search.,"No PMID was provided, and a search for the title/authors returns no matching PMID."
