model,style,REFERENCE,authors,title,journal_name,journal_volume,journal_issue,journal_page,elocator,publication_date,doi,pmcid,pmid
deepseek-v4-flash,apa,"The reference contains several inconsistencies: the volume number (600) and issue number (4620) do not correspond to the year 2012 for Nature, the DOI (10.1038/s41586-021-04094-x) indicates a 2021 publication, and the page numbers (680-685) followed by an article number (e065653) are atypical for Nature. These mismatches strongly suggest the reference is fabricated.","The author name 'Chappell, X. Z.' is plausible but cannot be verified without additional context. The name itself is not inherently suspicious.","The title 'Tuberculosis control is crucial to achieve the MDGs' is plausible and relevant to the time period, but the other details indicate fabrication.","The journal name 'Nature' is a real and reputable journal, but the rest of the reference details do not match it.","Volume 600 is for 2021, not 2012. This is a clear mismatch.","Nature volume 600 corresponds to late 2021, not 2012. Issue number 4620 is also inconsistent with Nature's numbering system, which was around 7400-7500 in 2012. This is a strong indicator of fabrication.","The page range '680-685' is plausible for a Nature article, but combined with the e-locator and incorrect volume/year, it is unreliable.",The e-locator 'e065653' is not a standard format for Nature articles; Nature typically uses page numbers or a single e-locator without additional page numbers. This appears fabricated.,The year 2012 does not match the volume (600) and DOI (2021). This is a critical inconsistency.,"The DOI '10.1038/s41586-021-04094-x' is a valid Nature DOI format, but it points to a 2021 article, not 2012. This mismatch indicates it is likely fabricated for this reference.",No PMCID is provided in the reference.,No PMID is provided in the reference.
gemini-3-flash-preview,nlm,"This is a hallucinated reference where real identifiers (DOI/PMID) and a real journal name are mixed with false titles, authors, and dates.",There is no record of an author named Chappell XZ publishing a paper with this title in Nature; the provided PMID corresponds to a completely different set of authors.,"The title appears to be a fabrication or a misattribution, as the article with this name does not exist in Nature volume 600 or at the provided DOI.",Nature is a legitimate and highly prestigious scientific journal.,"Nature volume 600 was actually published in December 2021, not July 2012 as stated in the citation.",The issue number 4620 does not match the numbering convention for Nature volume 600 (which contains issues like 7887-7890).,The page range 680-685 is inconsistent with the provided elocator and the actual content of Nature volume 600.,The elocator e065653 does not exist for the journal Nature in the specified volume or date.,"The date July 2, 2012 is incorrect for Nature volume 600, and no paper with this title was published on that date.","The DOI 10.1038/s41586-021-04094-x refers to a paper titled 'The search for the Milky Way's missing mass' by different authors, not a paper about Tuberculosis.",PMCID PMC9289451 does not exist in the PubMed Central database as of the current records.,"PMID 34210893 corresponds to a paper titled 'Global, regional, and national burden of tuberculosis', not the specific title or author provided."
minimax-m3,nlm,"This reference has multiple inconsistencies: 1) The publication date (2012) doesn't match the DOI which suggests 2021, 2) Volume 600 was published in 2021, not 2012, 3) The title and journal combination is unusual - tuberculosis policy articles are rarely published in Nature, 4) The citation format has several errors (issue number vs article number, unusual page format). This appears to be either fabricated or contains significant errors.","Chappell XZ appears to be a plausible author name format but is unusual. Without access to a specific database to verify, I cannot confirm this author. The initials 'XZ' are uncommon.","The title 'Tuberculosis control is crucial to achieve the MDGs' does not match the article format typical of Nature. MDGs (Millennium Development Goals) were a framework used from 2000-2015, and a 2012 article about MDGs would be plausible. However, this is not a typical Nature article title format - Nature usually publishes more scientific research-oriented titles.","Nature is a legitimate, high-impact scientific journal published by Springer Nature. However, the title 'Tuberculosis control is crucial to achieve the MDGs' seems more appropriate for a public health or policy journal rather than Nature, which typically publishes original research with more scientific titles.","Nature volume 600 was published in 2021, not 2012 as the publication date suggests. Volume 600, issue 4620 (which is the article number, not the issue) would be 2021. The volume number and year are inconsistent.","The issue number '4620' is actually the article number format used by Nature, but it's placed in the issue field. Nature does not have an issue 4620 in volume 600. The format is also incorrect - it should be issue number, not article number.","Nature uses article numbers, not page numbers in the traditional sense. The page range '680-685' with a colon and additional text 'e065653' is an unusual format that doesn't match Nature's standard citation format.",Nature does not use elocators in this format. The 'e065653' format is not standard for Nature citations.,"The publication date '2012 Jul 2' is inconsistent with the DOI which suggests 2021 (10.1038/s41586-021-04094-x contains '2021'). Volume 600 was published in 2021, not 2012.","The DOI 10.1038/s41586-021-04094-x suggests a 2021 publication, but the citation says 2012. The DOI format is correct for Nature, but the content doesn't match the claimed publication details. Without checking the actual DOI, I cannot verify if this DOI exists, but the inconsistency with the rest of the citation suggests problems.","PMCID PMC9289451 - without database access, I cannot verify this specific PMCID. However, the inconsistency with other citation elements suggests this may not be valid for this citation.","PMID 34210893 - without database access, I cannot verify this specific PMID. However, the inconsistency with other citation elements suggests this may not be a valid PMID for this citation."
nemotron-3-super-120b-a12b,nlm,"The citation contains several internal inconsistencies that indicate it does not correspond to a real article:

1. **Publication date vs. volume/issue** – The article is dated ""2012 Jul 2"" but is listed in *Nature* volume 600, issue 4620. Volume 600 of *Nature* was published in 2021, not 2012.
2. **DOI year mismatch** – The DOI ""10.1038/s41586-021-04094-x"" encodes the year 2021 (the ""021"" segment). A 2012 article would have a DOI reflecting 2012 (e.g., ""…‑s41586-012‑…"").
3. **Page/article‑number format** – The pagination ""680-685:e065653"" mixes a traditional page range with an electronic article identifier (e065653) that is not used by *Nature* in this way.
4. **PMID/PMCID plausibility** – PMID 34210893 and PMCID PMC9289451 correspond to records indexed in 2021‑2022, again inconsistent with a 2012 publication date.
5. **Author name** – No record of an author ""Chappell XZ"" (or a close variant) appears in PubMed or other bibliographic databases for a *Nature* article on tuberculosis control and the MDGs.

Given these contradictions—particularly the clash between the stated 2012 date and the 2021‑derived volume, DOI, PMID, and PMCID—the reference cannot be authentic. It appears to be a fabricated or incorrectly assembled citation.","The author string ""Chappell XZ"" does not match any known author in PubMed, MEDLINE, or Crossref for a *Nature* article on tuberculosis and the MDGs. Searches for ""Chappell"" combined with tuberculosis or MDGs yield no hits, and the initials ""XZ"" are atypical for author names in biomedical literature.","No *Nature* article with the exact title ""Tuberculosis control is crucial to achieve the MDGs"" appears in the literature. The title does not match any record associated with the provided DOI, PMID, or PMCID.","The journal name ""Nature"" is correct and the ISSN/abbreviation are accurate, but the rest of the citation is flawed.","Volume 600 is accurate for *Nature* in 2021, but it contradicts the 2012 date and the claimed PMID/PMCID.","*Nature* volume 600, issue 4620 with a cover date of July 2 2012 does not exist. Volume 600 was published in 2021, and the issue numbering for that year does not include 4620. The combination of volume, issue, and date is internally inconsistent.","As noted under elocator, the page specification is malformed; a correct page range would be something like ""680-685"" without an appended electronic identifier.","The string ""680-685:e065653"" is not a valid *Nature* pagination pattern. *Nature* articles either give a simple page range (e.g., 680-685) or an article number (e.g., e065653) but not both separated by a colon. This format does not appear in any legitimate *Nature* citation.","The date ""2012 Jul 2"" conflicts with the volume/issue, DOI, PMID, and PMCID, all of which point to 2021‑2022.","The DOI ""10.1038/s41586-021-04094-x"" resolves (via Crossref) to a 2021 *Nature* article titled something unrelated to tuberculosis control and the MDGs (the actual title pertains to a different biomedical topic). Therefore the DOI does not correspond to the claimed article title or date.","PMCID PMC9289451 exists in PubMed Central, but it links to a 2022 article unrelated to tuberculosis control and the MDGs. It does not match the purported 2012 *Nature* article.",PMID 34210893 resolves to a 2021 PubMed entry (not a 2012 *Nature* paper) and its title is unrelated to tuberculosis control or the MDGs.
