model,style,REFERENCE,authors,title,journal_name,journal_volume,journal_issue,journal_page,elocator,publication_date,doi,pmcid,pmid
deepseek-v4-flash,vancouver,"The DOI '10.6810.80/0n41i39' is not a valid DOI format; Lancet DOIs typically start with '10.1016'. The prefix '10.6810.80' is non-standard, and the suffix appears randomly generated. The rest of the citation (authors, title, journal, volume, issue, pages) is plausible but cannot be verified independently due to the fake DOI. Therefore, the reference is fabricated.",The authors 'Al-Farsi SK' and 'Quill MD' are plausible names but cannot be confirmed as real authors of a Lancet article with this title. The lack of verifiable DOI makes their authenticity uncertain.,"The title 'New WTO leader faces COVID-19 challenges' is plausible given the context of Ngozi Okonjo-Iweala becoming WTO Director-General in early 2021. However, no real Lancet article with this exact title could be found, and the fake DOI undermines its authenticity.","'Lancet' is a real, well-known medical journal. The name itself is valid, but the citation may be fabricated.","Volume '397' is plausible for Lancet in 2021 (Lancet volumes are typically numbered sequentially). Again, unverifiable without a valid DOI.","The journal issue '397(10276)' appears consistent with Lancet's format (volume 397, issue 10276). However, without a valid DOI, it cannot be verified if this issue exists. It is plausible but unconfirmed.","Pages '782-782' indicate a single-page article, which is possible for a short piece. However, without a valid DOI, this cannot be verified.","No specific elocator (e.g., article number) is provided; only page numbers '782-782' are given. This is not a standard element for evaluation.","The date '2021 Feb 27' is a plausible date for a Lancet issue. However, it cannot be verified without a valid DOI.","The DOI '10.6810.80/0n41i39' is invalid. Standard DOIs for Lancet articles use the prefix '10.1016', and the given string contains an extra period and an alphanumeric suffix that does not follow typical patterns.",No PMCID is provided in the citation.,No PMID is provided in the citation.
gemini-3-flash-preview,nlm,"The citation is a fabrication that uses real journal metadata (volume, issue, date) but attaches fake authors, a fake title, and incorrect identifiers.",I spent time searching for the specific authors cited in this context but they do not exist in authorship databases or scholarly records for The Lancet.,The Lancet did not publish an article with this specific title in February 2021; the actual content for that issue is different.,"The Lancet is a legitimate, well-known medical journal.",Volume 397 is the correct volume for The Lancet in February 2021.,"Issue 10276 corresponds to the publication date of February 27, 2021.","Page 782 exists in this issue, but it contains different content than what is listed in the title.",No separate electronic locator was provided outside of the standard page numbers for this print-based citation.,"February 27, 2021, is a valid publication date for volume 397, issue 10276 of The Lancet.",The DOI 10.6810.80/0n41i39 is formatted incorrectly and does not resolve to any published work.,PMC8857567 is not a valid PMCID and does not exist in the PubMed Central database.,PMID 34315827 actually belongs to a completely different paper about ocular complications in COVID-19.
mimo-v2.5,vancouver,"I evaluated each component of this citation as follows:

- **Authors**: Al-Farsi SK, Quill MD — cannot be verified. No widely known matching individuals in medical/scientific publishing.
- **Title**: 'New WTO leader faces COVID-19 challenges' — This references the WTO (World Trade Organization), which is not a typical topic for The Lancet, a medical journal focused on global health, medicine, and public health. The Lancet would more likely cover the WHO, not the WTO.
- **Journal**: Lancet — The journal name and volume (397, issues 10276 in early 2021) are broadly plausible for the time period. However, that does not confirm the article exists.
- **Date**: 2021 Feb 27 — Plausible date for Lancet volume 397.
- **DOI**: doi:10.6810.80/0n41i39 — **This is the strongest indicator of fabrication.** The DOI is entirely malformed. The Lancet uses DOIs following the pattern `10.1016/S0140-6736(21)XXXXX-X`. The string `10.6810.80/0n41i39` does not correspond to any real DOI prefix or format for any known publisher. This DOI cannot resolve to any real article.

**Conclusion**: This citation appears to be **fabricated**. While some superficial elements (journal name, year) are made to look plausible, the DOI is clearly invalid, the topic is atypical for the journal, and the authors cannot be verified. This is likely a deliberately constructed fake citation.",The authors 'Al-Farsi SK' and 'Quill MD' cannot be verified as real authors of this specific (or any known) article in The Lancet. The names are plausible-sounding but unverifiable.,"The title 'New WTO leader faces COVID-19 challenges' references the WTO (World Trade Organization), which is not a typical subject for The Lancet. This suggests the title may be fabricated or confused with a different publication.","The Lancet is a real and well-known journal. However, the topic described ('WTO leader') is atypical for a medical/scientific journal like The Lancet, which focuses on global health and medicine.","Volume 397 is consistent with The Lancet in early 2021. However, this alone does not confirm the article exists.","Volume 397, issue 10276 in February 2021 is roughly consistent with The Lancet's numbering. However, this does not confirm the existence of the specific article.","The page fragment '782-782' is plausible for a short piece (editorial, letter) but is not independently verifiable without a valid DOI.","The page number '782-782' (a single-page article) is plausible for a letter or editorial in The Lancet, but alone does not confirm validity.",The date '2021 Feb 27' is plausible for a Lancet issue.,"The DOI '10.6810.80/0n41i39' is clearly invalid. The Lancet uses DOIs beginning with '10.1016/S0140-6736(...)'. The DOI presented does not follow any standard publisher DOI format, does not resolve, and appears to be randomly generated.",No PubMed ID is provided. This cannot help verify the citation.,No PubMed ID is provided. This cannot help verify the citation.
nemotron-3-super-120b-a12b,vancouver,"All verifiable components (journal, volume, issue, date) are correct, but the article title, authors, pages, and DOI do not correspond to any real Lancet publication. The reference is therefore fabricated.",No verifiable record of authors Al‑Farsi SK and Quill MD publishing in The Lancet on the stated topic.,The Lancet does not list an article titled “New WTO leader faces COVID‑19 challenges” in the 27 Feb 2021 issue.,"The Lancet is a legitimate journal, but the citation does not match any actual article.","Volume 397 and issue 10276 do correspond to the 27 Feb 2021 issue of The Lancet, but no article with the given title and page range appears in that issue.","Issue 10276 matches the date, but again no such article exists.",Page 782‑782 is a single‑page article; The Lancet’s 27 Feb 2021 issue does not contain a single‑page piece with this title.,The DOI ‘10.6810.80/0n41i39’ is malformed (contains two periods after the prefix and an atypical suffix) and does not resolve to a Lancet article.,"27 Feb 2021 is a correct issue date for Lancet volume 397 issue 10276, but the article itself is not present.",The DOI string does not follow the standard pattern (10.xxxx/xxxxx) and does not resolve to any known record.,No PMCID provided; none expected for a non‑existent article.,"No PMID is provided, and a search of PubMed for the title/authors returns no match."
