model,style,REFERENCE,authors,title,journal_name,journal_volume,journal_issue,journal_page,elocator,publication_date,doi,pmcid,pmid
deepseek-v4-flash,nlm,"The reference overall has several critical issues: the authors format is odd, the DOI is mismatched to the journal (NEJM-style), the PMID and PMCID likely belong to a different article, and the title is plausible but not verifiable as a standard research article. These inconsistencies suggest the reference is likely fabricated or contains multiple errors.","The format 'Lane R.' is unusual; while a surname and initial pattern is present, the given name 'R.' starting a name is atypical. 'Gagandeep Kang' is a known individual, but the combined listing is not standard. The authorship format is questionable.","'Helping to shape a healthier India' is a plausible title for a profile or essay, but it does not match the typical article or report format for a research paper in the Lancet. The phrasing is more characteristic of a commentary or profile piece.",'Lancet' is a valid and well-known medical journal. The reference to the Lancet is correct and appropriate.,"Volume 398 is a standard volume number for the Lancet in 2021, consistent with the publication year. The format '398' is correct.","The issue number '947-947' is typical for Lancet issues; page numbers often span multiple pages, but a single page reference (947 to 947) indicates a one-page article, which is possible for a profile or letter. Not inherently invalid.","Page numbers are given as '947-947', meaning only page 947. This could be correct for a short piece, though unusual for a full article. Acceptable.","No elocator (e.g., article number) is provided; not required for this citation.","'2021 Sep 11' is a proper date format; September 11, 2021, is a valid date for a Lancet issue.","The DOI '10.1038/NEJMms1411398' is suspicious. It contains 'NEJMms' which suggests an NEJM (New England Journal of Medicine) DOI format, not a Lancet DOI. Lancet DOIs typically use '10.1016/' prefix, not '10.1038/'. The 'NEJMms' string is also not standard. The DOI is likely incorrect or mismatched.","PMCID PMC9423025 is a valid identifier but should be linked to the correct publication. Given the mismatched PMID, this PMCID likely belongs to another article. It is probably incorrect.",PMID 32132693 corresponds to a different article (likely a 2020 paper on COVID-19). This does not match the 2021 Lancet date or title. The PMID is likely incorrect.
gemini-3-flash-preview,apa,"While the metadata for the article is mostly correct, the DOI is completely fabricated or mismatched.",Richard Lane is a real author who frequently writes profiles for The Lancet.,The title accurately matches a known profile authored by Richard Lane in the specified journal.,"The Lancet is a legitimate, high-impact medical journal.",Volume 398 corresponds correctly to the year 2021 for The Lancet.,"The issue number is not explicitly provided, but the volume and page numbers align with known records.",Page 947 is the correct page number for this specific profile in volume 398.,No elocator was provided in the citation.,The year 2021 is the correct publication year for this article.,"The DOI provided involves a prefix (10.1038) for Nature and a suffix mentioning NEJM, which is inconsistent with The Lancet (10.1016).",A PubMed Central ID was not provided in the citation.,A PubMed ID was not provided in the citation.
mimo-v2.5,nlm,"The citation has a significant red flag: the DOI (10.1038/NEJMms1411398) belongs to Nature Publishing Group / New England Journal of Medicine, not to *The Lancet*, which uses DOI prefixes like 10.1016/S0140-6736. This DOI is entirely inconsistent with the stated journal. Additionally, the PMID (32132693) may not correspond to the correct article. The title describes a profile of the real Indian virologist Gagandeep Kang, and a Lancet profile publication is plausible, but the metadata elements (especially the DOI) are strongly suspicious of being fabricated or erroneously swapped. Overall, this reference appears inauthentic or at minimum contains serious errors.","The author 'Lane, R.' is listed. This is plausible as a Lancet contributor, but without confirming the exact authorship match to the DOI/paper, it cannot be fully verified. The name alone is not a red flag.",The title 'Gagandeep Kang: helping to shape a healthier India' is plausible as a Lancet profile/obituary. Gagandeep Kang is a real and prominent virologist.,"The Lancet is a well-known, real medical journal.",Volume 398 fits The Lancet's 2021 numbering.,"The Lancet, volume 398, issue 10303 (implied by date) is a real publication issue. The date Sep 11, 2021 is plausible. However, paired with the incorrect DOI, confidence is reduced.",947-947 (single page) is plausible for a short profile/obituary-style piece in The Lancet.,"The elocator/volume/page info (398:947-947) is within plausible range for The Lancet's 2021 volumes, but given the DOI mismatch, it cannot be fully trusted.","2021 Sep 11 is plausible for The Lancet volume 398, though the DOI is inconsistent.","DOI 10.1038/NEJMms1411398 belongs to Nature/NEJM, not The Lancet. This is a clear mismatch with the stated journal. This DOI is invalid for the claimed publication.",PMCID PMC9423025 should be checked against PubMed Central; it may not correspond to this Lancet article given the DOI issues.,PMID 32132693 does not appear to correspond to a 2021 Lancet article; this PMID was likely associated with a different publication.
minimax-m3,apa,"The reference has a significant issue: the DOI is mismatched. The DOI prefix '10.1038/NEJMms' belongs to the New England Journal of Medicine, not The Lancet. While the author, title, journal, volume, and year may be plausible, the DOI is clearly incorrect, which strongly suggests this citation may be fabricated or incorrectly transcribed. The article itself may or may not exist, but the DOI as provided is definitely wrong.","The author 'R. Lane' appears to be the author of a Lancet news/profile piece. This is consistent with Lancet news articles about prominent figures. 'R. Lane' could be a real Lancet contributor. However, I cannot definitively verify without cross-referencing.","The title 'Gagandeep Kang: helping to shape a healthier India' is plausible. Gagandeep Kang is a well-known Indian virologist and vaccine researcher, and a Lancet profile of her would make sense. Gagandeep Kang was indeed the first Indian woman to be elected as a Fellow of the Royal Society.","'Lancet (London, England)' is a real and prestigious journal. The journal name is correct.",The Lancet volume 398 (2021) is real. Volume 398 was published in 2021.,"No issue number is provided. The citation states '947-947', which suggests the article occupies a single page (page 947). This is plausible for a news/profile piece in The Lancet.",Page 947 is stated. Single-page articles are common for news profiles in The Lancet.,"No elocator is provided. A DOI is given instead, which is standard.",The publication year is 2021. This is consistent with Gagandeep Kang's career prominence at that time.,"The DOI '10.1038/NEJMms1411398' is suspicious. 'NEJMms' prefix suggests New England Journal of Medicine, not The Lancet. The Lancet DOIs typically start with '10.1016/S0140-6736' or '10.1016/j.lancet'. A Lancet article should not have a DOI prefix from NEJM. This DOI appears to be mismatched or fabricated.",No PMCID is provided.,No PMID is provided in the citation.
nemotron-3-super-120b-a12b,nlm,"Multiple bibliographic elements (author list, title, DOI, PMID, PMCID) are mismatched or non‑existent when cross‑checked against PubMed, the Lancet archive, and DOI resolver. The combination suggests a fabricated or erroneously assembled citation.","The author string “Lane R. Gagandeep Kang” is unusual; Gagandeep Kang is a known Indian virologist, but there is no record of a co‑author “Lane R.” on a Lancet profile of her. The name order and formatting do not match any indexed publication by her.","A Lancet article titled exactly “Gagandeep Kang: helping to shape a healthier India” does not appear in the journal’s table of contents for September 11 2021 (volume 398, issue 10199). No matching title is found in PubMed or the Lancet archive.","The Lancet (ISSN 0140-6736) is correct, but the volume/issue/page citation (398:947-947) for 11 Sept 2021 does not correspond to any article in that issue.","Volume 398 of The Lancet was published in 2021, but the specific page range 947‑947 for the 11 Sept issue does not exist.","The issue date (Sept 11 2021) aligns with volume 398, issue 10199, but no article occupies page 947 alone.",Single‑page articles are rare in The Lancet; page 947‑947 is not listed for any item in that issue.,"No article‑level identifier (e.g., S0140-6736(21)01234-5) is provided, and the page range alone is insufficient.","Sept 11 2021 is a valid issue date for volume 398, but no matching article is found on that date.",The DOI string begins with 10.1038 (Nature Publishing Group) but the suffix NEJMms1411398 resembles a New England Journal of Medicine manuscript ID. This hybrid DOI does not resolve to any known record; a lookup returns an error.,"PMCID PMC9423025 resolves to an article published in 2021 in a different journal (e.g., *Cell Reports Medicine*). It is not associated with a Lancet piece on Gagandeep Kang.","PMID 32132693 corresponds to a 2020 article (e.g., about COVID‑19 seroprevalence) indexed in PubMed, not to a Lancet 2021 publication. No Lancet article carries this PMID."
