model,style,REFERENCE,authors,title,journal_name,journal_volume,journal_issue,journal_page,elocator,publication_date,doi,pmcid,pmid
deepseek-v4-flash,vancouver,"The DOI is clearly incompatible with the journal and publication year. The Lancet article from 2007 would not have a DOI from the Nature Publishing Group (10.1038) nor a suffix referencing a Cell journal article from 2021. Additionally, the volume and page numbers (373:889-895) do not correspond to any known real publication with this author list and title. The entire reference appears to be fabricated.",The author list appears plausible but is likely fabricated as part of the overall false reference. No independent verification supports these authors for this specific article.,The title is plausible but does not match any real article in Lancet. Fabricated.,"The journal name 'Lancet' is a real journal, but the article is not published there as claimed.","Volume 373 of Lancet is real (2007-2008), but the specific article does not exist in that volume.","The journal issue (August 6, 2007) is not typical for Lancet; the journal usually publishes weekly issues. The specific date may be fabricated.",The page range '889-895' does not match any known Lancet article with this title and authors. Fabricated.,"No elocator (e.g., article number) is provided; only volume and page numbers are given. No issue of authenticity beyond the overall false reference.",The date '2007 Aug 6' is inconsistent with the DOI and likely fabricated.,The DOI '10.1038/j.cell.2021.03.021' is from a different publisher (Nature/Cell) and year (2021) than the claimed Lancet article (2007). It is clearly incorrect.,No PMC ID provided; not applicable.,No PMID provided; not applicable.
gemini-3-flash-preview,harvard,The citation is a hallucination that combines a fictitious author/title with a mismatched Lancet volume and a real DOI that actually belongs to a 2021 paper in the journal Cell.,There is no record of an author 'A.T. Schneider' publishing a multicentre Phase 3 study on recombinant factor IX in the Lancet during this period.,"The title provided describes a Phase 3 study for factor IX, but the dates and journal metadata do not align with any known published trial under this specific name.",The Lancet is a valid and highly reputable medical journal.,"Volume 373 of the Lancet was published in 2009, not 2007.",An issue number was not explicitly provided in the citation string though it is often required for specific identification.,"Pages 889-895 in volume 373 of the Lancet correspond to articles published in 2009, such as research on stroke or mental health, not hemophilia.",No specific e-locator was provided in the text.,"The Lancet is a weekly journal, and August 6, 2007, was a Monday; the provided year does not match the volume/page metadata provided.","The DOI 10.1038/j.cell.2021.03.021 belongs to the journal Cell (published by Elsevier/Cell Press) and was issued in 2021, not the Lancet in 2007.",No PubMed Central ID was provided in the citation.,No PubMed ID was provided in the citation.
mimo-v2.5,apa,"Suspicious Author List: The author list contains 17 authors, several of which appear fabricated or drawn from fiction. Notably, **Trelawney, I. K.** is a clear reference to the Harry Potter character (Sybill Trelawney). Other names exhibit patterns suggesting random generation or literary allusion (e.g., Yeats, W. J.).

DOI Mismatch: The DOI (10.1038/j.cell.2021.03.021) points to **Nature Publishing Group/Springer Nature** (prefix 10.1038), not **Elsevier** (which publishes **The Lancet**, using prefix 10.1016). Additionally, the DOI contains `2021`, contradicting the 2007 publication date. The suffix `j.cell` also suggests the **Cell** journal, not **The Lancet**.

Volume/Date Inconsistency: The Lancet's volume 373 corresponds to early **2008**, not 2007, creating an internal inconsistency.

Too Many Authors for a Pharmacology Study: While multi-centre trials can have many authors, 17 authors with such unusual names is unusual for a hemophilia B factor IX trial. The original real study on this topic likely has different authors.

Plausible Title but Likely Fabricated Details: The title itself is realistic and in the style of a clinical trial publication. However, the combination of suspicious author names and the mismatched DOI strongly indicates that this reference is **hallucinated** (i.e., fabricated by an AI language model with a mix of real and invented details).","Author #12 'Trelawney, I. K.' is a direct reference to the Harry Potter character (Sybill Trelawney). Several other names appear literary or randomly generated.",The title is plausible as a clinical trial for hemophilia B treatment but cannot be verified as a real Lancet article due to the other fabricated elements.,"The journal name is real (The Lancet), but the citation as a whole is fabricated.","The Lancet volume 373 corresponds to 2008, not the stated 2007.","Lancet volume 373 corresponds to 2008, not 2007. This inconsistency strongly suggests the citation is fabricated.","Page range 889-895 is plausible for The Lancet article, but cannot be confirmed.","The page numbers 889-895 are within a plausible range for The Lancet, but without verification of the exact article, they cannot be confirmed as authentic.","The stated year 2007 does not match the volume 373, which corresponds to 2008.","The DOI 10.1038/j.cell.2021.03.021 uses Springer Nature's prefix (10.1038) and appears to reference the journal Cell, not The Lancet (which uses 10.1016). The year 2021 in the DOI contradicts the stated 2007 publication date.",No PMCID is present in the citation.,No PMID is present in the citation.
