model,style,REFERENCE,authors,title,journal_name,journal_volume,journal_issue,journal_page,elocator,publication_date,doi,pmcid,pmid
deepseek-v4-flash,apa,"Multiple components are invalid or inconsistent: the title has many spelling errors, the year does not match the volume, the DOI uses the wrong prefix, and overall the reference appears fabricated.","The author list is formatted correctly with multiple authors and an ellipsis indicating more, using standard name formats. No obvious errors in structure.","The title contains multiple spelling errors (e.g., 'Ssfety', 'ans', 'xynamics', 'ntiviral', 'caniddate', 'stydy'), which are highly unusual for a real publication, indicating the title is likely fabricated.","Cell is a well-known, legitimate scientific journal. The name itself is valid.","Volume 184 is associated with Cell issues around 2021, not 2014 as stated in the publication date, creating a mismatch. The volume number may be valid in isolation but conflicts with the year.","Issue 25 is a plausible issue number for Cell, but given the overall inconsistencies, it is likely part of a fabricated reference.",No traditional page numbers provided; the reference uses an elocator instead. This field is not applicable; I treat it as missing/invalid.,"The elocator 'e067873' follows a format typical of Cell articles (e + number), but given the other discrepancies (especially the mismatched DOI and year), it is likely fabricated.","The year 2014 is provided, but the volume (184) and DOI (with 2021) suggest the article would be from around 2021, making the date inconsistent and likely incorrect.","The DOI '10.1056/j.cell.2021.03.021' uses the prefix for the New England Journal of Medicine (10.1056), not for Cell (10.1016), and the suffix format is atypical. This is clearly invalid.",No PMCID is provided in the reference; it is missing and thus cannot be validated.,No PMID is provided in the reference; it is missing and thus cannot be validated.
gemini-3-flash-preview,apa,"This is a completely hallucinated reference combining real journal names with impossible DOIs, misspelled titles, and fabricated author lists.",The author list contains highly improbable names and initials that do not correspond to any known research group for this topic or journal. The list appears to be hallucinated.,"The title contains numerous spelling errors ('Ssfety', 'ans', 'xynamics', 'ofha', 'orala', 'caniddate', 'stydy') and refers to a Dengue drug study that does not exist in the journal Cell.",Cell is a valid reputable peer-reviewed journal.,"While Cell has a volume 184, that volume corresponds to the year 2021, not 2014 as cited.","Volume 184, Issue 25 exists (published in December 2021), but the content does not match the provided reference.",The citation provides an e-locator/page number that does not match the format or actual contents of Cell volume 184.,The e-locator 'e067873' is not a valid identifier for an article in Cell; Cell typically uses continuous page numbering.,"The year 2014 is inconsistent with Volume 184 of Cell, which was published in 2021.","The DOI '10.1056/j.cell.2021.03.021' is malformed; '10.1056' belongs to NEJM, while 'j.cell' belongs to Elsevier/Cell Press (10.1016).",No PMCID was provided in the citation string to evaluate.,No PMID was provided in the citation string to evaluate.
mimo-v2.5,vancouver,"This reference contains multiple significant red flags indicating it is likely fabricated or AI-generated.

1. **Title**: Contains numerous spelling errors ('Ssfety', 'ans', 'xynamics', 'ofha', 'orala', 'ntiviral', 'caniddate', 'stydy'). Such pervasive errors are not consistent with a published journal article.

2. **DOI mismatch**: The DOI prefix '10.1056' belongs to the **New England Journal of Medicine (NEJM)**, whereas the journal listed is **Cell**, which uses the prefix '10.1016/j.cell.' These are incompatible.

3. **Date conflict**: The stated publication year is 2014, but the DOI embeds the year 2021 ('2021.03.021'), creating an internal contradiction.

4. **Authors**: The listed authors (Bracken YA, Goodwin WY, Harrow DS, etc.) cannot be verified as real researchers in this domain.

5. **Format**: The 'Available from: doi:' formatting is atypical for a Cell citation, which normally presents the DOI inline.

**Conclusion**: This reference is **inauthentic/fabricated**, with mismatched journal-DOI pairing, date inconsistencies, garbled title spelling, and unverifiable authors.","The authors listed (Bracken YA, Goodwin WY, Harrow DS, Muller MJ, Jarvis EG, Harrison PJ) cannot be verified as real researchers associated with the cited topic. The names appear to be fabricated but constructed to look like plausible pharmaceutical/medical research author names.","The title contains multiple severe spelling errors: 'Ssfety' (Safety), 'ans' (and), 'xynamics' (dynamics), 'ofha' (of a), 'orala' (oral), 'ntiviral' (antiviral), 'caniddate' (candidate), 'stydy' (study). These errors are not consistent with any published peer-reviewed article. The title appears to be garbled or AI-generated.","Cell is a real, prestigious peer-reviewed journal published by Cell Press (Elsevier), but the DOI used is not consistent with Cell Press (should be 10.1016/j.cell.*). The citation misattributes the journal or uses a fake DOI.","Volume 184 (2014) exists for Cell, but without the rest of the citation being valid, this alone does not make the reference authentic.","Volume 184 and issue 25 for August 2014 in Cell cannot be definitively verified, but the overall citation is so poorly constructed that this detail is likely fabricated as well. Cell is published weekly and does issue numbers, but this particular combination is unconfirmed.","No page number is given in the traditional sense; instead, an elocator-like format 'e067873' is used. Given all other issues, this is likely fabricated.","The elocator 'e067873' (listed as part of the reference) is a format typical of Cell Press but does not match Cell's standard electronic numbering (Cell articles typically use standard pagination, not 'e' prefixed numbers for research articles). This further suggests fabrication.",The date '2014 Aug 3' is inconsistent with the DOI content which contains '2021'. This internal conflict confirms fabrication.,"The DOI '10.1056/j.cell.2021.03.021' is non-functional/mismatched. The prefix 10.1056 belongs to NEJM (Massachusetts Medical Society), not to Cell Press (which uses 10.1016). Furthermore, referring to 'j.cell' under the 10.1056 prefix is not valid.",No PMCID is provided in the citation.,No PMID is provided in the citation.
nemotron-3-super-120b-a12b,vancouver,"Every bibliographic element (author list, title, journal, volume/issue/pages, date, DOI) is internally inconsistent and does not correspond to any retrievable publication. The citation appears to be a fabricated or heavily corrupted entry.","The author list (Bracken YA, Goodwin WY, Harrow DS, Müller MJ, Jarvis EG, Harrison PJ, et al.) does not correspond to any known publication on dengue antiviral trials. The combination of initials and surnames is not found in PubMed, CrossRef, or Google Scholar searches, suggesting the names were fabricated for this citation.","The title contains multiple typographical errors (‘Ssfety’, ‘ans’, ‘xynamics’, ‘oha’, ‘orala’, ‘ntiviral’, ‘caniddate’, ‘stydy’) and mixes concepts (safety, tolerability, viral clearance dynamics) in a phrasing that does not match any indexed article. No article with this exact wording exists in the biomedical literature.","While *Cell* is a legitimate journal, the volume/issue/pagination given (184(25):e067873) does not correspond to any *Cell* article. Furthermore, the DOI prefix ‘10.1056’ belongs to the New England Journal of Medicine, not to *Cell*, and the remainder ‘j.cell.2021.03.021’ is not a valid *Cell* DOI pattern.","Volume 184 of *Cell* would be from 2020‑2021, but the issue number 25 and the article identifier ‘e067873’ do not exist in that volume. The combination is fabricated.",Issue 25 of *Cell* volume 184 does not contain an article with the given identifier; the issue structure is incorrect.,"The page locator ‘e067873’ follows the electronic article ID pattern used by some journals (e.g., PLOS), but *Cell* does not use this format. No matching article exists.",See journal_page comment.,The date ‘2014 Aug 3’ conflicts with the DOI year implied by ‘2021’ and with the journal volume/issue timeline for *Cell*. No article matching these details exists.,The DOI string ‘10.1056/j.cell.2021.03.021’ mixes the NEJM prefix (10.1056) with a non‑existent ‘j.cell’ resolver and an invalid suffix. It does not resolve to any record.,"No PMCID is supplied, and none exists for this citation.","No PMID is supplied, and a search for the title/authors yields zero results in PubMed."
