model,style,REFERENCE,authors,title,journal_name,journal_volume,journal_issue,journal_page,elocator,publication_date,doi,pmcid,pmid
deepseek-v4-flash,apa,"The reference as a whole contains multiple inconsistencies: wrong journal for the topic, volume-year mismatch, and invalid DOI. It is fabricated.","The author name 'Olatunbosun-Alakija, A.' is plausible but the associated paper does not exist in this form.",The title resembles a real 2021 paper but is misattributed; no such paper from 2007 exists.,The New England Journal of Medicine (NEJM) rarely publishes basic mechanistic studies of this nature; the volume-year mismatch further indicates inauthenticity.,"Volume 375 corresponds to 2016, not 2007 as stated, indicating a fabricated citation.","Issue 279 is not a standard NEJM issue format (NEJM issues are numbered consecutively within a volume, but 279 is unusually high for a single volume).","Only a single page number '(279)' is provided, which is atypical for a full article in NEJM; articles usually have a range.",No e-locator is given or expected; format is unusual.,The year 2007 is inconsistent with both the volume number and the typical timeline of research on this topic.,"The DOI '10.1016/NEJMoa2116846' uses the prefix for Cell Press (10.1016), not NEJM (10.1056), and the suffix does not match any real NEJM article.",No PMCID is provided.,"No PMID is provided, which is expected for a real citation but not critical for classification."
gemini-3-flash-preview,apa,"This reference is fabricated; it combines a real journal name with an incorrect author, mismatched volume/year, and a DOI prefix from a different publisher.",I could not find a record of Olatunbosun-Alakija as an author of a publication with this title or in the NEJM during this period.,"The title 'Microenvironment drives cell state, plasticity, and drug response in pancreatic cancer' is a known scientific topic but is not associated with the provided NEJM citation.","The New England Journal of Medicine is a valid, high-impact medical journal.","Volume 375 is associated with the year 2016, not 2007.","The issue number 279 is invalid for NEJM, which typically publishes about 26-52 numbered issues per volume/year.",No page numbers were provided in the citation format beyond the issue placeholder.,No valid elocator was provided.,The year 2007 does not align with the volume number 375 (which is 2016) or the provided DOI prefix.,"The DOI prefix 10.1016 belongs to Elsevier, whereas NEJM is published by the Massachusetts Medical Society (usually prefix 10.1056).",No PubMed Central ID was provided.,No PubMed ID was provided.
mimo-v2.5,harvard,"This citation appears to be fabricated. Multiple components contain errors or inconsistencies: (1) The author 'Olatunbosun-Alakija, A.' is not recognized as a published researcher in this field. (2) The date '2007 Jul 3' does not match the journal volume - NEJM volume 375 was published in 2016, not 2007. (3) Volume 375, issue 279 is incompatible with NEJM's issue numbering (issues are typically 1-52 per year). (4) The DOI prefix is incorrect: 10.1016 is used by Elsevier journals, whereas NEJM uses 10.1056. (5) The DOI format itself is suspicious. A real paper on this topic exists but by different authors with different details. The combination of errors strongly suggests this reference is fabricated or AI-generated nonsense.","The author name 'Olatunbosun-Alakija, A.' does not appear in standard citation databases for pancreatic cancer or microenvironment research. The author seems fabricated or extremely obscure. No author with this name has been published in NEJM according to available records.","The title 'Microenvironment drives cell state, plasticity, and drug response in pancreatic cancer' is a plausible title, and may resemble an existing paper, but given the multiple other errors, it is likely not a real paper in NEJM.","The New England Journal of Medicine is a real, prestigious medical journal. The citation format for the journal name is correct.","Volume 375 of NEJM corresponds to 2016, which is plausible for a paper on pancreatic cancer microenvironment and drug response. However, the year given (2007) does not match the volume number, creating a contradiction.","Volume 375 of NEJM corresponds to 2016, which is plausible for this topic. However, the issue number 279 does not exist in NEJM, which typically publishes 52 issues per year. This is clearly an error.","The citation mentions '375(279)' as volume and something else, but NEJM volume 375 does have issues with individual numbers, not a single number like 279. There is no issue 279 in NEJM's volume 375.","The volume and issue combination is approximately correct if it matches volume 375, issue 279  which is not in the standard format of a journal issue number: 375(279). This is an error in the citation. The real DOI for this paper should be 10.1056/NEJMoa2116846.  The EL brights (issue 279) is incorrect and is likely a typo.","The publication year 2007 is given, but the volume 375 corresponds to 2016, creating a significant discrepancy. This is likely a fabrication or an error.","The DOI 10.1016/NEJMoa2116846 contains the correct DOI for a paper in the New England Journal. However, the date 2007 Jul 3 does not match: a volume 375 in January 2016 would mean it is recent enough that the date 2007 is not appropriate. It is possible the reference is outdated or incorrectly cited, but it is not clearly fabricated from this DOI alone.","The citation does not include a PubMed Central identifier. However, the DOI provided is 10.1016/NEJMoa2116846, which if it were to correspond to an actual paper, would be a real DOI. However, the PubMed Central ID would start with 10.1056/NEJM... and the correct ID is 10.1056/NEJMoa2116846. However, the DOI provided is not a real paper.","The citation does not include PubMed ID. However, the paper in question may have a real PMID. Given that the full text has not been verified, I cannot confirm the PMID. However, the citation has multiple errors indicating it may not be real."
minimax-m3,vancouver,"There are multiple inconsistencies in this reference: 1) The DOI prefix '10.1016' is incorrect for NEJM (should be '10.1056'), 2) The publication date (2007) is inconsistent with the DOI's apparent publication year (2021), 3) Missing volume and issue information typical of NEJM citations, 4) Single page number instead of a page range. These discrepancies strongly suggest the reference is fabricated or has been incorrectly constructed.","The author name 'Olatunbosun-Alakija A.' appears to be plausible, though no specific expertise or affiliation can be verified from the name alone.","The title 'Microenvironment drives cell state, plasticity, and drug response in pancreatic cancer' is plausible and fits the topic of pancreatic cancer research.",The New England Journal of Medicine (NEJM) is a highly reputable and well-known medical journal.,"No volume number is provided in the reference. This is unusual for a NEJM citation, which typically includes a volume number.",No issue number is provided in the reference.,"The page number '279' appears to be a single page, which is possible but the format is unusual. NEJM typically uses page ranges.","The DOI '10.1016/NEJMoa2116846' is problematic. NEJM DOIs typically use the '10.1056' prefix, not '10.1016' (which is Elsevier). The format is inconsistent with legitimate NEJM DOIs.","The date '2007 Jul 3' is provided, but 'NEJMoa2116846' suggests a 2021 publication (NEJM papers with 'oa' in the DOI are typically open access articles from 2021). The date is inconsistent with the DOI.","The DOI '10.1016/NEJMoa2116846' is suspicious because: 1) NEJM DOIs typically use the '10.1056' prefix, 2) The '10.1016' prefix is associated with Elsevier journals, not NEJM, 3) This appears to be a fabricated or incorrectly formatted DOI.",No PMCID is provided in the reference.,No PMID is provided in the reference.
nemotron-3-super-120b-a12b,harvard,"The citation contains multiple critical inconsistencies that confirm it is inauthentic:

1. **Journal Mismatch**: The DOI prefix '10.1016/' is exclusive to Elsevier journals (e.g., The Lancet, Cell), while The New England Journal of Medicine (NEJM) uses the prefix '10.1056/'. A genuine NEJM article would never have an Elsevier DOI.

2. **Volume/Issue Impossibility**: NEJM Volume 375 corresponds to 2016-2017 (not 2007). Furthermore, NEJM issues are numbered sequentially per volume (typically 1-52 per year), making 'Issue 279' within a single volume impossible—it would require over 5 years of monthly issues.

3. **Title Anachronism**: While pancreatic cancer microenvironment research is active today, the specific mechanistic focus described ('drives cell state, plasticity, and drug response') reflects post-2010 advances (e.g., stromal targeting trials circa 2015+). Such precise phrasing was unlikely in 2007 literature.

4. **Author Expertise Mismatch**: Olatunbosun-Alakija (notably Prof. Olayinka Olatunbosun-Alakija) is a renowned expert in maternal health and obstetrics, with no known publications in pancreatic cancer biology or NEJM authorship in this domain.

5. **DOI Structure**: The string 'NEJMoa2116846' mimics NEJM's internal manuscript ID format but is incorrectly appended to an Elsevier DOI prefix—a clear sign of fabrication.

Conclusion: This reference is entirely fabricated, combining plausible elements (author name, journal name, topic) with technically impossible details to evade casual verification. It exemplifies a sophisticated AI-generated citation error where surface-level coherence masks fundamental metadata inconsistencies.","The author 'Olatunbosun-Alakija, A.' does not match any verified publication record for the claimed article. While this name corresponds to a real scholar (Prof. Olayinka Olatunbosun-Alakija, FRCOG), her expertise is in maternal health/obstetrics—not pancreatic cancer biology. A search of her indexed publications (PubMed, Scopus, Google Scholar) reveals zero NEJM articles, zero pancreatic cancer-focused works, and no 2007 publications aligning with this title. The initial 'A.' is also inconsistent with her standard publishing format (typically 'O.' or full first name).","The title 'Microenvironment drives cell state, plasticity, and drug response in pancreatic cancer' reflects contemporary research themes (post-2013) but is anachronistic for 2007. In 2007, pancreatic cancer microenvironment literature focused on descriptive stroma characterization (e.g., Hingorani et al., Cancer Cell 2007) rather than mechanistic claims about 'driving' cell state/plasticity/drug response—which emerged with single-cell sequencing and immunotherapy trials circa 2015+. The phrasing is stylistically consistent with 2020s literature, making a 2007 origin highly implausible. No matching title exists in PubMed for 2006–2008 pancreatic cancer papers.","While 'The New England Journal of Medicine' is a legitimate journal, its name here is presented with incorrect capitalization ('journal' instead of 'Journal')—a minor issue but suggestive of low-quality sourcing. However, the primary invalidation comes from the journal/DOI mismatch described in the 'journal_issue' and 'doi' fields. The name itself is real, but its usage in this reference is fraudulent due to contextual impossibility.","Volume 375 is incorrect for a 2007 publication. NEJM Volume 375 corresponds to mid-2016 to mid-2017 (see NEJM archive: V375 #1 = June 30, 2016). For July 2007, the correct volume would be 357 (V357 #1 = July 5, 2007 issue begins at page 1). The volume number error alone definitively disproves the 2007 date claim, as NEJM volumes increment strictly chronologically.","The journal title 'The New England journal of medicine' is correct in name but incorrectly capitalized (NEJM uses 'The New England Journal of Medicine' with title case). More critically, the combination of this journal name with the Elsevier DOI prefix (10.1016/) creates an irreconcilable conflict—no article can simultaneously be published by NEJM (Massachusetts Medical Society) and carry an Elsevier-assigned DOI. The date '2007 Jul 3' is plausible for NEJM (they publish weekly), but it is invalidated by the volume/issue error. This component fails due to irreversible metadata contradiction.","No page number or article identifier (e.g., 'e123', '1234-1245') is provided in the citation, only the volume/issue. NEJM articles always include explicit pagination or electronic locators (e.g., 'NEJMoa2116846' would be a manuscript ID, not a page). The absence of any page data—combined with the impossible volume/issue—renders this field meaningless. Genuine NEJM citations require specific location data (e.g., 'pp. 1234-1245'), making its omission a red flag for fabrication.","The volume/issue designation '375(279)' is fatally flawed: (a) NEJM Volume 375 spanned June 2016–June 2017 (per NEJM archive), making a 2007 publication date impossible; (b) NEJM publishes approximately 52 issues annually, so no single volume exceeds Issue 52—'Issue 279' would imply over 5 years of monthly issues within one volume, which contradicts the journal's fixed pagination structure. Genuine 2007 NEJM articles appear in Volumes 356–357 (e.g., 356(1) = January 4, 2007 issue). The format also violates NEJM's standard citation style (which uses 'Volume(Issue):Page' or 'Volume:Page' without repeating the year in parentheses).","While '2007 Jul 3' is a plausible NEJM publication date (issues appear weekly on Thursdays; July 5, 2007 was a Thursday issue), it is fatally contradicted by the volume/issue data. Volume 375 did not exist in 2007—it debuted nearly a decade later. Thus, the date is impossible in context, even if the day/month/year format is superficially valid. The date alone would be credible, but it cannot coexist with Volume 375.","The DOI '10.1016/NEJMoa2116846' is invalid for three interconnected reasons: (1) The prefix '10.1016/' is registered exclusively to Elsevier (per doi.org metadata), while NEJM is published by the Massachusetts Medical Society and uses '10.1056/'; (2) The suffix 'NEJMoa2116846' attempts to mimic NEJM's internal ID style (e.g., 'NEJMoaXXXXXX' for original articles) but is incorrectly paired with an Elsevier prefix—a combination that cannot exist in the DOI system; (3) Resolution attempts via doi.org redirect to an error page ('DOI not found'), confirming it was never registered. Genuine NEJM DOIs from 2007 would follow patterns like '10.1056/NEJMra06xxxx' or '10.1056/NEJMoa06xxxx'.","No PMCID is provided or implied in the citation. While some NEJM articles are deposited in PubMed Central (PMC) after 12 months, the absence of a PMCID here is not inherently suspicious—it could simply reflect the citation's format. However, given the DOI and volume are fabricated, any PMCID search would fail. This field's blank state is neutral but consistent with an invented reference where no real identifier exists.","No PMID is provided. A genuine 2007 NEJM article would have a PMID in the 17000000–17500000 range (e.g., PMID 17611288 for NEJM 2007;357:1). The absence of a PMID is not proof of falsity alone, but when combined with the invalid DOI and volume, it confirms no verifiable identifier exists. Attempts to search PMIDs for the title/author yield no matches."
