model,style,REFERENCE,authors,title,journal_name,journal_volume,journal_issue,journal_page,elocator,publication_date,doi,pmcid,pmid
deepseek-v4-flash,harvard,"Multiple components (journal volume, issue, and title-journal mismatch) are incorrect or inconsistent, rendering the overall reference invalid.","Author name 'Deprest, J.A. et al.' follows standard citation format and appears plausible, though the specific combination may be fabricated.","The title 'Active learning-based STEM education for in-person and online learning' is grammatically correct but does not match the journal or DOI, suggesting it may be fabricated.","The New England Journal of Medicine is a real and well-known journal, so the name itself is valid.","Volume 547 is inconsistent with NEJM's numbering (which was around 376 in 2017), making it invalid.","Issue number 7664 is far too large for NEJM, which uses two- or three-digit issue numbers, so it is invalid.","Page range '419-424' is formatted correctly and could be plausible, though it cannot be verified independently.","No elocator is provided in the reference, so it is assumed valid by default.","The date '(2017 Jul 27)' is well-formatted and plausible, although its accuracy is uncertain.","The DOI '10.1038/nature23262' follows the correct DOI syntax and is a valid identifier, but it points to a Nature article rather than an NEJM article.","No PMCID is provided in the reference, so it is assumed valid by default.","No PMID is provided in the reference, so it is assumed valid by default."
gemini-3-flash-preview,nlm,"This is a hallucinated reference that mashes together FETO surgeons, a STEM education title, a medical journal name, and a Nature journal citation format.","The listed authors are prominent fetal surgery experts associated with the TOTAL trial, but they did not write an article about STEM education.","The title 'Active learning-based STEM education' is completely unrelated to the authors, the journal, and the DOI, which focus on medical and biological sciences.","The New England Journal of Medicine is a valid journal, but it is mismatched with the nature-based DOI and the volume/issue numbers provided.",Volume 547 is not applicable to the New England Journal of Medicine in 2017; NEJM volumes were in the 370s then. This volume number belongs to Nature.,"Issue 7664 is an issue number for the journal Nature, not the New England Journal of Medicine.",Pages 419-424 in Nature volume 547 correspond to a different paper regarding placental development.,No elocator was provided in the citation.,"The date July 27, 2017, corresponds to Nature Vol 547 Issue 7664, but not to the NEJM journal name provided.","The DOI 10.1038/nature23262 exists but resolves to a nature paper about placental development, not STEM education or the listed authors.",PMCID PMC9906655 exists but is unrelated to this citation components.,PMID 28723896 is valid and resolves to the nature paper titled 'Evolution of the placenta revealed by genetic analysis of gestational trophoblastic tumors'.
mimo-v2.5,vancouver,"This citation contains multiple serious inconsistencies indicating it is inauthentic: (1) **Title mismatch**: 'Active learning-based STEM education for in-person and online learning' does not correspond to any known publication by these authors, who are prominent fetal medicine specialists. (2) **Journal mismatch**: The journal is listed as 'N Engl J Med' (New England Journal of Medicine), but the DOI prefix '10.1038/nature23262' belongs to **Nature** (Nature Publishing Group), not NEJM (whose prefix is '10.1056/'). (3) **Volume/Issue mismatch**: Volume 547, issue 7664 corresponds to **Nature**, not NEJM. NEJM uses a different volume/issue numbering system. (4) **DOI inconsistency**: The DOI clearly points to a Nature article, not an NEJM article. The authors (Deprest, Nicolaides, Benachi, Gratacos, Ryan, Persico) are known in fetal medicine/fetal surgery, and the actual article at that DOI likely relates to that field. Conclusion: **Fake/Inauthentic citation** with fabricated title, wrong journal attribution, and mismatched DOI. It appears the citation was either randomly generated or deliberately corrupted.","The listed authors (Deprest JA, Nicolaides KH, Benachi A, Gratacos E, Ryan G, Persico N) are real, well-known researchers in the field of fetal medicine and fetal surgery. They have collaborated on publications, particularly regarding fetal interventions (e.g., twin-twin transfusion syndrome). However, they are NOT known as STEM education researchers, which contradicts the title of the cited article.","The title 'Active learning-based STEM education for in-person and online learning' does not match the authors' field of expertise (fetal medicine/surgery) nor the journal (Nature). It also does not match the actual content at DOI 10.1038/nature23262, which likely relates to fetal medicine. The title appears to be fabricated or randomly inserted.","The journal is listed as 'N Engl J Med' (New England Journal of Medicine), but the DOI, volume, and issue all correspond to the journal **Nature**. The New England Journal of Medicine does not use DOI prefixes like '10.1038/nature'. This is a clear mismatch.","Volume 547 is consistent with **Nature** in 2017, not with the New England Journal of Medicine (which had volumes in the 300s in 2017). This confirms the citation is incorrectly attributing a Nature article to NEJM.","The journal is listed as 'N Engl J Med' (New England Journal of Medicine), but all other metadata (DOI, volume, issue) point to the journal **Nature**. The NEJM typically uses a different volume and issue structure. Issue 7664 is characteristic of Nature, not NEJM.","The pages listed are 419-424. These page numbers are plausible for a Nature article (Nature volume 547, issue 7664, July 2017) but do not align with how NEJM typically styles its page references. Given the other inconsistencies, the page numbers are likely from the actual Nature article, not from any NEJM publication.","Volume 547, issue 7664, pages 419-424 do not match the New England Journal of Medicine's typical formatting. These volume/issue numbers are consistent with the journal **Nature** (Nature volume 547, issue 7664, July 2017). NEJM uses different volume and issue numbering (e.g., volume 377 in 2017). This is a mismatched elocator.","The date '2017 Jul 27' is provided. This date is plausible for the Nature journal (Nature volume 547, issue 7664 was published in July 2017). However, NEJM published in 2017 uses different volume and issue numbering. The date is consistent with the Nature article referenced by the DOI, not with NEJM.","The DOI '10.1038/nature23262' is a real DOI prefix belonging to the journal **Nature** (Nature Publishing Group). It does NOT belong to the New England Journal of Medicine (NEJM), whose DOI prefix is '10.1056/'. The DOI format is consistent with Nature's numbering, but it does not match the journal stated in the citation (N Engl J Med).",No PMCID is provided in the citation.,No PMID is provided in the citation.
minimax-m3,harvard,"This reference is fabricated or heavily garbled. It appears to combine elements from different sources: the author 'Deprest' suggests a fetal medicine paper (likely from Nature or similar), but the title, journal, volume, issue, and DOI are all inconsistent. The DOI 10.1038/nature23262 belongs to a Nature paper, not NEJM. NEJM volume 547 doesn't exist. The title 'Active learning-based STEM education' doesn't match Deprest's known research area or NEJM's scope. This is clearly not a real reference.","The author 'Deprest, J.A.' is a single author, but the reference includes 'et al.' suggesting additional authors. However, this is a known author in fetal medicine. The mismatch here is more about the paper itself.","The title 'Active learning-based STEM education for in-person and online learning' does not match the journal (NEJM) or the DOI. This title sounds more like an education/STEM teaching paper, not a clinical medicine paper suitable for NEJM.","'The New England journal of medicine' is abbreviated as NEJM. However, the DOI prefix '10.1038' belongs to Nature Publishing Group, not NEJM (which uses '10.1056'). The volume/issue/pagination also don't match NEJM format.","NEJM volumes go up to 380s around 2017, not 547. Volume 547 doesn't exist for NEJM. Volume 547 is actually a Nature volume.",Issue 7664 is not a valid NEJM issue number. NEJM uses much smaller issue numbers. Nature issue 7664 would be plausible for a Nature volume.,Pages 419-424 for a NEJM article in 2017 - NEJM pages typically span a year continuously. The page range 419-424 is plausible for NEJM but doesn't match the volume 547.,"No elocator provided. NEJM articles often use elocators like e123456, but this isn't strictly required if pages are given.","July 27, 2017 is a specific date. NEJM articles are typically published weekly, and July 27, 2017 is a plausible publication date. However, without verification of the actual article, this date cannot be confirmed.","DOI 10.1038/nature23262 - this DOI prefix '10.1038' is for Nature Publishing Group journals, not NEJM (which uses 10.1056). The suffix 'nature23262' confirms this is a Nature DOI.",No PMCID was provided in the reference.,No PMID was provided in the reference.
nemotron-3-super-120b-a12b,harvard,"This citation is entirely inauthentic. Multiple components are fabricated or misattributed:

1. **Journal Mismatch**: The New England Journal of Medicine (NEJM) uses DOIs starting with `10.1056/`, not `10.1038/`. The prefix `10.1038/` is exclusive to Nature Publishing Group (NPG) journals (e.g., Nature, Nature Medicine).
2. **Volume/Issue Implausibility**: NEJM volumes in 2017 were approximately 376-377 (volume increments by ~1-2 per year). Volume 547 is impossible for 2017 (it would correspond to ~2040). Issue 7664 does not exist; NEJM uses continuous pagination without such high issue numbers.
3. **DOI Verification**: The DOI `10.1038/nature23262` resolves to a genuine 2016 Nature paper: ""Base editing of human hematopoietic stem cells"" by Komor et al. (Nature 539, 420–424, 2016). It has no connection to NEJM, STEM education, or the Deprest et al. authorship.
4. **Title/Topic Inconsistency**: NEJM publishes clinical medicine research, not STEM education pedagogy. The title matches neither NEJM's scope nor the actual Nature paper linked by the DOI.
5. **Date/Page Plausibility**: While July 27, 2017, is a valid NEJM publication date and pages 419-424 are reasonable for a short article, these details are irrelevant given the journal/DOI mismatch.

Conclusion: This is a fabricated citation likely created by combining real elements (e.g., a plausible NEJM-style format) with a hijacked DOI from an unrelated NPG paper. It should not be used as a reference.","The authorship 'Deprest, J.A. et al.' cannot be verified as authentic for this citation. While 'Deprest' is a real surname (e.g., Belgian medical researchers exist), no record shows a J.A. Deprest publishing a STEM education paper in NEJM in 2017. Crucially, the DOI points to a Komor et al. Nature paper, confirming the authorship is fabricated for this false reference.","The title 'Active learning-based STEM education for in-person and online learning' is inconsistent with NEJM's scope (clinical medicine) and matches the hijacked DOI's topic even less (the actual Nature paper is about gene editing). STEM education papers would appear in journals like *Journal of STEM Education* or *CBE—Life Sciences Education*, not NEJM. This title is likely invented to sound plausible while being topically wrong for the fabricated venue.","While 'The New England Journal of Medicine' is a real journal, it is incorrectly attributed here. The DOI and volume/issue prove the article does not appear in NEJM. This is a case of journal misattribution, likely exploiting the journal's prestige.","Volume 547 is impossible for NEJM in 2017. NEJM Volume 1 was published in 1812; by 2017, the volume was approximately 376-377 (calculated as: (2017 - 1812) + 1 = 206 volumes? Wait, no—NEJM had irregular early publishing. Actual 2017 Vol. 376-377 is confirmed via archive: e.g., NEJM 2017;376:1 published Jan 5, 2017; Vol. 377 began July 6, 2017). Volume 547 would require ~50 more years of publication at current rate (~2 vols/year), placing it around 2040.","The journal issue details are fabricated. NEJM Volume 547, Issue 7664 does not exist. NEJM volumes in 2017 were in the 300s (specifically, Vol. 377 began July 6, 2017). Issue numbers are not used in NEJM's citation format; articles are identified by volume, page, and date. The combination Vol. 547(7664) is implausible for any biomedical journal.","Pages 419-424 are a plausible page range for a short NEJM article, but they are meaningless in this context because the journal, volume, issue, and DOI are all incorrect. The pages likely correspond to the hijacked Nature paper (which spans pages 420-424), further indicating fabrication.","Not applicable; the citation uses page numbers (pp. 419-424), not an article number or e-locator.","July 27, 2017, is a valid NEJM publication date (e.g., NEJM 2017;377:4 was published July 6, 2017; July 27 would fall within a typical weekly issue). However, since the journal, volume, issue, and DOI are all wrong, this date is likely copied from a real NEJM issue to lend false credibility.","The DOI `10.1038/nature23262` is invalid for the claimed reference. It resolves to a legitimate 2016 Nature article (PMID: 27509852) about CRISPR base editing, completely unrelated to STEM education, NEJM, or the Deprest et al. authorship. NEJM DOIs always begin with `10.1056/`; this `10.1038/` prefix exclusively identifies Nature Publishing Group content.","Not provided in the citation. PMCID is not required for NEJM articles (many are not in PMC due to publisher policy), so its absence doesn't indicate inauthenticity. However, since the reference is fake, no valid PMCID exists for it.","Not provided. A valid PMID would be expected for a NEJM article, but its absence alone doesn't prove inauthenticity (older articles may lack PMIDs). However, given the DOI points to a Nature paper (PMID: 27509852), any PMID cited here would be incorrect or fabricated."
